library/src/amd_detail/rocblaslt/src/Tensile/Logic/streamk/aquavanjaram/aquavanjaram942_Cijk_Alik_Bljk_HHS_BH_UserArgs.yaml
- {MinimumRequiredVersion: 4.33.0}
- aquavanjaram942
- gfx942
- [Device 0049, Device 0050]
    SolutionIndex: 0
    SolutionNameMin: Cijk_Alik_Bljk_HHS_BH_UserArgs_MT16x64x32_MI16x16x1_SN_LDSB0_GRVWA2_GRVWB4_GSU0_GSUC0_GSUWGMRR0_K1_LBSPPA128_LBSPPB128_LPA4_LPB4_LRVW4_MIWT1_1_SU32_SUM0_SUS256_SVW1_SKXCCM0_VWA1_WG16_16_1_WGM8_WGMXCC1_WGMXCCGn1
    SolutionIndex: 1
    SolutionNameMin: Cijk_Alik_Bljk_HHS_BH_UserArgs_MT16x64x32_MI16x16x1_SN_LDSB0_GRVWA2_GRVWB4_GSU0_GSUC0_GSUWGMRR0_K1_LBSPPA128_LBSPPB128_LPA4_LPB4_LRVW4_MIWT1_1_SU32_SUM0_SUS256_SVW1_SKXCCM8_VWA1_WG16_16_1_WGM8_WGMXCC1_WGMXCCGn1
    SolutionIndex: 2
    SolutionNameMin: Cijk_Alik_Bljk_HHS_BH_UserArgs_MT16x64x64_MI16x16x1_SN_LDSB0_GRVWA4_GRVWB8_GSU0_GSUC0_GSUWGMRR0_K1_LBSPPA128_LBSPPB128_LPA16_LPB16_LRVW8_MIWT1_1_SU32_SUM0_SUS256_SVW1_SKXCCM0_VWA1_WG16_16_1_WGM8_WGMXCC1_WGMXCCGn1
    SolutionIndex: 3
    SolutionNameMin: Cijk_Alik_Bljk_HHS_BH_UserArgs_MT16x64x64_MI16x16x1_SN_LDSB0_GRVWA4_GRVWB8_GSU0_GSUC0_GSUWGMRR0_K1_LBSPPA128_LBSPPB128_LPA16_LPB16_LRVW8_MIWT1_1_SU32_SUM0_SUS256_SVW1_SKXCCM8_VWA1_WG16_16_1_WGM8_WGMXCC1_WGMXCCGn1
    SolutionIndex: 4
    SolutionNameMin: Cijk_Alik_Bljk_HHS_BH_UserArgs_MT16x64x128_MI16x16x1_SN_LDSB0_GRVWA8_GRVWB8_GSU0_GSUC0_GSUWGMRR0_K1_LBSPPA256_LBSPPB256_LPA16_LPB16_LRVW8_MIWT1_1_SU32_SUM0_SUS256_SVW1_SKXCCM0_VWA1_WG16_16_1_WGM8_WGMXCC1_WGMXCCGn1
    SolutionIndex: 5
    SolutionNameMin: Cijk_Alik_Bljk_HHS_BH_UserArgs_MT16x64x128_MI16x16x1_SN_LDSB0_GRVWA8_GRVWB8_GSU0_GSUC0_GSUWGMRR0_K1_LBSPPA256_LBSPPB256_LPA16_LPB16_LRVW8_MIWT1_1_SU32_SUM0_SUS256_SVW1_SKXCCM8_VWA1_WG16_16_1_WGM8_WGMXCC1_WGMXCCGn1
    SolutionIndex: 6
    SolutionNameMin: Cijk_Alik_Bljk_HHS_BH_UserArgs_MT16x128x32_MI16x16x1_SN_LDSB0_GRVWA2_GRVWB4_GSU0_GSUC0_GSUWGMRR0_K1_LBSPPA128_LBSPPB128_LPA4_LPB4_LRVW4_MIWT1_2_SU32_SUM0_SUS256_SVW1_SKXCCM0_VWA1_WG16_16_1_WGM8_WGMXCC1_WGMXCCGn1
    SolutionIndex: 7
    SolutionNameMin: Cijk_Alik_Bljk_HHS_BH_UserArgs_MT16x128x32_MI16x16x1_SN_LDSB0_GRVWA2_GRVWB4_GSU0_GSUC0_GSUWGMRR0_K1_LBSPPA128_LBSPPB128_LPA4_LPB4_LRVW4_MIWT1_2_SU32_SUM0_SUS256_SVW1_SKXCCM8_VWA1_WG16_16_1_WGM8_WGMXCC1_WGMXCCGn1
    SolutionIndex: 8
    SolutionNameMin: Cijk_Alik_Bljk_HHS_BH_UserArgs_MT16x128x64_MI16x16x1_SN_LDSB1_GRVWA4_GRVWB8_GSU0_GSUC0_GSUWGMRR0_K1_LBSPPA128_LBSPPB128_LPA16_LPB16_LRVW8_MIWT1_2_SU32_SUM0_SUS256_SVW1_SKXCCM0_VWA1_WG16_16_1_WGM8_WGMXCC1_WGMXCCGn1
    SolutionIndex: 9
    SolutionNameMin: Cijk_Alik_Bljk_HHS_BH_UserArgs_MT16x128x64_MI16x16x1_SN_LDSB1_GRVWA4_GRVWB8_GSU0_GSUC0_GSUWGMRR0_K1_LBSPPA128_LBSPPB128_LPA16_LPB16_LRVW8_MIWT1_2_SU32_SUM0_SUS256_SVW1_SKXCCM8_VWA1_WG16_16_1_WGM8_WGMXCC1_WGMXCCGn1
    SolutionIndex: 10
    SolutionNameMin: Cijk_Alik_Bljk_HHS_BH_UserArgs_MT16x128x128_MI16x16x1_SN_LDSB1_GRVWA8_GRVWB8_GSU0_GSUC0_GSUWGMRR0_K1_LBSPPA256_LBSPPB256_LPA16_LPB16_LRVW8_MIWT1_2_SU32_SUM0_SUS256_SVW1_SKXCCM0_VWA1_WG16_16_1_WGM8_WGMXCC1_WGMXCCGn1
    SolutionIndex: 11
    SolutionNameMin: Cijk_Alik_Bljk_HHS_BH_UserArgs_MT16x128x128_MI16x16x1_SN_LDSB1_GRVWA8_GRVWB8_GSU0_GSUC0_GSUWGMRR0_K1_LBSPPA256_LBSPPB256_LPA16_LPB16_LRVW8_MIWT1_2_SU32_SUM0_SUS256_SVW1_SKXCCM8_VWA1_WG16_16_1_WGM8_WGMXCC1_WGMXCCGn1
    SolutionIndex: 12
    SolutionNameMin: Cijk_Alik_Bljk_HHS_BH_UserArgs_MT16x192x32_MI16x16x1_SN_LDSB0_GRVWA2_GRVWB4_GSU0_GSUC0_GSUWGMRR0_K1_LBSPPA128_LBSPPB128_LPA4_LPB4_LRVW4_MIWT1_3_SU32_SUM0_SUS256_SVW1_SKXCCM0_VWA1_WG16_16_1_WGM8_WGMXCC1_WGMXCCGn1
    SolutionIndex: 13
    SolutionNameMin: Cijk_Alik_Bljk_HHS_BH_UserArgs_MT16x192x32_MI16x16x1_SN_LDSB0_GRVWA2_GRVWB4_GSU0_GSUC0_GSUWGMRR0_K1_LBSPPA128_LBSPPB128_LPA4_LPB4_LRVW4_MIWT1_3_SU32_SUM0_SUS256_SVW1_SKXCCM8_VWA1_WG16_16_1_WGM8_WGMXCC1_WGMXCCGn1
    SolutionIndex: 14
    SolutionNameMin: Cijk_Alik_Bljk_HHS_BH_UserArgs_MT16x192x64_MI16x16x1_SN_LDSB1_GRVWA4_GRVWB8_GSU0_GSUC0_GSUWGMRR0_K1_LBSPPA128_LBSPPB128_LPA16_LPB16_LRVW8_MIWT1_3_SU32_SUM0_SUS256_SVW1_SKXCCM0_VWA1_WG16_16_1_WGM8_WGMXCC1_WGMXCCGn1
    SolutionIndex: 15
    SolutionNameMin: Cijk_Alik_Bljk_HHS_BH_UserArgs_MT16x192x64_MI16x16x1_SN_LDSB1_GRVWA4_GRVWB8_GSU0_GSUC0_GSUWGMRR0_K1_LBSPPA128_LBSPPB128_LPA16_LPB16_LRVW8_MIWT1_3_SU32_SUM0_SUS256_SVW1_SKXCCM8_VWA1_WG16_16_1_WGM8_WGMXCC1_WGMXCCGn1
    SolutionIndex: 16
    SolutionNameMin: Cijk_Alik_Bljk_HHS_BH_UserArgs_MT16x256x32_MI16x16x1_SN_LDSB1_GRVWA2_GRVWB4_GSU0_GSUC0_GSUWGMRR0_K1_LBSPPA128_LBSPPB128_LPA4_LPB4_LRVW4_MIWT1_4_SU32_SUM0_SUS256_SVW1_SKXCCM0_VWA1_WG16_16_1_WGM8_WGMXCC1_WGMXCCGn1
    SolutionIndex: 17
    SolutionNameMin: Cijk_Alik_Bljk_HHS_BH_UserArgs_MT16x256x32_MI16x16x1_SN_LDSB1_GRVWA2_GRVWB4_GSU0_GSUC0_GSUWGMRR0_K1_LBSPPA128_LBSPPB128_LPA4_LPB4_LRVW4_MIWT1_4_SU32_SUM0_SUS256_SVW1_SKXCCM8_VWA1_WG16_16_1_WGM8_WGMXCC1_WGMXCCGn1
    SolutionIndex: 18
    SolutionNameMin: Cijk_Alik_Bljk_HHS_BH_UserArgs_MT16x256x64_MI16x16x1_SN_LDSB1_GRVWA4_GRVWB8_GSU0_GSUC0_GSUWGMRR0_K1_LBSPPA128_LBSPPB128_LPA16_LPB16_LRVW8_MIWT1_4_SU32_SUM0_SUS256_SVW1_SKXCCM0_VWA1_WG16_16_1_WGM8_WGMXCC1_WGMXCCGn1
    SolutionIndex: 19
    SolutionNameMin: Cijk_Alik_Bljk_HHS_BH_UserArgs_MT16x256x64_MI16x16x1_SN_LDSB1_GRVWA4_GRVWB8_GSU0_GSUC0_GSUWGMRR0_K1_LBSPPA128_LBSPPB128_LPA16_LPB16_LRVW8_MIWT1_4_SU32_SUM0_SUS256_SVW1_SKXCCM8_VWA1_WG16_16_1_WGM8_WGMXCC1_WGMXCCGn1
    SolutionIndex: 20
    SolutionNameMin: Cijk_Alik_Bljk_HHS_BH_UserArgs_MT32x32x32_MI16x16x1_SN_LDSB0_GRVWA4_GRVWB4_GSU0_GSUC0_GSUWGMRR0_K1_LBSPPA128_LBSPPB128_LPA4_LPB4_LRVW4_MIWT1_1_SU32_SUM0_SUS256_SVW1_SKXCCM0_VWA1_WG32_8_1_WGM8_WGMXCC1_WGMXCCGn1
    SolutionIndex: 21
    SolutionNameMin: Cijk_Alik_Bljk_HHS_BH_UserArgs_MT32x32x32_MI16x16x1_SN_LDSB0_GRVWA4_GRVWB4_GSU0_GSUC0_GSUWGMRR0_K1_LBSPPA128_LBSPPB128_LPA4_LPB4_LRVW4_MIWT1_1_SU32_SUM0_SUS256_SVW1_SKXCCM8_VWA1_WG32_8_1_WGM8_WGMXCC1_WGMXCCGn1
    SolutionIndex: 22
    SolutionNameMin: Cijk_Alik_Bljk_HHS_BH_UserArgs_MT32x32x64_MI16x16x1_SN_LDSB0_GRVWA8_GRVWB8_GSU0_GSUC0_GSUWGMRR0_K1_LBSPPA128_LBSPPB128_LPA16_LPB16_LRVW8_MIWT1_1_SU32_SUM0_SUS256_SVW1_SKXCCM0_VWA1_WG32_8_1_WGM8_WGMXCC1_WGMXCCGn1
    SolutionIndex: 23
    SolutionNameMin: Cijk_Alik_Bljk_HHS_BH_UserArgs_MT32x32x64_MI16x16x1_SN_LDSB0_GRVWA8_GRVWB8_GSU0_GSUC0_GSUWGMRR0_K1_LBSPPA128_LBSPPB128_LPA16_LPB16_LRVW8_MIWT1_1_SU32_SUM0_SUS256_SVW1_SKXCCM8_VWA1_WG32_8_1_WGM8_WGMXCC1_WGMXCCGn1
    SolutionIndex: 24
    SolutionNameMin: Cijk_Alik_Bljk_HHS_BH_UserArgs_MT32x32x128_MI16x16x1_SN_LDSB0_GRVWA8_GRVWB8_GSU0_GSUC0_GSUWGMRR0_K1_LBSPPA256_LBSPPB256_LPA16_LPB16_LRVW8_MIWT1_1_SU32_SUM0_SUS256_SVW1_SKXCCM0_VWA1_WG32_8_1_WGM8_WGMXCC1_WGMXCCGn1
    SolutionIndex: 25
    SolutionNameMin: Cijk_Alik_Bljk_HHS_BH_UserArgs_MT32x32x128_MI16x16x1_SN_LDSB0_GRVWA8_GRVWB8_GSU0_GSUC0_GSUWGMRR0_K1_LBSPPA256_LBSPPB256_LPA16_LPB16_LRVW8_MIWT1_1_SU32_SUM0_SUS256_SVW1_SKXCCM8_VWA1_WG32_8_1_WGM8_WGMXCC1_WGMXCCGn1
    SolutionIndex: 26
    SolutionNameMin: Cijk_Alik_Bljk_HHS_BH_UserArgs_MT32x64x32_MI16x16x1_SN_LDSB0_GRVWA4_GRVWB4_GSU0_GSUC0_GSUWGMRR0_K1_LBSPPA128_LBSPPB128_LPA4_LPB4_LRVW4_MIWT2_1_SU32_SUM0_SUS256_SVW2_SKXCCM0_VWA2_WG16_16_1_WGM8_WGMXCC1_WGMXCCGn1
    SolutionIndex: 27
    SolutionNameMin: Cijk_Alik_Bljk_HHS_BH_UserArgs_MT32x64x32_MI16x16x1_SN_LDSB0_GRVWA4_GRVWB4_GSU0_GSUC0_GSUWGMRR0_K1_LBSPPA128_LBSPPB128_LPA4_LPB4_LRVW4_MIWT2_1_SU32_SUM0_SUS256_SVW2_SKXCCM8_VWA2_WG16_16_1_WGM8_WGMXCC1_WGMXCCGn1
    SolutionIndex: 28
    SolutionNameMin: Cijk_Alik_Bljk_HHS_BH_UserArgs_MT32x64x64_MI16x16x1_SN_LDSB0_GRVWA8_GRVWB8_GSU0_GSUC0_GSUWGMRR0_K1_LBSPPA256_LBSPPB128_LPA16_LPB16_LRVW8_MIWT2_1_SU32_SUM0_SUS256_SVW2_SKXCCM0_VWA2_WG16_16_1_WGM8_WGMXCC1_WGMXCCGn1
    SolutionIndex: 29
    SolutionNameMin: Cijk_Alik_Bljk_HHS_BH_UserArgs_MT32x64x64_MI16x16x1_SN_LDSB0_GRVWA8_GRVWB8_GSU0_GSUC0_GSUWGMRR0_K1_LBSPPA256_LBSPPB128_LPA16_LPB16_LRVW8_MIWT2_1_SU32_SUM0_SUS256_SVW2_SKXCCM8_VWA2_WG16_16_1_WGM8_WGMXCC1_WGMXCCGn1
    SolutionIndex: 30
    SolutionNameMin: Cijk_Alik_Bljk_HHS_BH_UserArgs_MT32x64x128_MI16x16x1_SN_LDSB1_GRVWA8_GRVWB8_GSU0_GSUC0_GSUWGMRR0_K1_LBSPPA512_LBSPPB256_LPA16_LPB16_LRVW8_MIWT2_1_SU32_SUM0_SUS256_SVW2_SKXCCM0_VWA2_WG16_16_1_WGM8_WGMXCC1_WGMXCCGn1
    SolutionIndex: 31
    SolutionNameMin: Cijk_Alik_Bljk_HHS_BH_UserArgs_MT32x64x128_MI16x16x1_SN_LDSB1_GRVWA8_GRVWB8_GSU0_GSUC0_GSUWGMRR0_K1_LBSPPA512_LBSPPB256_LPA16_LPB16_LRVW8_MIWT2_1_SU32_SUM0_SUS256_SVW2_SKXCCM8_VWA2_WG16_16_1_WGM8_WGMXCC1_WGMXCCGn1
    SolutionIndex: 32
    SolutionNameMin: Cijk_Alik_Bljk_HHS_BH_UserArgs_MT32x96x32_MI16x16x1_SN_LDSB0_GRVWA4_GRVWB4_GSU0_GSUC0_GSUWGMRR0_K1_LBSPPA128_LBSPPB128_LPA4_LPB4_LRVW4_MIWT1_3_SU32_SUM0_SUS256_SVW1_SKXCCM0_VWA1_WG32_8_1_WGM8_WGMXCC1_WGMXCCGn1
    SolutionIndex: 33
    SolutionNameMin: Cijk_Alik_Bljk_HHS_BH_UserArgs_MT32x96x32_MI16x16x1_SN_LDSB0_GRVWA4_GRVWB4_GSU0_GSUC0_GSUWGMRR0_K1_LBSPPA128_LBSPPB128_LPA4_LPB4_LRVW4_MIWT1_3_SU32_SUM0_SUS256_SVW1_SKXCCM8_VWA1_WG32_8_1_WGM8_WGMXCC1_WGMXCCGn1
    SolutionIndex: 34
    SolutionNameMin: Cijk_Alik_Bljk_HHS_BH_UserArgs_MT32x96x64_MI16x16x1_SN_LDSB1_GRVWA8_GRVWB8_GSU0_GSUC0_GSUWGMRR0_K1_LBSPPA128_LBSPPB128_LPA16_LPB16_LRVW8_MIWT1_3_SU32_SUM0_SUS256_SVW1_SKXCCM0_VWA1_WG32_8_1_WGM8_WGMXCC1_WGMXCCGn1
    SolutionIndex: 35
    SolutionNameMin: Cijk_Alik_Bljk_HHS_BH_UserArgs_MT32x96x64_MI16x16x1_SN_LDSB1_GRVWA8_GRVWB8_GSU0_GSUC0_GSUWGMRR0_K1_LBSPPA128_LBSPPB128_LPA16_LPB16_LRVW8_MIWT1_3_SU32_SUM0_SUS256_SVW1_SKXCCM8_VWA1_WG32_8_1_WGM8_WGMXCC1_WGMXCCGn1
    SolutionIndex: 36
    SolutionNameMin: Cijk_Alik_Bljk_HHS_BH_UserArgs_MT32x96x128_MI16x16x1_SN_LDSB1_GRVWA8_GRVWB8_GSU0_GSUC0_GSUWGMRR0_K1_LBSPPA256_LBSPPB256_LPA16_LPB16_LRVW8_MIWT1_3_SU32_SUM0_SUS256_SVW1_SKXCCM0_VWA1_WG32_8_1_WGM8_WGMXCC1_WGMXCCGn1
    SolutionIndex: 37
    SolutionNameMin: Cijk_Alik_Bljk_HHS_BH_UserArgs_MT32x96x128_MI16x16x1_SN_LDSB1_GRVWA8_GRVWB8_GSU0_GSUC0_GSUWGMRR0_K1_LBSPPA256_LBSPPB256_LPA16_LPB16_LRVW8_MIWT1_3_SU32_SUM0_SUS256_SVW1_SKXCCM8_VWA1_WG32_8_1_WGM8_WGMXCC1_WGMXCCGn1
    SolutionIndex: 38
    SolutionNameMin: Cijk_Alik_Bljk_HHS_BH_UserArgs_MT32x128x32_MI16x16x1_SN_LDSB0_GRVWA4_GRVWB4_GSU0_GSUC0_GSUWGMRR0_K1_LBSPPA128_LBSPPB128_LPA4_LPB4_LRVW4_MIWT2_2_SU32_SUM0_SUS256_SVW2_SKXCCM0_VWA2_WG16_16_1_WGM8_WGMXCC1_WGMXCCGn1
    SolutionIndex: 39
    SolutionNameMin: Cijk_Alik_Bljk_HHS_BH_UserArgs_MT32x128x32_MI16x16x1_SN_LDSB0_GRVWA4_GRVWB4_GSU0_GSUC0_GSUWGMRR0_K1_LBSPPA128_LBSPPB128_LPA4_LPB4_LRVW4_MIWT2_2_SU32_SUM0_SUS256_SVW2_SKXCCM8_VWA2_WG16_16_1_WGM8_WGMXCC1_WGMXCCGn1
    SolutionIndex: 40
    SolutionNameMin: Cijk_Alik_Bljk_HHS_BH_UserArgs_MT32x128x64_MI16x16x1_SN_LDSB1_GRVWA8_GRVWB8_GSU0_GSUC0_GSUWGMRR0_K1_LBSPPA256_LBSPPB128_LPA16_LPB16_LRVW8_MIWT2_2_SU32_SUM0_SUS256_SVW2_SKXCCM0_VWA2_WG16_16_1_WGM8_WGMXCC1_WGMXCCGn1
    SolutionIndex: 41
    SolutionNameMin: Cijk_Alik_Bljk_HHS_BH_UserArgs_MT32x128x64_MI16x16x1_SN_LDSB1_GRVWA8_GRVWB8_GSU0_GSUC0_GSUWGMRR0_K1_LBSPPA256_LBSPPB128_LPA16_LPB16_LRVW8_MIWT2_2_SU32_SUM0_SUS256_SVW2_SKXCCM8_VWA2_WG16_16_1_WGM8_WGMXCC1_WGMXCCGn1
    SolutionIndex: 42
    SolutionNameMin: Cijk_Alik_Bljk_HHS_BH_UserArgs_MT32x128x128_MI16x16x1_SN_LDSB1_GRVWA8_GRVWB8_GSU0_GSUC0_GSUWGMRR0_K1_LBSPPA512_LBSPPB256_LPA16_LPB16_LRVW8_MIWT2_2_SU32_SUM0_SUS256_SVW2_SKXCCM0_VWA2_WG16_16_1_WGM8_WGMXCC1_WGMXCCGn1
    SolutionIndex: 43
    SolutionNameMin: Cijk_Alik_Bljk_HHS_BH_UserArgs_MT32x128x128_MI16x16x1_SN_LDSB1_GRVWA8_GRVWB8_GSU0_GSUC0_GSUWGMRR0_K1_LBSPPA512_LBSPPB256_LPA16_LPB16_LRVW8_MIWT2_2_SU32_SUM0_SUS256_SVW2_SKXCCM8_VWA2_WG16_16_1_WGM8_WGMXCC1_WGMXCCGn1
    SolutionIndex: 44
    SolutionNameMin: Cijk_Alik_Bljk_HHS_BH_UserArgs_MT32x160x64_MI16x16x1_SN_LDSB1_GRVWA8_GRVWB8_GSU0_GSUC0_GSUWGMRR0_K1_LBSPPA128_LBSPPB128_LPA16_LPB16_LRVW8_MIWT1_5_SU32_SUM0_SUS256_SVW1_SKXCCM0_VWA1_WG32_8_1_WGM8_WGMXCC1_WGMXCCGn1
    SolutionIndex: 45
    SolutionNameMin: Cijk_Alik_Bljk_HHS_BH_UserArgs_MT32x160x64_MI16x16x1_SN_LDSB1_GRVWA8_GRVWB8_GSU0_GSUC0_GSUWGMRR0_K1_LBSPPA128_LBSPPB128_LPA16_LPB16_LRVW8_MIWT1_5_SU32_SUM0_SUS256_SVW1_SKXCCM8_VWA1_WG32_8_1_WGM8_WGMXCC1_WGMXCCGn1
    SolutionIndex: 46
    SolutionNameMin: Cijk_Alik_Bljk_HHS_BH_UserArgs_MT32x192x32_MI16x16x1_SN_LDSB0_GRVWA4_GRVWB4_GSU0_GSUC0_GSUWGMRR0_K1_LBSPPA128_LBSPPB128_LPA4_LPB4_LRVW4_MIWT2_3_SU32_SUM0_SUS256_SVW2_SKXCCM0_VWA2_WG16_16_1_WGM8_WGMXCC1_WGMXCCGn1
    SolutionIndex: 47
    SolutionNameMin: Cijk_Alik_Bljk_HHS_BH_UserArgs_MT32x192x32_MI16x16x1_SN_LDSB0_GRVWA4_GRVWB4_GSU0_GSUC0_GSUWGMRR0_K1_LBSPPA128_LBSPPB128_LPA4_LPB4_LRVW4_MIWT2_3_SU32_SUM0_SUS256_SVW2_SKXCCM8_VWA2_WG16_16_1_WGM8_WGMXCC1_WGMXCCGn1
    SolutionIndex: 48
    SolutionNameMin: Cijk_Alik_Bljk_HHS_BH_UserArgs_MT32x192x64_MI16x16x1_SN_LDSB1_GRVWA8_GRVWB8_GSU0_GSUC0_GSUWGMRR0_K1_LBSPPA256_LBSPPB128_LPA16_LPB16_LRVW8_MIWT2_3_SU32_SUM0_SUS256_SVW2_SKXCCM0_VWA2_WG16_16_1_WGM8_WGMXCC1_WGMXCCGn1
    SolutionIndex: 49
    SolutionNameMin: Cijk_Alik_Bljk_HHS_BH_UserArgs_MT32x192x64_MI16x16x1_SN_LDSB1_GRVWA8_GRVWB8_GSU0_GSUC0_GSUWGMRR0_K1_LBSPPA256_LBSPPB128_LPA16_LPB16_LRVW8_MIWT2_3_SU32_SUM0_SUS256_SVW2_SKXCCM8_VWA2_WG16_16_1_WGM8_WGMXCC1_WGMXCCGn1
    SolutionIndex: 50
    SolutionNameMin: Cijk_Alik_Bljk_HHS_BH_UserArgs_MT32x224x64_MI16x16x1_SN_LDSB1_GRVWA8_GRVWB8_GSU0_GSUC0_GSUWGMRR0_K1_LBSPPA128_LBSPPB128_LPA16_LPB16_LRVW8_MIWT1_7_SU32_SUM0_SUS256_SVW1_SKXCCM0_VWA1_WG32_8_1_WGM8_WGMXCC1_WGMXCCGn1
    SolutionIndex: 51
    SolutionNameMin: Cijk_Alik_Bljk_HHS_BH_UserArgs_MT32x224x64_MI16x16x1_SN_LDSB1_GRVWA8_GRVWB8_GSU0_GSUC0_GSUWGMRR0_K1_LBSPPA128_LBSPPB128_LPA16_LPB16_LRVW8_MIWT1_7_SU32_SUM0_SUS256_SVW1_SKXCCM8_VWA1_WG32_8_1_WGM8_WGMXCC1_WGMXCCGn1
    SolutionIndex: 52
    SolutionNameMin: Cijk_Alik_Bljk_HHS_BH_UserArgs_MT32x256x32_MI16x16x1_SN_LDSB1_GRVWA4_GRVWB4_GSU0_GSUC0_GSUWGMRR0_K1_LBSPPA128_LBSPPB128_LPA4_LPB4_LRVW4_MIWT2_4_SU32_SUM0_SUS256_SVW2_SKXCCM0_VWA2_WG16_16_1_WGM8_WGMXCC1_WGMXCCGn1
    SolutionIndex: 53
    SolutionNameMin: Cijk_Alik_Bljk_HHS_BH_UserArgs_MT32x256x32_MI16x16x1_SN_LDSB1_GRVWA4_GRVWB4_GSU0_GSUC0_GSUWGMRR0_K1_LBSPPA128_LBSPPB128_LPA4_LPB4_LRVW4_MIWT2_4_SU32_SUM0_SUS256_SVW2_SKXCCM8_VWA2_WG16_16_1_WGM8_WGMXCC1_WGMXCCGn1
    SolutionIndex: 54
    SolutionNameMin: Cijk_Alik_Bljk_HHS_BH_UserArgs_MT32x256x64_MI16x16x1_SN_LDSB1_GRVWA8_GRVWB8_GSU0_GSUC0_GSUWGMRR0_K1_LBSPPA256_LBSPPB128_LPA16_LPB16_LRVW8_MIWT2_4_SU32_SUM0_SUS256_SVW2_SKXCCM0_VWA2_WG16_16_1_WGM8_WGMXCC1_WGMXCCGn1
    SolutionIndex: 55
    SolutionNameMin: Cijk_Alik_Bljk_HHS_BH_UserArgs_MT32x256x64_MI16x16x1_SN_LDSB1_GRVWA8_GRVWB8_GSU0_GSUC0_GSUWGMRR0_K1_LBSPPA256_LBSPPB128_LPA16_LPB16_LRVW8_MIWT2_4_SU32_SUM0_SUS256_SVW2_SKXCCM8_VWA2_WG16_16_1_WGM8_WGMXCC1_WGMXCCGn1
    SolutionIndex: 56
    SolutionNameMin: Cijk_Alik_Bljk_HHS_BH_UserArgs_MT48x64x32_MI16x16x1_SN_LDSB0_GRVWA2_GRVWB4_GSU0_GSUC0_GSUWGMRR0_K1_LBSPPA128_LBSPPB128_LPA4_LPB4_LRVW4_MIWT3_1_SU32_SUM0_SUS256_SVW1_SKXCCM0_VWA1_WG16_16_1_WGM8_WGMXCC1_WGMXCCGn1
    SolutionIndex: 57
    SolutionNameMin: Cijk_Alik_Bljk_HHS_BH_UserArgs_MT48x64x32_MI16x16x1_SN_LDSB0_GRVWA2_GRVWB4_GSU0_GSUC0_GSUWGMRR0_K1_LBSPPA128_LBSPPB128_LPA4_LPB4_LRVW4_MIWT3_1_SU32_SUM0_SUS256_SVW1_SKXCCM8_VWA1_WG16_16_1_WGM8_WGMXCC1_WGMXCCGn1
    SolutionIndex: 58
    SolutionNameMin: Cijk_Alik_Bljk_HHS_BH_UserArgs_MT48x64x64_MI16x16x1_SN_LDSB1_GRVWA4_GRVWB8_GSU0_GSUC0_GSUWGMRR0_K1_LBSPPA128_LBSPPB128_LPA16_LPB16_LRVW8_MIWT3_1_SU32_SUM0_SUS256_SVW1_SKXCCM0_VWA1_WG16_16_1_WGM8_WGMXCC1_WGMXCCGn1
    SolutionIndex: 59
    SolutionNameMin: Cijk_Alik_Bljk_HHS_BH_UserArgs_MT48x64x64_MI16x16x1_SN_LDSB1_GRVWA4_GRVWB8_GSU0_GSUC0_GSUWGMRR0_K1_LBSPPA128_LBSPPB128_LPA16_LPB16_LRVW8_MIWT3_1_SU32_SUM0_SUS256_SVW1_SKXCCM8_VWA1_WG16_16_1_WGM8_WGMXCC1_WGMXCCGn1
    SolutionIndex: 60
    SolutionNameMin: Cijk_Alik_Bljk_HHS_BH_UserArgs_MT48x64x128_MI16x16x1_SN_LDSB1_GRVWA8_GRVWB8_GSU0_GSUC0_GSUWGMRR0_K1_LBSPPA256_LBSPPB256_LPA16_LPB16_LRVW8_MIWT3_1_SU32_SUM0_SUS256_SVW1_SKXCCM0_VWA1_WG16_16_1_WGM8_WGMXCC1_WGMXCCGn1
    SolutionIndex: 61
    SolutionNameMin: Cijk_Alik_Bljk_HHS_BH_UserArgs_MT48x64x128_MI16x16x1_SN_LDSB1_GRVWA8_GRVWB8_GSU0_GSUC0_GSUWGMRR0_K1_LBSPPA256_LBSPPB256_LPA16_LPB16_LRVW8_MIWT3_1_SU32_SUM0_SUS256_SVW1_SKXCCM8_VWA1_WG16_16_1_WGM8_WGMXCC1_WGMXCCGn1
    SolutionIndex: 62
    SolutionNameMin: Cijk_Alik_Bljk_HHS_BH_UserArgs_MT48x128x32_MI16x16x1_SN_LDSB0_GRVWA2_GRVWB4_GSU0_GSUC0_GSUWGMRR0_K1_LBSPPA128_LBSPPB128_LPA4_LPB4_LRVW4_MIWT3_2_SU32_SUM0_SUS256_SVW1_SKXCCM0_VWA1_WG16_16_1_WGM8_WGMXCC1_WGMXCCGn1
    SolutionIndex: 63
    SolutionNameMin: Cijk_Alik_Bljk_HHS_BH_UserArgs_MT48x128x32_MI16x16x1_SN_LDSB0_GRVWA2_GRVWB4_GSU0_GSUC0_GSUWGMRR0_K1_LBSPPA128_LBSPPB128_LPA4_LPB4_LRVW4_MIWT3_2_SU32_SUM0_SUS256_SVW1_SKXCCM8_VWA1_WG16_16_1_WGM8_WGMXCC1_WGMXCCGn1
    SolutionIndex: 64
    SolutionNameMin: Cijk_Alik_Bljk_HHS_BH_UserArgs_MT48x128x64_MI16x16x1_SN_LDSB1_GRVWA4_GRVWB8_GSU0_GSUC0_GSUWGMRR0_K1_LBSPPA128_LBSPPB128_LPA16_LPB16_LRVW8_MIWT3_2_SU32_SUM0_SUS256_SVW1_SKXCCM0_VWA1_WG16_16_1_WGM8_WGMXCC1_WGMXCCGn1
    SolutionIndex: 65
    SolutionNameMin: Cijk_Alik_Bljk_HHS_BH_UserArgs_MT48x128x64_MI16x16x1_SN_LDSB1_GRVWA4_GRVWB8_GSU0_GSUC0_GSUWGMRR0_K1_LBSPPA128_LBSPPB128_LPA16_LPB16_LRVW8_MIWT3_2_SU32_SUM0_SUS256_SVW1_SKXCCM8_VWA1_WG16_16_1_WGM8_WGMXCC1_WGMXCCGn1
    SolutionIndex: 66
    SolutionNameMin: Cijk_Alik_Bljk_HHS_BH_UserArgs_MT48x192x64_MI16x16x1_SN_LDSB1_GRVWA4_GRVWB8_GSU0_GSUC0_GSUWGMRR0_K1_LBSPPA128_LBSPPB128_LPA16_LPB16_LRVW8_MIWT3_3_SU32_SUM0_SUS256_SVW1_SKXCCM0_VWA1_WG16_16_1_WGM8_WGMXCC1_WGMXCCGn1
    SolutionIndex: 67
    SolutionNameMin: Cijk_Alik_Bljk_HHS_BH_UserArgs_MT48x192x64_MI16x16x1_SN_LDSB1_GRVWA4_GRVWB8_GSU0_GSUC0_GSUWGMRR0_K1_LBSPPA128_LBSPPB128_LPA16_LPB16_LRVW8_MIWT3_3_SU32_SUM0_SUS256_SVW1_SKXCCM8_VWA1_WG16_16_1_WGM8_WGMXCC1_WGMXCCGn1
    SolutionIndex: 68
    SolutionNameMin: Cijk_Alik_Bljk_HHS_BH_UserArgs_MT64x16x32_MI16x16x1_SN_LDSB0_GRVWA4_GRVWB2_GSU0_GSUC0_GSUWGMRR0_K1_LBSPPA128_LBSPPB128_LPA4_LPB4_LRVW4_MIWT1_1_SU32_SUM0_SUS256_SVW1_SKXCCM0_VWA1_WG64_4_1_WGM8_WGMXCC1_WGMXCCGn1
    SolutionIndex: 69
    SolutionNameMin: Cijk_Alik_Bljk_HHS_BH_UserArgs_MT64x16x32_MI16x16x1_SN_LDSB0_GRVWA4_GRVWB2_GSU0_GSUC0_GSUWGMRR0_K1_LBSPPA128_LBSPPB128_LPA4_LPB4_LRVW4_MIWT1_1_SU32_SUM0_SUS256_SVW1_SKXCCM8_VWA1_WG64_4_1_WGM8_WGMXCC1_WGMXCCGn1
    SolutionIndex: 70
    SolutionNameMin: Cijk_Alik_Bljk_HHS_BH_UserArgs_MT64x16x64_MI16x16x1_SN_LDSB0_GRVWA8_GRVWB4_GSU0_GSUC0_GSUWGMRR0_K1_LBSPPA128_LBSPPB128_LPA16_LPB16_LRVW8_MIWT1_1_SU32_SUM0_SUS256_SVW1_SKXCCM0_VWA1_WG64_4_1_WGM8_WGMXCC1_WGMXCCGn1
    SolutionIndex: 71
    SolutionNameMin: Cijk_Alik_Bljk_HHS_BH_UserArgs_MT64x16x64_MI16x16x1_SN_LDSB0_GRVWA8_GRVWB4_GSU0_GSUC0_GSUWGMRR0_K1_LBSPPA128_LBSPPB128_LPA16_LPB16_LRVW8_MIWT1_1_SU32_SUM0_SUS256_SVW1_SKXCCM8_VWA1_WG64_4_1_WGM8_WGMXCC1_WGMXCCGn1
    SolutionIndex: 72
    SolutionNameMin: Cijk_Alik_Bljk_HHS_BH_UserArgs_MT64x16x128_MI16x16x1_SN_LDSB0_GRVWA8_GRVWB8_GSU0_GSUC0_GSUWGMRR0_K1_LBSPPA256_LBSPPB256_LPA16_LPB16_LRVW8_MIWT1_1_SU32_SUM0_SUS256_SVW1_SKXCCM0_VWA1_WG64_4_1_WGM8_WGMXCC1_WGMXCCGn1
    SolutionIndex: 73
    SolutionNameMin: Cijk_Alik_Bljk_HHS_BH_UserArgs_MT64x16x128_MI16x16x1_SN_LDSB0_GRVWA8_GRVWB8_GSU0_GSUC0_GSUWGMRR0_K1_LBSPPA256_LBSPPB256_LPA16_LPB16_LRVW8_MIWT1_1_SU32_SUM0_SUS256_SVW1_SKXCCM8_VWA1_WG64_4_1_WGM8_WGMXCC1_WGMXCCGn1
    SolutionIndex: 74
    SolutionNameMin: Cijk_Alik_Bljk_HHS_BH_UserArgs_MT64x32x32_MI16x16x1_SN_LDSB0_GRVWA4_GRVWB4_GSU0_GSUC0_GSUWGMRR0_K1_LBSPPA128_LBSPPB128_LPA4_LPB4_LRVW4_MIWT2_1_SU32_SUM0_SUS256_SVW2_SKXCCM0_VWA2_WG32_8_1_WGM8_WGMXCC1_WGMXCCGn1
    SolutionIndex: 75
    SolutionNameMin: Cijk_Alik_Bljk_HHS_BH_UserArgs_MT64x32x32_MI16x16x1_SN_LDSB0_GRVWA4_GRVWB4_GSU0_GSUC0_GSUWGMRR0_K1_LBSPPA128_LBSPPB128_LPA4_LPB4_LRVW4_MIWT2_1_SU32_SUM0_SUS256_SVW2_SKXCCM8_VWA2_WG32_8_1_WGM8_WGMXCC1_WGMXCCGn1
    SolutionIndex: 76
    SolutionNameMin: Cijk_Alik_Bljk_HHS_BH_UserArgs_MT64x32x64_MI16x16x1_SN_LDSB0_GRVWA8_GRVWB8_GSU0_GSUC0_GSUWGMRR0_K1_LBSPPA256_LBSPPB128_LPA16_LPB16_LRVW8_MIWT2_1_SU32_SUM0_SUS256_SVW2_SKXCCM0_VWA2_WG32_8_1_WGM8_WGMXCC1_WGMXCCGn1
    SolutionIndex: 77
    SolutionNameMin: Cijk_Alik_Bljk_HHS_BH_UserArgs_MT64x32x64_MI16x16x1_SN_LDSB0_GRVWA8_GRVWB8_GSU0_GSUC0_GSUWGMRR0_K1_LBSPPA256_LBSPPB128_LPA16_LPB16_LRVW8_MIWT2_1_SU32_SUM0_SUS256_SVW2_SKXCCM8_VWA2_WG32_8_1_WGM8_WGMXCC1_WGMXCCGn1
    SolutionIndex: 78
    SolutionNameMin: Cijk_Alik_Bljk_HHS_BH_UserArgs_MT64x32x128_MI16x16x1_SN_LDSB1_GRVWA8_GRVWB8_GSU0_GSUC0_GSUWGMRR0_K1_LBSPPA512_LBSPPB256_LPA16_LPB16_LRVW8_MIWT2_1_SU32_SUM0_SUS256_SVW2_SKXCCM0_VWA2_WG32_8_1_WGM8_WGMXCC1_WGMXCCGn1
    SolutionIndex: 79
    SolutionNameMin: Cijk_Alik_Bljk_HHS_BH_UserArgs_MT64x32x128_MI16x16x1_SN_LDSB1_GRVWA8_GRVWB8_GSU0_GSUC0_GSUWGMRR0_K1_LBSPPA512_LBSPPB256_LPA16_LPB16_LRVW8_MIWT2_1_SU32_SUM0_SUS256_SVW2_SKXCCM8_VWA2_WG32_8_1_WGM8_WGMXCC1_WGMXCCGn1
    SolutionIndex: 80
    SolutionNameMin: Cijk_Alik_Bljk_HHS_BH_UserArgs_MT64x48x32_MI16x16x1_SN_LDSB0_GRVWA4_GRVWB2_GSU0_GSUC0_GSUWGMRR0_K1_LBSPPA128_LBSPPB128_LPA4_LPB4_LRVW4_MIWT1_3_SU32_SUM0_SUS256_SVW1_SKXCCM0_VWA1_WG64_4_1_WGM8_WGMXCC1_WGMXCCGn1
    SolutionIndex: 81
    SolutionNameMin: Cijk_Alik_Bljk_HHS_BH_UserArgs_MT64x48x32_MI16x16x1_SN_LDSB0_GRVWA4_GRVWB2_GSU0_GSUC0_GSUWGMRR0_K1_LBSPPA128_LBSPPB128_LPA4_LPB4_LRVW4_MIWT1_3_SU32_SUM0_SUS256_SVW1_SKXCCM8_VWA1_WG64_4_1_WGM8_WGMXCC1_WGMXCCGn1
    SolutionIndex: 82
    SolutionNameMin: Cijk_Alik_Bljk_HHS_BH_UserArgs_MT64x48x64_MI16x16x1_SN_LDSB1_GRVWA8_GRVWB4_GSU0_GSUC0_GSUWGMRR0_K1_LBSPPA128_LBSPPB128_LPA16_LPB16_LRVW8_MIWT1_3_SU32_SUM0_SUS256_SVW1_SKXCCM0_VWA1_WG64_4_1_WGM8_WGMXCC1_WGMXCCGn1
    SolutionIndex: 83
    SolutionNameMin: Cijk_Alik_Bljk_HHS_BH_UserArgs_MT64x48x64_MI16x16x1_SN_LDSB1_GRVWA8_GRVWB4_GSU0_GSUC0_GSUWGMRR0_K1_LBSPPA128_LBSPPB128_LPA16_LPB16_LRVW8_MIWT1_3_SU32_SUM0_SUS256_SVW1_SKXCCM8_VWA1_WG64_4_1_WGM8_WGMXCC1_WGMXCCGn1
    SolutionIndex: 84
    SolutionNameMin: Cijk_Alik_Bljk_HHS_BH_UserArgs_MT64x48x128_MI16x16x1_SN_LDSB1_GRVWA8_GRVWB8_GSU0_GSUC0_GSUWGMRR0_K1_LBSPPA256_LBSPPB256_LPA16_LPB16_LRVW8_MIWT1_3_SU32_SUM0_SUS256_SVW1_SKXCCM0_VWA1_WG64_4_1_WGM8_WGMXCC1_WGMXCCGn1
    SolutionIndex: 85
    SolutionNameMin: Cijk_Alik_Bljk_HHS_BH_UserArgs_MT64x48x128_MI16x16x1_SN_LDSB1_GRVWA8_GRVWB8_GSU0_GSUC0_GSUWGMRR0_K1_LBSPPA256_LBSPPB256_LPA16_LPB16_LRVW8_MIWT1_3_SU32_SUM0_SUS256_SVW1_SKXCCM8_VWA1_WG64_4_1_WGM8_WGMXCC1_WGMXCCGn1
    SolutionIndex: 86
    SolutionNameMin: Cijk_Alik_Bljk_HHS_BH_UserArgs_MT64x64x32_MI16x16x1_SN_LDSB0_GRVWA4_GRVWB4_GSU0_GSUC0_GSUWGMRR0_K1_LBSPPA128_LBSPPB128_LPA4_LPB4_LRVW4_MIWT2_2_SU32_SUM0_SUS256_SVW2_SKXCCM0_VWA2_WG32_8_1_WGM8_WGMXCC1_WGMXCCGn1
    SolutionIndex: 87
    SolutionNameMin: Cijk_Alik_Bljk_HHS_BH_UserArgs_MT64x64x32_MI16x16x1_SN_LDSB0_GRVWA4_GRVWB4_GSU0_GSUC0_GSUWGMRR0_K1_LBSPPA128_LBSPPB128_LPA4_LPB4_LRVW4_MIWT2_2_SU32_SUM0_SUS256_SVW2_SKXCCM8_VWA2_WG32_8_1_WGM8_WGMXCC1_WGMXCCGn1
    SolutionIndex: 88
    SolutionNameMin: Cijk_Alik_Bljk_HHS_BH_UserArgs_MT64x64x64_MI16x16x1_SN_LDSB1_GRVWA8_GRVWB8_GSU0_GSUC0_GSUWGMRR0_K1_LBSPPA256_LBSPPB128_LPA16_LPB16_LRVW8_MIWT2_2_SU32_SUM0_SUS256_SVW2_SKXCCM0_VWA2_WG32_8_1_WGM8_WGMXCC1_WGMXCCGn1
    SolutionIndex: 89
    SolutionNameMin: Cijk_Alik_Bljk_HHS_BH_UserArgs_MT64x64x64_MI16x16x1_SN_LDSB1_GRVWA8_GRVWB8_GSU0_GSUC0_GSUWGMRR0_K1_LBSPPA256_LBSPPB128_LPA16_LPB16_LRVW8_MIWT2_2_SU32_SUM0_SUS256_SVW2_SKXCCM8_VWA2_WG32_8_1_WGM8_WGMXCC1_WGMXCCGn1
    SolutionIndex: 90
    SolutionNameMin: Cijk_Alik_Bljk_HHS_BH_UserArgs_MT64x64x128_MI16x16x1_SN_LDSB1_GRVWA8_GRVWB8_GSU0_GSUC0_GSUWGMRR0_K1_LBSPPA512_LBSPPB256_LPA16_LPB16_LRVW8_MIWT2_2_SU32_SUM0_SUS256_SVW2_SKXCCM0_VWA2_WG32_8_1_WGM8_WGMXCC1_WGMXCCGn1
    SolutionIndex: 91
    SolutionNameMin: Cijk_Alik_Bljk_HHS_BH_UserArgs_MT64x64x128_MI16x16x1_SN_LDSB1_GRVWA8_GRVWB8_GSU0_GSUC0_GSUWGMRR0_K1_LBSPPA512_LBSPPB256_LPA16_LPB16_LRVW8_MIWT2_2_SU32_SUM0_SUS256_SVW2_SKXCCM8_VWA2_WG32_8_1_WGM8_WGMXCC1_WGMXCCGn1
    SolutionIndex: 92
    SolutionNameMin: Cijk_Alik_Bljk_HHS_BH_UserArgs_MT64x80x32_MI16x16x1_SN_LDSB0_GRVWA4_GRVWB2_GSU0_GSUC0_GSUWGMRR0_K1_LBSPPA128_LBSPPB128_LPA4_LPB4_LRVW4_MIWT1_5_SU32_SUM0_SUS256_SVW1_SKXCCM0_VWA1_WG64_4_1_WGM8_WGMXCC1_WGMXCCGn1
    SolutionIndex: 93
    SolutionNameMin: Cijk_Alik_Bljk_HHS_BH_UserArgs_MT64x80x32_MI16x16x1_SN_LDSB0_GRVWA4_GRVWB2_GSU0_GSUC0_GSUWGMRR0_K1_LBSPPA128_LBSPPB128_LPA4_LPB4_LRVW4_MIWT1_5_SU32_SUM0_SUS256_SVW1_SKXCCM8_VWA1_WG64_4_1_WGM8_WGMXCC1_WGMXCCGn1
    SolutionIndex: 94
    SolutionNameMin: Cijk_Alik_Bljk_HHS_BH_UserArgs_MT64x80x64_MI16x16x1_SN_LDSB1_GRVWA8_GRVWB4_GSU0_GSUC0_GSUWGMRR0_K1_LBSPPA128_LBSPPB128_LPA16_LPB16_LRVW8_MIWT1_5_SU32_SUM0_SUS256_SVW1_SKXCCM0_VWA1_WG64_4_1_WGM8_WGMXCC1_WGMXCCGn1
    SolutionIndex: 95
    SolutionNameMin: Cijk_Alik_Bljk_HHS_BH_UserArgs_MT64x80x64_MI16x16x1_SN_LDSB1_GRVWA8_GRVWB4_GSU0_GSUC0_GSUWGMRR0_K1_LBSPPA128_LBSPPB128_LPA16_LPB16_LRVW8_MIWT1_5_SU32_SUM0_SUS256_SVW1_SKXCCM8_VWA1_WG64_4_1_WGM8_WGMXCC1_WGMXCCGn1
    SolutionIndex: 96
    SolutionNameMin: Cijk_Alik_Bljk_HHS_BH_UserArgs_MT64x80x128_MI16x16x1_SN_LDSB1_GRVWA8_GRVWB8_GSU0_GSUC0_GSUWGMRR0_K1_LBSPPA256_LBSPPB256_LPA16_LPB16_LRVW8_MIWT1_5_SU32_SUM0_SUS256_SVW1_SKXCCM0_VWA1_WG64_4_1_WGM8_WGMXCC1_WGMXCCGn1
    SolutionIndex: 97
    SolutionNameMin: Cijk_Alik_Bljk_HHS_BH_UserArgs_MT64x80x128_MI16x16x1_SN_LDSB1_GRVWA8_GRVWB8_GSU0_GSUC0_GSUWGMRR0_K1_LBSPPA256_LBSPPB256_LPA16_LPB16_LRVW8_MIWT1_5_SU32_SUM0_SUS256_SVW1_SKXCCM8_VWA1_WG64_4_1_WGM8_WGMXCC1_WGMXCCGn1
    SolutionIndex: 98
    SolutionNameMin: Cijk_Alik_Bljk_HHS_BH_UserArgs_MT64x96x32_MI16x16x1_SN_LDSB0_GRVWA4_GRVWB4_GSU0_GSUC0_GSUWGMRR0_K1_LBSPPA128_LBSPPB128_LPA4_LPB4_LRVW4_MIWT2_3_SU32_SUM0_SUS256_SVW2_SKXCCM0_VWA2_WG32_8_1_WGM8_WGMXCC1_WGMXCCGn1
    SolutionIndex: 99
    SolutionNameMin: Cijk_Alik_Bljk_HHS_BH_UserArgs_MT64x96x32_MI16x16x1_SN_LDSB0_GRVWA4_GRVWB4_GSU0_GSUC0_GSUWGMRR0_K1_LBSPPA128_LBSPPB128_LPA4_LPB4_LRVW4_MIWT2_3_SU32_SUM0_SUS256_SVW2_SKXCCM8_VWA2_WG32_8_1_WGM8_WGMXCC1_WGMXCCGn1
    SolutionIndex: 100
    SolutionNameMin: Cijk_Alik_Bljk_HHS_BH_UserArgs_MT64x96x64_MI16x16x1_SN_LDSB1_GRVWA8_GRVWB8_GSU0_GSUC0_GSUWGMRR0_K1_LBSPPA256_LBSPPB128_LPA16_LPB16_LRVW8_MIWT2_3_SU32_SUM0_SUS256_SVW2_SKXCCM0_VWA2_WG32_8_1_WGM8_WGMXCC1_WGMXCCGn1
    SolutionIndex: 101
    SolutionNameMin: Cijk_Alik_Bljk_HHS_BH_UserArgs_MT64x96x64_MI16x16x1_SN_LDSB1_GRVWA8_GRVWB8_GSU0_GSUC0_GSUWGMRR0_K1_LBSPPA256_LBSPPB128_LPA16_LPB16_LRVW8_MIWT2_3_SU32_SUM0_SUS256_SVW2_SKXCCM8_VWA2_WG32_8_1_WGM8_WGMXCC1_WGMXCCGn1
    SolutionIndex: 102
    SolutionNameMin: Cijk_Alik_Bljk_HHS_BH_UserArgs_MT64x96x128_MI16x16x1_SN_LDSB1_GRVWA8_GRVWB8_GSU0_GSUC0_GSUWGMRR0_K1_LBSPPA512_LBSPPB256_LPA16_LPB16_LRVW8_MIWT2_3_SU32_SUM0_SUS256_SVW2_SKXCCM0_VWA2_WG32_8_1_WGM8_WGMXCC1_WGMXCCGn1
    SolutionIndex: 103
    SolutionNameMin: Cijk_Alik_Bljk_HHS_BH_UserArgs_MT64x96x128_MI16x16x1_SN_LDSB1_GRVWA8_GRVWB8_GSU0_GSUC0_GSUWGMRR0_K1_LBSPPA512_LBSPPB256_LPA16_LPB16_LRVW8_MIWT2_3_SU32_SUM0_SUS256_SVW2_SKXCCM8_VWA2_WG32_8_1_WGM8_WGMXCC1_WGMXCCGn1
    SolutionIndex: 104
    SolutionNameMin: Cijk_Alik_Bljk_HHS_BH_UserArgs_MT64x112x64_MI16x16x1_SN_LDSB1_GRVWA8_GRVWB4_GSU0_GSUC0_GSUWGMRR0_K1_LBSPPA128_LBSPPB128_LPA16_LPB16_LRVW8_MIWT1_7_SU32_SUM0_SUS256_SVW1_SKXCCM0_VWA1_WG64_4_1_WGM8_WGMXCC1_WGMXCCGn1
    SolutionIndex: 105
    SolutionNameMin: Cijk_Alik_Bljk_HHS_BH_UserArgs_MT64x112x64_MI16x16x1_SN_LDSB1_GRVWA8_GRVWB4_GSU0_GSUC0_GSUWGMRR0_K1_LBSPPA128_LBSPPB128_LPA16_LPB16_LRVW8_MIWT1_7_SU32_SUM0_SUS256_SVW1_SKXCCM8_VWA1_WG64_4_1_WGM8_WGMXCC1_WGMXCCGn1
    SolutionIndex: 106
    SolutionNameMin: Cijk_Alik_Bljk_HHS_BH_UserArgs_MT64x128x32_MI16x16x1_SN_LDSB0_GRVWA4_GRVWB4_GSU0_GSUC0_GSUWGMRR0_K1_LBSPPA256_LBSPPB128_LPA4_LPB4_LRVW4_MIWT4_2_SU32_SUM0_SUS256_SVW4_SKXCCM0_VWA4_WG16_16_1_WGM8_WGMXCC1_WGMXCCGn1
    SolutionIndex: 107
    SolutionNameMin: Cijk_Alik_Bljk_HHS_BH_UserArgs_MT64x128x32_MI16x16x1_SN_LDSB0_GRVWA4_GRVWB4_GSU0_GSUC0_GSUWGMRR0_K1_LBSPPA256_LBSPPB128_LPA4_LPB4_LRVW4_MIWT4_2_SU32_SUM0_SUS256_SVW4_SKXCCM8_VWA4_WG16_16_1_WGM8_WGMXCC1_WGMXCCGn1
    SolutionIndex: 108
    SolutionNameMin: Cijk_Alik_Bljk_HHS_BH_UserArgs_MT64x128x64_MI16x16x1_SN_LDSB1_GRVWA8_GRVWB8_GSU0_GSUC0_GSUWGMRR0_K1_LBSPPA512_LBSPPB128_LPA16_LPB16_LRVW8_MIWT4_2_SU32_SUM0_SUS256_SVW4_SKXCCM0_VWA4_WG16_16_1_WGM8_WGMXCC1_WGMXCCGn1
    SolutionIndex: 109
    SolutionNameMin: Cijk_Alik_Bljk_HHS_BH_UserArgs_MT64x128x64_MI16x16x1_SN_LDSB1_GRVWA8_GRVWB8_GSU0_GSUC0_GSUWGMRR0_K1_LBSPPA512_LBSPPB128_LPA16_LPB16_LRVW8_MIWT4_2_SU32_SUM0_SUS256_SVW4_SKXCCM8_VWA4_WG16_16_1_WGM8_WGMXCC1_WGMXCCGn1
    SolutionIndex: 110
    SolutionNameMin: Cijk_Alik_Bljk_HHS_BH_UserArgs_MT64x160x32_MI16x16x1_SN_LDSB0_GRVWA4_GRVWB4_GSU0_GSUC0_GSUWGMRR0_K1_LBSPPA128_LBSPPB128_LPA4_LPB4_LRVW4_MIWT2_5_SU32_SUM0_SUS256_SVW2_SKXCCM0_VWA2_WG32_8_1_WGM8_WGMXCC1_WGMXCCGn1
    SolutionIndex: 111
    SolutionNameMin: Cijk_Alik_Bljk_HHS_BH_UserArgs_MT64x160x32_MI16x16x1_SN_LDSB0_GRVWA4_GRVWB4_GSU0_GSUC0_GSUWGMRR0_K1_LBSPPA128_LBSPPB128_LPA4_LPB4_LRVW4_MIWT2_5_SU32_SUM0_SUS256_SVW2_SKXCCM8_VWA2_WG32_8_1_WGM8_WGMXCC1_WGMXCCGn1
    SolutionIndex: 112
    SolutionNameMin: Cijk_Alik_Bljk_HHS_BH_UserArgs_MT64x160x64_MI16x16x1_SN_LDSB1_GRVWA8_GRVWB8_GSU0_GSUC0_GSUWGMRR0_K1_LBSPPA256_LBSPPB128_LPA16_LPB16_LRVW8_MIWT2_5_SU32_SUM0_SUS256_SVW2_SKXCCM0_VWA2_WG32_8_1_WGM8_WGMXCC1_WGMXCCGn1
    SolutionIndex: 113
    SolutionNameMin: Cijk_Alik_Bljk_HHS_BH_UserArgs_MT64x160x64_MI16x16x1_SN_LDSB1_GRVWA8_GRVWB8_GSU0_GSUC0_GSUWGMRR0_K1_LBSPPA256_LBSPPB128_LPA16_LPB16_LRVW8_MIWT2_5_SU32_SUM0_SUS256_SVW2_SKXCCM8_VWA2_WG32_8_1_WGM8_WGMXCC1_WGMXCCGn1
    SolutionIndex: 114
    SolutionNameMin: Cijk_Alik_Bljk_HHS_BH_UserArgs_MT64x192x32_MI16x16x1_SN_LDSB1_GRVWA4_GRVWB4_GSU0_GSUC0_GSUWGMRR0_K1_LBSPPA128_LBSPPB128_LPA4_LPB4_LRVW4_MIWT2_6_SU32_SUM0_SUS256_SVW2_SKXCCM0_VWA2_WG32_8_1_WGM8_WGMXCC1_WGMXCCGn1
    SolutionIndex: 115
    SolutionNameMin: Cijk_Alik_Bljk_HHS_BH_UserArgs_MT64x192x32_MI16x16x1_SN_LDSB1_GRVWA4_GRVWB4_GSU0_GSUC0_GSUWGMRR0_K1_LBSPPA128_LBSPPB128_LPA4_LPB4_LRVW4_MIWT2_6_SU32_SUM0_SUS256_SVW2_SKXCCM8_VWA2_WG32_8_1_WGM8_WGMXCC1_WGMXCCGn1
    SolutionIndex: 116
    SolutionNameMin: Cijk_Alik_Bljk_HHS_BH_UserArgs_MT64x192x64_MI16x16x1_SN_LDSB1_GRVWA8_GRVWB8_GSU0_GSUC0_GSUWGMRR0_K1_LBSPPA256_LBSPPB128_LPA16_LPB16_LRVW8_MIWT2_6_SU32_SUM0_SUS256_SVW2_SKXCCM0_VWA2_WG32_8_1_WGM8_WGMXCC1_WGMXCCGn1
    SolutionIndex: 117
    SolutionNameMin: Cijk_Alik_Bljk_HHS_BH_UserArgs_MT64x192x64_MI16x16x1_SN_LDSB1_GRVWA8_GRVWB8_GSU0_GSUC0_GSUWGMRR0_K1_LBSPPA256_LBSPPB128_LPA16_LPB16_LRVW8_MIWT2_6_SU32_SUM0_SUS256_SVW2_SKXCCM8_VWA2_WG32_8_1_WGM8_WGMXCC1_WGMXCCGn1
    SolutionIndex: 118
    SolutionNameMin: Cijk_Alik_Bljk_HHS_BH_UserArgs_MT64x224x32_MI16x16x1_SN_LDSB1_GRVWA4_GRVWB4_GSU0_GSUC0_GSUWGMRR0_K1_LBSPPA128_LBSPPB128_LPA4_LPB4_LRVW4_MIWT2_7_SU32_SUM0_SUS256_SVW2_SKXCCM0_VWA2_WG32_8_1_WGM8_WGMXCC1_WGMXCCGn1
    SolutionIndex: 119
    SolutionNameMin: Cijk_Alik_Bljk_HHS_BH_UserArgs_MT64x224x32_MI16x16x1_SN_LDSB1_GRVWA4_GRVWB4_GSU0_GSUC0_GSUWGMRR0_K1_LBSPPA128_LBSPPB128_LPA4_LPB4_LRVW4_MIWT2_7_SU32_SUM0_SUS256_SVW2_SKXCCM8_VWA2_WG32_8_1_WGM8_WGMXCC1_WGMXCCGn1
    SolutionIndex: 120
    SolutionNameMin: Cijk_Alik_Bljk_HHS_BH_UserArgs_MT64x224x64_MI16x16x1_SN_LDSB1_GRVWA8_GRVWB8_GSU0_GSUC0_GSUWGMRR0_K1_LBSPPA256_LBSPPB128_LPA16_LPB16_LRVW8_MIWT2_7_SU32_SUM0_SUS256_SVW2_SKXCCM0_VWA2_WG32_8_1_WGM8_WGMXCC1_WGMXCCGn1
    SolutionIndex: 121
    SolutionNameMin: Cijk_Alik_Bljk_HHS_BH_UserArgs_MT64x224x64_MI16x16x1_SN_LDSB1_GRVWA8_GRVWB8_GSU0_GSUC0_GSUWGMRR0_K1_LBSPPA256_LBSPPB128_LPA16_LPB16_LRVW8_MIWT2_7_SU32_SUM0_SUS256_SVW2_SKXCCM8_VWA2_WG32_8_1_WGM8_WGMXCC1_WGMXCCGn1
    SolutionIndex: 122
    SolutionNameMin: Cijk_Alik_Bljk_HHS_BH_UserArgs_MT64x256x32_MI16x16x1_SN_LDSB1_GRVWA4_GRVWB4_GSU0_GSUC0_GSUWGMRR0_K1_LBSPPA256_LBSPPB128_LPA4_LPB4_LRVW4_MIWT4_4_SU32_SUM0_SUS256_SVW4_SKXCCM0_VWA4_WG16_16_1_WGM8_WGMXCC1_WGMXCCGn1
    SolutionIndex: 123
    SolutionNameMin: Cijk_Alik_Bljk_HHS_BH_UserArgs_MT64x256x32_MI16x16x1_SN_LDSB1_GRVWA4_GRVWB4_GSU0_GSUC0_GSUWGMRR0_K1_LBSPPA256_LBSPPB128_LPA4_LPB4_LRVW4_MIWT4_4_SU32_SUM0_SUS256_SVW4_SKXCCM8_VWA4_WG16_16_1_WGM8_WGMXCC1_WGMXCCGn1
    SolutionIndex: 124
    SolutionNameMin: Cijk_Alik_Bljk_HHS_BH_UserArgs_MT64x256x64_MI16x16x1_SN_LDSB1_GRVWA8_GRVWB8_GSU0_GSUC0_GSUWGMRR0_K1_LBSPPA512_LBSPPB128_LPA16_LPB16_LRVW8_MIWT4_4_SU32_SUM0_SUS256_SVW4_SKXCCM0_VWA4_WG16_16_1_WGM8_WGMXCC1_WGMXCCGn1
    SolutionIndex: 125
    SolutionNameMin: Cijk_Alik_Bljk_HHS_BH_UserArgs_MT64x256x64_MI16x16x1_SN_LDSB1_GRVWA8_GRVWB8_GSU0_GSUC0_GSUWGMRR0_K1_LBSPPA512_LBSPPB128_LPA16_LPB16_LRVW8_MIWT4_4_SU32_SUM0_SUS256_SVW4_SKXCCM8_VWA4_WG16_16_1_WGM8_WGMXCC1_WGMXCCGn1
    SolutionIndex: 126
    SolutionNameMin: Cijk_Alik_Bljk_HHS_BH_UserArgs_MT80x64x32_MI16x16x1_SN_LDSB0_GRVWA2_GRVWB4_GSU0_GSUC0_GSUWGMRR0_K1_LBSPPA128_LBSPPB128_LPA4_LPB4_LRVW4_MIWT5_1_SU32_SUM0_SUS256_SVW1_SKXCCM0_VWA1_WG16_16_1_WGM8_WGMXCC1_WGMXCCGn1
    SolutionIndex: 127
    SolutionNameMin: Cijk_Alik_Bljk_HHS_BH_UserArgs_MT80x64x32_MI16x16x1_SN_LDSB0_GRVWA2_GRVWB4_GSU0_GSUC0_GSUWGMRR0_K1_LBSPPA128_LBSPPB128_LPA4_LPB4_LRVW4_MIWT5_1_SU32_SUM0_SUS256_SVW1_SKXCCM8_VWA1_WG16_16_1_WGM8_WGMXCC1_WGMXCCGn1
    SolutionIndex: 128
    SolutionNameMin: Cijk_Alik_Bljk_HHS_BH_UserArgs_MT80x64x64_MI16x16x1_SN_LDSB1_GRVWA4_GRVWB8_GSU0_GSUC0_GSUWGMRR0_K1_LBSPPA128_LBSPPB128_LPA16_LPB16_LRVW8_MIWT5_1_SU32_SUM0_SUS256_SVW1_SKXCCM0_VWA1_WG16_16_1_WGM8_WGMXCC1_WGMXCCGn1
    SolutionIndex: 129
    SolutionNameMin: Cijk_Alik_Bljk_HHS_BH_UserArgs_MT80x64x64_MI16x16x1_SN_LDSB1_GRVWA4_GRVWB8_GSU0_GSUC0_GSUWGMRR0_K1_LBSPPA128_LBSPPB128_LPA16_LPB16_LRVW8_MIWT5_1_SU32_SUM0_SUS256_SVW1_SKXCCM8_VWA1_WG16_16_1_WGM8_WGMXCC1_WGMXCCGn1
    SolutionIndex: 130
    SolutionNameMin: Cijk_Alik_Bljk_HHS_BH_UserArgs_MT80x64x128_MI16x16x1_SN_LDSB1_GRVWA8_GRVWB8_GSU0_GSUC0_GSUWGMRR0_K1_LBSPPA256_LBSPPB256_LPA16_LPB16_LRVW8_MIWT5_1_SU32_SUM0_SUS256_SVW1_SKXCCM0_VWA1_WG16_16_1_WGM8_WGMXCC1_WGMXCCGn1
    SolutionIndex: 131
    SolutionNameMin: Cijk_Alik_Bljk_HHS_BH_UserArgs_MT80x64x128_MI16x16x1_SN_LDSB1_GRVWA8_GRVWB8_GSU0_GSUC0_GSUWGMRR0_K1_LBSPPA256_LBSPPB256_LPA16_LPB16_LRVW8_MIWT5_1_SU32_SUM0_SUS256_SVW1_SKXCCM8_VWA1_WG16_16_1_WGM8_WGMXCC1_WGMXCCGn1
    SolutionIndex: 132
    SolutionNameMin: Cijk_Alik_Bljk_HHS_BH_UserArgs_MT80x128x32_MI16x16x1_SN_LDSB0_GRVWA2_GRVWB4_GSU0_GSUC0_GSUWGMRR0_K1_LBSPPA128_LBSPPB128_LPA4_LPB4_LRVW4_MIWT5_2_SU32_SUM0_SUS256_SVW1_SKXCCM0_VWA1_WG16_16_1_WGM8_WGMXCC1_WGMXCCGn1
    SolutionIndex: 133
    SolutionNameMin: Cijk_Alik_Bljk_HHS_BH_UserArgs_MT80x128x32_MI16x16x1_SN_LDSB0_GRVWA2_GRVWB4_GSU0_GSUC0_GSUWGMRR0_K1_LBSPPA128_LBSPPB128_LPA4_LPB4_LRVW4_MIWT5_2_SU32_SUM0_SUS256_SVW1_SKXCCM8_VWA1_WG16_16_1_WGM8_WGMXCC1_WGMXCCGn1
    SolutionIndex: 134
    SolutionNameMin: Cijk_Alik_Bljk_HHS_BH_UserArgs_MT80x128x64_MI16x16x1_SN_LDSB1_GRVWA4_GRVWB8_GSU0_GSUC0_GSUWGMRR0_K1_LBSPPA128_LBSPPB128_LPA16_LPB16_LRVW8_MIWT5_2_SU32_SUM0_SUS256_SVW1_SKXCCM0_VWA1_WG16_16_1_WGM8_WGMXCC1_WGMXCCGn1
    SolutionIndex: 135
    SolutionNameMin: Cijk_Alik_Bljk_HHS_BH_UserArgs_MT80x128x64_MI16x16x1_SN_LDSB1_GRVWA4_GRVWB8_GSU0_GSUC0_GSUWGMRR0_K1_LBSPPA128_LBSPPB128_LPA16_LPB16_LRVW8_MIWT5_2_SU32_SUM0_SUS256_SVW1_SKXCCM8_VWA1_WG16_16_1_WGM8_WGMXCC1_WGMXCCGn1
    SolutionIndex: 136
    SolutionNameMin: Cijk_Alik_Bljk_HHS_BH_UserArgs_MT96x32x32_MI16x16x1_SN_LDSB0_GRVWA4_GRVWB4_GSU0_GSUC0_GSUWGMRR0_K1_LBSPPA128_LBSPPB128_LPA4_LPB4_LRVW4_MIWT3_1_SU32_SUM0_SUS256_SVW1_SKXCCM0_VWA1_WG32_8_1_WGM8_WGMXCC1_WGMXCCGn1
    SolutionIndex: 137
    SolutionNameMin: Cijk_Alik_Bljk_HHS_BH_UserArgs_MT96x32x32_MI16x16x1_SN_LDSB0_GRVWA4_GRVWB4_GSU0_GSUC0_GSUWGMRR0_K1_LBSPPA128_LBSPPB128_LPA4_LPB4_LRVW4_MIWT3_1_SU32_SUM0_SUS256_SVW1_SKXCCM8_VWA1_WG32_8_1_WGM8_WGMXCC1_WGMXCCGn1
    SolutionIndex: 138
    SolutionNameMin: Cijk_Alik_Bljk_HHS_BH_UserArgs_MT96x32x64_MI16x16x1_SN_LDSB1_GRVWA8_GRVWB8_GSU0_GSUC0_GSUWGMRR0_K1_LBSPPA128_LBSPPB128_LPA16_LPB16_LRVW8_MIWT3_1_SU32_SUM0_SUS256_SVW1_SKXCCM0_VWA1_WG32_8_1_WGM8_WGMXCC1_WGMXCCGn1
    SolutionIndex: 139
    SolutionNameMin: Cijk_Alik_Bljk_HHS_BH_UserArgs_MT96x32x64_MI16x16x1_SN_LDSB1_GRVWA8_GRVWB8_GSU0_GSUC0_GSUWGMRR0_K1_LBSPPA128_LBSPPB128_LPA16_LPB16_LRVW8_MIWT3_1_SU32_SUM0_SUS256_SVW1_SKXCCM8_VWA1_WG32_8_1_WGM8_WGMXCC1_WGMXCCGn1
    SolutionIndex: 140
    SolutionNameMin: Cijk_Alik_Bljk_HHS_BH_UserArgs_MT96x32x128_MI16x16x1_SN_LDSB1_GRVWA8_GRVWB8_GSU0_GSUC0_GSUWGMRR0_K1_LBSPPA256_LBSPPB256_LPA16_LPB16_LRVW8_MIWT3_1_SU32_SUM0_SUS256_SVW1_SKXCCM0_VWA1_WG32_8_1_WGM8_WGMXCC1_WGMXCCGn1
    SolutionIndex: 141
    SolutionNameMin: Cijk_Alik_Bljk_HHS_BH_UserArgs_MT96x32x128_MI16x16x1_SN_LDSB1_GRVWA8_GRVWB8_GSU0_GSUC0_GSUWGMRR0_K1_LBSPPA256_LBSPPB256_LPA16_LPB16_LRVW8_MIWT3_1_SU32_SUM0_SUS256_SVW1_SKXCCM8_VWA1_WG32_8_1_WGM8_WGMXCC1_WGMXCCGn1
    SolutionIndex: 142
    SolutionNameMin: Cijk_Alik_Bljk_HHS_BH_UserArgs_MT96x64x32_MI16x16x1_SN_LDSB0_GRVWA4_GRVWB4_GSU0_GSUC0_GSUWGMRR0_K1_LBSPPA128_LBSPPB128_LPA4_LPB4_LRVW4_MIWT6_1_SU32_SUM0_SUS256_SVW2_SKXCCM0_VWA2_WG16_16_1_WGM8_WGMXCC1_WGMXCCGn1
    SolutionIndex: 143
    SolutionNameMin: Cijk_Alik_Bljk_HHS_BH_UserArgs_MT96x64x32_MI16x16x1_SN_LDSB0_GRVWA4_GRVWB4_GSU0_GSUC0_GSUWGMRR0_K1_LBSPPA128_LBSPPB128_LPA4_LPB4_LRVW4_MIWT6_1_SU32_SUM0_SUS256_SVW2_SKXCCM8_VWA2_WG16_16_1_WGM8_WGMXCC1_WGMXCCGn1
    SolutionIndex: 144
    SolutionNameMin: Cijk_Alik_Bljk_HHS_BH_UserArgs_MT96x64x64_MI16x16x1_SN_LDSB1_GRVWA8_GRVWB8_GSU0_GSUC0_GSUWGMRR0_K1_LBSPPA256_LBSPPB128_LPA16_LPB16_LRVW8_MIWT6_1_SU32_SUM0_SUS256_SVW2_SKXCCM0_VWA2_WG16_16_1_WGM8_WGMXCC1_WGMXCCGn1
    SolutionIndex: 145
    SolutionNameMin: Cijk_Alik_Bljk_HHS_BH_UserArgs_MT96x64x64_MI16x16x1_SN_LDSB1_GRVWA8_GRVWB8_GSU0_GSUC0_GSUWGMRR0_K1_LBSPPA256_LBSPPB128_LPA16_LPB16_LRVW8_MIWT6_1_SU32_SUM0_SUS256_SVW2_SKXCCM8_VWA2_WG16_16_1_WGM8_WGMXCC1_WGMXCCGn1
    SolutionIndex: 146
    SolutionNameMin: Cijk_Alik_Bljk_HHS_BH_UserArgs_MT96x64x128_MI16x16x1_SN_LDSB1_GRVWA8_GRVWB8_GSU0_GSUC0_GSUWGMRR0_K1_LBSPPA512_LBSPPB256_LPA16_LPB16_LRVW8_MIWT6_1_SU32_SUM0_SUS256_SVW2_SKXCCM0_VWA2_WG16_16_1_WGM8_WGMXCC1_WGMXCCGn1
    SolutionIndex: 147
    SolutionNameMin: Cijk_Alik_Bljk_HHS_BH_UserArgs_MT96x64x128_MI16x16x1_SN_LDSB1_GRVWA8_GRVWB8_GSU0_GSUC0_GSUWGMRR0_K1_LBSPPA512_LBSPPB256_LPA16_LPB16_LRVW8_MIWT6_1_SU32_SUM0_SUS256_SVW2_SKXCCM8_VWA2_WG16_16_1_WGM8_WGMXCC1_WGMXCCGn1
    SolutionIndex: 148
    SolutionNameMin: Cijk_Alik_Bljk_HHS_BH_UserArgs_MT96x96x64_MI16x16x1_SN_LDSB1_GRVWA8_GRVWB8_GSU0_GSUC0_GSUWGMRR0_K1_LBSPPA128_LBSPPB128_LPA16_LPB16_LRVW8_MIWT3_3_SU32_SUM0_SUS256_SVW1_SKXCCM0_VWA1_WG32_8_1_WGM8_WGMXCC1_WGMXCCGn1
    SolutionIndex: 149
    SolutionNameMin: Cijk_Alik_Bljk_HHS_BH_UserArgs_MT96x96x64_MI16x16x1_SN_LDSB1_GRVWA8_GRVWB8_GSU0_GSUC0_GSUWGMRR0_K1_LBSPPA128_LBSPPB128_LPA16_LPB16_LRVW8_MIWT3_3_SU32_SUM0_SUS256_SVW1_SKXCCM8_VWA1_WG32_8_1_WGM8_WGMXCC1_WGMXCCGn1
    SolutionIndex: 150
    SolutionNameMin: Cijk_Alik_Bljk_HHS_BH_UserArgs_MT96x128x32_MI16x16x1_SN_LDSB0_GRVWA4_GRVWB4_GSU0_GSUC0_GSUWGMRR0_K1_LBSPPA128_LBSPPB128_LPA4_LPB4_LRVW4_MIWT6_2_SU32_SUM0_SUS256_SVW2_SKXCCM0_VWA2_WG16_16_1_WGM8_WGMXCC1_WGMXCCGn1
    SolutionIndex: 151
    SolutionNameMin: Cijk_Alik_Bljk_HHS_BH_UserArgs_MT96x128x32_MI16x16x1_SN_LDSB0_GRVWA4_GRVWB4_GSU0_GSUC0_GSUWGMRR0_K1_LBSPPA128_LBSPPB128_LPA4_LPB4_LRVW4_MIWT6_2_SU32_SUM0_SUS256_SVW2_SKXCCM8_VWA2_WG16_16_1_WGM8_WGMXCC1_WGMXCCGn1
    SolutionIndex: 152
    SolutionNameMin: Cijk_Alik_Bljk_HHS_BH_UserArgs_MT96x128x64_MI16x16x1_SN_LDSB1_GRVWA8_GRVWB8_GSU0_GSUC0_GSUWGMRR0_K1_LBSPPA256_LBSPPB128_LPA16_LPB16_LRVW8_MIWT6_2_SU32_SUM0_SUS256_SVW2_SKXCCM0_VWA2_WG16_16_1_WGM8_WGMXCC1_WGMXCCGn1
    SolutionIndex: 153
    SolutionNameMin: Cijk_Alik_Bljk_HHS_BH_UserArgs_MT96x128x64_MI16x16x1_SN_LDSB1_GRVWA8_GRVWB8_GSU0_GSUC0_GSUWGMRR0_K1_LBSPPA256_LBSPPB128_LPA16_LPB16_LRVW8_MIWT6_2_SU32_SUM0_SUS256_SVW2_SKXCCM8_VWA2_WG16_16_1_WGM8_WGMXCC1_WGMXCCGn1
    SolutionIndex: 154
    SolutionNameMin: Cijk_Alik_Bljk_HHS_BH_UserArgs_MT96x160x32_MI16x16x1_SN_LDSB1_GRVWA4_GRVWB4_GSU0_GSUC0_GSUWGMRR0_K1_LBSPPA128_LBSPPB128_LPA4_LPB4_LRVW4_MIWT3_5_SU32_SUM0_SUS256_SVW1_SKXCCM0_VWA1_WG32_8_1_WGM8_WGMXCC1_WGMXCCGn1
    SolutionIndex: 155
    SolutionNameMin: Cijk_Alik_Bljk_HHS_BH_UserArgs_MT96x160x32_MI16x16x1_SN_LDSB1_GRVWA4_GRVWB4_GSU0_GSUC0_GSUWGMRR0_K1_LBSPPA128_LBSPPB128_LPA4_LPB4_LRVW4_MIWT3_5_SU32_SUM0_SUS256_SVW1_SKXCCM8_VWA1_WG32_8_1_WGM8_WGMXCC1_WGMXCCGn1
    SolutionIndex: 156
    SolutionNameMin: Cijk_Alik_Bljk_HHS_BH_UserArgs_MT96x160x64_MI16x16x1_SN_LDSB1_GRVWA8_GRVWB8_GSU0_GSUC0_GSUWGMRR0_K1_LBSPPA128_LBSPPB128_LPA16_LPB16_LRVW8_MIWT3_5_SU32_SUM0_SUS256_SVW1_SKXCCM0_VWA1_WG32_8_1_WGM8_WGMXCC1_WGMXCCGn1
    SolutionIndex: 157
    SolutionNameMin: Cijk_Alik_Bljk_HHS_BH_UserArgs_MT96x160x64_MI16x16x1_SN_LDSB1_GRVWA8_GRVWB8_GSU0_GSUC0_GSUWGMRR0_K1_LBSPPA128_LBSPPB128_LPA16_LPB16_LRVW8_MIWT3_5_SU32_SUM0_SUS256_SVW1_SKXCCM8_VWA1_WG32_8_1_WGM8_WGMXCC1_WGMXCCGn1
    SolutionIndex: 158
    SolutionNameMin: Cijk_Alik_Bljk_HHS_BH_UserArgs_MT96x192x32_MI16x16x1_SN_LDSB1_GRVWA4_GRVWB4_GSU0_GSUC0_GSUWGMRR0_K1_LBSPPA128_LBSPPB128_LPA4_LPB4_LRVW4_MIWT6_3_SU32_SUM0_SUS256_SVW2_SKXCCM0_VWA2_WG16_16_1_WGM8_WGMXCC1_WGMXCCGn1
    SolutionIndex: 159
    SolutionNameMin: Cijk_Alik_Bljk_HHS_BH_UserArgs_MT96x192x32_MI16x16x1_SN_LDSB1_GRVWA4_GRVWB4_GSU0_GSUC0_GSUWGMRR0_K1_LBSPPA128_LBSPPB128_LPA4_LPB4_LRVW4_MIWT6_3_SU32_SUM0_SUS256_SVW2_SKXCCM8_VWA2_WG16_16_1_WGM8_WGMXCC1_WGMXCCGn1
    SolutionIndex: 160
    SolutionNameMin: Cijk_Alik_Bljk_HHS_BH_UserArgs_MT96x192x64_MI16x16x1_SN_LDSB1_GRVWA8_GRVWB8_GSU0_GSUC0_GSUWGMRR0_K1_LBSPPA256_LBSPPB128_LPA16_LPB16_LRVW8_MIWT6_3_SU32_SUM0_SUS256_SVW2_SKXCCM0_VWA2_WG16_16_1_WGM8_WGMXCC1_WGMXCCGn1
    SolutionIndex: 161
    SolutionNameMin: Cijk_Alik_Bljk_HHS_BH_UserArgs_MT96x192x64_MI16x16x1_SN_LDSB1_GRVWA8_GRVWB8_GSU0_GSUC0_GSUWGMRR0_K1_LBSPPA256_LBSPPB128_LPA16_LPB16_LRVW8_MIWT6_3_SU32_SUM0_SUS256_SVW2_SKXCCM8_VWA2_WG16_16_1_WGM8_WGMXCC1_WGMXCCGn1
    SolutionIndex: 162
    SolutionNameMin: Cijk_Alik_Bljk_HHS_BH_UserArgs_MT96x224x32_MI16x16x1_SN_LDSB1_GRVWA4_GRVWB4_GSU0_GSUC0_GSUWGMRR0_K1_LBSPPA128_LBSPPB128_LPA4_LPB4_LRVW4_MIWT3_7_SU32_SUM0_SUS256_SVW1_SKXCCM0_VWA1_WG32_8_1_WGM8_WGMXCC1_WGMXCCGn1
    SolutionIndex: 163
    SolutionNameMin: Cijk_Alik_Bljk_HHS_BH_UserArgs_MT96x224x32_MI16x16x1_SN_LDSB1_GRVWA4_GRVWB4_GSU0_GSUC0_GSUWGMRR0_K1_LBSPPA128_LBSPPB128_LPA4_LPB4_LRVW4_MIWT3_7_SU32_SUM0_SUS256_SVW1_SKXCCM8_VWA1_WG32_8_1_WGM8_WGMXCC1_WGMXCCGn1
    SolutionIndex: 164
    SolutionNameMin: Cijk_Alik_Bljk_HHS_BH_UserArgs_MT96x224x64_MI16x16x1_SN_LDSB1_GRVWA8_GRVWB8_GSU0_GSUC0_GSUWGMRR0_K1_LBSPPA128_LBSPPB128_LPA16_LPB16_LRVW8_MIWT3_7_SU32_SUM0_SUS256_SVW1_SKXCCM0_VWA1_WG32_8_1_WGM8_WGMXCC1_WGMXCCGn1
    SolutionIndex: 165
    SolutionNameMin: Cijk_Alik_Bljk_HHS_BH_UserArgs_MT96x224x64_MI16x16x1_SN_LDSB1_GRVWA8_GRVWB8_GSU0_GSUC0_GSUWGMRR0_K1_LBSPPA128_LBSPPB128_LPA16_LPB16_LRVW8_MIWT3_7_SU32_SUM0_SUS256_SVW1_SKXCCM8_VWA1_WG32_8_1_WGM8_WGMXCC1_WGMXCCGn1
    SolutionIndex: 166
    SolutionNameMin: Cijk_Alik_Bljk_HHS_BH_UserArgs_MT112x64x32_MI16x16x1_SN_LDSB0_GRVWA2_GRVWB4_GSU0_GSUC0_GSUWGMRR0_K1_LBSPPA128_LBSPPB128_LPA4_LPB4_LRVW4_MIWT7_1_SU32_SUM0_SUS256_SVW1_SKXCCM0_VWA1_WG16_16_1_WGM8_WGMXCC1_WGMXCCGn1
    SolutionIndex: 167
    SolutionNameMin: Cijk_Alik_Bljk_HHS_BH_UserArgs_MT112x64x32_MI16x16x1_SN_LDSB0_GRVWA2_GRVWB4_GSU0_GSUC0_GSUWGMRR0_K1_LBSPPA128_LBSPPB128_LPA4_LPB4_LRVW4_MIWT7_1_SU32_SUM0_SUS256_SVW1_SKXCCM8_VWA1_WG16_16_1_WGM8_WGMXCC1_WGMXCCGn1
    SolutionIndex: 168
    SolutionNameMin: Cijk_Alik_Bljk_HHS_BH_UserArgs_MT112x64x64_MI16x16x1_SN_LDSB1_GRVWA4_GRVWB8_GSU0_GSUC0_GSUWGMRR0_K1_LBSPPA128_LBSPPB128_LPA16_LPB16_LRVW8_MIWT7_1_SU32_SUM0_SUS256_SVW1_SKXCCM0_VWA1_WG16_16_1_WGM8_WGMXCC1_WGMXCCGn1
    SolutionIndex: 169
    SolutionNameMin: Cijk_Alik_Bljk_HHS_BH_UserArgs_MT112x64x64_MI16x16x1_SN_LDSB1_GRVWA4_GRVWB8_GSU0_GSUC0_GSUWGMRR0_K1_LBSPPA128_LBSPPB128_LPA16_LPB16_LRVW8_MIWT7_1_SU32_SUM0_SUS256_SVW1_SKXCCM8_VWA1_WG16_16_1_WGM8_WGMXCC1_WGMXCCGn1
    SolutionIndex: 170
    SolutionNameMin: Cijk_Alik_Bljk_HHS_BH_UserArgs_MT128x16x32_MI16x16x1_SN_LDSB0_GRVWA4_GRVWB2_GSU0_GSUC0_GSUWGMRR0_K1_LBSPPA128_LBSPPB128_LPA4_LPB4_LRVW4_MIWT2_1_SU32_SUM0_SUS256_SVW2_SKXCCM0_VWA2_WG64_4_1_WGM8_WGMXCC1_WGMXCCGn1
    SolutionIndex: 171
    SolutionNameMin: Cijk_Alik_Bljk_HHS_BH_UserArgs_MT128x16x32_MI16x16x1_SN_LDSB0_GRVWA4_GRVWB2_GSU0_GSUC0_GSUWGMRR0_K1_LBSPPA128_LBSPPB128_LPA4_LPB4_LRVW4_MIWT2_1_SU32_SUM0_SUS256_SVW2_SKXCCM8_VWA2_WG64_4_1_WGM8_WGMXCC1_WGMXCCGn1
    SolutionIndex: 172
    SolutionNameMin: Cijk_Alik_Bljk_HHS_BH_UserArgs_MT128x16x64_MI16x16x1_SN_LDSB1_GRVWA8_GRVWB4_GSU0_GSUC0_GSUWGMRR0_K1_LBSPPA256_LBSPPB128_LPA16_LPB16_LRVW8_MIWT2_1_SU32_SUM0_SUS256_SVW2_SKXCCM0_VWA2_WG64_4_1_WGM8_WGMXCC1_WGMXCCGn1
    SolutionIndex: 173
    SolutionNameMin: Cijk_Alik_Bljk_HHS_BH_UserArgs_MT128x16x64_MI16x16x1_SN_LDSB1_GRVWA8_GRVWB4_GSU0_GSUC0_GSUWGMRR0_K1_LBSPPA256_LBSPPB128_LPA16_LPB16_LRVW8_MIWT2_1_SU32_SUM0_SUS256_SVW2_SKXCCM8_VWA2_WG64_4_1_WGM8_WGMXCC1_WGMXCCGn1
    SolutionIndex: 174
    SolutionNameMin: Cijk_Alik_Bljk_HHS_BH_UserArgs_MT128x16x128_MI16x16x1_SN_LDSB1_GRVWA8_GRVWB8_GSU0_GSUC0_GSUWGMRR0_K1_LBSPPA512_LBSPPB256_LPA16_LPB16_LRVW8_MIWT2_1_SU32_SUM0_SUS256_SVW2_SKXCCM0_VWA2_WG64_4_1_WGM8_WGMXCC1_WGMXCCGn1
    SolutionIndex: 175
    SolutionNameMin: Cijk_Alik_Bljk_HHS_BH_UserArgs_MT128x16x128_MI16x16x1_SN_LDSB1_GRVWA8_GRVWB8_GSU0_GSUC0_GSUWGMRR0_K1_LBSPPA512_LBSPPB256_LPA16_LPB16_LRVW8_MIWT2_1_SU32_SUM0_SUS256_SVW2_SKXCCM8_VWA2_WG64_4_1_WGM8_WGMXCC1_WGMXCCGn1
    SolutionIndex: 176
    SolutionNameMin: Cijk_Alik_Bljk_HHS_BH_UserArgs_MT128x32x32_MI16x16x1_SN_LDSB0_GRVWA4_GRVWB4_GSU0_GSUC0_GSUWGMRR0_K1_LBSPPA128_LBSPPB128_LPA4_LPB4_LRVW4_MIWT2_2_SU32_SUM0_SUS256_SVW2_SKXCCM0_VWA2_WG64_4_1_WGM8_WGMXCC1_WGMXCCGn1
    SolutionIndex: 177
    SolutionNameMin: Cijk_Alik_Bljk_HHS_BH_UserArgs_MT128x32x32_MI16x16x1_SN_LDSB0_GRVWA4_GRVWB4_GSU0_GSUC0_GSUWGMRR0_K1_LBSPPA128_LBSPPB128_LPA4_LPB4_LRVW4_MIWT2_2_SU32_SUM0_SUS256_SVW2_SKXCCM8_VWA2_WG64_4_1_WGM8_WGMXCC1_WGMXCCGn1
    SolutionIndex: 178
    SolutionNameMin: Cijk_Alik_Bljk_HHS_BH_UserArgs_MT128x32x64_MI16x16x1_SN_LDSB1_GRVWA8_GRVWB8_GSU0_GSUC0_GSUWGMRR0_K1_LBSPPA256_LBSPPB128_LPA16_LPB16_LRVW8_MIWT2_2_SU32_SUM0_SUS256_SVW2_SKXCCM0_VWA2_WG64_4_1_WGM8_WGMXCC1_WGMXCCGn1
    SolutionIndex: 179
    SolutionNameMin: Cijk_Alik_Bljk_HHS_BH_UserArgs_MT128x32x64_MI16x16x1_SN_LDSB1_GRVWA8_GRVWB8_GSU0_GSUC0_GSUWGMRR0_K1_LBSPPA256_LBSPPB128_LPA16_LPB16_LRVW8_MIWT2_2_SU32_SUM0_SUS256_SVW2_SKXCCM8_VWA2_WG64_4_1_WGM8_WGMXCC1_WGMXCCGn1
    SolutionIndex: 180
    SolutionNameMin: Cijk_Alik_Bljk_HHS_BH_UserArgs_MT128x32x128_MI16x16x1_SN_LDSB1_GRVWA8_GRVWB8_GSU0_GSUC0_GSUWGMRR0_K1_LBSPPA512_LBSPPB256_LPA16_LPB16_LRVW8_MIWT2_2_SU32_SUM0_SUS256_SVW2_SKXCCM0_VWA2_WG64_4_1_WGM8_WGMXCC1_WGMXCCGn1
    SolutionIndex: 181
    SolutionNameMin: Cijk_Alik_Bljk_HHS_BH_UserArgs_MT128x32x128_MI16x16x1_SN_LDSB1_GRVWA8_GRVWB8_GSU0_GSUC0_GSUWGMRR0_K1_LBSPPA512_LBSPPB256_LPA16_LPB16_LRVW8_MIWT2_2_SU32_SUM0_SUS256_SVW2_SKXCCM8_VWA2_WG64_4_1_WGM8_WGMXCC1_WGMXCCGn1
    SolutionIndex: 182
    SolutionNameMin: Cijk_Alik_Bljk_HHS_BH_UserArgs_MT128x48x32_MI16x16x1_SN_LDSB0_GRVWA4_GRVWB2_GSU0_GSUC0_GSUWGMRR0_K1_LBSPPA128_LBSPPB128_LPA4_LPB4_LRVW4_MIWT2_3_SU32_SUM0_SUS256_SVW2_SKXCCM0_VWA2_WG64_4_1_WGM8_WGMXCC1_WGMXCCGn1
    SolutionIndex: 183
    SolutionNameMin: Cijk_Alik_Bljk_HHS_BH_UserArgs_MT128x48x32_MI16x16x1_SN_LDSB0_GRVWA4_GRVWB2_GSU0_GSUC0_GSUWGMRR0_K1_LBSPPA128_LBSPPB128_LPA4_LPB4_LRVW4_MIWT2_3_SU32_SUM0_SUS256_SVW2_SKXCCM8_VWA2_WG64_4_1_WGM8_WGMXCC1_WGMXCCGn1
    SolutionIndex: 184
    SolutionNameMin: Cijk_Alik_Bljk_HHS_BH_UserArgs_MT128x48x64_MI16x16x1_SN_LDSB1_GRVWA8_GRVWB4_GSU0_GSUC0_GSUWGMRR0_K1_LBSPPA256_LBSPPB128_LPA16_LPB16_LRVW8_MIWT2_3_SU32_SUM0_SUS256_SVW2_SKXCCM0_VWA2_WG64_4_1_WGM8_WGMXCC1_WGMXCCGn1
    SolutionIndex: 185
    SolutionNameMin: Cijk_Alik_Bljk_HHS_BH_UserArgs_MT128x48x64_MI16x16x1_SN_LDSB1_GRVWA8_GRVWB4_GSU0_GSUC0_GSUWGMRR0_K1_LBSPPA256_LBSPPB128_LPA16_LPB16_LRVW8_MIWT2_3_SU32_SUM0_SUS256_SVW2_SKXCCM8_VWA2_WG64_4_1_WGM8_WGMXCC1_WGMXCCGn1
    SolutionIndex: 186
    SolutionNameMin: Cijk_Alik_Bljk_HHS_BH_UserArgs_MT128x64x32_MI16x16x1_SN_LDSB0_GRVWA4_GRVWB4_GSU0_GSUC0_GSUWGMRR0_K1_LBSPPA256_LBSPPB128_LPA4_LPB4_LRVW4_MIWT4_2_SU32_SUM0_SUS256_SVW4_SKXCCM0_VWA4_WG32_8_1_WGM8_WGMXCC1_WGMXCCGn1
    SolutionIndex: 187
    SolutionNameMin: Cijk_Alik_Bljk_HHS_BH_UserArgs_MT128x64x32_MI16x16x1_SN_LDSB0_GRVWA4_GRVWB4_GSU0_GSUC0_GSUWGMRR0_K1_LBSPPA256_LBSPPB128_LPA4_LPB4_LRVW4_MIWT4_2_SU32_SUM0_SUS256_SVW4_SKXCCM8_VWA4_WG32_8_1_WGM8_WGMXCC1_WGMXCCGn1
    SolutionIndex: 188
    SolutionNameMin: Cijk_Alik_Bljk_HHS_BH_UserArgs_MT128x64x64_MI16x16x1_SN_LDSB1_GRVWA8_GRVWB8_GSU0_GSUC0_GSUWGMRR0_K1_LBSPPA512_LBSPPB128_LPA16_LPB16_LRVW8_MIWT4_2_SU32_SUM0_SUS256_SVW4_SKXCCM0_VWA4_WG32_8_1_WGM8_WGMXCC1_WGMXCCGn1
    SolutionIndex: 189
    SolutionNameMin: Cijk_Alik_Bljk_HHS_BH_UserArgs_MT128x64x64_MI16x16x1_SN_LDSB1_GRVWA8_GRVWB8_GSU0_GSUC0_GSUWGMRR0_K1_LBSPPA512_LBSPPB128_LPA16_LPB16_LRVW8_MIWT4_2_SU32_SUM0_SUS256_SVW4_SKXCCM8_VWA4_WG32_8_1_WGM8_WGMXCC1_WGMXCCGn1
    SolutionIndex: 190
    SolutionNameMin: Cijk_Alik_Bljk_HHS_BH_UserArgs_MT128x80x32_MI16x16x1_SN_LDSB0_GRVWA4_GRVWB2_GSU0_GSUC0_GSUWGMRR0_K1_LBSPPA128_LBSPPB128_LPA4_LPB4_LRVW4_MIWT2_5_SU32_SUM0_SUS256_SVW2_SKXCCM0_VWA2_WG64_4_1_WGM8_WGMXCC1_WGMXCCGn1
    SolutionIndex: 191
    SolutionNameMin: Cijk_Alik_Bljk_HHS_BH_UserArgs_MT128x80x32_MI16x16x1_SN_LDSB0_GRVWA4_GRVWB2_GSU0_GSUC0_GSUWGMRR0_K1_LBSPPA128_LBSPPB128_LPA4_LPB4_LRVW4_MIWT2_5_SU32_SUM0_SUS256_SVW2_SKXCCM8_VWA2_WG64_4_1_WGM8_WGMXCC1_WGMXCCGn1
    SolutionIndex: 192
    SolutionNameMin: Cijk_Alik_Bljk_HHS_BH_UserArgs_MT128x80x64_MI16x16x1_SN_LDSB1_GRVWA8_GRVWB4_GSU0_GSUC0_GSUWGMRR0_K1_LBSPPA256_LBSPPB128_LPA16_LPB16_LRVW8_MIWT2_5_SU32_SUM0_SUS256_SVW2_SKXCCM0_VWA2_WG64_4_1_WGM8_WGMXCC1_WGMXCCGn1
    SolutionIndex: 193
    SolutionNameMin: Cijk_Alik_Bljk_HHS_BH_UserArgs_MT128x80x64_MI16x16x1_SN_LDSB1_GRVWA8_GRVWB4_GSU0_GSUC0_GSUWGMRR0_K1_LBSPPA256_LBSPPB128_LPA16_LPB16_LRVW8_MIWT2_5_SU32_SUM0_SUS256_SVW2_SKXCCM8_VWA2_WG64_4_1_WGM8_WGMXCC1_WGMXCCGn1
    SolutionIndex: 194
    SolutionNameMin: Cijk_Alik_Bljk_HHS_BH_UserArgs_MT128x96x32_MI16x16x1_SN_LDSB0_GRVWA4_GRVWB4_GSU0_GSUC0_GSUWGMRR0_K1_LBSPPA128_LBSPPB128_LPA4_LPB4_LRVW4_MIWT2_6_SU32_SUM0_SUS256_SVW2_SKXCCM0_VWA2_WG64_4_1_WGM8_WGMXCC1_WGMXCCGn1
    SolutionIndex: 195
    SolutionNameMin: Cijk_Alik_Bljk_HHS_BH_UserArgs_MT128x96x32_MI16x16x1_SN_LDSB0_GRVWA4_GRVWB4_GSU0_GSUC0_GSUWGMRR0_K1_LBSPPA128_LBSPPB128_LPA4_LPB4_LRVW4_MIWT2_6_SU32_SUM0_SUS256_SVW2_SKXCCM8_VWA2_WG64_4_1_WGM8_WGMXCC1_WGMXCCGn1
    SolutionIndex: 196
    SolutionNameMin: Cijk_Alik_Bljk_HHS_BH_UserArgs_MT128x96x64_MI16x16x1_SN_LDSB1_GRVWA8_GRVWB8_GSU0_GSUC0_GSUWGMRR0_K1_LBSPPA256_LBSPPB128_LPA16_LPB16_LRVW8_MIWT2_6_SU32_SUM0_SUS256_SVW2_SKXCCM0_VWA2_WG64_4_1_WGM8_WGMXCC1_WGMXCCGn1
    SolutionIndex: 197
    SolutionNameMin: Cijk_Alik_Bljk_HHS_BH_UserArgs_MT128x96x64_MI16x16x1_SN_LDSB1_GRVWA8_GRVWB8_GSU0_GSUC0_GSUWGMRR0_K1_LBSPPA256_LBSPPB128_LPA16_LPB16_LRVW8_MIWT2_6_SU32_SUM0_SUS256_SVW2_SKXCCM8_VWA2_WG64_4_1_WGM8_WGMXCC1_WGMXCCGn1
    SolutionIndex: 198
    SolutionNameMin: Cijk_Alik_Bljk_HHS_BH_UserArgs_MT128x128x32_MI16x16x1_SN_LDSB1_GRVWA4_GRVWB4_GSU0_GSUC0_GSUWGMRR0_K1_LBSPPA256_LBSPPB128_LPA4_LPB4_LRVW4_MIWT4_4_SU32_SUM0_SUS256_SVW4_SKXCCM0_VWA4_WG32_8_1_WGM8_WGMXCC1_WGMXCCGn1
    SolutionIndex: 199
    SolutionNameMin: Cijk_Alik_Bljk_HHS_BH_UserArgs_MT128x128x32_MI16x16x1_SN_LDSB1_GRVWA4_GRVWB4_GSU0_GSUC0_GSUWGMRR0_K1_LBSPPA256_LBSPPB128_LPA4_LPB4_LRVW4_MIWT4_4_SU32_SUM0_SUS256_SVW4_SKXCCM8_VWA4_WG32_8_1_WGM8_WGMXCC1_WGMXCCGn1
    SolutionIndex: 200
    SolutionNameMin: Cijk_Alik_Bljk_HHS_BH_UserArgs_MT128x128x64_MI16x16x1_SN_LDSB1_GRVWA8_GRVWB8_GSU0_GSUC0_GSUWGMRR0_K1_LBSPPA512_LBSPPB128_LPA16_LPB16_LRVW8_MIWT4_4_SU32_SUM0_SUS256_SVW4_SKXCCM0_VWA4_WG32_8_1_WGM8_WGMXCC1_WGMXCCGn1
    SolutionIndex: 201
    SolutionNameMin: Cijk_Alik_Bljk_HHS_BH_UserArgs_MT128x128x64_MI16x16x1_SN_LDSB1_GRVWA8_GRVWB8_GSU0_GSUC0_GSUWGMRR0_K1_LBSPPA512_LBSPPB128_LPA16_LPB16_LRVW8_MIWT4_4_SU32_SUM0_SUS256_SVW4_SKXCCM8_VWA4_WG32_8_1_WGM8_WGMXCC1_WGMXCCGn1
    SolutionIndex: 202
    SolutionNameMin: Cijk_Alik_Bljk_HHS_BH_UserArgs_MT128x160x32_MI16x16x1_SN_LDSB1_GRVWA4_GRVWB4_GSU0_GSUC0_GSUWGMRR0_K1_LBSPPA128_LBSPPB128_LPA4_LPB4_LRVW4_MIWT2_10_SU32_SUM0_SUS256_SVW2_SKXCCM0_VWA2_WG64_4_1_WGM8_WGMXCC1_WGMXCCGn1
    SolutionIndex: 203
    SolutionNameMin: Cijk_Alik_Bljk_HHS_BH_UserArgs_MT128x160x32_MI16x16x1_SN_LDSB1_GRVWA4_GRVWB4_GSU0_GSUC0_GSUWGMRR0_K1_LBSPPA128_LBSPPB128_LPA4_LPB4_LRVW4_MIWT2_10_SU32_SUM0_SUS256_SVW2_SKXCCM8_VWA2_WG64_4_1_WGM8_WGMXCC1_WGMXCCGn1
    SolutionIndex: 204
    SolutionNameMin: Cijk_Alik_Bljk_HHS_BH_UserArgs_MT128x160x64_MI16x16x1_SN_LDSB1_GRVWA8_GRVWB8_GSU0_GSUC0_GSUWGMRR0_K1_LBSPPA256_LBSPPB128_LPA16_LPB16_LRVW8_MIWT2_10_SU32_SUM0_SUS256_SVW2_SKXCCM0_VWA2_WG64_4_1_WGM8_WGMXCC1_WGMXCCGn1
    SolutionIndex: 205
    SolutionNameMin: Cijk_Alik_Bljk_HHS_BH_UserArgs_MT128x160x64_MI16x16x1_SN_LDSB1_GRVWA8_GRVWB8_GSU0_GSUC0_GSUWGMRR0_K1_LBSPPA256_LBSPPB128_LPA16_LPB16_LRVW8_MIWT2_10_SU32_SUM0_SUS256_SVW2_SKXCCM8_VWA2_WG64_4_1_WGM8_WGMXCC1_WGMXCCGn1
    SolutionIndex: 206
    SolutionNameMin: Cijk_Alik_Bljk_HHS_BH_UserArgs_MT128x192x32_MI16x16x1_SN_LDSB1_GRVWA4_GRVWB4_GSU0_GSUC0_GSUWGMRR0_K1_LBSPPA256_LBSPPB128_LPA4_LPB4_LRVW4_MIWT4_6_SU32_SUM0_SUS256_SVW4_SKXCCM0_VWA4_WG32_8_1_WGM8_WGMXCC1_WGMXCCGn1
    SolutionIndex: 207
    SolutionNameMin: Cijk_Alik_Bljk_HHS_BH_UserArgs_MT128x192x32_MI16x16x1_SN_LDSB1_GRVWA4_GRVWB4_GSU0_GSUC0_GSUWGMRR0_K1_LBSPPA256_LBSPPB128_LPA4_LPB4_LRVW4_MIWT4_6_SU32_SUM0_SUS256_SVW4_SKXCCM8_VWA4_WG32_8_1_WGM8_WGMXCC1_WGMXCCGn1
    SolutionIndex: 208
    SolutionNameMin: Cijk_Alik_Bljk_HHS_BH_UserArgs_MT128x192x64_MI16x16x1_SN_LDSB1_GRVWA8_GRVWB8_GSU0_GSUC0_GSUWGMRR0_K1_LBSPPA512_LBSPPB128_LPA16_LPB16_LRVW8_MIWT4_6_SU32_SUM0_SUS256_SVW4_SKXCCM0_VWA4_WG32_8_1_WGM8_WGMXCC1_WGMXCCGn1
    SolutionIndex: 209
    SolutionNameMin: Cijk_Alik_Bljk_HHS_BH_UserArgs_MT128x192x64_MI16x16x1_SN_LDSB1_GRVWA8_GRVWB8_GSU0_GSUC0_GSUWGMRR0_K1_LBSPPA512_LBSPPB128_LPA16_LPB16_LRVW8_MIWT4_6_SU32_SUM0_SUS256_SVW4_SKXCCM8_VWA4_WG32_8_1_WGM8_WGMXCC1_WGMXCCGn1
    SolutionIndex: 210
    SolutionNameMin: Cijk_Alik_Bljk_HHS_BH_UserArgs_MT160x32x64_MI16x16x1_SN_LDSB1_GRVWA8_GRVWB8_GSU0_GSUC0_GSUWGMRR0_K1_LBSPPA128_LBSPPB128_LPA16_LPB16_LRVW8_MIWT5_1_SU32_SUM0_SUS256_SVW1_SKXCCM0_VWA1_WG32_8_1_WGM8_WGMXCC1_WGMXCCGn1
    SolutionIndex: 211
    SolutionNameMin: Cijk_Alik_Bljk_HHS_BH_UserArgs_MT160x32x64_MI16x16x1_SN_LDSB1_GRVWA8_GRVWB8_GSU0_GSUC0_GSUWGMRR0_K1_LBSPPA128_LBSPPB128_LPA16_LPB16_LRVW8_MIWT5_1_SU32_SUM0_SUS256_SVW1_SKXCCM8_VWA1_WG32_8_1_WGM8_WGMXCC1_WGMXCCGn1
    SolutionIndex: 212
    SolutionNameMin: Cijk_Alik_Bljk_HHS_BH_UserArgs_MT160x64x32_MI16x16x1_SN_LDSB0_GRVWA4_GRVWB4_GSU0_GSUC0_GSUWGMRR0_K1_LBSPPA128_LBSPPB128_LPA4_LPB4_LRVW4_MIWT10_1_SU32_SUM0_SUS256_SVW2_SKXCCM0_VWA2_WG16_16_1_WGM8_WGMXCC1_WGMXCCGn1
    SolutionIndex: 213
    SolutionNameMin: Cijk_Alik_Bljk_HHS_BH_UserArgs_MT160x64x32_MI16x16x1_SN_LDSB0_GRVWA4_GRVWB4_GSU0_GSUC0_GSUWGMRR0_K1_LBSPPA128_LBSPPB128_LPA4_LPB4_LRVW4_MIWT10_1_SU32_SUM0_SUS256_SVW2_SKXCCM8_VWA2_WG16_16_1_WGM8_WGMXCC1_WGMXCCGn1
    SolutionIndex: 214
    SolutionNameMin: Cijk_Alik_Bljk_HHS_BH_UserArgs_MT160x64x64_MI16x16x1_SN_LDSB1_GRVWA8_GRVWB8_GSU0_GSUC0_GSUWGMRR0_K1_LBSPPA256_LBSPPB128_LPA16_LPB16_LRVW8_MIWT10_1_SU32_SUM0_SUS256_SVW2_SKXCCM0_VWA2_WG16_16_1_WGM8_WGMXCC1_WGMXCCGn1
    SolutionIndex: 215
    SolutionNameMin: Cijk_Alik_Bljk_HHS_BH_UserArgs_MT160x64x64_MI16x16x1_SN_LDSB1_GRVWA8_GRVWB8_GSU0_GSUC0_GSUWGMRR0_K1_LBSPPA256_LBSPPB128_LPA16_LPB16_LRVW8_MIWT10_1_SU32_SUM0_SUS256_SVW2_SKXCCM8_VWA2_WG16_16_1_WGM8_WGMXCC1_WGMXCCGn1
    SolutionIndex: 216
    SolutionNameMin: Cijk_Alik_Bljk_HHS_BH_UserArgs_MT160x96x32_MI16x16x1_SN_LDSB1_GRVWA4_GRVWB4_GSU0_GSUC0_GSUWGMRR0_K1_LBSPPA128_LBSPPB128_LPA4_LPB4_LRVW4_MIWT5_3_SU32_SUM0_SUS256_SVW1_SKXCCM0_VWA1_WG32_8_1_WGM8_WGMXCC1_WGMXCCGn1
    SolutionIndex: 217
    SolutionNameMin: Cijk_Alik_Bljk_HHS_BH_UserArgs_MT160x96x32_MI16x16x1_SN_LDSB1_GRVWA4_GRVWB4_GSU0_GSUC0_GSUWGMRR0_K1_LBSPPA128_LBSPPB128_LPA4_LPB4_LRVW4_MIWT5_3_SU32_SUM0_SUS256_SVW1_SKXCCM8_VWA1_WG32_8_1_WGM8_WGMXCC1_WGMXCCGn1
    SolutionIndex: 218
    SolutionNameMin: Cijk_Alik_Bljk_HHS_BH_UserArgs_MT160x96x64_MI16x16x1_SN_LDSB1_GRVWA8_GRVWB8_GSU0_GSUC0_GSUWGMRR0_K1_LBSPPA128_LBSPPB128_LPA16_LPB16_LRVW8_MIWT5_3_SU32_SUM0_SUS256_SVW1_SKXCCM0_VWA1_WG32_8_1_WGM8_WGMXCC1_WGMXCCGn1
    SolutionIndex: 219
    SolutionNameMin: Cijk_Alik_Bljk_HHS_BH_UserArgs_MT160x96x64_MI16x16x1_SN_LDSB1_GRVWA8_GRVWB8_GSU0_GSUC0_GSUWGMRR0_K1_LBSPPA128_LBSPPB128_LPA16_LPB16_LRVW8_MIWT5_3_SU32_SUM0_SUS256_SVW1_SKXCCM8_VWA1_WG32_8_1_WGM8_WGMXCC1_WGMXCCGn1
    SolutionIndex: 220
    SolutionNameMin: Cijk_Alik_Bljk_HHS_BH_UserArgs_MT160x128x32_MI16x16x1_SN_LDSB1_GRVWA4_GRVWB4_GSU0_GSUC0_GSUWGMRR0_K1_LBSPPA128_LBSPPB128_LPA4_LPB4_LRVW4_MIWT10_2_SU32_SUM0_SUS256_SVW2_SKXCCM0_VWA2_WG16_16_1_WGM8_WGMXCC1_WGMXCCGn1
    SolutionIndex: 221
    SolutionNameMin: Cijk_Alik_Bljk_HHS_BH_UserArgs_MT160x128x32_MI16x16x1_SN_LDSB1_GRVWA4_GRVWB4_GSU0_GSUC0_GSUWGMRR0_K1_LBSPPA128_LBSPPB128_LPA4_LPB4_LRVW4_MIWT10_2_SU32_SUM0_SUS256_SVW2_SKXCCM8_VWA2_WG16_16_1_WGM8_WGMXCC1_WGMXCCGn1
    SolutionIndex: 222
    SolutionNameMin: Cijk_Alik_Bljk_HHS_BH_UserArgs_MT160x128x64_MI16x16x1_SN_LDSB1_GRVWA8_GRVWB8_GSU0_GSUC0_GSUWGMRR0_K1_LBSPPA256_LBSPPB128_LPA16_LPB16_LRVW8_MIWT10_2_SU32_SUM0_SUS256_SVW2_SKXCCM0_VWA2_WG16_16_1_WGM8_WGMXCC1_WGMXCCGn1
    SolutionIndex: 223
    SolutionNameMin: Cijk_Alik_Bljk_HHS_BH_UserArgs_MT160x128x64_MI16x16x1_SN_LDSB1_GRVWA8_GRVWB8_GSU0_GSUC0_GSUWGMRR0_K1_LBSPPA256_LBSPPB128_LPA16_LPB16_LRVW8_MIWT10_2_SU32_SUM0_SUS256_SVW2_SKXCCM8_VWA2_WG16_16_1_WGM8_WGMXCC1_WGMXCCGn1
    SolutionIndex: 224
    SolutionNameMin: Cijk_Alik_Bljk_HHS_BH_UserArgs_MT160x160x32_MI16x16x1_SN_LDSB1_GRVWA4_GRVWB4_GSU0_GSUC0_GSUWGMRR0_K1_LBSPPA128_LBSPPB128_LPA4_LPB4_LRVW4_MIWT5_5_SU32_SUM0_SUS256_SVW1_SKXCCM0_VWA1_WG32_8_1_WGM8_WGMXCC1_WGMXCCGn1
    SolutionIndex: 225
    SolutionNameMin: Cijk_Alik_Bljk_HHS_BH_UserArgs_MT160x160x32_MI16x16x1_SN_LDSB1_GRVWA4_GRVWB4_GSU0_GSUC0_GSUWGMRR0_K1_LBSPPA128_LBSPPB128_LPA4_LPB4_LRVW4_MIWT5_5_SU32_SUM0_SUS256_SVW1_SKXCCM8_VWA1_WG32_8_1_WGM8_WGMXCC1_WGMXCCGn1
    SolutionIndex: 226
    SolutionNameMin: Cijk_Alik_Bljk_HHS_BH_UserArgs_MT160x160x64_MI16x16x1_SN_LDSB1_GRVWA8_GRVWB8_GSU0_GSUC0_GSUWGMRR0_K1_LBSPPA128_LBSPPB128_LPA16_LPB16_LRVW8_MIWT5_5_SU32_SUM0_SUS256_SVW1_SKXCCM0_VWA1_WG32_8_1_WGM8_WGMXCC1_WGMXCCGn1
    SolutionIndex: 227
    SolutionNameMin: Cijk_Alik_Bljk_HHS_BH_UserArgs_MT160x160x64_MI16x16x1_SN_LDSB1_GRVWA8_GRVWB8_GSU0_GSUC0_GSUWGMRR0_K1_LBSPPA128_LBSPPB128_LPA16_LPB16_LRVW8_MIWT5_5_SU32_SUM0_SUS256_SVW1_SKXCCM8_VWA1_WG32_8_1_WGM8_WGMXCC1_WGMXCCGn1
    SolutionIndex: 228
    SolutionNameMin: Cijk_Alik_Bljk_HHS_BH_UserArgs_MT192x16x32_MI16x16x1_SN_LDSB0_GRVWA4_GRVWB2_GSU0_GSUC0_GSUWGMRR0_K1_LBSPPA128_LBSPPB128_LPA4_LPB4_LRVW4_MIWT3_1_SU32_SUM0_SUS256_SVW1_SKXCCM0_VWA1_WG64_4_1_WGM8_WGMXCC1_WGMXCCGn1
    SolutionIndex: 229
    SolutionNameMin: Cijk_Alik_Bljk_HHS_BH_UserArgs_MT192x16x32_MI16x16x1_SN_LDSB0_GRVWA4_GRVWB2_GSU0_GSUC0_GSUWGMRR0_K1_LBSPPA128_LBSPPB128_LPA4_LPB4_LRVW4_MIWT3_1_SU32_SUM0_SUS256_SVW1_SKXCCM8_VWA1_WG64_4_1_WGM8_WGMXCC1_WGMXCCGn1
    SolutionIndex: 230
    SolutionNameMin: Cijk_Alik_Bljk_HHS_BH_UserArgs_MT192x16x64_MI16x16x1_SN_LDSB1_GRVWA8_GRVWB4_GSU0_GSUC0_GSUWGMRR0_K1_LBSPPA128_LBSPPB128_LPA16_LPB16_LRVW8_MIWT3_1_SU32_SUM0_SUS256_SVW1_SKXCCM0_VWA1_WG64_4_1_WGM8_WGMXCC1_WGMXCCGn1
    SolutionIndex: 231
    SolutionNameMin: Cijk_Alik_Bljk_HHS_BH_UserArgs_MT192x16x64_MI16x16x1_SN_LDSB1_GRVWA8_GRVWB4_GSU0_GSUC0_GSUWGMRR0_K1_LBSPPA128_LBSPPB128_LPA16_LPB16_LRVW8_MIWT3_1_SU32_SUM0_SUS256_SVW1_SKXCCM8_VWA1_WG64_4_1_WGM8_WGMXCC1_WGMXCCGn1
    SolutionIndex: 232
    SolutionNameMin: Cijk_Alik_Bljk_HHS_BH_UserArgs_MT192x32x32_MI16x16x1_SN_LDSB0_GRVWA4_GRVWB4_GSU0_GSUC0_GSUWGMRR0_K1_LBSPPA128_LBSPPB128_LPA4_LPB4_LRVW4_MIWT6_1_SU32_SUM0_SUS256_SVW2_SKXCCM0_VWA2_WG32_8_1_WGM8_WGMXCC1_WGMXCCGn1
    SolutionIndex: 233
    SolutionNameMin: Cijk_Alik_Bljk_HHS_BH_UserArgs_MT192x32x32_MI16x16x1_SN_LDSB0_GRVWA4_GRVWB4_GSU0_GSUC0_GSUWGMRR0_K1_LBSPPA128_LBSPPB128_LPA4_LPB4_LRVW4_MIWT6_1_SU32_SUM0_SUS256_SVW2_SKXCCM8_VWA2_WG32_8_1_WGM8_WGMXCC1_WGMXCCGn1
    SolutionIndex: 234
    SolutionNameMin: Cijk_Alik_Bljk_HHS_BH_UserArgs_MT192x32x64_MI16x16x1_SN_LDSB1_GRVWA8_GRVWB8_GSU0_GSUC0_GSUWGMRR0_K1_LBSPPA256_LBSPPB128_LPA16_LPB16_LRVW8_MIWT6_1_SU32_SUM0_SUS256_SVW2_SKXCCM0_VWA2_WG32_8_1_WGM8_WGMXCC1_WGMXCCGn1
    SolutionIndex: 235
    SolutionNameMin: Cijk_Alik_Bljk_HHS_BH_UserArgs_MT192x32x64_MI16x16x1_SN_LDSB1_GRVWA8_GRVWB8_GSU0_GSUC0_GSUWGMRR0_K1_LBSPPA256_LBSPPB128_LPA16_LPB16_LRVW8_MIWT6_1_SU32_SUM0_SUS256_SVW2_SKXCCM8_VWA2_WG32_8_1_WGM8_WGMXCC1_WGMXCCGn1
    SolutionIndex: 236
    SolutionNameMin: Cijk_Alik_Bljk_HHS_BH_UserArgs_MT192x48x64_MI16x16x1_SN_LDSB1_GRVWA8_GRVWB4_GSU0_GSUC0_GSUWGMRR0_K1_LBSPPA128_LBSPPB128_LPA16_LPB16_LRVW8_MIWT3_3_SU32_SUM0_SUS256_SVW1_SKXCCM0_VWA1_WG64_4_1_WGM8_WGMXCC1_WGMXCCGn1
    SolutionIndex: 237
    SolutionNameMin: Cijk_Alik_Bljk_HHS_BH_UserArgs_MT192x48x64_MI16x16x1_SN_LDSB1_GRVWA8_GRVWB4_GSU0_GSUC0_GSUWGMRR0_K1_LBSPPA128_LBSPPB128_LPA16_LPB16_LRVW8_MIWT3_3_SU32_SUM0_SUS256_SVW1_SKXCCM8_VWA1_WG64_4_1_WGM8_WGMXCC1_WGMXCCGn1
    SolutionIndex: 238
    SolutionNameMin: Cijk_Alik_Bljk_HHS_BH_UserArgs_MT192x64x32_MI16x16x1_SN_LDSB1_GRVWA4_GRVWB4_GSU0_GSUC0_GSUWGMRR0_K1_LBSPPA128_LBSPPB128_LPA4_LPB4_LRVW4_MIWT6_2_SU32_SUM0_SUS256_SVW2_SKXCCM0_VWA2_WG32_8_1_WGM8_WGMXCC1_WGMXCCGn1
    SolutionIndex: 239
    SolutionNameMin: Cijk_Alik_Bljk_HHS_BH_UserArgs_MT192x64x32_MI16x16x1_SN_LDSB1_GRVWA4_GRVWB4_GSU0_GSUC0_GSUWGMRR0_K1_LBSPPA128_LBSPPB128_LPA4_LPB4_LRVW4_MIWT6_2_SU32_SUM0_SUS256_SVW2_SKXCCM8_VWA2_WG32_8_1_WGM8_WGMXCC1_WGMXCCGn1
    SolutionIndex: 240
    SolutionNameMin: Cijk_Alik_Bljk_HHS_BH_UserArgs_MT192x64x64_MI16x16x1_SN_LDSB1_GRVWA8_GRVWB8_GSU0_GSUC0_GSUWGMRR0_K1_LBSPPA256_LBSPPB128_LPA16_LPB16_LRVW8_MIWT6_2_SU32_SUM0_SUS256_SVW2_SKXCCM0_VWA2_WG32_8_1_WGM8_WGMXCC1_WGMXCCGn1
    SolutionIndex: 241
    SolutionNameMin: Cijk_Alik_Bljk_HHS_BH_UserArgs_MT192x64x64_MI16x16x1_SN_LDSB1_GRVWA8_GRVWB8_GSU0_GSUC0_GSUWGMRR0_K1_LBSPPA256_LBSPPB128_LPA16_LPB16_LRVW8_MIWT6_2_SU32_SUM0_SUS256_SVW2_SKXCCM8_VWA2_WG32_8_1_WGM8_WGMXCC1_WGMXCCGn1
    SolutionIndex: 242
    SolutionNameMin: Cijk_Alik_Bljk_HHS_BH_UserArgs_MT192x96x32_MI16x16x1_SN_LDSB1_GRVWA4_GRVWB4_GSU0_GSUC0_GSUWGMRR0_K1_LBSPPA128_LBSPPB128_LPA4_LPB4_LRVW4_MIWT6_3_SU32_SUM0_SUS256_SVW2_SKXCCM0_VWA2_WG32_8_1_WGM8_WGMXCC1_WGMXCCGn1
    SolutionIndex: 243
    SolutionNameMin: Cijk_Alik_Bljk_HHS_BH_UserArgs_MT192x96x32_MI16x16x1_SN_LDSB1_GRVWA4_GRVWB4_GSU0_GSUC0_GSUWGMRR0_K1_LBSPPA128_LBSPPB128_LPA4_LPB4_LRVW4_MIWT6_3_SU32_SUM0_SUS256_SVW2_SKXCCM8_VWA2_WG32_8_1_WGM8_WGMXCC1_WGMXCCGn1
    SolutionIndex: 244
    SolutionNameMin: Cijk_Alik_Bljk_HHS_BH_UserArgs_MT192x96x64_MI16x16x1_SN_LDSB1_GRVWA8_GRVWB8_GSU0_GSUC0_GSUWGMRR0_K1_LBSPPA256_LBSPPB128_LPA16_LPB16_LRVW8_MIWT6_3_SU32_SUM0_SUS256_SVW2_SKXCCM0_VWA2_WG32_8_1_WGM8_WGMXCC1_WGMXCCGn1
    SolutionIndex: 245
    SolutionNameMin: Cijk_Alik_Bljk_HHS_BH_UserArgs_MT192x96x64_MI16x16x1_SN_LDSB1_GRVWA8_GRVWB8_GSU0_GSUC0_GSUWGMRR0_K1_LBSPPA256_LBSPPB128_LPA16_LPB16_LRVW8_MIWT6_3_SU32_SUM0_SUS256_SVW2_SKXCCM8_VWA2_WG32_8_1_WGM8_WGMXCC1_WGMXCCGn1
    SolutionIndex: 246
    SolutionNameMin: Cijk_Alik_Bljk_HHS_BH_UserArgs_MT192x128x32_MI16x16x1_SN_LDSB1_GRVWA4_GRVWB4_GSU0_GSUC0_GSUWGMRR0_K1_LBSPPA256_LBSPPB128_LPA4_LPB4_LRVW4_MIWT12_2_SU32_SUM0_SUS256_SVW4_SKXCCM0_VWA4_WG16_16_1_WGM8_WGMXCC1_WGMXCCGn1
    SolutionIndex: 247
    SolutionNameMin: Cijk_Alik_Bljk_HHS_BH_UserArgs_MT192x128x32_MI16x16x1_SN_LDSB1_GRVWA4_GRVWB4_GSU0_GSUC0_GSUWGMRR0_K1_LBSPPA256_LBSPPB128_LPA4_LPB4_LRVW4_MIWT12_2_SU32_SUM0_SUS256_SVW4_SKXCCM8_VWA4_WG16_16_1_WGM8_WGMXCC1_WGMXCCGn1
    SolutionIndex: 248
    SolutionNameMin: Cijk_Alik_Bljk_HHS_BH_UserArgs_MT192x128x64_MI16x16x1_SN_LDSB1_GRVWA8_GRVWB8_GSU0_GSUC0_GSUWGMRR0_K1_LBSPPA512_LBSPPB128_LPA16_LPB16_LRVW8_MIWT12_2_SU32_SUM0_SUS256_SVW4_SKXCCM0_VWA4_WG16_16_1_WGM8_WGMXCC1_WGMXCCGn1
    SolutionIndex: 249
    SolutionNameMin: Cijk_Alik_Bljk_HHS_BH_UserArgs_MT192x128x64_MI16x16x1_SN_LDSB1_GRVWA8_GRVWB8_GSU0_GSUC0_GSUWGMRR0_K1_LBSPPA512_LBSPPB128_LPA16_LPB16_LRVW8_MIWT12_2_SU32_SUM0_SUS256_SVW4_SKXCCM8_VWA4_WG16_16_1_WGM8_WGMXCC1_WGMXCCGn1
    SolutionIndex: 250
    SolutionNameMin: Cijk_Alik_Bljk_HHS_BH_UserArgs_MT224x32x64_MI16x16x1_SN_LDSB1_GRVWA8_GRVWB8_GSU0_GSUC0_GSUWGMRR0_K1_LBSPPA128_LBSPPB128_LPA16_LPB16_LRVW8_MIWT7_1_SU32_SUM0_SUS256_SVW1_SKXCCM0_VWA1_WG32_8_1_WGM8_WGMXCC1_WGMXCCGn1
    SolutionIndex: 251
    SolutionNameMin: Cijk_Alik_Bljk_HHS_BH_UserArgs_MT224x32x64_MI16x16x1_SN_LDSB1_GRVWA8_GRVWB8_GSU0_GSUC0_GSUWGMRR0_K1_LBSPPA128_LBSPPB128_LPA16_LPB16_LRVW8_MIWT7_1_SU32_SUM0_SUS256_SVW1_SKXCCM8_VWA1_WG32_8_1_WGM8_WGMXCC1_WGMXCCGn1
    SolutionIndex: 252
    SolutionNameMin: Cijk_Alik_Bljk_HHS_BH_UserArgs_MT224x64x32_MI16x16x1_SN_LDSB1_GRVWA4_GRVWB4_GSU0_GSUC0_GSUWGMRR0_K1_LBSPPA128_LBSPPB128_LPA4_LPB4_LRVW4_MIWT14_1_SU32_SUM0_SUS256_SVW2_SKXCCM0_VWA2_WG16_16_1_WGM8_WGMXCC1_WGMXCCGn1
    SolutionIndex: 253
    SolutionNameMin: Cijk_Alik_Bljk_HHS_BH_UserArgs_MT224x64x32_MI16x16x1_SN_LDSB1_GRVWA4_GRVWB4_GSU0_GSUC0_GSUWGMRR0_K1_LBSPPA128_LBSPPB128_LPA4_LPB4_LRVW4_MIWT14_1_SU32_SUM0_SUS256_SVW2_SKXCCM8_VWA2_WG16_16_1_WGM8_WGMXCC1_WGMXCCGn1
    SolutionIndex: 254
    SolutionNameMin: Cijk_Alik_Bljk_HHS_BH_UserArgs_MT224x64x64_MI16x16x1_SN_LDSB1_GRVWA8_GRVWB8_GSU0_GSUC0_GSUWGMRR0_K1_LBSPPA256_LBSPPB128_LPA16_LPB16_LRVW8_MIWT14_1_SU32_SUM0_SUS256_SVW2_SKXCCM0_VWA2_WG16_16_1_WGM8_WGMXCC1_WGMXCCGn1
    SolutionIndex: 255
    SolutionNameMin: Cijk_Alik_Bljk_HHS_BH_UserArgs_MT224x64x64_MI16x16x1_SN_LDSB1_GRVWA8_GRVWB8_GSU0_GSUC0_GSUWGMRR0_K1_LBSPPA256_LBSPPB128_LPA16_LPB16_LRVW8_MIWT14_1_SU32_SUM0_SUS256_SVW2_SKXCCM8_VWA2_WG16_16_1_WGM8_WGMXCC1_WGMXCCGn1
    SolutionIndex: 256
    SolutionNameMin: Cijk_Alik_Bljk_HHS_BH_UserArgs_MT224x96x32_MI16x16x1_SN_LDSB1_GRVWA4_GRVWB4_GSU0_GSUC0_GSUWGMRR0_K1_LBSPPA128_LBSPPB128_LPA4_LPB4_LRVW4_MIWT7_3_SU32_SUM0_SUS256_SVW1_SKXCCM0_VWA1_WG32_8_1_WGM8_WGMXCC1_WGMXCCGn1
    SolutionIndex: 257
    SolutionNameMin: Cijk_Alik_Bljk_HHS_BH_UserArgs_MT224x96x32_MI16x16x1_SN_LDSB1_GRVWA4_GRVWB4_GSU0_GSUC0_GSUWGMRR0_K1_LBSPPA128_LBSPPB128_LPA4_LPB4_LRVW4_MIWT7_3_SU32_SUM0_SUS256_SVW1_SKXCCM8_VWA1_WG32_8_1_WGM8_WGMXCC1_WGMXCCGn1
    SolutionIndex: 258
    SolutionNameMin: Cijk_Alik_Bljk_HHS_BH_UserArgs_MT224x96x64_MI16x16x1_SN_LDSB1_GRVWA8_GRVWB8_GSU0_GSUC0_GSUWGMRR0_K1_LBSPPA128_LBSPPB128_LPA16_LPB16_LRVW8_MIWT7_3_SU32_SUM0_SUS256_SVW1_SKXCCM0_VWA1_WG32_8_1_WGM8_WGMXCC1_WGMXCCGn1
    SolutionIndex: 259
    SolutionNameMin: Cijk_Alik_Bljk_HHS_BH_UserArgs_MT224x96x64_MI16x16x1_SN_LDSB1_GRVWA8_GRVWB8_GSU0_GSUC0_GSUWGMRR0_K1_LBSPPA128_LBSPPB128_LPA16_LPB16_LRVW8_MIWT7_3_SU32_SUM0_SUS256_SVW1_SKXCCM8_VWA1_WG32_8_1_WGM8_WGMXCC1_WGMXCCGn1
    SolutionIndex: 260
    SolutionNameMin: Cijk_Alik_Bljk_HHS_BH_UserArgs_MT256x16x32_MI16x16x1_SN_LDSB1_GRVWA4_GRVWB2_GSU0_GSUC0_GSUWGMRR0_K1_LBSPPA256_LBSPPB128_LPA4_LPB4_LRVW4_MIWT4_1_SU32_SUM0_SUS256_SVW4_SKXCCM0_VWA4_WG64_4_1_WGM8_WGMXCC1_WGMXCCGn1
    SolutionIndex: 261
    SolutionNameMin: Cijk_Alik_Bljk_HHS_BH_UserArgs_MT256x16x32_MI16x16x1_SN_LDSB1_GRVWA4_GRVWB2_GSU0_GSUC0_GSUWGMRR0_K1_LBSPPA256_LBSPPB128_LPA4_LPB4_LRVW4_MIWT4_1_SU32_SUM0_SUS256_SVW4_SKXCCM8_VWA4_WG64_4_1_WGM8_WGMXCC1_WGMXCCGn1
    SolutionIndex: 262
    SolutionNameMin: Cijk_Alik_Bljk_HHS_BH_UserArgs_MT256x16x64_MI16x16x1_SN_LDSB1_GRVWA8_GRVWB4_GSU0_GSUC0_GSUWGMRR0_K1_LBSPPA512_LBSPPB128_LPA16_LPB16_LRVW8_MIWT4_1_SU32_SUM0_SUS256_SVW4_SKXCCM0_VWA4_WG64_4_1_WGM8_WGMXCC1_WGMXCCGn1
    SolutionIndex: 263
    SolutionNameMin: Cijk_Alik_Bljk_HHS_BH_UserArgs_MT256x16x64_MI16x16x1_SN_LDSB1_GRVWA8_GRVWB4_GSU0_GSUC0_GSUWGMRR0_K1_LBSPPA512_LBSPPB128_LPA16_LPB16_LRVW8_MIWT4_1_SU32_SUM0_SUS256_SVW4_SKXCCM8_VWA4_WG64_4_1_WGM8_WGMXCC1_WGMXCCGn1
    SolutionIndex: 264
    SolutionNameMin: Cijk_Alik_Bljk_HHS_BH_UserArgs_MT256x32x32_MI16x16x1_SN_LDSB1_GRVWA4_GRVWB4_GSU0_GSUC0_GSUWGMRR0_K1_LBSPPA256_LBSPPB128_LPA4_LPB4_LRVW4_MIWT4_2_SU32_SUM0_SUS256_SVW4_SKXCCM0_VWA4_WG64_4_1_WGM8_WGMXCC1_WGMXCCGn1
    SolutionIndex: 265
    SolutionNameMin: Cijk_Alik_Bljk_HHS_BH_UserArgs_MT256x32x32_MI16x16x1_SN_LDSB1_GRVWA4_GRVWB4_GSU0_GSUC0_GSUWGMRR0_K1_LBSPPA256_LBSPPB128_LPA4_LPB4_LRVW4_MIWT4_2_SU32_SUM0_SUS256_SVW4_SKXCCM8_VWA4_WG64_4_1_WGM8_WGMXCC1_WGMXCCGn1
    SolutionIndex: 266
    SolutionNameMin: Cijk_Alik_Bljk_HHS_BH_UserArgs_MT256x32x64_MI16x16x1_SN_LDSB1_GRVWA8_GRVWB8_GSU0_GSUC0_GSUWGMRR0_K1_LBSPPA512_LBSPPB128_LPA16_LPB16_LRVW8_MIWT4_2_SU32_SUM0_SUS256_SVW4_SKXCCM0_VWA4_WG64_4_1_WGM8_WGMXCC1_WGMXCCGn1
    SolutionIndex: 267
    SolutionNameMin: Cijk_Alik_Bljk_HHS_BH_UserArgs_MT256x32x64_MI16x16x1_SN_LDSB1_GRVWA8_GRVWB8_GSU0_GSUC0_GSUWGMRR0_K1_LBSPPA512_LBSPPB128_LPA16_LPB16_LRVW8_MIWT4_2_SU32_SUM0_SUS256_SVW4_SKXCCM8_VWA4_WG64_4_1_WGM8_WGMXCC1_WGMXCCGn1
    SolutionIndex: 268
    SolutionNameMin: Cijk_Alik_Bljk_HHS_BH_UserArgs_MT256x64x32_MI16x16x1_SN_LDSB1_GRVWA4_GRVWB4_GSU0_GSUC0_GSUWGMRR0_K1_LBSPPA256_LBSPPB128_LPA4_LPB4_LRVW4_MIWT4_4_SU32_SUM0_SUS256_SVW4_SKXCCM0_VWA4_WG64_4_1_WGM8_WGMXCC1_WGMXCCGn1
    SolutionIndex: 269
    SolutionNameMin: Cijk_Alik_Bljk_HHS_BH_UserArgs_MT256x64x32_MI16x16x1_SN_LDSB1_GRVWA4_GRVWB4_GSU0_GSUC0_GSUWGMRR0_K1_LBSPPA256_LBSPPB128_LPA4_LPB4_LRVW4_MIWT4_4_SU32_SUM0_SUS256_SVW4_SKXCCM8_VWA4_WG64_4_1_WGM8_WGMXCC1_WGMXCCGn1
    SolutionIndex: 270
    SolutionNameMin: Cijk_Alik_Bljk_HHS_BH_UserArgs_MT256x64x64_MI16x16x1_SN_LDSB1_GRVWA8_GRVWB8_GSU0_GSUC0_GSUWGMRR0_K1_LBSPPA512_LBSPPB128_LPA16_LPB16_LRVW8_MIWT4_4_SU32_SUM0_SUS256_SVW4_SKXCCM0_VWA4_WG64_4_1_WGM8_WGMXCC1_WGMXCCGn1
    SolutionIndex: 271
    SolutionNameMin: Cijk_Alik_Bljk_HHS_BH_UserArgs_MT256x64x64_MI16x16x1_SN_LDSB1_GRVWA8_GRVWB8_GSU0_GSUC0_GSUWGMRR0_K1_LBSPPA512_LBSPPB128_LPA16_LPB16_LRVW8_MIWT4_4_SU32_SUM0_SUS256_SVW4_SKXCCM8_VWA4_WG64_4_1_WGM8_WGMXCC1_WGMXCCGn1
- - - [16, 16, 1, 16]
    - [0, 0.0]
  - - [32, 32, 1, 32]
    - [1, 0.0]
  - - [48, 48, 1, 48]
    - [2, 0.0]
  - - [64, 64, 1, 64]
    - [3, 0.0]
  - - [80, 80, 1, 80]
    - [4, 0.0]
  - - [96, 96, 1, 96]
    - [5, 0.0]
  - - [112, 112, 1, 112]
    - [6, 0.0]
  - - [128, 128, 1, 128]
    - [7, 0.0]
  - - [144, 144, 1, 144]
    - [8, 0.0]
  - - [160, 160, 1, 160]
    - [9, 0.0]
  - - [176, 176, 1, 176]
    - [10, 0.0]
  - - [192, 192, 1, 192]
    - [11, 0.0]
  - - [208, 208, 1, 208]
    - [12, 0.0]
  - - [224, 224, 1, 224]
    - [13, 0.0]
  - - [240, 240, 1, 240]
    - [14, 0.0]
  - - [256, 256, 1, 256]
    - [15, 0.0]
  - - [272, 272, 1, 272]
    - [16, 0.0]
  - - [288, 288, 1, 288]
    - [17, 0.0]
  - - [304, 304, 1, 304]
    - [18, 0.0]
  - - [320, 320, 1, 320]
    - [19, 0.0]
  - - [336, 336, 1, 336]
    - [20, 0.0]
  - - [352, 352, 1, 352]
    - [21, 0.0]
  - - [368, 368, 1, 368]
    - [22, 0.0]
  - - [384, 384, 1, 384]
    - [23, 0.0]
  - - [400, 400, 1, 400]
    - [24, 0.0]
  - - [416, 416, 1, 416]
    - [25, 0.0]
  - - [432, 432, 1, 432]
    - [26, 0.0]
  - - [448, 448, 1, 448]
    - [27, 0.0]
  - - [464, 464, 1, 464]
    - [28, 0.0]
  - - [480, 480, 1, 480]
    - [29, 0.0]
  - - [496, 496, 1, 496]
    - [30, 0.0]
  - - [512, 512, 1, 512]
    - [31, 0.0]
  - - [528, 528, 1, 528]
    - [32, 0.0]
  - - [544, 544, 1, 544]
    - [33, 0.0]
  - - [560, 560, 1, 560]
    - [34, 0.0]
  - - [576, 576, 1, 576]
    - [35, 0.0]
  - - [592, 592, 1, 592]
    - [36, 0.0]
  - - [608, 608, 1, 608]
    - [37, 0.0]
  - - [624, 624, 1, 624]
    - [38, 0.0]
  - - [640, 640, 1, 640]
    - [39, 0.0]
  - - [656, 656, 1, 656]
    - [40, 0.0]
  - - [672, 672, 1, 672]
    - [41, 0.0]
  - - [688, 688, 1, 688]
    - [42, 0.0]
  - - [704, 704, 1, 704]
    - [43, 0.0]
  - - [720, 720, 1, 720]
    - [44, 0.0]
  - - [736, 736, 1, 736]
    - [45, 0.0]
  - - [752, 752, 1, 752]
    - [46, 0.0]
  - - [768, 768, 1, 768]
    - [47, 0.0]
  - - [784, 784, 1, 784]
    - [48, 0.0]
  - - [800, 800, 1, 800]
    - [49, 0.0]
  - - [816, 816, 1, 816]
    - [50, 0.0]
  - - [832, 832, 1, 832]
    - [51, 0.0]
  - - [848, 848, 1, 848]
    - [52, 0.0]
  - - [864, 864, 1, 864]
    - [53, 0.0]
  - - [880, 880, 1, 880]
    - [54, 0.0]
  - - [896, 896, 1, 896]
    - [55, 0.0]
  - - [912, 912, 1, 912]
    - [56, 0.0]
  - - [928, 928, 1, 928]
    - [57, 0.0]
  - - [944, 944, 1, 944]
    - [58, 0.0]
  - - [960, 960, 1, 960]
    - [59, 0.0]
  - - [976, 976, 1, 976]
    - [60, 0.0]
  - - [992, 992, 1, 992]
    - [61, 0.0]
  - - [1008, 1008, 1, 1008]
    - [62, 0.0]
  - - [1024, 1024, 1, 1024]
    - [63, 0.0]
  - - [1040, 1040, 1, 1040]
    - [64, 0.0]
  - - [1056, 1056, 1, 1056]
    - [65, 0.0]
  - - [1072, 1072, 1, 1072]
    - [66, 0.0]
  - - [1088, 1088, 1, 1088]
    - [67, 0.0]
  - - [1104, 1104, 1, 1104]
    - [68, 0.0]
  - - [1120, 1120, 1, 1120]
    - [69, 0.0]
  - - [1136, 1136, 1, 1136]
    - [70, 0.0]
  - - [1152, 1152, 1, 1152]
    - [71, 0.0]
  - - [1168, 1168, 1, 1168]
    - [72, 0.0]
  - - [1184, 1184, 1, 1184]
    - [73, 0.0]
  - - [1200, 1200, 1, 1200]
    - [74, 0.0]
  - - [1216, 1216, 1, 1216]
    - [75, 0.0]
  - - [1232, 1232, 1, 1232]
    - [76, 0.0]
  - - [1248, 1248, 1, 1248]
    - [77, 0.0]
  - - [1264, 1264, 1, 1264]
    - [78, 0.0]
  - - [1280, 1280, 1, 1280]
    - [79, 0.0]
  - - [1296, 1296, 1, 1296]
    - [80, 0.0]
  - - [1312, 1312, 1, 1312]
    - [81, 0.0]
  - - [1328, 1328, 1, 1328]
    - [82, 0.0]
  - - [1344, 1344, 1, 1344]
    - [83, 0.0]
  - - [1360, 1360, 1, 1360]
    - [84, 0.0]
  - - [1376, 1376, 1, 1376]
    - [85, 0.0]
  - - [1392, 1392, 1, 1392]
    - [86, 0.0]
  - - [1408, 1408, 1, 1408]
    - [87, 0.0]
  - - [1424, 1424, 1, 1424]
    - [88, 0.0]
  - - [1440, 1440, 1, 1440]
    - [89, 0.0]
  - - [1456, 1456, 1, 1456]
    - [90, 0.0]
  - - [1472, 1472, 1, 1472]
    - [91, 0.0]
  - - [1488, 1488, 1, 1488]
    - [92, 0.0]
  - - [1504, 1504, 1, 1504]
    - [93, 0.0]
  - - [1520, 1520, 1, 1520]
    - [94, 0.0]
  - - [1536, 1536, 1, 1536]
    - [95, 0.0]
  - - [1552, 1552, 1, 1552]
    - [96, 0.0]
  - - [1568, 1568, 1, 1568]
    - [97, 0.0]
  - - [1584, 1584, 1, 1584]
    - [98, 0.0]
  - - [1600, 1600, 1, 1600]
    - [99, 0.0]
  - - [1616, 1616, 1, 1616]
    - [100, 0.0]
  - - [1632, 1632, 1, 1632]
    - [101, 0.0]
  - - [1648, 1648, 1, 1648]
    - [102, 0.0]
  - - [1664, 1664, 1, 1664]
    - [103, 0.0]
  - - [1680, 1680, 1, 1680]
    - [104, 0.0]
  - - [1696, 1696, 1, 1696]
    - [105, 0.0]
  - - [1712, 1712, 1, 1712]
    - [106, 0.0]
  - - [1728, 1728, 1, 1728]
    - [107, 0.0]
  - - [1744, 1744, 1, 1744]
    - [108, 0.0]
  - - [1760, 1760, 1, 1760]
    - [109, 0.0]
  - - [1776, 1776, 1, 1776]
    - [110, 0.0]
  - - [1792, 1792, 1, 1792]
    - [111, 0.0]
  - - [1808, 1808, 1, 1808]
    - [112, 0.0]
  - - [1824, 1824, 1, 1824]
    - [113, 0.0]
  - - [1840, 1840, 1, 1840]
    - [114, 0.0]
  - - [1856, 1856, 1, 1856]
    - [115, 0.0]
  - - [1872, 1872, 1, 1872]
    - [116, 0.0]
  - - [1888, 1888, 1, 1888]
    - [117, 0.0]
  - - [1904, 1904, 1, 1904]
    - [118, 0.0]
  - - [1920, 1920, 1, 1920]
    - [119, 0.0]
  - - [1936, 1936, 1, 1936]
    - [120, 0.0]
  - - [1952, 1952, 1, 1952]
    - [121, 0.0]
  - - [1968, 1968, 1, 1968]
    - [122, 0.0]
  - - [1984, 1984, 1, 1984]
    - [123, 0.0]
  - - [2000, 2000, 1, 2000]
    - [124, 0.0]
  - - [2016, 2016, 1, 2016]
    - [125, 0.0]
  - - [2032, 2032, 1, 2032]
    - [126, 0.0]
  - - [2048, 2048, 1, 2048]
    - [127, 0.0]
  - - [2064, 2064, 1, 2064]
    - [128, 0.0]
  - - [2080, 2080, 1, 2080]
    - [129, 0.0]
  - - [2096, 2096, 1, 2096]
    - [130, 0.0]
  - - [2112, 2112, 1, 2112]
    - [131, 0.0]
  - - [2128, 2128, 1, 2128]
    - [132, 0.0]
  - - [2144, 2144, 1, 2144]
    - [133, 0.0]
  - - [2160, 2160, 1, 2160]
    - [134, 0.0]
  - - [2176, 2176, 1, 2176]
    - [135, 0.0]
  - - [2192, 2192, 1, 2192]
    - [136, 0.0]
  - - [2208, 2208, 1, 2208]
    - [137, 0.0]
  - - [2224, 2224, 1, 2224]
    - [138, 0.0]
  - - [2240, 2240, 1, 2240]
    - [139, 0.0]
  - - [2256, 2256, 1, 2256]
    - [140, 0.0]
  - - [2272, 2272, 1, 2272]
    - [141, 0.0]
  - - [2288, 2288, 1, 2288]
    - [142, 0.0]
  - - [2304, 2304, 1, 2304]
    - [143, 0.0]
  - - [2320, 2320, 1, 2320]
    - [144, 0.0]
  - - [2336, 2336, 1, 2336]
    - [145, 0.0]
  - - [2352, 2352, 1, 2352]
    - [146, 0.0]
  - - [2368, 2368, 1, 2368]
    - [147, 0.0]
  - - [2384, 2384, 1, 2384]
    - [148, 0.0]
  - - [2400, 2400, 1, 2400]
    - [149, 0.0]
  - - [2416, 2416, 1, 2416]
    - [150, 0.0]
  - - [2432, 2432, 1, 2432]
    - [151, 0.0]
  - - [2448, 2448, 1, 2448]
    - [152, 0.0]
  - - [2464, 2464, 1, 2464]
    - [153, 0.0]
  - - [2480, 2480, 1, 2480]
    - [154, 0.0]
  - - [2496, 2496, 1, 2496]
    - [155, 0.0]
  - - [2512, 2512, 1, 2512]
    - [156, 0.0]
  - - [2528, 2528, 1, 2528]
    - [157, 0.0]
  - - [2544, 2544, 1, 2544]
    - [158, 0.0]
  - - [2560, 2560, 1, 2560]
    - [159, 0.0]
  - - [2576, 2576, 1, 2576]
    - [160, 0.0]
  - - [2592, 2592, 1, 2592]
    - [161, 0.0]
  - - [2608, 2608, 1, 2608]
    - [162, 0.0]
  - - [2624, 2624, 1, 2624]
    - [163, 0.0]
  - - [2640, 2640, 1, 2640]
    - [164, 0.0]
  - - [2656, 2656, 1, 2656]
    - [165, 0.0]
  - - [2672, 2672, 1, 2672]
    - [166, 0.0]
  - - [2688, 2688, 1, 2688]
    - [167, 0.0]
  - - [2704, 2704, 1, 2704]
    - [168, 0.0]
  - - [2720, 2720, 1, 2720]
    - [169, 0.0]
  - - [2736, 2736, 1, 2736]
    - [170, 0.0]
  - - [2752, 2752, 1, 2752]
    - [171, 0.0]
  - - [2768, 2768, 1, 2768]
    - [172, 0.0]
  - - [2784, 2784, 1, 2784]
    - [173, 0.0]
  - - [2800, 2800, 1, 2800]
    - [174, 0.0]
  - - [2816, 2816, 1, 2816]
    - [175, 0.0]
  - - [2832, 2832, 1, 2832]
    - [176, 0.0]
  - - [2848, 2848, 1, 2848]
    - [177, 0.0]
  - - [2864, 2864, 1, 2864]
    - [178, 0.0]
  - - [2880, 2880, 1, 2880]
    - [179, 0.0]
  - - [2896, 2896, 1, 2896]
    - [180, 0.0]
  - - [2912, 2912, 1, 2912]
    - [181, 0.0]
  - - [2928, 2928, 1, 2928]
    - [182, 0.0]
  - - [2944, 2944, 1, 2944]
    - [183, 0.0]
  - - [2960, 2960, 1, 2960]
    - [184, 0.0]
  - - [2976, 2976, 1, 2976]
    - [185, 0.0]
  - - [2992, 2992, 1, 2992]
    - [186, 0.0]
  - - [3008, 3008, 1, 3008]
    - [187, 0.0]
  - - [3024, 3024, 1, 3024]
    - [188, 0.0]
  - - [3040, 3040, 1, 3040]
    - [189, 0.0]
  - - [3056, 3056, 1, 3056]
    - [190, 0.0]
  - - [3072, 3072, 1, 3072]
    - [191, 0.0]
  - - [3088, 3088, 1, 3088]
    - [192, 0.0]
  - - [3104, 3104, 1, 3104]
    - [193, 0.0]
  - - [3120, 3120, 1, 3120]
    - [194, 0.0]
  - - [3136, 3136, 1, 3136]
    - [195, 0.0]
  - - [3152, 3152, 1, 3152]
    - [196, 0.0]
  - - [3168, 3168, 1, 3168]
    - [197, 0.0]
  - - [3184, 3184, 1, 3184]
    - [198, 0.0]
  - - [3200, 3200, 1, 3200]
    - [199, 0.0]
  - - [3216, 3216, 1, 3216]
    - [200, 0.0]
  - - [3232, 3232, 1, 3232]
    - [201, 0.0]
  - - [3248, 3248, 1, 3248]
    - [202, 0.0]
  - - [3264, 3264, 1, 3264]
    - [203, 0.0]
  - - [3280, 3280, 1, 3280]
    - [204, 0.0]
  - - [3296, 3296, 1, 3296]
    - [205, 0.0]
  - - [3312, 3312, 1, 3312]
    - [206, 0.0]
  - - [3328, 3328, 1, 3328]
    - [207, 0.0]
  - - [3344, 3344, 1, 3344]
    - [208, 0.0]
  - - [3360, 3360, 1, 3360]
    - [209, 0.0]
  - - [3376, 3376, 1, 3376]
    - [210, 0.0]
  - - [3392, 3392, 1, 3392]
    - [211, 0.0]
  - - [3408, 3408, 1, 3408]
    - [212, 0.0]
  - - [3424, 3424, 1, 3424]
    - [213, 0.0]
  - - [3440, 3440, 1, 3440]
    - [214, 0.0]
  - - [3456, 3456, 1, 3456]
    - [215, 0.0]
  - - [3472, 3472, 1, 3472]
    - [216, 0.0]
  - - [3488, 3488, 1, 3488]
    - [217, 0.0]
  - - [3504, 3504, 1, 3504]
    - [218, 0.0]
  - - [3520, 3520, 1, 3520]
    - [219, 0.0]
  - - [3536, 3536, 1, 3536]
    - [220, 0.0]
  - - [3552, 3552, 1, 3552]
    - [221, 0.0]
  - - [3568, 3568, 1, 3568]
    - [222, 0.0]
  - - [3584, 3584, 1, 3584]
    - [223, 0.0]
  - - [3600, 3600, 1, 3600]
    - [224, 0.0]
  - - [3616, 3616, 1, 3616]
    - [225, 0.0]
  - - [3632, 3632, 1, 3632]
    - [226, 0.0]
  - - [3648, 3648, 1, 3648]
    - [227, 0.0]
  - - [3664, 3664, 1, 3664]
    - [228, 0.0]
  - - [3680, 3680, 1, 3680]
    - [229, 0.0]
  - - [3696, 3696, 1, 3696]
    - [230, 0.0]
  - - [3712, 3712, 1, 3712]
    - [231, 0.0]
  - - [3728, 3728, 1, 3728]
    - [232, 0.0]
  - - [3744, 3744, 1, 3744]
    - [233, 0.0]
  - - [3760, 3760, 1, 3760]
    - [234, 0.0]
  - - [3776, 3776, 1, 3776]
    - [235, 0.0]
  - - [3792, 3792, 1, 3792]
    - [236, 0.0]
  - - [3808, 3808, 1, 3808]
    - [237, 0.0]
  - - [3824, 3824, 1, 3824]
    - [238, 0.0]
  - - [3840, 3840, 1, 3840]
    - [239, 0.0]
  - - [3856, 3856, 1, 3856]
    - [240, 0.0]
  - - [3872, 3872, 1, 3872]
    - [241, 0.0]
  - - [3888, 3888, 1, 3888]
    - [242, 0.0]
  - - [3904, 3904, 1, 3904]
    - [243, 0.0]
  - - [3920, 3920, 1, 3920]
    - [244, 0.0]
  - - [3936, 3936, 1, 3936]
    - [245, 0.0]
  - - [3952, 3952, 1, 3952]
    - [246, 0.0]
  - - [3968, 3968, 1, 3968]
    - [247, 0.0]
  - - [3984, 3984, 1, 3984]
    - [248, 0.0]
  - - [4000, 4000, 1, 4000]
    - [249, 0.0]
  - - [4016, 4016, 1, 4016]
    - [250, 0.0]
  - - [4032, 4032, 1, 4032]
    - [251, 0.0]
  - - [4048, 4048, 1, 4048]
    - [252, 0.0]
  - - [4064, 4064, 1, 4064]
    - [253, 0.0]
  - - [4080, 4080, 1, 4080]
    - [254, 0.0]
  - - [4096, 4096, 1, 4096]
    - [255, 0.0]
  - - [4112, 4112, 1, 4112]
    - [256, 0.0]
  - - [4128, 4128, 1, 4128]
    - [257, 0.0]
  - - [4144, 4144, 1, 4144]
    - [258, 0.0]
  - - [4160, 4160, 1, 4160]
    - [259, 0.0]
  - - [4176, 4176, 1, 4176]
    - [260, 0.0]
  - - [4192, 4192, 1, 4192]
    - [261, 0.0]
  - - [4208, 4208, 1, 4208]
    - [262, 0.0]
  - - [4224, 4224, 1, 4224]
    - [263, 0.0]
  - - [4240, 4240, 1, 4240]
    - [264, 0.0]
  - - [4256, 4256, 1, 4256]
    - [265, 0.0]
  - - [4272, 4272, 1, 4272]
    - [266, 0.0]
  - - [4288, 4288, 1, 4288]
    - [267, 0.0]
  - - [4304, 4304, 1, 4304]
    - [268, 0.0]
  - - [4320, 4320, 1, 4320]
    - [269, 0.0]
  - - [4336, 4336, 1, 4336]
    - [270, 0.0]
  - - [4352, 4352, 1, 4352]
    - [271, 0.0]
- null
- null
- DeviceEfficiency
- GridBased
