library/src/amd_detail/rocblaslt/src/Tensile/Logic/streamk/aquavanjaram/aquavanjaram942_Cijk_Ailk_Bljk_HHS_BH_UserArgs.yaml
- {MinimumRequiredVersion: 4.33.0}
- aquavanjaram942
- gfx942
- [Device 0049, Device 0050]
    SolutionIndex: 0
    SolutionNameMin: Cijk_Ailk_Bljk_HHS_BH_UserArgs_MT16x64x32_MI16x16x1_SN_LDSB0_GRVWA1_GRVWB4_GSU0_GSUC0_GSUWGMRR0_K1_LBSPPA128_LBSPPB128_LPA16_LPB4_LRVW4_MIWT1_1_NLCA1_SU32_SUM0_SUS256_SVW1_SKXCCM0_VWA1_WG16_16_1_WGM8_WGMXCC1_WGMXCCGn1
    SolutionIndex: 1
    SolutionNameMin: Cijk_Ailk_Bljk_HHS_BH_UserArgs_MT16x64x32_MI16x16x1_SN_LDSB0_GRVWA1_GRVWB4_GSU0_GSUC0_GSUWGMRR0_K1_LBSPPA128_LBSPPB128_LPA16_LPB4_LRVW4_MIWT1_1_NLCA1_SU32_SUM0_SUS256_SVW1_SKXCCM8_VWA1_WG16_16_1_WGM8_WGMXCC1_WGMXCCGn1
    SolutionIndex: 2
    SolutionNameMin: Cijk_Ailk_Bljk_HHS_BH_UserArgs_MT16x64x64_MI16x16x1_SN_LDSB0_GRVWA4_GRVWB8_GSU0_GSUC0_GSUWGMRR0_K1_LBSPPA256_LBSPPB128_LPA16_LPB16_LRVW8_MIWT1_1_NLCA1_SU32_SUM0_SUS256_SVW1_SKXCCM0_VWA1_WG16_16_1_WGM8_WGMXCC1_WGMXCCGn1
    SolutionIndex: 3
    SolutionNameMin: Cijk_Ailk_Bljk_HHS_BH_UserArgs_MT16x64x64_MI16x16x1_SN_LDSB0_GRVWA4_GRVWB8_GSU0_GSUC0_GSUWGMRR0_K1_LBSPPA256_LBSPPB128_LPA16_LPB16_LRVW8_MIWT1_1_NLCA1_SU32_SUM0_SUS256_SVW1_SKXCCM8_VWA1_WG16_16_1_WGM8_WGMXCC1_WGMXCCGn1
    SolutionIndex: 4
    SolutionNameMin: Cijk_Ailk_Bljk_HHS_BH_UserArgs_MT16x64x128_MI16x16x1_SN_LDSB0_GRVWA8_GRVWB8_GSU0_GSUC0_GSUWGMRR0_K1_LBSPPA256_LBSPPB256_LPA16_LPB16_LRVW8_MIWT1_1_NLCA1_SU32_SUM0_SUS256_SVW1_SKXCCM0_VWA1_WG16_16_1_WGM8_WGMXCC1_WGMXCCGn1
    SolutionIndex: 5
    SolutionNameMin: Cijk_Ailk_Bljk_HHS_BH_UserArgs_MT16x64x128_MI16x16x1_SN_LDSB0_GRVWA8_GRVWB8_GSU0_GSUC0_GSUWGMRR0_K1_LBSPPA256_LBSPPB256_LPA16_LPB16_LRVW8_MIWT1_1_NLCA1_SU32_SUM0_SUS256_SVW1_SKXCCM8_VWA1_WG16_16_1_WGM8_WGMXCC1_WGMXCCGn1
    SolutionIndex: 6
    SolutionNameMin: Cijk_Ailk_Bljk_HHS_BH_UserArgs_MT16x128x32_MI16x16x1_SN_LDSB0_GRVWA1_GRVWB4_GSU0_GSUC0_GSUWGMRR0_K1_LBSPPA128_LBSPPB128_LPA16_LPB4_LRVW4_MIWT1_2_NLCA1_SU32_SUM0_SUS256_SVW1_SKXCCM0_VWA1_WG16_16_1_WGM8_WGMXCC1_WGMXCCGn1
    SolutionIndex: 7
    SolutionNameMin: Cijk_Ailk_Bljk_HHS_BH_UserArgs_MT16x128x32_MI16x16x1_SN_LDSB0_GRVWA1_GRVWB4_GSU0_GSUC0_GSUWGMRR0_K1_LBSPPA128_LBSPPB128_LPA16_LPB4_LRVW4_MIWT1_2_NLCA1_SU32_SUM0_SUS256_SVW1_SKXCCM8_VWA1_WG16_16_1_WGM8_WGMXCC1_WGMXCCGn1
    SolutionIndex: 8
    SolutionNameMin: Cijk_Ailk_Bljk_HHS_BH_UserArgs_MT16x128x64_MI16x16x1_SN_LDSB1_GRVWA1_GRVWB8_GSU0_GSUC0_GSUWGMRR0_K1_LBSPPA256_LBSPPB128_LPA16_LPB16_LRVW8_MIWT1_2_NLCA1_SU32_SUM0_SUS256_SVW1_SKXCCM0_VWA1_WG16_16_1_WGM8_WGMXCC1_WGMXCCGn1
    SolutionIndex: 9
    SolutionNameMin: Cijk_Ailk_Bljk_HHS_BH_UserArgs_MT16x128x64_MI16x16x1_SN_LDSB1_GRVWA1_GRVWB8_GSU0_GSUC0_GSUWGMRR0_K1_LBSPPA256_LBSPPB128_LPA16_LPB16_LRVW8_MIWT1_2_NLCA1_SU32_SUM0_SUS256_SVW1_SKXCCM8_VWA1_WG16_16_1_WGM8_WGMXCC1_WGMXCCGn1
    SolutionIndex: 10
    SolutionNameMin: Cijk_Ailk_Bljk_HHS_BH_UserArgs_MT16x192x32_MI16x16x1_SN_LDSB0_GRVWA2_GRVWB4_GSU0_GSUC0_GSUWGMRR0_K1_LBSPPA128_LBSPPB128_LPA16_LPB4_LRVW4_MIWT1_3_NLCA1_SU32_SUM0_SUS256_SVW1_SKXCCM0_VWA1_WG16_16_1_WGM8_WGMXCC1_WGMXCCGn1
    SolutionIndex: 11
    SolutionNameMin: Cijk_Ailk_Bljk_HHS_BH_UserArgs_MT16x192x32_MI16x16x1_SN_LDSB0_GRVWA2_GRVWB4_GSU0_GSUC0_GSUWGMRR0_K1_LBSPPA128_LBSPPB128_LPA16_LPB4_LRVW4_MIWT1_3_NLCA1_SU32_SUM0_SUS256_SVW1_SKXCCM8_VWA1_WG16_16_1_WGM8_WGMXCC1_WGMXCCGn1
    SolutionIndex: 12
    SolutionNameMin: Cijk_Ailk_Bljk_HHS_BH_UserArgs_MT16x192x64_MI16x16x1_SN_LDSB1_GRVWA4_GRVWB8_GSU0_GSUC0_GSUWGMRR0_K1_LBSPPA256_LBSPPB128_LPA16_LPB16_LRVW8_MIWT1_3_NLCA1_SU32_SUM0_SUS256_SVW1_SKXCCM0_VWA1_WG16_16_1_WGM8_WGMXCC1_WGMXCCGn1
    SolutionIndex: 13
    SolutionNameMin: Cijk_Ailk_Bljk_HHS_BH_UserArgs_MT16x192x64_MI16x16x1_SN_LDSB1_GRVWA4_GRVWB8_GSU0_GSUC0_GSUWGMRR0_K1_LBSPPA256_LBSPPB128_LPA16_LPB16_LRVW8_MIWT1_3_NLCA1_SU32_SUM0_SUS256_SVW1_SKXCCM8_VWA1_WG16_16_1_WGM8_WGMXCC1_WGMXCCGn1
    SolutionIndex: 14
    SolutionNameMin: Cijk_Ailk_Bljk_HHS_BH_UserArgs_MT16x256x32_MI16x16x1_SN_LDSB1_GRVWA1_GRVWB4_GSU0_GSUC0_GSUWGMRR0_K1_LBSPPA128_LBSPPB128_LPA16_LPB4_LRVW4_MIWT1_4_NLCA1_SU32_SUM0_SUS256_SVW1_SKXCCM0_VWA1_WG16_16_1_WGM8_WGMXCC1_WGMXCCGn1
    SolutionIndex: 15
    SolutionNameMin: Cijk_Ailk_Bljk_HHS_BH_UserArgs_MT16x256x32_MI16x16x1_SN_LDSB1_GRVWA1_GRVWB4_GSU0_GSUC0_GSUWGMRR0_K1_LBSPPA128_LBSPPB128_LPA16_LPB4_LRVW4_MIWT1_4_NLCA1_SU32_SUM0_SUS256_SVW1_SKXCCM8_VWA1_WG16_16_1_WGM8_WGMXCC1_WGMXCCGn1
    SolutionIndex: 16
    SolutionNameMin: Cijk_Ailk_Bljk_HHS_BH_UserArgs_MT16x384x64_MI16x16x1_SN_LDSB1_GRVWA4_GRVWB8_GSU0_GSUC0_GSUWGMRR0_K1_LBSPPA256_LBSPPB128_LPA16_LPB16_LRVW8_MIWT1_6_NLCA1_SU32_SUM0_SUS256_SVW1_SKXCCM0_VWA1_WG16_16_1_WGM8_WGMXCC1_WGMXCCGn1
    SolutionIndex: 17
    SolutionNameMin: Cijk_Ailk_Bljk_HHS_BH_UserArgs_MT16x384x64_MI16x16x1_SN_LDSB1_GRVWA4_GRVWB8_GSU0_GSUC0_GSUWGMRR0_K1_LBSPPA256_LBSPPB128_LPA16_LPB16_LRVW8_MIWT1_6_NLCA1_SU32_SUM0_SUS256_SVW1_SKXCCM8_VWA1_WG16_16_1_WGM8_WGMXCC1_WGMXCCGn1
    SolutionIndex: 18
    SolutionNameMin: Cijk_Ailk_Bljk_HHS_BH_UserArgs_MT32x32x32_MI16x16x1_SN_LDSB0_GRVWA4_GRVWB4_GSU0_GSUC0_GSUWGMRR0_K1_LBSPPA256_LBSPPB128_LPA16_LPB4_LRVW4_MIWT1_1_NLCA1_SU32_SUM0_SUS256_SVW1_SKXCCM0_VWA1_WG32_8_1_WGM8_WGMXCC1_WGMXCCGn1
    SolutionIndex: 19
    SolutionNameMin: Cijk_Ailk_Bljk_HHS_BH_UserArgs_MT32x32x32_MI16x16x1_SN_LDSB0_GRVWA4_GRVWB4_GSU0_GSUC0_GSUWGMRR0_K1_LBSPPA256_LBSPPB128_LPA16_LPB4_LRVW4_MIWT1_1_NLCA1_SU32_SUM0_SUS256_SVW1_SKXCCM8_VWA1_WG32_8_1_WGM8_WGMXCC1_WGMXCCGn1
    SolutionIndex: 20
    SolutionNameMin: Cijk_Ailk_Bljk_HHS_BH_UserArgs_MT32x32x64_MI16x16x1_SN_LDSB0_GRVWA8_GRVWB8_GSU0_GSUC0_GSUWGMRR0_K1_LBSPPA512_LBSPPB128_LPA16_LPB16_LRVW8_MIWT1_1_NLCA1_SU32_SUM0_SUS256_SVW1_SKXCCM0_VWA1_WG32_8_1_WGM8_WGMXCC1_WGMXCCGn1
    SolutionIndex: 21
    SolutionNameMin: Cijk_Ailk_Bljk_HHS_BH_UserArgs_MT32x32x64_MI16x16x1_SN_LDSB0_GRVWA8_GRVWB8_GSU0_GSUC0_GSUWGMRR0_K1_LBSPPA512_LBSPPB128_LPA16_LPB16_LRVW8_MIWT1_1_NLCA1_SU32_SUM0_SUS256_SVW1_SKXCCM8_VWA1_WG32_8_1_WGM8_WGMXCC1_WGMXCCGn1
    SolutionIndex: 22
    SolutionNameMin: Cijk_Ailk_Bljk_HHS_BH_UserArgs_MT32x32x128_MI16x16x1_SN_LDSB0_GRVWA8_GRVWB8_GSU0_GSUC0_GSUWGMRR0_K1_LBSPPA512_LBSPPB256_LPA16_LPB16_LRVW8_MIWT1_1_NLCA1_SU32_SUM0_SUS256_SVW1_SKXCCM0_VWA1_WG32_8_1_WGM8_WGMXCC1_WGMXCCGn1
    SolutionIndex: 23
    SolutionNameMin: Cijk_Ailk_Bljk_HHS_BH_UserArgs_MT32x32x128_MI16x16x1_SN_LDSB0_GRVWA8_GRVWB8_GSU0_GSUC0_GSUWGMRR0_K1_LBSPPA512_LBSPPB256_LPA16_LPB16_LRVW8_MIWT1_1_NLCA1_SU32_SUM0_SUS256_SVW1_SKXCCM8_VWA1_WG32_8_1_WGM8_WGMXCC1_WGMXCCGn1
    SolutionIndex: 24
    SolutionNameMin: Cijk_Ailk_Bljk_HHS_BH_UserArgs_MT32x64x32_MI16x16x1_SN_LDSB0_GRVWA4_GRVWB4_GSU0_GSUC0_GSUWGMRR0_K1_LBSPPA256_LBSPPB128_LPA32_LPB4_LRVW4_MIWT2_1_NLCA1_SU32_SUM0_SUS256_SVW2_SKXCCM0_VWA2_WG16_16_1_WGM8_WGMXCC1_WGMXCCGn1
    SolutionIndex: 25
    SolutionNameMin: Cijk_Ailk_Bljk_HHS_BH_UserArgs_MT32x64x32_MI16x16x1_SN_LDSB0_GRVWA4_GRVWB4_GSU0_GSUC0_GSUWGMRR0_K1_LBSPPA256_LBSPPB128_LPA32_LPB4_LRVW4_MIWT2_1_NLCA1_SU32_SUM0_SUS256_SVW2_SKXCCM8_VWA2_WG16_16_1_WGM8_WGMXCC1_WGMXCCGn1
    SolutionIndex: 26
    SolutionNameMin: Cijk_Ailk_Bljk_HHS_BH_UserArgs_MT32x64x64_MI16x16x1_SN_LDSB0_GRVWA8_GRVWB8_GSU0_GSUC0_GSUWGMRR0_K1_LBSPPA512_LBSPPB128_LPA32_LPB16_LRVW8_MIWT2_1_NLCA1_SU32_SUM0_SUS256_SVW2_SKXCCM0_VWA2_WG16_16_1_WGM8_WGMXCC1_WGMXCCGn1
    SolutionIndex: 27
    SolutionNameMin: Cijk_Ailk_Bljk_HHS_BH_UserArgs_MT32x64x64_MI16x16x1_SN_LDSB0_GRVWA8_GRVWB8_GSU0_GSUC0_GSUWGMRR0_K1_LBSPPA512_LBSPPB128_LPA32_LPB16_LRVW8_MIWT2_1_NLCA1_SU32_SUM0_SUS256_SVW2_SKXCCM8_VWA2_WG16_16_1_WGM8_WGMXCC1_WGMXCCGn1
    SolutionIndex: 28
    SolutionNameMin: Cijk_Ailk_Bljk_HHS_BH_UserArgs_MT32x64x128_MI16x16x1_SN_LDSB1_GRVWA8_GRVWB8_GSU0_GSUC0_GSUWGMRR0_K1_LBSPPA512_LBSPPB256_LPA32_LPB16_LRVW8_MIWT2_1_NLCA1_SU32_SUM0_SUS256_SVW2_SKXCCM0_VWA2_WG16_16_1_WGM8_WGMXCC1_WGMXCCGn1
    SolutionIndex: 29
    SolutionNameMin: Cijk_Ailk_Bljk_HHS_BH_UserArgs_MT32x64x128_MI16x16x1_SN_LDSB1_GRVWA8_GRVWB8_GSU0_GSUC0_GSUWGMRR0_K1_LBSPPA512_LBSPPB256_LPA32_LPB16_LRVW8_MIWT2_1_NLCA1_SU32_SUM0_SUS256_SVW2_SKXCCM8_VWA2_WG16_16_1_WGM8_WGMXCC1_WGMXCCGn1
    SolutionIndex: 30
    SolutionNameMin: Cijk_Ailk_Bljk_HHS_BH_UserArgs_MT32x96x32_MI16x16x1_SN_LDSB0_GRVWA4_GRVWB4_GSU0_GSUC0_GSUWGMRR0_K1_LBSPPA256_LBSPPB128_LPA16_LPB4_LRVW4_MIWT1_3_NLCA1_SU32_SUM0_SUS256_SVW1_SKXCCM0_VWA1_WG32_8_1_WGM8_WGMXCC1_WGMXCCGn1
    SolutionIndex: 31
    SolutionNameMin: Cijk_Ailk_Bljk_HHS_BH_UserArgs_MT32x96x32_MI16x16x1_SN_LDSB0_GRVWA4_GRVWB4_GSU0_GSUC0_GSUWGMRR0_K1_LBSPPA256_LBSPPB128_LPA16_LPB4_LRVW4_MIWT1_3_NLCA1_SU32_SUM0_SUS256_SVW1_SKXCCM8_VWA1_WG32_8_1_WGM8_WGMXCC1_WGMXCCGn1
    SolutionIndex: 32
    SolutionNameMin: Cijk_Ailk_Bljk_HHS_BH_UserArgs_MT32x96x64_MI16x16x1_SN_LDSB1_GRVWA8_GRVWB8_GSU0_GSUC0_GSUWGMRR0_K1_LBSPPA512_LBSPPB128_LPA16_LPB16_LRVW8_MIWT1_3_NLCA1_SU32_SUM0_SUS256_SVW1_SKXCCM0_VWA1_WG32_8_1_WGM8_WGMXCC1_WGMXCCGn1
    SolutionIndex: 33
    SolutionNameMin: Cijk_Ailk_Bljk_HHS_BH_UserArgs_MT32x96x64_MI16x16x1_SN_LDSB1_GRVWA8_GRVWB8_GSU0_GSUC0_GSUWGMRR0_K1_LBSPPA512_LBSPPB128_LPA16_LPB16_LRVW8_MIWT1_3_NLCA1_SU32_SUM0_SUS256_SVW1_SKXCCM8_VWA1_WG32_8_1_WGM8_WGMXCC1_WGMXCCGn1
    SolutionIndex: 34
    SolutionNameMin: Cijk_Ailk_Bljk_HHS_BH_UserArgs_MT32x96x128_MI16x16x1_SN_LDSB1_GRVWA8_GRVWB8_GSU0_GSUC0_GSUWGMRR0_K1_LBSPPA512_LBSPPB256_LPA16_LPB16_LRVW8_MIWT1_3_NLCA1_SU32_SUM0_SUS256_SVW1_SKXCCM0_VWA1_WG32_8_1_WGM8_WGMXCC1_WGMXCCGn1
    SolutionIndex: 35
    SolutionNameMin: Cijk_Ailk_Bljk_HHS_BH_UserArgs_MT32x96x128_MI16x16x1_SN_LDSB1_GRVWA8_GRVWB8_GSU0_GSUC0_GSUWGMRR0_K1_LBSPPA512_LBSPPB256_LPA16_LPB16_LRVW8_MIWT1_3_NLCA1_SU32_SUM0_SUS256_SVW1_SKXCCM8_VWA1_WG32_8_1_WGM8_WGMXCC1_WGMXCCGn1
    SolutionIndex: 36
    SolutionNameMin: Cijk_Ailk_Bljk_HHS_BH_UserArgs_MT32x128x32_MI16x16x1_SN_LDSB0_GRVWA4_GRVWB4_GSU0_GSUC0_GSUWGMRR0_K1_LBSPPA256_LBSPPB128_LPA32_LPB4_LRVW4_MIWT2_2_NLCA1_SU32_SUM0_SUS256_SVW2_SKXCCM0_VWA2_WG16_16_1_WGM8_WGMXCC1_WGMXCCGn1
    SolutionIndex: 37
    SolutionNameMin: Cijk_Ailk_Bljk_HHS_BH_UserArgs_MT32x128x32_MI16x16x1_SN_LDSB0_GRVWA4_GRVWB4_GSU0_GSUC0_GSUWGMRR0_K1_LBSPPA256_LBSPPB128_LPA32_LPB4_LRVW4_MIWT2_2_NLCA1_SU32_SUM0_SUS256_SVW2_SKXCCM8_VWA2_WG16_16_1_WGM8_WGMXCC1_WGMXCCGn1
    SolutionIndex: 38
    SolutionNameMin: Cijk_Ailk_Bljk_HHS_BH_UserArgs_MT32x128x64_MI16x16x1_SN_LDSB1_GRVWA8_GRVWB8_GSU0_GSUC0_GSUWGMRR0_K1_LBSPPA512_LBSPPB128_LPA32_LPB16_LRVW8_MIWT2_2_NLCA1_SU32_SUM0_SUS256_SVW2_SKXCCM0_VWA2_WG16_16_1_WGM8_WGMXCC1_WGMXCCGn1
    SolutionIndex: 39
    SolutionNameMin: Cijk_Ailk_Bljk_HHS_BH_UserArgs_MT32x128x64_MI16x16x1_SN_LDSB1_GRVWA8_GRVWB8_GSU0_GSUC0_GSUWGMRR0_K1_LBSPPA512_LBSPPB128_LPA32_LPB16_LRVW8_MIWT2_2_NLCA1_SU32_SUM0_SUS256_SVW2_SKXCCM8_VWA2_WG16_16_1_WGM8_WGMXCC1_WGMXCCGn1
    SolutionIndex: 40
    SolutionNameMin: Cijk_Ailk_Bljk_HHS_BH_UserArgs_MT32x128x128_MI16x16x1_SN_LDSB1_GRVWA8_GRVWB8_GSU0_GSUC0_GSUWGMRR0_K1_LBSPPA512_LBSPPB256_LPA32_LPB16_LRVW8_MIWT2_2_NLCA1_SU32_SUM0_SUS256_SVW2_SKXCCM0_VWA2_WG16_16_1_WGM8_WGMXCC1_WGMXCCGn1
    SolutionIndex: 41
    SolutionNameMin: Cijk_Ailk_Bljk_HHS_BH_UserArgs_MT32x128x128_MI16x16x1_SN_LDSB1_GRVWA8_GRVWB8_GSU0_GSUC0_GSUWGMRR0_K1_LBSPPA512_LBSPPB256_LPA32_LPB16_LRVW8_MIWT2_2_NLCA1_SU32_SUM0_SUS256_SVW2_SKXCCM8_VWA2_WG16_16_1_WGM8_WGMXCC1_WGMXCCGn1
    SolutionIndex: 42
    SolutionNameMin: Cijk_Ailk_Bljk_HHS_BH_UserArgs_MT32x160x64_MI16x16x1_SN_LDSB1_GRVWA8_GRVWB8_GSU0_GSUC0_GSUWGMRR0_K1_LBSPPA512_LBSPPB128_LPA16_LPB16_LRVW8_MIWT1_5_NLCA1_SU32_SUM0_SUS256_SVW1_SKXCCM0_VWA1_WG32_8_1_WGM8_WGMXCC1_WGMXCCGn1
    SolutionIndex: 43
    SolutionNameMin: Cijk_Ailk_Bljk_HHS_BH_UserArgs_MT32x160x64_MI16x16x1_SN_LDSB1_GRVWA8_GRVWB8_GSU0_GSUC0_GSUWGMRR0_K1_LBSPPA512_LBSPPB128_LPA16_LPB16_LRVW8_MIWT1_5_NLCA1_SU32_SUM0_SUS256_SVW1_SKXCCM8_VWA1_WG32_8_1_WGM8_WGMXCC1_WGMXCCGn1
    SolutionIndex: 44
    SolutionNameMin: Cijk_Ailk_Bljk_HHS_BH_UserArgs_MT32x160x128_MI16x16x1_SN_LDSB1_GRVWA8_GRVWB8_GSU0_GSUC0_GSUWGMRR0_K1_LBSPPA512_LBSPPB256_LPA16_LPB16_LRVW8_MIWT1_5_NLCA1_SU32_SUM0_SUS256_SVW1_SKXCCM0_VWA1_WG32_8_1_WGM8_WGMXCC1_WGMXCCGn1
    SolutionIndex: 45
    SolutionNameMin: Cijk_Ailk_Bljk_HHS_BH_UserArgs_MT32x160x128_MI16x16x1_SN_LDSB1_GRVWA8_GRVWB8_GSU0_GSUC0_GSUWGMRR0_K1_LBSPPA512_LBSPPB256_LPA16_LPB16_LRVW8_MIWT1_5_NLCA1_SU32_SUM0_SUS256_SVW1_SKXCCM8_VWA1_WG32_8_1_WGM8_WGMXCC1_WGMXCCGn1
    SolutionIndex: 46
    SolutionNameMin: Cijk_Ailk_Bljk_HHS_BH_UserArgs_MT32x192x32_MI16x16x1_SN_LDSB0_GRVWA4_GRVWB4_GSU0_GSUC0_GSUWGMRR0_K1_LBSPPA256_LBSPPB128_LPA32_LPB4_LRVW4_MIWT2_3_NLCA1_SU32_SUM0_SUS256_SVW2_SKXCCM0_VWA2_WG16_16_1_WGM8_WGMXCC1_WGMXCCGn1
    SolutionIndex: 47
    SolutionNameMin: Cijk_Ailk_Bljk_HHS_BH_UserArgs_MT32x192x32_MI16x16x1_SN_LDSB0_GRVWA4_GRVWB4_GSU0_GSUC0_GSUWGMRR0_K1_LBSPPA256_LBSPPB128_LPA32_LPB4_LRVW4_MIWT2_3_NLCA1_SU32_SUM0_SUS256_SVW2_SKXCCM8_VWA2_WG16_16_1_WGM8_WGMXCC1_WGMXCCGn1
    SolutionIndex: 48
    SolutionNameMin: Cijk_Ailk_Bljk_HHS_BH_UserArgs_MT32x192x64_MI16x16x1_SN_LDSB1_GRVWA8_GRVWB8_GSU0_GSUC0_GSUWGMRR0_K1_LBSPPA512_LBSPPB128_LPA32_LPB16_LRVW8_MIWT2_3_NLCA1_SU32_SUM0_SUS256_SVW2_SKXCCM0_VWA2_WG16_16_1_WGM8_WGMXCC1_WGMXCCGn1
    SolutionIndex: 49
    SolutionNameMin: Cijk_Ailk_Bljk_HHS_BH_UserArgs_MT32x192x64_MI16x16x1_SN_LDSB1_GRVWA8_GRVWB8_GSU0_GSUC0_GSUWGMRR0_K1_LBSPPA512_LBSPPB128_LPA32_LPB16_LRVW8_MIWT2_3_NLCA1_SU32_SUM0_SUS256_SVW2_SKXCCM8_VWA2_WG16_16_1_WGM8_WGMXCC1_WGMXCCGn1
    SolutionIndex: 50
    SolutionNameMin: Cijk_Ailk_Bljk_HHS_BH_UserArgs_MT32x192x128_MI16x16x1_SN_LDSB1_GRVWA8_GRVWB4_GSU0_GSUC0_GSUWGMRR0_K1_LBSPPA256_LBSPPB256_LPA32_LPB4_LRVW4_MIWT2_3_NLCA1_SU32_SUM0_SUS256_SVW2_SKXCCM0_VWA2_WG16_16_1_WGM8_WGMXCC1_WGMXCCGn1
    SolutionIndex: 51
    SolutionNameMin: Cijk_Ailk_Bljk_HHS_BH_UserArgs_MT32x192x128_MI16x16x1_SN_LDSB1_GRVWA8_GRVWB4_GSU0_GSUC0_GSUWGMRR0_K1_LBSPPA256_LBSPPB256_LPA32_LPB4_LRVW4_MIWT2_3_NLCA1_SU32_SUM0_SUS256_SVW2_SKXCCM8_VWA2_WG16_16_1_WGM8_WGMXCC1_WGMXCCGn1
    SolutionIndex: 52
    SolutionNameMin: Cijk_Ailk_Bljk_HHS_BH_UserArgs_MT32x224x32_MI16x16x1_SN_LDSB1_GRVWA4_GRVWB4_GSU0_GSUC0_GSUWGMRR0_K1_LBSPPA256_LBSPPB128_LPA16_LPB4_LRVW4_MIWT1_7_NLCA1_SU32_SUM0_SUS256_SVW1_SKXCCM0_VWA1_WG32_8_1_WGM8_WGMXCC1_WGMXCCGn1
    SolutionIndex: 53
    SolutionNameMin: Cijk_Ailk_Bljk_HHS_BH_UserArgs_MT32x224x32_MI16x16x1_SN_LDSB1_GRVWA4_GRVWB4_GSU0_GSUC0_GSUWGMRR0_K1_LBSPPA256_LBSPPB128_LPA16_LPB4_LRVW4_MIWT1_7_NLCA1_SU32_SUM0_SUS256_SVW1_SKXCCM8_VWA1_WG32_8_1_WGM8_WGMXCC1_WGMXCCGn1
    SolutionIndex: 54
    SolutionNameMin: Cijk_Ailk_Bljk_HHS_BH_UserArgs_MT32x224x64_MI16x16x1_SN_LDSB1_GRVWA8_GRVWB8_GSU0_GSUC0_GSUWGMRR0_K1_LBSPPA512_LBSPPB128_LPA16_LPB16_LRVW8_MIWT1_7_NLCA1_SU32_SUM0_SUS256_SVW1_SKXCCM0_VWA1_WG32_8_1_WGM8_WGMXCC1_WGMXCCGn1
    SolutionIndex: 55
    SolutionNameMin: Cijk_Ailk_Bljk_HHS_BH_UserArgs_MT32x224x64_MI16x16x1_SN_LDSB1_GRVWA8_GRVWB8_GSU0_GSUC0_GSUWGMRR0_K1_LBSPPA512_LBSPPB128_LPA16_LPB16_LRVW8_MIWT1_7_NLCA1_SU32_SUM0_SUS256_SVW1_SKXCCM8_VWA1_WG32_8_1_WGM8_WGMXCC1_WGMXCCGn1
    SolutionIndex: 56
    SolutionNameMin: Cijk_Ailk_Bljk_HHS_BH_UserArgs_MT32x256x32_MI16x16x1_SN_LDSB1_GRVWA4_GRVWB4_GSU0_GSUC0_GSUWGMRR0_K1_LBSPPA256_LBSPPB128_LPA32_LPB4_LRVW4_MIWT2_4_NLCA1_SU32_SUM0_SUS256_SVW2_SKXCCM0_VWA2_WG16_16_1_WGM8_WGMXCC1_WGMXCCGn1
    SolutionIndex: 57
    SolutionNameMin: Cijk_Ailk_Bljk_HHS_BH_UserArgs_MT32x256x32_MI16x16x1_SN_LDSB1_GRVWA4_GRVWB4_GSU0_GSUC0_GSUWGMRR0_K1_LBSPPA256_LBSPPB128_LPA32_LPB4_LRVW4_MIWT2_4_NLCA1_SU32_SUM0_SUS256_SVW2_SKXCCM8_VWA2_WG16_16_1_WGM8_WGMXCC1_WGMXCCGn1
    SolutionIndex: 58
    SolutionNameMin: Cijk_Ailk_Bljk_HHS_BH_UserArgs_MT32x256x64_MI16x16x1_SN_LDSB1_GRVWA8_GRVWB8_GSU0_GSUC0_GSUWGMRR0_K1_LBSPPA512_LBSPPB128_LPA32_LPB16_LRVW8_MIWT2_4_NLCA1_SU32_SUM0_SUS256_SVW2_SKXCCM0_VWA2_WG16_16_1_WGM8_WGMXCC1_WGMXCCGn1
    SolutionIndex: 59
    SolutionNameMin: Cijk_Ailk_Bljk_HHS_BH_UserArgs_MT32x256x64_MI16x16x1_SN_LDSB1_GRVWA8_GRVWB8_GSU0_GSUC0_GSUWGMRR0_K1_LBSPPA512_LBSPPB128_LPA32_LPB16_LRVW8_MIWT2_4_NLCA1_SU32_SUM0_SUS256_SVW2_SKXCCM8_VWA2_WG16_16_1_WGM8_WGMXCC1_WGMXCCGn1
    SolutionIndex: 60
    SolutionNameMin: Cijk_Ailk_Bljk_HHS_BH_UserArgs_MT48x64x32_MI16x16x1_SN_LDSB0_GRVWA2_GRVWB4_GSU0_GSUC0_GSUWGMRR0_K1_LBSPPA384_LBSPPB128_LPA16_LPB4_LRVW4_MIWT3_1_NLCA3_SU32_SUM0_SUS256_SVW1_SKXCCM0_VWA1_WG16_16_1_WGM8_WGMXCC1_WGMXCCGn1
    SolutionIndex: 61
    SolutionNameMin: Cijk_Ailk_Bljk_HHS_BH_UserArgs_MT48x64x32_MI16x16x1_SN_LDSB0_GRVWA2_GRVWB4_GSU0_GSUC0_GSUWGMRR0_K1_LBSPPA384_LBSPPB128_LPA16_LPB4_LRVW4_MIWT3_1_NLCA3_SU32_SUM0_SUS256_SVW1_SKXCCM8_VWA1_WG16_16_1_WGM8_WGMXCC1_WGMXCCGn1
    SolutionIndex: 62
    SolutionNameMin: Cijk_Ailk_Bljk_HHS_BH_UserArgs_MT48x64x64_MI16x16x1_SN_LDSB1_GRVWA4_GRVWB8_GSU0_GSUC0_GSUWGMRR0_K1_LBSPPA768_LBSPPB128_LPA16_LPB16_LRVW8_MIWT3_1_NLCA3_SU32_SUM0_SUS256_SVW1_SKXCCM0_VWA1_WG16_16_1_WGM8_WGMXCC1_WGMXCCGn1
    SolutionIndex: 63
    SolutionNameMin: Cijk_Ailk_Bljk_HHS_BH_UserArgs_MT48x64x64_MI16x16x1_SN_LDSB1_GRVWA4_GRVWB8_GSU0_GSUC0_GSUWGMRR0_K1_LBSPPA768_LBSPPB128_LPA16_LPB16_LRVW8_MIWT3_1_NLCA3_SU32_SUM0_SUS256_SVW1_SKXCCM8_VWA1_WG16_16_1_WGM8_WGMXCC1_WGMXCCGn1
    SolutionIndex: 64
    SolutionNameMin: Cijk_Ailk_Bljk_HHS_BH_UserArgs_MT48x64x128_MI16x16x1_SN_LDSB1_GRVWA8_GRVWB8_GSU0_GSUC0_GSUWGMRR0_K1_LBSPPA768_LBSPPB256_LPA16_LPB16_LRVW8_MIWT3_1_NLCA3_SU32_SUM0_SUS256_SVW1_SKXCCM0_VWA1_WG16_16_1_WGM8_WGMXCC1_WGMXCCGn1
    SolutionIndex: 65
    SolutionNameMin: Cijk_Ailk_Bljk_HHS_BH_UserArgs_MT48x64x128_MI16x16x1_SN_LDSB1_GRVWA8_GRVWB8_GSU0_GSUC0_GSUWGMRR0_K1_LBSPPA768_LBSPPB256_LPA16_LPB16_LRVW8_MIWT3_1_NLCA3_SU32_SUM0_SUS256_SVW1_SKXCCM8_VWA1_WG16_16_1_WGM8_WGMXCC1_WGMXCCGn1
    SolutionIndex: 66
    SolutionNameMin: Cijk_Ailk_Bljk_HHS_BH_UserArgs_MT48x128x32_MI16x16x1_SN_LDSB0_GRVWA2_GRVWB4_GSU0_GSUC0_GSUWGMRR0_K1_LBSPPA384_LBSPPB128_LPA16_LPB4_LRVW4_MIWT3_2_NLCA3_SU32_SUM0_SUS256_SVW1_SKXCCM0_VWA1_WG16_16_1_WGM8_WGMXCC1_WGMXCCGn1
    SolutionIndex: 67
    SolutionNameMin: Cijk_Ailk_Bljk_HHS_BH_UserArgs_MT48x128x32_MI16x16x1_SN_LDSB0_GRVWA2_GRVWB4_GSU0_GSUC0_GSUWGMRR0_K1_LBSPPA384_LBSPPB128_LPA16_LPB4_LRVW4_MIWT3_2_NLCA3_SU32_SUM0_SUS256_SVW1_SKXCCM8_VWA1_WG16_16_1_WGM8_WGMXCC1_WGMXCCGn1
    SolutionIndex: 68
    SolutionNameMin: Cijk_Ailk_Bljk_HHS_BH_UserArgs_MT48x128x64_MI16x16x1_SN_LDSB1_GRVWA4_GRVWB8_GSU0_GSUC0_GSUWGMRR0_K1_LBSPPA768_LBSPPB128_LPA16_LPB16_LRVW8_MIWT3_2_NLCA3_SU32_SUM0_SUS256_SVW1_SKXCCM0_VWA1_WG16_16_1_WGM8_WGMXCC1_WGMXCCGn1
    SolutionIndex: 69
    SolutionNameMin: Cijk_Ailk_Bljk_HHS_BH_UserArgs_MT48x128x64_MI16x16x1_SN_LDSB1_GRVWA4_GRVWB8_GSU0_GSUC0_GSUWGMRR0_K1_LBSPPA768_LBSPPB128_LPA16_LPB16_LRVW8_MIWT3_2_NLCA3_SU32_SUM0_SUS256_SVW1_SKXCCM8_VWA1_WG16_16_1_WGM8_WGMXCC1_WGMXCCGn1
    SolutionIndex: 70
    SolutionNameMin: Cijk_Ailk_Bljk_HHS_BH_UserArgs_MT48x128x128_MI16x16x1_SN_LDSB1_GRVWA8_GRVWB8_GSU0_GSUC0_GSUWGMRR0_K1_LBSPPA768_LBSPPB256_LPA16_LPB16_LRVW8_MIWT3_2_NLCA3_SU32_SUM0_SUS256_SVW1_SKXCCM0_VWA1_WG16_16_1_WGM8_WGMXCC1_WGMXCCGn1
    SolutionIndex: 71
    SolutionNameMin: Cijk_Ailk_Bljk_HHS_BH_UserArgs_MT48x128x128_MI16x16x1_SN_LDSB1_GRVWA8_GRVWB8_GSU0_GSUC0_GSUWGMRR0_K1_LBSPPA768_LBSPPB256_LPA16_LPB16_LRVW8_MIWT3_2_NLCA3_SU32_SUM0_SUS256_SVW1_SKXCCM8_VWA1_WG16_16_1_WGM8_WGMXCC1_WGMXCCGn1
    SolutionIndex: 72
    SolutionNameMin: Cijk_Ailk_Bljk_HHS_BH_UserArgs_MT48x192x64_MI16x16x1_SN_LDSB1_GRVWA4_GRVWB8_GSU0_GSUC0_GSUWGMRR0_K1_LBSPPA768_LBSPPB128_LPA16_LPB16_LRVW8_MIWT3_3_NLCA3_SU32_SUM0_SUS256_SVW1_SKXCCM0_VWA1_WG16_16_1_WGM8_WGMXCC1_WGMXCCGn1
    SolutionIndex: 73
    SolutionNameMin: Cijk_Ailk_Bljk_HHS_BH_UserArgs_MT48x192x64_MI16x16x1_SN_LDSB1_GRVWA4_GRVWB8_GSU0_GSUC0_GSUWGMRR0_K1_LBSPPA768_LBSPPB128_LPA16_LPB16_LRVW8_MIWT3_3_NLCA3_SU32_SUM0_SUS256_SVW1_SKXCCM8_VWA1_WG16_16_1_WGM8_WGMXCC1_WGMXCCGn1
    SolutionIndex: 74
    SolutionNameMin: Cijk_Ailk_Bljk_HHS_BH_UserArgs_MT48x192x128_MI16x16x1_SN_LDSB1_GRVWA8_GRVWB4_GSU0_GSUC0_GSUWGMRR0_K1_LBSPPA384_LBSPPB256_LPA16_LPB4_LRVW4_MIWT3_3_NLCA3_SU32_SUM0_SUS256_SVW1_SKXCCM0_VWA1_WG16_16_1_WGM8_WGMXCC1_WGMXCCGn1
    SolutionIndex: 75
    SolutionNameMin: Cijk_Ailk_Bljk_HHS_BH_UserArgs_MT48x192x128_MI16x16x1_SN_LDSB1_GRVWA8_GRVWB4_GSU0_GSUC0_GSUWGMRR0_K1_LBSPPA384_LBSPPB256_LPA16_LPB4_LRVW4_MIWT3_3_NLCA3_SU32_SUM0_SUS256_SVW1_SKXCCM8_VWA1_WG16_16_1_WGM8_WGMXCC1_WGMXCCGn1
    SolutionIndex: 76
    SolutionNameMin: Cijk_Ailk_Bljk_HHS_BH_UserArgs_MT48x256x32_MI16x16x1_SN_LDSB1_GRVWA2_GRVWB4_GSU0_GSUC0_GSUWGMRR0_K1_LBSPPA384_LBSPPB128_LPA16_LPB4_LRVW4_MIWT3_4_NLCA3_SU32_SUM0_SUS256_SVW1_SKXCCM0_VWA1_WG16_16_1_WGM8_WGMXCC1_WGMXCCGn1
    SolutionIndex: 77
    SolutionNameMin: Cijk_Ailk_Bljk_HHS_BH_UserArgs_MT48x256x32_MI16x16x1_SN_LDSB1_GRVWA2_GRVWB4_GSU0_GSUC0_GSUWGMRR0_K1_LBSPPA384_LBSPPB128_LPA16_LPB4_LRVW4_MIWT3_4_NLCA3_SU32_SUM0_SUS256_SVW1_SKXCCM8_VWA1_WG16_16_1_WGM8_WGMXCC1_WGMXCCGn1
    SolutionIndex: 78
    SolutionNameMin: Cijk_Ailk_Bljk_HHS_BH_UserArgs_MT48x256x64_MI16x16x1_SN_LDSB1_GRVWA4_GRVWB8_GSU0_GSUC0_GSUWGMRR0_K1_LBSPPA768_LBSPPB128_LPA16_LPB16_LRVW8_MIWT3_4_NLCA3_SU32_SUM0_SUS256_SVW1_SKXCCM0_VWA1_WG16_16_1_WGM8_WGMXCC1_WGMXCCGn1
    SolutionIndex: 79
    SolutionNameMin: Cijk_Ailk_Bljk_HHS_BH_UserArgs_MT48x256x64_MI16x16x1_SN_LDSB1_GRVWA4_GRVWB8_GSU0_GSUC0_GSUWGMRR0_K1_LBSPPA768_LBSPPB128_LPA16_LPB16_LRVW8_MIWT3_4_NLCA3_SU32_SUM0_SUS256_SVW1_SKXCCM8_VWA1_WG16_16_1_WGM8_WGMXCC1_WGMXCCGn1
    SolutionIndex: 80
    SolutionNameMin: Cijk_Ailk_Bljk_HHS_BH_UserArgs_MT64x16x32_MI16x16x1_SN_LDSB0_GRVWA8_GRVWB2_GSU0_GSUC0_GSUWGMRR0_K1_LBSPPA512_LBSPPB128_LPA16_LPB4_LRVW4_MIWT1_1_NLCA1_SU32_SUM0_SUS256_SVW1_SKXCCM0_VWA1_WG64_4_1_WGM8_WGMXCC1_WGMXCCGn1
    SolutionIndex: 81
    SolutionNameMin: Cijk_Ailk_Bljk_HHS_BH_UserArgs_MT64x16x32_MI16x16x1_SN_LDSB0_GRVWA8_GRVWB2_GSU0_GSUC0_GSUWGMRR0_K1_LBSPPA512_LBSPPB128_LPA16_LPB4_LRVW4_MIWT1_1_NLCA1_SU32_SUM0_SUS256_SVW1_SKXCCM8_VWA1_WG64_4_1_WGM8_WGMXCC1_WGMXCCGn1
    SolutionIndex: 82
    SolutionNameMin: Cijk_Ailk_Bljk_HHS_BH_UserArgs_MT64x16x64_MI16x16x1_SN_LDSB0_GRVWA8_GRVWB4_GSU0_GSUC0_GSUWGMRR0_K1_LBSPPA1024_LBSPPB128_LPA16_LPB16_LRVW8_MIWT1_1_NLCA1_SU32_SUM0_SUS256_SVW1_SKXCCM0_VWA1_WG64_4_1_WGM8_WGMXCC1_WGMXCCGn1
    SolutionIndex: 83
    SolutionNameMin: Cijk_Ailk_Bljk_HHS_BH_UserArgs_MT64x16x64_MI16x16x1_SN_LDSB0_GRVWA8_GRVWB4_GSU0_GSUC0_GSUWGMRR0_K1_LBSPPA1024_LBSPPB128_LPA16_LPB16_LRVW8_MIWT1_1_NLCA1_SU32_SUM0_SUS256_SVW1_SKXCCM8_VWA1_WG64_4_1_WGM8_WGMXCC1_WGMXCCGn1
    SolutionIndex: 84
    SolutionNameMin: Cijk_Ailk_Bljk_HHS_BH_UserArgs_MT64x16x128_MI16x16x1_SN_LDSB0_GRVWA8_GRVWB8_GSU0_GSUC0_GSUWGMRR0_K1_LBSPPA1024_LBSPPB256_LPA16_LPB16_LRVW8_MIWT1_1_NLCA1_SU32_SUM0_SUS256_SVW1_SKXCCM0_VWA1_WG64_4_1_WGM8_WGMXCC1_WGMXCCGn1
    SolutionIndex: 85
    SolutionNameMin: Cijk_Ailk_Bljk_HHS_BH_UserArgs_MT64x16x128_MI16x16x1_SN_LDSB0_GRVWA8_GRVWB8_GSU0_GSUC0_GSUWGMRR0_K1_LBSPPA1024_LBSPPB256_LPA16_LPB16_LRVW8_MIWT1_1_NLCA1_SU32_SUM0_SUS256_SVW1_SKXCCM8_VWA1_WG64_4_1_WGM8_WGMXCC1_WGMXCCGn1
    SolutionIndex: 86
    SolutionNameMin: Cijk_Ailk_Bljk_HHS_BH_UserArgs_MT64x32x32_MI16x16x1_SN_LDSB0_GRVWA8_GRVWB4_GSU0_GSUC0_GSUWGMRR0_K1_LBSPPA512_LBSPPB128_LPA32_LPB4_LRVW4_MIWT2_1_NLCA1_SU32_SUM0_SUS256_SVW2_SKXCCM0_VWA2_WG32_8_1_WGM8_WGMXCC1_WGMXCCGn1
    SolutionIndex: 87
    SolutionNameMin: Cijk_Ailk_Bljk_HHS_BH_UserArgs_MT64x32x32_MI16x16x1_SN_LDSB0_GRVWA8_GRVWB4_GSU0_GSUC0_GSUWGMRR0_K1_LBSPPA512_LBSPPB128_LPA32_LPB4_LRVW4_MIWT2_1_NLCA1_SU32_SUM0_SUS256_SVW2_SKXCCM8_VWA2_WG32_8_1_WGM8_WGMXCC1_WGMXCCGn1
    SolutionIndex: 88
    SolutionNameMin: Cijk_Ailk_Bljk_HHS_BH_UserArgs_MT64x32x64_MI16x16x1_SN_LDSB0_GRVWA8_GRVWB8_GSU0_GSUC0_GSUWGMRR0_K1_LBSPPA1024_LBSPPB128_LPA32_LPB16_LRVW8_MIWT2_1_NLCA1_SU32_SUM0_SUS256_SVW2_SKXCCM0_VWA2_WG32_8_1_WGM8_WGMXCC1_WGMXCCGn1
    SolutionIndex: 89
    SolutionNameMin: Cijk_Ailk_Bljk_HHS_BH_UserArgs_MT64x32x64_MI16x16x1_SN_LDSB0_GRVWA8_GRVWB8_GSU0_GSUC0_GSUWGMRR0_K1_LBSPPA1024_LBSPPB128_LPA32_LPB16_LRVW8_MIWT2_1_NLCA1_SU32_SUM0_SUS256_SVW2_SKXCCM8_VWA2_WG32_8_1_WGM8_WGMXCC1_WGMXCCGn1
    SolutionIndex: 90
    SolutionNameMin: Cijk_Ailk_Bljk_HHS_BH_UserArgs_MT64x32x128_MI16x16x1_SN_LDSB1_GRVWA8_GRVWB8_GSU0_GSUC0_GSUWGMRR0_K1_LBSPPA1024_LBSPPB256_LPA32_LPB16_LRVW8_MIWT2_1_NLCA1_SU32_SUM0_SUS256_SVW2_SKXCCM0_VWA2_WG32_8_1_WGM8_WGMXCC1_WGMXCCGn1
    SolutionIndex: 91
    SolutionNameMin: Cijk_Ailk_Bljk_HHS_BH_UserArgs_MT64x32x128_MI16x16x1_SN_LDSB1_GRVWA8_GRVWB8_GSU0_GSUC0_GSUWGMRR0_K1_LBSPPA1024_LBSPPB256_LPA32_LPB16_LRVW8_MIWT2_1_NLCA1_SU32_SUM0_SUS256_SVW2_SKXCCM8_VWA2_WG32_8_1_WGM8_WGMXCC1_WGMXCCGn1
    SolutionIndex: 92
    SolutionNameMin: Cijk_Ailk_Bljk_HHS_BH_UserArgs_MT64x48x32_MI16x16x1_SN_LDSB0_GRVWA8_GRVWB2_GSU0_GSUC0_GSUWGMRR0_K1_LBSPPA512_LBSPPB128_LPA16_LPB4_LRVW4_MIWT1_3_NLCA1_SU32_SUM0_SUS256_SVW1_SKXCCM0_VWA1_WG64_4_1_WGM8_WGMXCC1_WGMXCCGn1
    SolutionIndex: 93
    SolutionNameMin: Cijk_Ailk_Bljk_HHS_BH_UserArgs_MT64x48x32_MI16x16x1_SN_LDSB0_GRVWA8_GRVWB2_GSU0_GSUC0_GSUWGMRR0_K1_LBSPPA512_LBSPPB128_LPA16_LPB4_LRVW4_MIWT1_3_NLCA1_SU32_SUM0_SUS256_SVW1_SKXCCM8_VWA1_WG64_4_1_WGM8_WGMXCC1_WGMXCCGn1
    SolutionIndex: 94
    SolutionNameMin: Cijk_Ailk_Bljk_HHS_BH_UserArgs_MT64x48x64_MI16x16x1_SN_LDSB0_GRVWA8_GRVWB4_GSU0_GSUC0_GSUWGMRR0_K1_LBSPPA1024_LBSPPB128_LPA16_LPB16_LRVW8_MIWT1_3_NLCA1_SU32_SUM0_SUS256_SVW1_SKXCCM0_VWA1_WG64_4_1_WGM8_WGMXCC1_WGMXCCGn1
    SolutionIndex: 95
    SolutionNameMin: Cijk_Ailk_Bljk_HHS_BH_UserArgs_MT64x48x64_MI16x16x1_SN_LDSB0_GRVWA8_GRVWB4_GSU0_GSUC0_GSUWGMRR0_K1_LBSPPA1024_LBSPPB128_LPA16_LPB16_LRVW8_MIWT1_3_NLCA1_SU32_SUM0_SUS256_SVW1_SKXCCM8_VWA1_WG64_4_1_WGM8_WGMXCC1_WGMXCCGn1
    SolutionIndex: 96
    SolutionNameMin: Cijk_Ailk_Bljk_HHS_BH_UserArgs_MT64x48x128_MI16x16x1_SN_LDSB1_GRVWA8_GRVWB8_GSU0_GSUC0_GSUWGMRR0_K1_LBSPPA1024_LBSPPB256_LPA16_LPB16_LRVW8_MIWT1_3_NLCA1_SU32_SUM0_SUS256_SVW1_SKXCCM0_VWA1_WG64_4_1_WGM8_WGMXCC1_WGMXCCGn1
    SolutionIndex: 97
    SolutionNameMin: Cijk_Ailk_Bljk_HHS_BH_UserArgs_MT64x48x128_MI16x16x1_SN_LDSB1_GRVWA8_GRVWB8_GSU0_GSUC0_GSUWGMRR0_K1_LBSPPA1024_LBSPPB256_LPA16_LPB16_LRVW8_MIWT1_3_NLCA1_SU32_SUM0_SUS256_SVW1_SKXCCM8_VWA1_WG64_4_1_WGM8_WGMXCC1_WGMXCCGn1
    SolutionIndex: 98
    SolutionNameMin: Cijk_Ailk_Bljk_HHS_BH_UserArgs_MT64x64x32_MI16x16x1_SN_LDSB0_GRVWA8_GRVWB4_GSU0_GSUC0_GSUWGMRR0_K1_LBSPPA512_LBSPPB128_LPA32_LPB4_LRVW4_MIWT2_2_NLCA1_SU32_SUM0_SUS256_SVW2_SKXCCM0_VWA2_WG32_8_1_WGM8_WGMXCC1_WGMXCCGn1
    SolutionIndex: 99
    SolutionNameMin: Cijk_Ailk_Bljk_HHS_BH_UserArgs_MT64x64x32_MI16x16x1_SN_LDSB0_GRVWA8_GRVWB4_GSU0_GSUC0_GSUWGMRR0_K1_LBSPPA512_LBSPPB128_LPA32_LPB4_LRVW4_MIWT2_2_NLCA1_SU32_SUM0_SUS256_SVW2_SKXCCM8_VWA2_WG32_8_1_WGM8_WGMXCC1_WGMXCCGn1
    SolutionIndex: 100
    SolutionNameMin: Cijk_Ailk_Bljk_HHS_BH_UserArgs_MT64x64x64_MI16x16x1_SN_LDSB1_GRVWA8_GRVWB8_GSU0_GSUC0_GSUWGMRR0_K1_LBSPPA1024_LBSPPB128_LPA32_LPB16_LRVW8_MIWT2_2_NLCA1_SU32_SUM0_SUS256_SVW2_SKXCCM0_VWA2_WG32_8_1_WGM8_WGMXCC1_WGMXCCGn1
    SolutionIndex: 101
    SolutionNameMin: Cijk_Ailk_Bljk_HHS_BH_UserArgs_MT64x64x64_MI16x16x1_SN_LDSB1_GRVWA8_GRVWB8_GSU0_GSUC0_GSUWGMRR0_K1_LBSPPA1024_LBSPPB128_LPA32_LPB16_LRVW8_MIWT2_2_NLCA1_SU32_SUM0_SUS256_SVW2_SKXCCM8_VWA2_WG32_8_1_WGM8_WGMXCC1_WGMXCCGn1
    SolutionIndex: 102
    SolutionNameMin: Cijk_Ailk_Bljk_HHS_BH_UserArgs_MT64x64x128_MI16x16x1_SN_LDSB1_GRVWA8_GRVWB8_GSU0_GSUC0_GSUWGMRR0_K1_LBSPPA1024_LBSPPB256_LPA32_LPB16_LRVW8_MIWT2_2_NLCA1_SU32_SUM0_SUS256_SVW2_SKXCCM0_VWA2_WG32_8_1_WGM8_WGMXCC1_WGMXCCGn1
    SolutionIndex: 103
    SolutionNameMin: Cijk_Ailk_Bljk_HHS_BH_UserArgs_MT64x64x128_MI16x16x1_SN_LDSB1_GRVWA8_GRVWB8_GSU0_GSUC0_GSUWGMRR0_K1_LBSPPA1024_LBSPPB256_LPA32_LPB16_LRVW8_MIWT2_2_NLCA1_SU32_SUM0_SUS256_SVW2_SKXCCM8_VWA2_WG32_8_1_WGM8_WGMXCC1_WGMXCCGn1
    SolutionIndex: 104
    SolutionNameMin: Cijk_Ailk_Bljk_HHS_BH_UserArgs_MT64x80x32_MI16x16x1_SN_LDSB0_GRVWA8_GRVWB2_GSU0_GSUC0_GSUWGMRR0_K1_LBSPPA512_LBSPPB128_LPA16_LPB4_LRVW4_MIWT1_5_NLCA1_SU32_SUM0_SUS256_SVW1_SKXCCM0_VWA1_WG64_4_1_WGM8_WGMXCC1_WGMXCCGn1
    SolutionIndex: 105
    SolutionNameMin: Cijk_Ailk_Bljk_HHS_BH_UserArgs_MT64x80x32_MI16x16x1_SN_LDSB0_GRVWA8_GRVWB2_GSU0_GSUC0_GSUWGMRR0_K1_LBSPPA512_LBSPPB128_LPA16_LPB4_LRVW4_MIWT1_5_NLCA1_SU32_SUM0_SUS256_SVW1_SKXCCM8_VWA1_WG64_4_1_WGM8_WGMXCC1_WGMXCCGn1
    SolutionIndex: 106
    SolutionNameMin: Cijk_Ailk_Bljk_HHS_BH_UserArgs_MT64x80x64_MI16x16x1_SN_LDSB1_GRVWA8_GRVWB4_GSU0_GSUC0_GSUWGMRR0_K1_LBSPPA1024_LBSPPB128_LPA16_LPB16_LRVW8_MIWT1_5_NLCA1_SU32_SUM0_SUS256_SVW1_SKXCCM0_VWA1_WG64_4_1_WGM8_WGMXCC1_WGMXCCGn1
    SolutionIndex: 107
    SolutionNameMin: Cijk_Ailk_Bljk_HHS_BH_UserArgs_MT64x80x64_MI16x16x1_SN_LDSB1_GRVWA8_GRVWB4_GSU0_GSUC0_GSUWGMRR0_K1_LBSPPA1024_LBSPPB128_LPA16_LPB16_LRVW8_MIWT1_5_NLCA1_SU32_SUM0_SUS256_SVW1_SKXCCM8_VWA1_WG64_4_1_WGM8_WGMXCC1_WGMXCCGn1
    SolutionIndex: 108
    SolutionNameMin: Cijk_Ailk_Bljk_HHS_BH_UserArgs_MT64x80x128_MI16x16x1_SN_LDSB1_GRVWA8_GRVWB8_GSU0_GSUC0_GSUWGMRR0_K1_LBSPPA1024_LBSPPB256_LPA16_LPB16_LRVW8_MIWT1_5_NLCA1_SU32_SUM0_SUS256_SVW1_SKXCCM0_VWA1_WG64_4_1_WGM8_WGMXCC1_WGMXCCGn1
    SolutionIndex: 109
    SolutionNameMin: Cijk_Ailk_Bljk_HHS_BH_UserArgs_MT64x80x128_MI16x16x1_SN_LDSB1_GRVWA8_GRVWB8_GSU0_GSUC0_GSUWGMRR0_K1_LBSPPA1024_LBSPPB256_LPA16_LPB16_LRVW8_MIWT1_5_NLCA1_SU32_SUM0_SUS256_SVW1_SKXCCM8_VWA1_WG64_4_1_WGM8_WGMXCC1_WGMXCCGn1
    SolutionIndex: 110
    SolutionNameMin: Cijk_Ailk_Bljk_HHS_BH_UserArgs_MT64x96x32_MI16x16x1_SN_LDSB0_GRVWA8_GRVWB4_GSU0_GSUC0_GSUWGMRR0_K1_LBSPPA512_LBSPPB128_LPA32_LPB4_LRVW4_MIWT2_3_NLCA1_SU32_SUM0_SUS256_SVW2_SKXCCM0_VWA2_WG32_8_1_WGM8_WGMXCC1_WGMXCCGn1
    SolutionIndex: 111
    SolutionNameMin: Cijk_Ailk_Bljk_HHS_BH_UserArgs_MT64x96x32_MI16x16x1_SN_LDSB0_GRVWA8_GRVWB4_GSU0_GSUC0_GSUWGMRR0_K1_LBSPPA512_LBSPPB128_LPA32_LPB4_LRVW4_MIWT2_3_NLCA1_SU32_SUM0_SUS256_SVW2_SKXCCM8_VWA2_WG32_8_1_WGM8_WGMXCC1_WGMXCCGn1
    SolutionIndex: 112
    SolutionNameMin: Cijk_Ailk_Bljk_HHS_BH_UserArgs_MT64x96x64_MI16x16x1_SN_LDSB1_GRVWA8_GRVWB8_GSU0_GSUC0_GSUWGMRR0_K1_LBSPPA1024_LBSPPB128_LPA32_LPB16_LRVW8_MIWT2_3_NLCA1_SU32_SUM0_SUS256_SVW2_SKXCCM0_VWA2_WG32_8_1_WGM8_WGMXCC1_WGMXCCGn1
    SolutionIndex: 113
    SolutionNameMin: Cijk_Ailk_Bljk_HHS_BH_UserArgs_MT64x96x64_MI16x16x1_SN_LDSB1_GRVWA8_GRVWB8_GSU0_GSUC0_GSUWGMRR0_K1_LBSPPA1024_LBSPPB128_LPA32_LPB16_LRVW8_MIWT2_3_NLCA1_SU32_SUM0_SUS256_SVW2_SKXCCM8_VWA2_WG32_8_1_WGM8_WGMXCC1_WGMXCCGn1
    SolutionIndex: 114
    SolutionNameMin: Cijk_Ailk_Bljk_HHS_BH_UserArgs_MT64x96x128_MI16x16x1_SN_LDSB1_GRVWA8_GRVWB8_GSU0_GSUC0_GSUWGMRR0_K1_LBSPPA1024_LBSPPB256_LPA32_LPB16_LRVW8_MIWT2_3_NLCA1_SU32_SUM0_SUS256_SVW2_SKXCCM0_VWA2_WG32_8_1_WGM8_WGMXCC1_WGMXCCGn1
    SolutionIndex: 115
    SolutionNameMin: Cijk_Ailk_Bljk_HHS_BH_UserArgs_MT64x96x128_MI16x16x1_SN_LDSB1_GRVWA8_GRVWB8_GSU0_GSUC0_GSUWGMRR0_K1_LBSPPA1024_LBSPPB256_LPA32_LPB16_LRVW8_MIWT2_3_NLCA1_SU32_SUM0_SUS256_SVW2_SKXCCM8_VWA2_WG32_8_1_WGM8_WGMXCC1_WGMXCCGn1
    SolutionIndex: 116
    SolutionNameMin: Cijk_Ailk_Bljk_HHS_BH_UserArgs_MT64x112x32_MI16x16x1_SN_LDSB0_GRVWA8_GRVWB2_GSU0_GSUC0_GSUWGMRR0_K1_LBSPPA512_LBSPPB128_LPA16_LPB4_LRVW4_MIWT1_7_NLCA1_SU32_SUM0_SUS256_SVW1_SKXCCM0_VWA1_WG64_4_1_WGM8_WGMXCC1_WGMXCCGn1
    SolutionIndex: 117
    SolutionNameMin: Cijk_Ailk_Bljk_HHS_BH_UserArgs_MT64x112x32_MI16x16x1_SN_LDSB0_GRVWA8_GRVWB2_GSU0_GSUC0_GSUWGMRR0_K1_LBSPPA512_LBSPPB128_LPA16_LPB4_LRVW4_MIWT1_7_NLCA1_SU32_SUM0_SUS256_SVW1_SKXCCM8_VWA1_WG64_4_1_WGM8_WGMXCC1_WGMXCCGn1
    SolutionIndex: 118
    SolutionNameMin: Cijk_Ailk_Bljk_HHS_BH_UserArgs_MT64x112x64_MI16x16x1_SN_LDSB1_GRVWA8_GRVWB4_GSU0_GSUC0_GSUWGMRR0_K1_LBSPPA1024_LBSPPB128_LPA16_LPB16_LRVW8_MIWT1_7_NLCA1_SU32_SUM0_SUS256_SVW1_SKXCCM0_VWA1_WG64_4_1_WGM8_WGMXCC1_WGMXCCGn1
    SolutionIndex: 119
    SolutionNameMin: Cijk_Ailk_Bljk_HHS_BH_UserArgs_MT64x112x64_MI16x16x1_SN_LDSB1_GRVWA8_GRVWB4_GSU0_GSUC0_GSUWGMRR0_K1_LBSPPA1024_LBSPPB128_LPA16_LPB16_LRVW8_MIWT1_7_NLCA1_SU32_SUM0_SUS256_SVW1_SKXCCM8_VWA1_WG64_4_1_WGM8_WGMXCC1_WGMXCCGn1
    SolutionIndex: 120
    SolutionNameMin: Cijk_Ailk_Bljk_HHS_BH_UserArgs_MT64x112x128_MI16x16x1_SN_LDSB1_GRVWA8_GRVWB8_GSU0_GSUC0_GSUWGMRR0_K1_LBSPPA1024_LBSPPB256_LPA16_LPB16_LRVW8_MIWT1_7_NLCA1_SU32_SUM0_SUS256_SVW1_SKXCCM0_VWA1_WG64_4_1_WGM8_WGMXCC1_WGMXCCGn1
    SolutionIndex: 121
    SolutionNameMin: Cijk_Ailk_Bljk_HHS_BH_UserArgs_MT64x112x128_MI16x16x1_SN_LDSB1_GRVWA8_GRVWB8_GSU0_GSUC0_GSUWGMRR0_K1_LBSPPA1024_LBSPPB256_LPA16_LPB16_LRVW8_MIWT1_7_NLCA1_SU32_SUM0_SUS256_SVW1_SKXCCM8_VWA1_WG64_4_1_WGM8_WGMXCC1_WGMXCCGn1
    SolutionIndex: 122
    SolutionNameMin: Cijk_Ailk_Bljk_HHS_BH_UserArgs_MT64x128x32_MI16x16x1_SN_LDSB0_GRVWA8_GRVWB4_GSU0_GSUC0_GSUWGMRR0_K1_LBSPPA512_LBSPPB128_LPA0_LPB4_LRVW4_MIWT4_2_NLCA1_SU32_SUM0_SUS256_SVW4_SKXCCM0_VWA4_WG16_16_1_WGM8_WGMXCC1_WGMXCCGn1
    SolutionIndex: 123
    SolutionNameMin: Cijk_Ailk_Bljk_HHS_BH_UserArgs_MT64x128x32_MI16x16x1_SN_LDSB0_GRVWA8_GRVWB4_GSU0_GSUC0_GSUWGMRR0_K1_LBSPPA512_LBSPPB128_LPA0_LPB4_LRVW4_MIWT4_2_NLCA1_SU32_SUM0_SUS256_SVW4_SKXCCM8_VWA4_WG16_16_1_WGM8_WGMXCC1_WGMXCCGn1
    SolutionIndex: 124
    SolutionNameMin: Cijk_Ailk_Bljk_HHS_BH_UserArgs_MT64x128x64_MI16x16x1_SN_LDSB1_GRVWA8_GRVWB8_GSU0_GSUC0_GSUWGMRR0_K1_LBSPPA1024_LBSPPB128_LPA0_LPB16_LRVW8_MIWT4_2_NLCA1_SU32_SUM0_SUS256_SVW4_SKXCCM0_VWA4_WG16_16_1_WGM8_WGMXCC1_WGMXCCGn1
    SolutionIndex: 125
    SolutionNameMin: Cijk_Ailk_Bljk_HHS_BH_UserArgs_MT64x128x64_MI16x16x1_SN_LDSB1_GRVWA8_GRVWB8_GSU0_GSUC0_GSUWGMRR0_K1_LBSPPA1024_LBSPPB128_LPA0_LPB16_LRVW8_MIWT4_2_NLCA1_SU32_SUM0_SUS256_SVW4_SKXCCM8_VWA4_WG16_16_1_WGM8_WGMXCC1_WGMXCCGn1
    SolutionIndex: 126
    SolutionNameMin: Cijk_Ailk_Bljk_HHS_BH_UserArgs_MT64x128x128_MI16x16x1_SN_LDSB1_GRVWA8_GRVWB8_GSU0_GSUC0_GSUWGMRR0_K1_LBSPPA1024_LBSPPB256_LPA0_LPB16_LRVW8_MIWT4_2_NLCA1_SU32_SUM0_SUS256_SVW4_SKXCCM0_VWA4_WG16_16_1_WGM8_WGMXCC1_WGMXCCGn1
    SolutionIndex: 127
    SolutionNameMin: Cijk_Ailk_Bljk_HHS_BH_UserArgs_MT64x128x128_MI16x16x1_SN_LDSB1_GRVWA8_GRVWB8_GSU0_GSUC0_GSUWGMRR0_K1_LBSPPA1024_LBSPPB256_LPA0_LPB16_LRVW8_MIWT4_2_NLCA1_SU32_SUM0_SUS256_SVW4_SKXCCM8_VWA4_WG16_16_1_WGM8_WGMXCC1_WGMXCCGn1
    SolutionIndex: 128
    SolutionNameMin: Cijk_Ailk_Bljk_HHS_BH_UserArgs_MT64x144x64_MI16x16x1_SN_LDSB1_GRVWA8_GRVWB4_GSU0_GSUC0_GSUWGMRR0_K1_LBSPPA1024_LBSPPB128_LPA16_LPB16_LRVW8_MIWT1_9_NLCA1_SU32_SUM0_SUS256_SVW1_SKXCCM0_VWA1_WG64_4_1_WGM8_WGMXCC1_WGMXCCGn1
    SolutionIndex: 129
    SolutionNameMin: Cijk_Ailk_Bljk_HHS_BH_UserArgs_MT64x144x64_MI16x16x1_SN_LDSB1_GRVWA8_GRVWB4_GSU0_GSUC0_GSUWGMRR0_K1_LBSPPA1024_LBSPPB128_LPA16_LPB16_LRVW8_MIWT1_9_NLCA1_SU32_SUM0_SUS256_SVW1_SKXCCM8_VWA1_WG64_4_1_WGM8_WGMXCC1_WGMXCCGn1
    SolutionIndex: 130
    SolutionNameMin: Cijk_Ailk_Bljk_HHS_BH_UserArgs_MT64x144x128_MI16x16x1_SN_LDSB1_GRVWA8_GRVWB8_GSU0_GSUC0_GSUWGMRR0_K1_LBSPPA1024_LBSPPB256_LPA16_LPB16_LRVW8_MIWT1_9_NLCA1_SU32_SUM0_SUS256_SVW1_SKXCCM0_VWA1_WG64_4_1_WGM8_WGMXCC1_WGMXCCGn1
    SolutionIndex: 131
    SolutionNameMin: Cijk_Ailk_Bljk_HHS_BH_UserArgs_MT64x144x128_MI16x16x1_SN_LDSB1_GRVWA8_GRVWB8_GSU0_GSUC0_GSUWGMRR0_K1_LBSPPA1024_LBSPPB256_LPA16_LPB16_LRVW8_MIWT1_9_NLCA1_SU32_SUM0_SUS256_SVW1_SKXCCM8_VWA1_WG64_4_1_WGM8_WGMXCC1_WGMXCCGn1
    SolutionIndex: 132
    SolutionNameMin: Cijk_Ailk_Bljk_HHS_BH_UserArgs_MT64x160x32_MI16x16x1_SN_LDSB0_GRVWA8_GRVWB4_GSU0_GSUC0_GSUWGMRR0_K1_LBSPPA512_LBSPPB128_LPA32_LPB4_LRVW4_MIWT2_5_NLCA1_SU32_SUM0_SUS256_SVW2_SKXCCM0_VWA2_WG32_8_1_WGM8_WGMXCC1_WGMXCCGn1
    SolutionIndex: 133
    SolutionNameMin: Cijk_Ailk_Bljk_HHS_BH_UserArgs_MT64x160x32_MI16x16x1_SN_LDSB0_GRVWA8_GRVWB4_GSU0_GSUC0_GSUWGMRR0_K1_LBSPPA512_LBSPPB128_LPA32_LPB4_LRVW4_MIWT2_5_NLCA1_SU32_SUM0_SUS256_SVW2_SKXCCM8_VWA2_WG32_8_1_WGM8_WGMXCC1_WGMXCCGn1
    SolutionIndex: 134
    SolutionNameMin: Cijk_Ailk_Bljk_HHS_BH_UserArgs_MT64x160x64_MI16x16x1_SN_LDSB1_GRVWA8_GRVWB8_GSU0_GSUC0_GSUWGMRR0_K1_LBSPPA1024_LBSPPB128_LPA32_LPB16_LRVW8_MIWT2_5_NLCA1_SU32_SUM0_SUS256_SVW2_SKXCCM0_VWA2_WG32_8_1_WGM8_WGMXCC1_WGMXCCGn1
    SolutionIndex: 135
    SolutionNameMin: Cijk_Ailk_Bljk_HHS_BH_UserArgs_MT64x160x64_MI16x16x1_SN_LDSB1_GRVWA8_GRVWB8_GSU0_GSUC0_GSUWGMRR0_K1_LBSPPA1024_LBSPPB128_LPA32_LPB16_LRVW8_MIWT2_5_NLCA1_SU32_SUM0_SUS256_SVW2_SKXCCM8_VWA2_WG32_8_1_WGM8_WGMXCC1_WGMXCCGn1
    SolutionIndex: 136
    SolutionNameMin: Cijk_Ailk_Bljk_HHS_BH_UserArgs_MT64x160x128_MI16x16x1_SN_LDSB1_GRVWA8_GRVWB4_GSU0_GSUC0_GSUWGMRR0_K1_LBSPPA512_LBSPPB256_LPA32_LPB4_LRVW4_MIWT2_5_NLCA1_SU32_SUM0_SUS256_SVW2_SKXCCM0_VWA2_WG32_8_1_WGM8_WGMXCC1_WGMXCCGn1
    SolutionIndex: 137
    SolutionNameMin: Cijk_Ailk_Bljk_HHS_BH_UserArgs_MT64x160x128_MI16x16x1_SN_LDSB1_GRVWA8_GRVWB4_GSU0_GSUC0_GSUWGMRR0_K1_LBSPPA512_LBSPPB256_LPA32_LPB4_LRVW4_MIWT2_5_NLCA1_SU32_SUM0_SUS256_SVW2_SKXCCM8_VWA2_WG32_8_1_WGM8_WGMXCC1_WGMXCCGn1
    SolutionIndex: 138
    SolutionNameMin: Cijk_Ailk_Bljk_HHS_BH_UserArgs_MT64x176x32_MI16x16x1_SN_LDSB0_GRVWA8_GRVWB2_GSU0_GSUC0_GSUWGMRR0_K1_LBSPPA512_LBSPPB128_LPA16_LPB4_LRVW4_MIWT1_11_NLCA1_SU32_SUM0_SUS256_SVW1_SKXCCM0_VWA1_WG64_4_1_WGM8_WGMXCC1_WGMXCCGn1
    SolutionIndex: 139
    SolutionNameMin: Cijk_Ailk_Bljk_HHS_BH_UserArgs_MT64x176x32_MI16x16x1_SN_LDSB0_GRVWA8_GRVWB2_GSU0_GSUC0_GSUWGMRR0_K1_LBSPPA512_LBSPPB128_LPA16_LPB4_LRVW4_MIWT1_11_NLCA1_SU32_SUM0_SUS256_SVW1_SKXCCM8_VWA1_WG64_4_1_WGM8_WGMXCC1_WGMXCCGn1
    SolutionIndex: 140
    SolutionNameMin: Cijk_Ailk_Bljk_HHS_BH_UserArgs_MT64x176x64_MI16x16x1_SN_LDSB1_GRVWA8_GRVWB4_GSU0_GSUC0_GSUWGMRR0_K1_LBSPPA1024_LBSPPB128_LPA16_LPB16_LRVW8_MIWT1_11_NLCA1_SU32_SUM0_SUS256_SVW1_SKXCCM0_VWA1_WG64_4_1_WGM8_WGMXCC1_WGMXCCGn1
    SolutionIndex: 141
    SolutionNameMin: Cijk_Ailk_Bljk_HHS_BH_UserArgs_MT64x176x64_MI16x16x1_SN_LDSB1_GRVWA8_GRVWB4_GSU0_GSUC0_GSUWGMRR0_K1_LBSPPA1024_LBSPPB128_LPA16_LPB16_LRVW8_MIWT1_11_NLCA1_SU32_SUM0_SUS256_SVW1_SKXCCM8_VWA1_WG64_4_1_WGM8_WGMXCC1_WGMXCCGn1
    SolutionIndex: 142
    SolutionNameMin: Cijk_Ailk_Bljk_HHS_BH_UserArgs_MT64x192x32_MI16x16x1_SN_LDSB1_GRVWA8_GRVWB4_GSU0_GSUC0_GSUWGMRR0_K1_LBSPPA512_LBSPPB128_LPA32_LPB4_LRVW4_MIWT2_6_NLCA1_SU32_SUM0_SUS256_SVW2_SKXCCM0_VWA2_WG32_8_1_WGM8_WGMXCC1_WGMXCCGn1
    SolutionIndex: 143
    SolutionNameMin: Cijk_Ailk_Bljk_HHS_BH_UserArgs_MT64x192x32_MI16x16x1_SN_LDSB1_GRVWA8_GRVWB4_GSU0_GSUC0_GSUWGMRR0_K1_LBSPPA512_LBSPPB128_LPA32_LPB4_LRVW4_MIWT2_6_NLCA1_SU32_SUM0_SUS256_SVW2_SKXCCM8_VWA2_WG32_8_1_WGM8_WGMXCC1_WGMXCCGn1
    SolutionIndex: 144
    SolutionNameMin: Cijk_Ailk_Bljk_HHS_BH_UserArgs_MT64x192x64_MI16x16x1_SN_LDSB1_GRVWA8_GRVWB8_GSU0_GSUC0_GSUWGMRR0_K1_LBSPPA1024_LBSPPB128_LPA32_LPB16_LRVW8_MIWT2_6_NLCA1_SU32_SUM0_SUS256_SVW2_SKXCCM0_VWA2_WG32_8_1_WGM8_WGMXCC1_WGMXCCGn1
    SolutionIndex: 145
    SolutionNameMin: Cijk_Ailk_Bljk_HHS_BH_UserArgs_MT64x192x64_MI16x16x1_SN_LDSB1_GRVWA8_GRVWB8_GSU0_GSUC0_GSUWGMRR0_K1_LBSPPA1024_LBSPPB128_LPA32_LPB16_LRVW8_MIWT2_6_NLCA1_SU32_SUM0_SUS256_SVW2_SKXCCM8_VWA2_WG32_8_1_WGM8_WGMXCC1_WGMXCCGn1
    SolutionIndex: 146
    SolutionNameMin: Cijk_Ailk_Bljk_HHS_BH_UserArgs_MT64x208x32_MI16x16x1_SN_LDSB1_GRVWA8_GRVWB2_GSU0_GSUC0_GSUWGMRR0_K1_LBSPPA512_LBSPPB128_LPA16_LPB4_LRVW4_MIWT1_13_NLCA1_SU32_SUM0_SUS256_SVW1_SKXCCM0_VWA1_WG64_4_1_WGM8_WGMXCC1_WGMXCCGn1
    SolutionIndex: 147
    SolutionNameMin: Cijk_Ailk_Bljk_HHS_BH_UserArgs_MT64x208x32_MI16x16x1_SN_LDSB1_GRVWA8_GRVWB2_GSU0_GSUC0_GSUWGMRR0_K1_LBSPPA512_LBSPPB128_LPA16_LPB4_LRVW4_MIWT1_13_NLCA1_SU32_SUM0_SUS256_SVW1_SKXCCM8_VWA1_WG64_4_1_WGM8_WGMXCC1_WGMXCCGn1
    SolutionIndex: 148
    SolutionNameMin: Cijk_Ailk_Bljk_HHS_BH_UserArgs_MT64x208x64_MI16x16x1_SN_LDSB1_GRVWA8_GRVWB4_GSU0_GSUC0_GSUWGMRR0_K1_LBSPPA1024_LBSPPB128_LPA16_LPB16_LRVW8_MIWT1_13_NLCA1_SU32_SUM0_SUS256_SVW1_SKXCCM0_VWA1_WG64_4_1_WGM8_WGMXCC1_WGMXCCGn1
    SolutionIndex: 149
    SolutionNameMin: Cijk_Ailk_Bljk_HHS_BH_UserArgs_MT64x208x64_MI16x16x1_SN_LDSB1_GRVWA8_GRVWB4_GSU0_GSUC0_GSUWGMRR0_K1_LBSPPA1024_LBSPPB128_LPA16_LPB16_LRVW8_MIWT1_13_NLCA1_SU32_SUM0_SUS256_SVW1_SKXCCM8_VWA1_WG64_4_1_WGM8_WGMXCC1_WGMXCCGn1
    SolutionIndex: 150
    SolutionNameMin: Cijk_Ailk_Bljk_HHS_BH_UserArgs_MT64x224x32_MI16x16x1_SN_LDSB1_GRVWA8_GRVWB4_GSU0_GSUC0_GSUWGMRR0_K1_LBSPPA512_LBSPPB128_LPA32_LPB4_LRVW4_MIWT2_7_NLCA1_SU32_SUM0_SUS256_SVW2_SKXCCM0_VWA2_WG32_8_1_WGM8_WGMXCC1_WGMXCCGn1
    SolutionIndex: 151
    SolutionNameMin: Cijk_Ailk_Bljk_HHS_BH_UserArgs_MT64x224x32_MI16x16x1_SN_LDSB1_GRVWA8_GRVWB4_GSU0_GSUC0_GSUWGMRR0_K1_LBSPPA512_LBSPPB128_LPA32_LPB4_LRVW4_MIWT2_7_NLCA1_SU32_SUM0_SUS256_SVW2_SKXCCM8_VWA2_WG32_8_1_WGM8_WGMXCC1_WGMXCCGn1
    SolutionIndex: 152
    SolutionNameMin: Cijk_Ailk_Bljk_HHS_BH_UserArgs_MT64x224x64_MI16x16x1_SN_LDSB1_GRVWA8_GRVWB8_GSU0_GSUC0_GSUWGMRR0_K1_LBSPPA1024_LBSPPB128_LPA32_LPB16_LRVW8_MIWT2_7_NLCA1_SU32_SUM0_SUS256_SVW2_SKXCCM0_VWA2_WG32_8_1_WGM8_WGMXCC1_WGMXCCGn1
    SolutionIndex: 153
    SolutionNameMin: Cijk_Ailk_Bljk_HHS_BH_UserArgs_MT64x224x64_MI16x16x1_SN_LDSB1_GRVWA8_GRVWB8_GSU0_GSUC0_GSUWGMRR0_K1_LBSPPA1024_LBSPPB128_LPA32_LPB16_LRVW8_MIWT2_7_NLCA1_SU32_SUM0_SUS256_SVW2_SKXCCM8_VWA2_WG32_8_1_WGM8_WGMXCC1_WGMXCCGn1
    SolutionIndex: 154
    SolutionNameMin: Cijk_Ailk_Bljk_HHS_BH_UserArgs_MT64x240x32_MI16x16x1_SN_LDSB1_GRVWA8_GRVWB2_GSU0_GSUC0_GSUWGMRR0_K1_LBSPPA512_LBSPPB128_LPA16_LPB4_LRVW4_MIWT1_15_NLCA1_SU32_SUM0_SUS256_SVW1_SKXCCM0_VWA1_WG64_4_1_WGM8_WGMXCC1_WGMXCCGn1
    SolutionIndex: 155
    SolutionNameMin: Cijk_Ailk_Bljk_HHS_BH_UserArgs_MT64x240x32_MI16x16x1_SN_LDSB1_GRVWA8_GRVWB2_GSU0_GSUC0_GSUWGMRR0_K1_LBSPPA512_LBSPPB128_LPA16_LPB4_LRVW4_MIWT1_15_NLCA1_SU32_SUM0_SUS256_SVW1_SKXCCM8_VWA1_WG64_4_1_WGM8_WGMXCC1_WGMXCCGn1
    SolutionIndex: 156
    SolutionNameMin: Cijk_Ailk_Bljk_HHS_BH_UserArgs_MT64x240x64_MI16x16x1_SN_LDSB1_GRVWA8_GRVWB4_GSU0_GSUC0_GSUWGMRR0_K1_LBSPPA1024_LBSPPB128_LPA16_LPB16_LRVW8_MIWT1_15_NLCA1_SU32_SUM0_SUS256_SVW1_SKXCCM0_VWA1_WG64_4_1_WGM8_WGMXCC1_WGMXCCGn1
    SolutionIndex: 157
    SolutionNameMin: Cijk_Ailk_Bljk_HHS_BH_UserArgs_MT64x240x64_MI16x16x1_SN_LDSB1_GRVWA8_GRVWB4_GSU0_GSUC0_GSUWGMRR0_K1_LBSPPA1024_LBSPPB128_LPA16_LPB16_LRVW8_MIWT1_15_NLCA1_SU32_SUM0_SUS256_SVW1_SKXCCM8_VWA1_WG64_4_1_WGM8_WGMXCC1_WGMXCCGn1
    SolutionIndex: 158
    SolutionNameMin: Cijk_Ailk_Bljk_HHS_BH_UserArgs_MT64x256x32_MI16x16x1_SN_LDSB1_GRVWA8_GRVWB4_GSU0_GSUC0_GSUWGMRR0_K1_LBSPPA512_LBSPPB128_LPA0_LPB4_LRVW4_MIWT4_4_NLCA1_SU32_SUM0_SUS256_SVW4_SKXCCM0_VWA4_WG16_16_1_WGM8_WGMXCC1_WGMXCCGn1
    SolutionIndex: 159
    SolutionNameMin: Cijk_Ailk_Bljk_HHS_BH_UserArgs_MT64x256x32_MI16x16x1_SN_LDSB1_GRVWA8_GRVWB4_GSU0_GSUC0_GSUWGMRR0_K1_LBSPPA512_LBSPPB128_LPA0_LPB4_LRVW4_MIWT4_4_NLCA1_SU32_SUM0_SUS256_SVW4_SKXCCM8_VWA4_WG16_16_1_WGM8_WGMXCC1_WGMXCCGn1
    SolutionIndex: 160
    SolutionNameMin: Cijk_Ailk_Bljk_HHS_BH_UserArgs_MT64x256x64_MI16x16x1_SN_LDSB1_GRVWA8_GRVWB8_GSU0_GSUC0_GSUWGMRR0_K1_LBSPPA1024_LBSPPB128_LPA0_LPB16_LRVW8_MIWT4_4_NLCA1_SU32_SUM0_SUS256_SVW4_SKXCCM0_VWA4_WG16_16_1_WGM8_WGMXCC1_WGMXCCGn1
    SolutionIndex: 161
    SolutionNameMin: Cijk_Ailk_Bljk_HHS_BH_UserArgs_MT64x256x64_MI16x16x1_SN_LDSB1_GRVWA8_GRVWB8_GSU0_GSUC0_GSUWGMRR0_K1_LBSPPA1024_LBSPPB128_LPA0_LPB16_LRVW8_MIWT4_4_NLCA1_SU32_SUM0_SUS256_SVW4_SKXCCM8_VWA4_WG16_16_1_WGM8_WGMXCC1_WGMXCCGn1
    SolutionIndex: 162
    SolutionNameMin: Cijk_Ailk_Bljk_HHS_BH_UserArgs_MT80x64x32_MI16x16x1_SN_LDSB0_GRVWA2_GRVWB4_GSU0_GSUC0_GSUWGMRR0_K1_LBSPPA640_LBSPPB128_LPA16_LPB4_LRVW4_MIWT5_1_NLCA5_SU32_SUM0_SUS256_SVW1_SKXCCM0_VWA1_WG16_16_1_WGM8_WGMXCC1_WGMXCCGn1
    SolutionIndex: 163
    SolutionNameMin: Cijk_Ailk_Bljk_HHS_BH_UserArgs_MT80x64x32_MI16x16x1_SN_LDSB0_GRVWA2_GRVWB4_GSU0_GSUC0_GSUWGMRR0_K1_LBSPPA640_LBSPPB128_LPA16_LPB4_LRVW4_MIWT5_1_NLCA5_SU32_SUM0_SUS256_SVW1_SKXCCM8_VWA1_WG16_16_1_WGM8_WGMXCC1_WGMXCCGn1
    SolutionIndex: 164
    SolutionNameMin: Cijk_Ailk_Bljk_HHS_BH_UserArgs_MT80x64x64_MI16x16x1_SN_LDSB1_GRVWA4_GRVWB8_GSU0_GSUC0_GSUWGMRR0_K1_LBSPPA1280_LBSPPB128_LPA16_LPB16_LRVW8_MIWT5_1_NLCA5_SU32_SUM0_SUS256_SVW1_SKXCCM0_VWA1_WG16_16_1_WGM8_WGMXCC1_WGMXCCGn1
    SolutionIndex: 165
    SolutionNameMin: Cijk_Ailk_Bljk_HHS_BH_UserArgs_MT80x64x64_MI16x16x1_SN_LDSB1_GRVWA4_GRVWB8_GSU0_GSUC0_GSUWGMRR0_K1_LBSPPA1280_LBSPPB128_LPA16_LPB16_LRVW8_MIWT5_1_NLCA5_SU32_SUM0_SUS256_SVW1_SKXCCM8_VWA1_WG16_16_1_WGM8_WGMXCC1_WGMXCCGn1
    SolutionIndex: 166
    SolutionNameMin: Cijk_Ailk_Bljk_HHS_BH_UserArgs_MT80x64x128_MI16x16x1_SN_LDSB1_GRVWA8_GRVWB8_GSU0_GSUC0_GSUWGMRR0_K1_LBSPPA1280_LBSPPB256_LPA16_LPB16_LRVW8_MIWT5_1_NLCA5_SU32_SUM0_SUS256_SVW1_SKXCCM0_VWA1_WG16_16_1_WGM1_WGMXCC1_WGMXCCGn1
    SolutionIndex: 167
    SolutionNameMin: Cijk_Ailk_Bljk_HHS_BH_UserArgs_MT80x64x128_MI16x16x1_SN_LDSB1_GRVWA8_GRVWB8_GSU0_GSUC0_GSUWGMRR0_K1_LBSPPA1280_LBSPPB256_LPA16_LPB16_LRVW8_MIWT5_1_NLCA5_SU32_SUM0_SUS256_SVW1_SKXCCM8_VWA1_WG16_16_1_WGM1_WGMXCC1_WGMXCCGn1
    SolutionIndex: 168
    SolutionNameMin: Cijk_Ailk_Bljk_HHS_BH_UserArgs_MT80x128x32_MI16x16x1_SN_LDSB0_GRVWA2_GRVWB4_GSU0_GSUC0_GSUWGMRR0_K1_LBSPPA640_LBSPPB128_LPA16_LPB4_LRVW4_MIWT5_2_NLCA5_SU32_SUM0_SUS256_SVW1_SKXCCM0_VWA1_WG16_16_1_WGM8_WGMXCC1_WGMXCCGn1
    SolutionIndex: 169
    SolutionNameMin: Cijk_Ailk_Bljk_HHS_BH_UserArgs_MT80x128x32_MI16x16x1_SN_LDSB0_GRVWA2_GRVWB4_GSU0_GSUC0_GSUWGMRR0_K1_LBSPPA640_LBSPPB128_LPA16_LPB4_LRVW4_MIWT5_2_NLCA5_SU32_SUM0_SUS256_SVW1_SKXCCM8_VWA1_WG16_16_1_WGM8_WGMXCC1_WGMXCCGn1
    SolutionIndex: 170
    SolutionNameMin: Cijk_Ailk_Bljk_HHS_BH_UserArgs_MT80x128x64_MI16x16x1_SN_LDSB1_GRVWA4_GRVWB8_GSU0_GSUC0_GSUWGMRR0_K1_LBSPPA1280_LBSPPB128_LPA16_LPB16_LRVW8_MIWT5_2_NLCA5_SU32_SUM0_SUS256_SVW1_SKXCCM0_VWA1_WG16_16_1_WGM8_WGMXCC1_WGMXCCGn1
    SolutionIndex: 171
    SolutionNameMin: Cijk_Ailk_Bljk_HHS_BH_UserArgs_MT80x128x64_MI16x16x1_SN_LDSB1_GRVWA4_GRVWB8_GSU0_GSUC0_GSUWGMRR0_K1_LBSPPA1280_LBSPPB128_LPA16_LPB16_LRVW8_MIWT5_2_NLCA5_SU32_SUM0_SUS256_SVW1_SKXCCM8_VWA1_WG16_16_1_WGM8_WGMXCC1_WGMXCCGn1
    SolutionIndex: 172
    SolutionNameMin: Cijk_Ailk_Bljk_HHS_BH_UserArgs_MT80x192x32_MI16x16x1_SN_LDSB1_GRVWA2_GRVWB4_GSU0_GSUC0_GSUWGMRR0_K1_LBSPPA640_LBSPPB128_LPA16_LPB4_LRVW4_MIWT5_3_NLCA5_SU32_SUM0_SUS256_SVW1_SKXCCM0_VWA1_WG16_16_1_WGM8_WGMXCC1_WGMXCCGn1
    SolutionIndex: 173
    SolutionNameMin: Cijk_Ailk_Bljk_HHS_BH_UserArgs_MT80x192x32_MI16x16x1_SN_LDSB1_GRVWA2_GRVWB4_GSU0_GSUC0_GSUWGMRR0_K1_LBSPPA640_LBSPPB128_LPA16_LPB4_LRVW4_MIWT5_3_NLCA5_SU32_SUM0_SUS256_SVW1_SKXCCM8_VWA1_WG16_16_1_WGM8_WGMXCC1_WGMXCCGn1
    SolutionIndex: 174
    SolutionNameMin: Cijk_Ailk_Bljk_HHS_BH_UserArgs_MT80x192x64_MI16x16x1_SN_LDSB1_GRVWA4_GRVWB8_GSU0_GSUC0_GSUWGMRR0_K1_LBSPPA1280_LBSPPB128_LPA16_LPB16_LRVW8_MIWT5_3_NLCA5_SU32_SUM0_SUS256_SVW1_SKXCCM0_VWA1_WG16_16_1_WGM8_WGMXCC1_WGMXCCGn1
    SolutionIndex: 175
    SolutionNameMin: Cijk_Ailk_Bljk_HHS_BH_UserArgs_MT80x192x64_MI16x16x1_SN_LDSB1_GRVWA4_GRVWB8_GSU0_GSUC0_GSUWGMRR0_K1_LBSPPA1280_LBSPPB128_LPA16_LPB16_LRVW8_MIWT5_3_NLCA5_SU32_SUM0_SUS256_SVW1_SKXCCM8_VWA1_WG16_16_1_WGM8_WGMXCC1_WGMXCCGn1
    SolutionIndex: 176
    SolutionNameMin: Cijk_Ailk_Bljk_HHS_BH_UserArgs_MT80x256x32_MI16x16x1_SN_LDSB1_GRVWA2_GRVWB4_GSU0_GSUC0_GSUWGMRR0_K1_LBSPPA640_LBSPPB128_LPA16_LPB4_LRVW4_MIWT5_4_NLCA5_SU32_SUM0_SUS256_SVW1_SKXCCM0_VWA1_WG16_16_1_WGM8_WGMXCC1_WGMXCCGn1
    SolutionIndex: 177
    SolutionNameMin: Cijk_Ailk_Bljk_HHS_BH_UserArgs_MT80x256x32_MI16x16x1_SN_LDSB1_GRVWA2_GRVWB4_GSU0_GSUC0_GSUWGMRR0_K1_LBSPPA640_LBSPPB128_LPA16_LPB4_LRVW4_MIWT5_4_NLCA5_SU32_SUM0_SUS256_SVW1_SKXCCM8_VWA1_WG16_16_1_WGM8_WGMXCC1_WGMXCCGn1
    SolutionIndex: 178
    SolutionNameMin: Cijk_Ailk_Bljk_HHS_BH_UserArgs_MT80x256x64_MI16x16x1_SN_LDSB1_GRVWA4_GRVWB8_GSU0_GSUC0_GSUWGMRR0_K1_LBSPPA1280_LBSPPB128_LPA16_LPB16_LRVW8_MIWT5_4_NLCA5_SU32_SUM0_SUS256_SVW1_SKXCCM0_VWA1_WG16_16_1_WGM8_WGMXCC1_WGMXCCGn1
    SolutionIndex: 179
    SolutionNameMin: Cijk_Ailk_Bljk_HHS_BH_UserArgs_MT80x256x64_MI16x16x1_SN_LDSB1_GRVWA4_GRVWB8_GSU0_GSUC0_GSUWGMRR0_K1_LBSPPA1280_LBSPPB128_LPA16_LPB16_LRVW8_MIWT5_4_NLCA5_SU32_SUM0_SUS256_SVW1_SKXCCM8_VWA1_WG16_16_1_WGM8_WGMXCC1_WGMXCCGn1
    SolutionIndex: 180
    SolutionNameMin: Cijk_Ailk_Bljk_HHS_BH_UserArgs_MT96x32x32_MI16x16x1_SN_LDSB0_GRVWA4_GRVWB4_GSU0_GSUC0_GSUWGMRR0_K1_LBSPPA768_LBSPPB128_LPA16_LPB4_LRVW4_MIWT3_1_NLCA3_SU32_SUM0_SUS256_SVW1_SKXCCM0_VWA1_WG32_8_1_WGM8_WGMXCC1_WGMXCCGn1
    SolutionIndex: 181
    SolutionNameMin: Cijk_Ailk_Bljk_HHS_BH_UserArgs_MT96x32x32_MI16x16x1_SN_LDSB0_GRVWA4_GRVWB4_GSU0_GSUC0_GSUWGMRR0_K1_LBSPPA768_LBSPPB128_LPA16_LPB4_LRVW4_MIWT3_1_NLCA3_SU32_SUM0_SUS256_SVW1_SKXCCM8_VWA1_WG32_8_1_WGM8_WGMXCC1_WGMXCCGn1
    SolutionIndex: 182
    SolutionNameMin: Cijk_Ailk_Bljk_HHS_BH_UserArgs_MT96x32x64_MI16x16x1_SN_LDSB1_GRVWA8_GRVWB8_GSU0_GSUC0_GSUWGMRR0_K1_LBSPPA1536_LBSPPB128_LPA16_LPB16_LRVW8_MIWT3_1_NLCA3_SU32_SUM0_SUS256_SVW1_SKXCCM0_VWA1_WG32_8_1_WGM8_WGMXCC1_WGMXCCGn1
    SolutionIndex: 183
    SolutionNameMin: Cijk_Ailk_Bljk_HHS_BH_UserArgs_MT96x32x64_MI16x16x1_SN_LDSB1_GRVWA8_GRVWB8_GSU0_GSUC0_GSUWGMRR0_K1_LBSPPA1536_LBSPPB128_LPA16_LPB16_LRVW8_MIWT3_1_NLCA3_SU32_SUM0_SUS256_SVW1_SKXCCM8_VWA1_WG32_8_1_WGM8_WGMXCC1_WGMXCCGn1
    SolutionIndex: 184
    SolutionNameMin: Cijk_Ailk_Bljk_HHS_BH_UserArgs_MT96x32x128_MI16x16x1_SN_LDSB1_GRVWA8_GRVWB8_GSU0_GSUC0_GSUWGMRR0_K1_LBSPPA1536_LBSPPB256_LPA16_LPB16_LRVW8_MIWT3_1_NLCA3_SU32_SUM0_SUS256_SVW1_SKXCCM0_VWA1_WG32_8_1_WGM8_WGMXCC1_WGMXCCGn1
    SolutionIndex: 185
    SolutionNameMin: Cijk_Ailk_Bljk_HHS_BH_UserArgs_MT96x32x128_MI16x16x1_SN_LDSB1_GRVWA8_GRVWB8_GSU0_GSUC0_GSUWGMRR0_K1_LBSPPA1536_LBSPPB256_LPA16_LPB16_LRVW8_MIWT3_1_NLCA3_SU32_SUM0_SUS256_SVW1_SKXCCM8_VWA1_WG32_8_1_WGM8_WGMXCC1_WGMXCCGn1
    SolutionIndex: 186
    SolutionNameMin: Cijk_Ailk_Bljk_HHS_BH_UserArgs_MT96x64x32_MI16x16x1_SN_LDSB0_GRVWA4_GRVWB4_GSU0_GSUC0_GSUWGMRR0_K1_LBSPPA768_LBSPPB128_LPA32_LPB4_LRVW4_MIWT6_1_NLCA3_SU32_SUM0_SUS256_SVW2_SKXCCM0_VWA2_WG16_16_1_WGM8_WGMXCC1_WGMXCCGn1
    SolutionIndex: 187
    SolutionNameMin: Cijk_Ailk_Bljk_HHS_BH_UserArgs_MT96x64x32_MI16x16x1_SN_LDSB0_GRVWA4_GRVWB4_GSU0_GSUC0_GSUWGMRR0_K1_LBSPPA768_LBSPPB128_LPA32_LPB4_LRVW4_MIWT6_1_NLCA3_SU32_SUM0_SUS256_SVW2_SKXCCM8_VWA2_WG16_16_1_WGM8_WGMXCC1_WGMXCCGn1
    SolutionIndex: 188
    SolutionNameMin: Cijk_Ailk_Bljk_HHS_BH_UserArgs_MT96x64x64_MI16x16x1_SN_LDSB1_GRVWA8_GRVWB8_GSU0_GSUC0_GSUWGMRR0_K1_LBSPPA1536_LBSPPB128_LPA32_LPB16_LRVW8_MIWT6_1_NLCA3_SU32_SUM0_SUS256_SVW2_SKXCCM0_VWA2_WG16_16_1_WGM8_WGMXCC1_WGMXCCGn1
    SolutionIndex: 189
    SolutionNameMin: Cijk_Ailk_Bljk_HHS_BH_UserArgs_MT96x64x64_MI16x16x1_SN_LDSB1_GRVWA8_GRVWB8_GSU0_GSUC0_GSUWGMRR0_K1_LBSPPA1536_LBSPPB128_LPA32_LPB16_LRVW8_MIWT6_1_NLCA3_SU32_SUM0_SUS256_SVW2_SKXCCM8_VWA2_WG16_16_1_WGM8_WGMXCC1_WGMXCCGn1
    SolutionIndex: 190
    SolutionNameMin: Cijk_Ailk_Bljk_HHS_BH_UserArgs_MT96x64x128_MI16x16x1_SN_LDSB1_GRVWA8_GRVWB8_GSU0_GSUC0_GSUWGMRR0_K1_LBSPPA1536_LBSPPB256_LPA32_LPB16_LRVW8_MIWT6_1_NLCA3_SU32_SUM0_SUS256_SVW2_SKXCCM0_VWA2_WG16_16_1_WGM8_WGMXCC1_WGMXCCGn1
    SolutionIndex: 191
    SolutionNameMin: Cijk_Ailk_Bljk_HHS_BH_UserArgs_MT96x64x128_MI16x16x1_SN_LDSB1_GRVWA8_GRVWB8_GSU0_GSUC0_GSUWGMRR0_K1_LBSPPA1536_LBSPPB256_LPA32_LPB16_LRVW8_MIWT6_1_NLCA3_SU32_SUM0_SUS256_SVW2_SKXCCM8_VWA2_WG16_16_1_WGM8_WGMXCC1_WGMXCCGn1
    SolutionIndex: 192
    SolutionNameMin: Cijk_Ailk_Bljk_HHS_BH_UserArgs_MT96x96x32_MI16x16x1_SN_LDSB0_GRVWA4_GRVWB4_GSU0_GSUC0_GSUWGMRR0_K1_LBSPPA768_LBSPPB128_LPA16_LPB4_LRVW4_MIWT3_3_NLCA3_SU32_SUM0_SUS256_SVW1_SKXCCM0_VWA1_WG32_8_1_WGM1_WGMXCC1_WGMXCCGn1
    SolutionIndex: 193
    SolutionNameMin: Cijk_Ailk_Bljk_HHS_BH_UserArgs_MT96x96x32_MI16x16x1_SN_LDSB0_GRVWA4_GRVWB4_GSU0_GSUC0_GSUWGMRR0_K1_LBSPPA768_LBSPPB128_LPA16_LPB4_LRVW4_MIWT3_3_NLCA3_SU32_SUM0_SUS256_SVW1_SKXCCM8_VWA1_WG32_8_1_WGM1_WGMXCC1_WGMXCCGn1
    SolutionIndex: 194
    SolutionNameMin: Cijk_Ailk_Bljk_HHS_BH_UserArgs_MT96x96x64_MI16x16x1_SN_LDSB1_GRVWA8_GRVWB8_GSU0_GSUC0_GSUWGMRR0_K1_LBSPPA1536_LBSPPB128_LPA16_LPB16_LRVW8_MIWT3_3_NLCA3_SU32_SUM0_SUS256_SVW1_SKXCCM0_VWA1_WG32_8_1_WGM8_WGMXCC1_WGMXCCGn1
    SolutionIndex: 195
    SolutionNameMin: Cijk_Ailk_Bljk_HHS_BH_UserArgs_MT96x96x64_MI16x16x1_SN_LDSB1_GRVWA8_GRVWB8_GSU0_GSUC0_GSUWGMRR0_K1_LBSPPA1536_LBSPPB128_LPA16_LPB16_LRVW8_MIWT3_3_NLCA3_SU32_SUM0_SUS256_SVW1_SKXCCM8_VWA1_WG32_8_1_WGM8_WGMXCC1_WGMXCCGn1
    SolutionIndex: 196
    SolutionNameMin: Cijk_Ailk_Bljk_HHS_BH_UserArgs_MT96x96x128_MI16x16x1_SN_LDSB1_GRVWA8_GRVWB8_GSU0_GSUC0_GSUWGMRR0_K1_LBSPPA1536_LBSPPB256_LPA16_LPB16_LRVW8_MIWT3_3_NLCA3_SU32_SUM0_SUS256_SVW1_SKXCCM0_VWA1_WG32_8_1_WGM8_WGMXCC1_WGMXCCGn1
    SolutionIndex: 197
    SolutionNameMin: Cijk_Ailk_Bljk_HHS_BH_UserArgs_MT96x96x128_MI16x16x1_SN_LDSB1_GRVWA8_GRVWB8_GSU0_GSUC0_GSUWGMRR0_K1_LBSPPA1536_LBSPPB256_LPA16_LPB16_LRVW8_MIWT3_3_NLCA3_SU32_SUM0_SUS256_SVW1_SKXCCM8_VWA1_WG32_8_1_WGM8_WGMXCC1_WGMXCCGn1
    SolutionIndex: 198
    SolutionNameMin: Cijk_Ailk_Bljk_HHS_BH_UserArgs_MT96x128x32_MI16x16x1_SN_LDSB0_GRVWA4_GRVWB4_GSU0_GSUC0_GSUWGMRR0_K1_LBSPPA768_LBSPPB128_LPA32_LPB4_LRVW4_MIWT6_2_NLCA3_SU32_SUM0_SUS256_SVW2_SKXCCM0_VWA2_WG16_16_1_WGM8_WGMXCC1_WGMXCCGn1
    SolutionIndex: 199
    SolutionNameMin: Cijk_Ailk_Bljk_HHS_BH_UserArgs_MT96x128x32_MI16x16x1_SN_LDSB0_GRVWA4_GRVWB4_GSU0_GSUC0_GSUWGMRR0_K1_LBSPPA768_LBSPPB128_LPA32_LPB4_LRVW4_MIWT6_2_NLCA3_SU32_SUM0_SUS256_SVW2_SKXCCM8_VWA2_WG16_16_1_WGM8_WGMXCC1_WGMXCCGn1
    SolutionIndex: 200
    SolutionNameMin: Cijk_Ailk_Bljk_HHS_BH_UserArgs_MT96x128x64_MI16x16x1_SN_LDSB1_GRVWA8_GRVWB8_GSU0_GSUC0_GSUWGMRR0_K1_LBSPPA1536_LBSPPB128_LPA32_LPB16_LRVW8_MIWT6_2_NLCA3_SU32_SUM0_SUS256_SVW2_SKXCCM0_VWA2_WG16_16_1_WGM8_WGMXCC1_WGMXCCGn1
    SolutionIndex: 201
    SolutionNameMin: Cijk_Ailk_Bljk_HHS_BH_UserArgs_MT96x128x64_MI16x16x1_SN_LDSB1_GRVWA8_GRVWB8_GSU0_GSUC0_GSUWGMRR0_K1_LBSPPA1536_LBSPPB128_LPA32_LPB16_LRVW8_MIWT6_2_NLCA3_SU32_SUM0_SUS256_SVW2_SKXCCM8_VWA2_WG16_16_1_WGM8_WGMXCC1_WGMXCCGn1
    SolutionIndex: 202
    SolutionNameMin: Cijk_Ailk_Bljk_HHS_BH_UserArgs_MT96x128x128_MI16x16x1_SN_LDSB1_GRVWA8_GRVWB8_GSU0_GSUC0_GSUWGMRR0_K1_LBSPPA1536_LBSPPB256_LPA32_LPB16_LRVW8_MIWT6_2_NLCA3_SU32_SUM0_SUS256_SVW2_SKXCCM0_VWA2_WG16_16_1_WGM8_WGMXCC1_WGMXCCGn1
    SolutionIndex: 203
    SolutionNameMin: Cijk_Ailk_Bljk_HHS_BH_UserArgs_MT96x128x128_MI16x16x1_SN_LDSB1_GRVWA8_GRVWB8_GSU0_GSUC0_GSUWGMRR0_K1_LBSPPA1536_LBSPPB256_LPA32_LPB16_LRVW8_MIWT6_2_NLCA3_SU32_SUM0_SUS256_SVW2_SKXCCM8_VWA2_WG16_16_1_WGM8_WGMXCC1_WGMXCCGn1
    SolutionIndex: 204
    SolutionNameMin: Cijk_Ailk_Bljk_HHS_BH_UserArgs_MT96x160x32_MI16x16x1_SN_LDSB1_GRVWA4_GRVWB4_GSU0_GSUC0_GSUWGMRR0_K1_LBSPPA768_LBSPPB128_LPA16_LPB4_LRVW4_MIWT3_5_NLCA3_SU32_SUM0_SUS256_SVW1_SKXCCM0_VWA1_WG32_8_1_WGM8_WGMXCC1_WGMXCCGn1
    SolutionIndex: 205
    SolutionNameMin: Cijk_Ailk_Bljk_HHS_BH_UserArgs_MT96x160x32_MI16x16x1_SN_LDSB1_GRVWA4_GRVWB4_GSU0_GSUC0_GSUWGMRR0_K1_LBSPPA768_LBSPPB128_LPA16_LPB4_LRVW4_MIWT3_5_NLCA3_SU32_SUM0_SUS256_SVW1_SKXCCM8_VWA1_WG32_8_1_WGM8_WGMXCC1_WGMXCCGn1
    SolutionIndex: 206
    SolutionNameMin: Cijk_Ailk_Bljk_HHS_BH_UserArgs_MT96x160x64_MI16x16x1_SN_LDSB1_GRVWA8_GRVWB8_GSU0_GSUC0_GSUWGMRR0_K1_LBSPPA1536_LBSPPB128_LPA16_LPB16_LRVW8_MIWT3_5_NLCA3_SU32_SUM0_SUS256_SVW1_SKXCCM0_VWA1_WG32_8_1_WGM8_WGMXCC1_WGMXCCGn1
    SolutionIndex: 207
    SolutionNameMin: Cijk_Ailk_Bljk_HHS_BH_UserArgs_MT96x160x64_MI16x16x1_SN_LDSB1_GRVWA8_GRVWB8_GSU0_GSUC0_GSUWGMRR0_K1_LBSPPA1536_LBSPPB128_LPA16_LPB16_LRVW8_MIWT3_5_NLCA3_SU32_SUM0_SUS256_SVW1_SKXCCM8_VWA1_WG32_8_1_WGM8_WGMXCC1_WGMXCCGn1
    SolutionIndex: 208
    SolutionNameMin: Cijk_Ailk_Bljk_HHS_BH_UserArgs_MT96x192x32_MI16x16x1_SN_LDSB1_GRVWA4_GRVWB4_GSU0_GSUC0_GSUWGMRR0_K1_LBSPPA768_LBSPPB128_LPA32_LPB4_LRVW4_MIWT6_3_NLCA3_SU32_SUM0_SUS256_SVW2_SKXCCM0_VWA2_WG16_16_1_WGM8_WGMXCC1_WGMXCCGn1
    SolutionIndex: 209
    SolutionNameMin: Cijk_Ailk_Bljk_HHS_BH_UserArgs_MT96x192x32_MI16x16x1_SN_LDSB1_GRVWA4_GRVWB4_GSU0_GSUC0_GSUWGMRR0_K1_LBSPPA768_LBSPPB128_LPA32_LPB4_LRVW4_MIWT6_3_NLCA3_SU32_SUM0_SUS256_SVW2_SKXCCM8_VWA2_WG16_16_1_WGM8_WGMXCC1_WGMXCCGn1
    SolutionIndex: 210
    SolutionNameMin: Cijk_Ailk_Bljk_HHS_BH_UserArgs_MT96x192x64_MI16x16x1_SN_LDSB1_GRVWA8_GRVWB8_GSU0_GSUC0_GSUWGMRR0_K1_LBSPPA1536_LBSPPB128_LPA32_LPB16_LRVW8_MIWT6_3_NLCA3_SU32_SUM0_SUS256_SVW2_SKXCCM0_VWA2_WG16_16_1_WGM8_WGMXCC1_WGMXCCGn1
    SolutionIndex: 211
    SolutionNameMin: Cijk_Ailk_Bljk_HHS_BH_UserArgs_MT96x192x64_MI16x16x1_SN_LDSB1_GRVWA8_GRVWB8_GSU0_GSUC0_GSUWGMRR0_K1_LBSPPA1536_LBSPPB128_LPA32_LPB16_LRVW8_MIWT6_3_NLCA3_SU32_SUM0_SUS256_SVW2_SKXCCM8_VWA2_WG16_16_1_WGM8_WGMXCC1_WGMXCCGn1
    SolutionIndex: 212
    SolutionNameMin: Cijk_Ailk_Bljk_HHS_BH_UserArgs_MT96x224x32_MI16x16x1_SN_LDSB1_GRVWA4_GRVWB4_GSU0_GSUC0_GSUWGMRR0_K1_LBSPPA768_LBSPPB128_LPA16_LPB4_LRVW4_MIWT3_7_NLCA3_SU32_SUM0_SUS256_SVW1_SKXCCM0_VWA1_WG32_8_1_WGM8_WGMXCC1_WGMXCCGn1
    SolutionIndex: 213
    SolutionNameMin: Cijk_Ailk_Bljk_HHS_BH_UserArgs_MT96x224x32_MI16x16x1_SN_LDSB1_GRVWA4_GRVWB4_GSU0_GSUC0_GSUWGMRR0_K1_LBSPPA768_LBSPPB128_LPA16_LPB4_LRVW4_MIWT3_7_NLCA3_SU32_SUM0_SUS256_SVW1_SKXCCM8_VWA1_WG32_8_1_WGM8_WGMXCC1_WGMXCCGn1
    SolutionIndex: 214
    SolutionNameMin: Cijk_Ailk_Bljk_HHS_BH_UserArgs_MT96x224x64_MI16x16x1_SN_LDSB1_GRVWA8_GRVWB8_GSU0_GSUC0_GSUWGMRR0_K1_LBSPPA1536_LBSPPB128_LPA16_LPB16_LRVW8_MIWT3_7_NLCA3_SU32_SUM0_SUS256_SVW1_SKXCCM0_VWA1_WG32_8_1_WGM8_WGMXCC1_WGMXCCGn1
    SolutionIndex: 215
    SolutionNameMin: Cijk_Ailk_Bljk_HHS_BH_UserArgs_MT96x224x64_MI16x16x1_SN_LDSB1_GRVWA8_GRVWB8_GSU0_GSUC0_GSUWGMRR0_K1_LBSPPA1536_LBSPPB128_LPA16_LPB16_LRVW8_MIWT3_7_NLCA3_SU32_SUM0_SUS256_SVW1_SKXCCM8_VWA1_WG32_8_1_WGM8_WGMXCC1_WGMXCCGn1
    SolutionIndex: 216
    SolutionNameMin: Cijk_Ailk_Bljk_HHS_BH_UserArgs_MT96x256x32_MI16x16x1_SN_LDSB1_GRVWA4_GRVWB4_GSU0_GSUC0_GSUWGMRR0_K1_LBSPPA768_LBSPPB128_LPA32_LPB4_LRVW4_MIWT6_4_NLCA3_SU32_SUM0_SUS256_SVW2_SKXCCM0_VWA2_WG16_16_1_WGM8_WGMXCC1_WGMXCCGn1
    SolutionIndex: 217
    SolutionNameMin: Cijk_Ailk_Bljk_HHS_BH_UserArgs_MT96x256x32_MI16x16x1_SN_LDSB1_GRVWA4_GRVWB4_GSU0_GSUC0_GSUWGMRR0_K1_LBSPPA768_LBSPPB128_LPA32_LPB4_LRVW4_MIWT6_4_NLCA3_SU32_SUM0_SUS256_SVW2_SKXCCM8_VWA2_WG16_16_1_WGM8_WGMXCC1_WGMXCCGn1
    SolutionIndex: 218
    SolutionNameMin: Cijk_Ailk_Bljk_HHS_BH_UserArgs_MT96x256x64_MI16x16x1_SN_LDSB1_GRVWA8_GRVWB8_GSU0_GSUC0_GSUWGMRR0_K1_LBSPPA1536_LBSPPB128_LPA32_LPB16_LRVW8_MIWT6_4_NLCA3_SU32_SUM0_SUS256_SVW2_SKXCCM0_VWA2_WG16_16_1_WGM8_WGMXCC1_WGMXCCGn1
    SolutionIndex: 219
    SolutionNameMin: Cijk_Ailk_Bljk_HHS_BH_UserArgs_MT96x256x64_MI16x16x1_SN_LDSB1_GRVWA8_GRVWB8_GSU0_GSUC0_GSUWGMRR0_K1_LBSPPA1536_LBSPPB128_LPA32_LPB16_LRVW8_MIWT6_4_NLCA3_SU32_SUM0_SUS256_SVW2_SKXCCM8_VWA2_WG16_16_1_WGM8_WGMXCC1_WGMXCCGn1
    SolutionIndex: 220
    SolutionNameMin: Cijk_Ailk_Bljk_HHS_BH_UserArgs_MT112x64x64_MI16x16x1_SN_LDSB1_GRVWA4_GRVWB8_GSU0_GSUC0_GSUWGMRR0_K1_LBSPPA1792_LBSPPB128_LPA16_LPB16_LRVW8_MIWT7_1_NLCA7_SU32_SUM0_SUS256_SVW1_SKXCCM0_VWA1_WG16_16_1_WGM8_WGMXCC1_WGMXCCGn1
    SolutionIndex: 221
    SolutionNameMin: Cijk_Ailk_Bljk_HHS_BH_UserArgs_MT112x64x64_MI16x16x1_SN_LDSB1_GRVWA4_GRVWB8_GSU0_GSUC0_GSUWGMRR0_K1_LBSPPA1792_LBSPPB128_LPA16_LPB16_LRVW8_MIWT7_1_NLCA7_SU32_SUM0_SUS256_SVW1_SKXCCM8_VWA1_WG16_16_1_WGM8_WGMXCC1_WGMXCCGn1
    SolutionIndex: 222
    SolutionNameMin: Cijk_Ailk_Bljk_HHS_BH_UserArgs_MT112x128x32_MI16x16x1_SN_LDSB0_GRVWA2_GRVWB4_GSU0_GSUC0_GSUWGMRR0_K1_LBSPPA896_LBSPPB128_LPA16_LPB4_LRVW4_MIWT7_2_NLCA7_SU32_SUM0_SUS256_SVW1_SKXCCM0_VWA1_WG16_16_1_WGM8_WGMXCC1_WGMXCCGn1
    SolutionIndex: 223
    SolutionNameMin: Cijk_Ailk_Bljk_HHS_BH_UserArgs_MT112x128x32_MI16x16x1_SN_LDSB0_GRVWA2_GRVWB4_GSU0_GSUC0_GSUWGMRR0_K1_LBSPPA896_LBSPPB128_LPA16_LPB4_LRVW4_MIWT7_2_NLCA7_SU32_SUM0_SUS256_SVW1_SKXCCM8_VWA1_WG16_16_1_WGM8_WGMXCC1_WGMXCCGn1
    SolutionIndex: 224
    SolutionNameMin: Cijk_Ailk_Bljk_HHS_BH_UserArgs_MT112x128x64_MI16x16x1_SN_LDSB1_GRVWA4_GRVWB8_GSU0_GSUC0_GSUWGMRR0_K1_LBSPPA1792_LBSPPB128_LPA16_LPB16_LRVW8_MIWT7_2_NLCA7_SU32_SUM0_SUS256_SVW1_SKXCCM0_VWA1_WG16_16_1_WGM8_WGMXCC1_WGMXCCGn1
    SolutionIndex: 225
    SolutionNameMin: Cijk_Ailk_Bljk_HHS_BH_UserArgs_MT112x128x64_MI16x16x1_SN_LDSB1_GRVWA4_GRVWB8_GSU0_GSUC0_GSUWGMRR0_K1_LBSPPA1792_LBSPPB128_LPA16_LPB16_LRVW8_MIWT7_2_NLCA7_SU32_SUM0_SUS256_SVW1_SKXCCM8_VWA1_WG16_16_1_WGM8_WGMXCC1_WGMXCCGn1
    SolutionIndex: 226
    SolutionNameMin: Cijk_Ailk_Bljk_HHS_BH_UserArgs_MT112x192x64_MI16x16x1_SN_LDSB1_GRVWA4_GRVWB8_GSU0_GSUC0_GSUWGMRR0_K1_LBSPPA1792_LBSPPB128_LPA16_LPB16_LRVW8_MIWT7_3_NLCA7_SU32_SUM0_SUS256_SVW1_SKXCCM0_VWA1_WG16_16_1_WGM8_WGMXCC1_WGMXCCGn1
    SolutionIndex: 227
    SolutionNameMin: Cijk_Ailk_Bljk_HHS_BH_UserArgs_MT112x192x64_MI16x16x1_SN_LDSB1_GRVWA4_GRVWB8_GSU0_GSUC0_GSUWGMRR0_K1_LBSPPA1792_LBSPPB128_LPA16_LPB16_LRVW8_MIWT7_3_NLCA7_SU32_SUM0_SUS256_SVW1_SKXCCM8_VWA1_WG16_16_1_WGM8_WGMXCC1_WGMXCCGn1
    SolutionIndex: 228
    SolutionNameMin: Cijk_Ailk_Bljk_HHS_BH_UserArgs_MT112x256x32_MI16x16x1_SN_LDSB1_GRVWA2_GRVWB4_GSU0_GSUC0_GSUWGMRR0_K1_LBSPPA896_LBSPPB128_LPA16_LPB4_LRVW4_MIWT7_4_NLCA7_SU32_SUM0_SUS256_SVW1_SKXCCM0_VWA1_WG16_16_1_WGM8_WGMXCC1_WGMXCCGn1
    SolutionIndex: 229
    SolutionNameMin: Cijk_Ailk_Bljk_HHS_BH_UserArgs_MT112x256x32_MI16x16x1_SN_LDSB1_GRVWA2_GRVWB4_GSU0_GSUC0_GSUWGMRR0_K1_LBSPPA896_LBSPPB128_LPA16_LPB4_LRVW4_MIWT7_4_NLCA7_SU32_SUM0_SUS256_SVW1_SKXCCM8_VWA1_WG16_16_1_WGM8_WGMXCC1_WGMXCCGn1
    SolutionIndex: 230
    SolutionNameMin: Cijk_Ailk_Bljk_HHS_BH_UserArgs_MT112x256x64_MI16x16x1_SN_LDSB1_GRVWA4_GRVWB8_GSU0_GSUC0_GSUWGMRR0_K1_LBSPPA1792_LBSPPB128_LPA16_LPB16_LRVW8_MIWT7_4_NLCA7_SU32_SUM0_SUS256_SVW1_SKXCCM0_VWA1_WG16_16_1_WGM8_WGMXCC1_WGMXCCGn1
    SolutionIndex: 231
    SolutionNameMin: Cijk_Ailk_Bljk_HHS_BH_UserArgs_MT112x256x64_MI16x16x1_SN_LDSB1_GRVWA4_GRVWB8_GSU0_GSUC0_GSUWGMRR0_K1_LBSPPA1792_LBSPPB128_LPA16_LPB16_LRVW8_MIWT7_4_NLCA7_SU32_SUM0_SUS256_SVW1_SKXCCM8_VWA1_WG16_16_1_WGM8_WGMXCC1_WGMXCCGn1
    SolutionIndex: 232
    SolutionNameMin: Cijk_Ailk_Bljk_HHS_BH_UserArgs_MT128x16x32_MI16x16x1_SN_LDSB0_GRVWA8_GRVWB2_GSU0_GSUC0_GSUWGMRR0_K1_LBSPPA1024_LBSPPB128_LPA32_LPB4_LRVW4_MIWT2_1_NLCA1_SU32_SUM0_SUS256_SVW2_SKXCCM0_VWA2_WG64_4_1_WGM8_WGMXCC1_WGMXCCGn1
    SolutionIndex: 233
    SolutionNameMin: Cijk_Ailk_Bljk_HHS_BH_UserArgs_MT128x16x32_MI16x16x1_SN_LDSB0_GRVWA8_GRVWB2_GSU0_GSUC0_GSUWGMRR0_K1_LBSPPA1024_LBSPPB128_LPA32_LPB4_LRVW4_MIWT2_1_NLCA1_SU32_SUM0_SUS256_SVW2_SKXCCM8_VWA2_WG64_4_1_WGM8_WGMXCC1_WGMXCCGn1
    SolutionIndex: 234
    SolutionNameMin: Cijk_Ailk_Bljk_HHS_BH_UserArgs_MT128x16x64_MI16x16x1_SN_LDSB1_GRVWA8_GRVWB4_GSU0_GSUC0_GSUWGMRR0_K1_LBSPPA2048_LBSPPB128_LPA32_LPB16_LRVW8_MIWT2_1_NLCA1_SU32_SUM0_SUS256_SVW2_SKXCCM0_VWA2_WG64_4_1_WGM8_WGMXCC1_WGMXCCGn1
    SolutionIndex: 235
    SolutionNameMin: Cijk_Ailk_Bljk_HHS_BH_UserArgs_MT128x16x64_MI16x16x1_SN_LDSB1_GRVWA8_GRVWB4_GSU0_GSUC0_GSUWGMRR0_K1_LBSPPA2048_LBSPPB128_LPA32_LPB16_LRVW8_MIWT2_1_NLCA1_SU32_SUM0_SUS256_SVW2_SKXCCM8_VWA2_WG64_4_1_WGM8_WGMXCC1_WGMXCCGn1
    SolutionIndex: 236
    SolutionNameMin: Cijk_Ailk_Bljk_HHS_BH_UserArgs_MT128x16x128_MI16x16x1_SN_LDSB1_GRVWA8_GRVWB8_GSU0_GSUC0_GSUWGMRR0_K1_LBSPPA2048_LBSPPB256_LPA32_LPB16_LRVW8_MIWT2_1_NLCA1_SU32_SUM0_SUS256_SVW2_SKXCCM0_VWA2_WG64_4_1_WGM8_WGMXCC1_WGMXCCGn1
    SolutionIndex: 237
    SolutionNameMin: Cijk_Ailk_Bljk_HHS_BH_UserArgs_MT128x16x128_MI16x16x1_SN_LDSB1_GRVWA8_GRVWB8_GSU0_GSUC0_GSUWGMRR0_K1_LBSPPA2048_LBSPPB256_LPA32_LPB16_LRVW8_MIWT2_1_NLCA1_SU32_SUM0_SUS256_SVW2_SKXCCM8_VWA2_WG64_4_1_WGM8_WGMXCC1_WGMXCCGn1
    SolutionIndex: 238
    SolutionNameMin: Cijk_Ailk_Bljk_HHS_BH_UserArgs_MT128x32x32_MI16x16x1_SN_LDSB0_GRVWA8_GRVWB4_GSU0_GSUC0_GSUWGMRR0_K1_LBSPPA1024_LBSPPB128_LPA32_LPB4_LRVW4_MIWT2_2_NLCA1_SU32_SUM0_SUS256_SVW2_SKXCCM0_VWA2_WG64_4_1_WGM8_WGMXCC1_WGMXCCGn1
    SolutionIndex: 239
    SolutionNameMin: Cijk_Ailk_Bljk_HHS_BH_UserArgs_MT128x32x32_MI16x16x1_SN_LDSB0_GRVWA8_GRVWB4_GSU0_GSUC0_GSUWGMRR0_K1_LBSPPA1024_LBSPPB128_LPA32_LPB4_LRVW4_MIWT2_2_NLCA1_SU32_SUM0_SUS256_SVW2_SKXCCM8_VWA2_WG64_4_1_WGM8_WGMXCC1_WGMXCCGn1
    SolutionIndex: 240
    SolutionNameMin: Cijk_Ailk_Bljk_HHS_BH_UserArgs_MT128x32x64_MI16x16x1_SN_LDSB1_GRVWA8_GRVWB8_GSU0_GSUC0_GSUWGMRR0_K1_LBSPPA2048_LBSPPB128_LPA32_LPB16_LRVW8_MIWT2_2_NLCA1_SU32_SUM0_SUS256_SVW2_SKXCCM0_VWA2_WG64_4_1_WGM8_WGMXCC1_WGMXCCGn1
    SolutionIndex: 241
    SolutionNameMin: Cijk_Ailk_Bljk_HHS_BH_UserArgs_MT128x32x64_MI16x16x1_SN_LDSB1_GRVWA8_GRVWB8_GSU0_GSUC0_GSUWGMRR0_K1_LBSPPA2048_LBSPPB128_LPA32_LPB16_LRVW8_MIWT2_2_NLCA1_SU32_SUM0_SUS256_SVW2_SKXCCM8_VWA2_WG64_4_1_WGM8_WGMXCC1_WGMXCCGn1
    SolutionIndex: 242
    SolutionNameMin: Cijk_Ailk_Bljk_HHS_BH_UserArgs_MT128x32x128_MI16x16x1_SN_LDSB1_GRVWA8_GRVWB8_GSU0_GSUC0_GSUWGMRR0_K1_LBSPPA2048_LBSPPB256_LPA32_LPB16_LRVW8_MIWT2_2_NLCA1_SU32_SUM0_SUS256_SVW2_SKXCCM0_VWA2_WG64_4_1_WGM8_WGMXCC1_WGMXCCGn1
    SolutionIndex: 243
    SolutionNameMin: Cijk_Ailk_Bljk_HHS_BH_UserArgs_MT128x32x128_MI16x16x1_SN_LDSB1_GRVWA8_GRVWB8_GSU0_GSUC0_GSUWGMRR0_K1_LBSPPA2048_LBSPPB256_LPA32_LPB16_LRVW8_MIWT2_2_NLCA1_SU32_SUM0_SUS256_SVW2_SKXCCM8_VWA2_WG64_4_1_WGM8_WGMXCC1_WGMXCCGn1
    SolutionIndex: 244
    SolutionNameMin: Cijk_Ailk_Bljk_HHS_BH_UserArgs_MT128x48x32_MI16x16x1_SN_LDSB0_GRVWA8_GRVWB2_GSU0_GSUC0_GSUWGMRR0_K1_LBSPPA1024_LBSPPB128_LPA32_LPB4_LRVW4_MIWT2_3_NLCA1_SU32_SUM0_SUS256_SVW2_SKXCCM0_VWA2_WG64_4_1_WGM8_WGMXCC1_WGMXCCGn1
    SolutionIndex: 245
    SolutionNameMin: Cijk_Ailk_Bljk_HHS_BH_UserArgs_MT128x48x32_MI16x16x1_SN_LDSB0_GRVWA8_GRVWB2_GSU0_GSUC0_GSUWGMRR0_K1_LBSPPA1024_LBSPPB128_LPA32_LPB4_LRVW4_MIWT2_3_NLCA1_SU32_SUM0_SUS256_SVW2_SKXCCM8_VWA2_WG64_4_1_WGM8_WGMXCC1_WGMXCCGn1
    SolutionIndex: 246
    SolutionNameMin: Cijk_Ailk_Bljk_HHS_BH_UserArgs_MT128x48x64_MI16x16x1_SN_LDSB1_GRVWA8_GRVWB4_GSU0_GSUC0_GSUWGMRR0_K1_LBSPPA2048_LBSPPB128_LPA32_LPB16_LRVW8_MIWT2_3_NLCA1_SU32_SUM0_SUS256_SVW2_SKXCCM0_VWA2_WG64_4_1_WGM8_WGMXCC1_WGMXCCGn1
    SolutionIndex: 247
    SolutionNameMin: Cijk_Ailk_Bljk_HHS_BH_UserArgs_MT128x48x64_MI16x16x1_SN_LDSB1_GRVWA8_GRVWB4_GSU0_GSUC0_GSUWGMRR0_K1_LBSPPA2048_LBSPPB128_LPA32_LPB16_LRVW8_MIWT2_3_NLCA1_SU32_SUM0_SUS256_SVW2_SKXCCM8_VWA2_WG64_4_1_WGM8_WGMXCC1_WGMXCCGn1
    SolutionIndex: 248
    SolutionNameMin: Cijk_Ailk_Bljk_HHS_BH_UserArgs_MT128x48x128_MI16x16x1_SN_LDSB1_GRVWA8_GRVWB8_GSU0_GSUC0_GSUWGMRR0_K1_LBSPPA2048_LBSPPB256_LPA32_LPB16_LRVW8_MIWT2_3_NLCA1_SU32_SUM0_SUS256_SVW2_SKXCCM0_VWA2_WG64_4_1_WGM8_WGMXCC1_WGMXCCGn1
    SolutionIndex: 249
    SolutionNameMin: Cijk_Ailk_Bljk_HHS_BH_UserArgs_MT128x48x128_MI16x16x1_SN_LDSB1_GRVWA8_GRVWB8_GSU0_GSUC0_GSUWGMRR0_K1_LBSPPA2048_LBSPPB256_LPA32_LPB16_LRVW8_MIWT2_3_NLCA1_SU32_SUM0_SUS256_SVW2_SKXCCM8_VWA2_WG64_4_1_WGM8_WGMXCC1_WGMXCCGn1
    SolutionIndex: 250
    SolutionNameMin: Cijk_Ailk_Bljk_HHS_BH_UserArgs_MT128x64x32_MI16x16x1_SN_LDSB0_GRVWA8_GRVWB4_GSU0_GSUC0_GSUWGMRR0_K1_LBSPPA1024_LBSPPB128_LPA0_LPB4_LRVW4_MIWT4_2_NLCA1_SU32_SUM0_SUS256_SVW4_SKXCCM0_VWA4_WG32_8_1_WGM8_WGMXCC1_WGMXCCGn1
    SolutionIndex: 251
    SolutionNameMin: Cijk_Ailk_Bljk_HHS_BH_UserArgs_MT128x64x32_MI16x16x1_SN_LDSB0_GRVWA8_GRVWB4_GSU0_GSUC0_GSUWGMRR0_K1_LBSPPA1024_LBSPPB128_LPA0_LPB4_LRVW4_MIWT4_2_NLCA1_SU32_SUM0_SUS256_SVW4_SKXCCM8_VWA4_WG32_8_1_WGM8_WGMXCC1_WGMXCCGn1
    SolutionIndex: 252
    SolutionNameMin: Cijk_Ailk_Bljk_HHS_BH_UserArgs_MT128x64x64_MI16x16x1_SN_LDSB1_GRVWA8_GRVWB8_GSU0_GSUC0_GSUWGMRR0_K1_LBSPPA2048_LBSPPB128_LPA0_LPB16_LRVW8_MIWT4_2_NLCA1_SU32_SUM0_SUS256_SVW4_SKXCCM0_VWA4_WG32_8_1_WGM8_WGMXCC1_WGMXCCGn1
    SolutionIndex: 253
    SolutionNameMin: Cijk_Ailk_Bljk_HHS_BH_UserArgs_MT128x64x64_MI16x16x1_SN_LDSB1_GRVWA8_GRVWB8_GSU0_GSUC0_GSUWGMRR0_K1_LBSPPA2048_LBSPPB128_LPA0_LPB16_LRVW8_MIWT4_2_NLCA1_SU32_SUM0_SUS256_SVW4_SKXCCM8_VWA4_WG32_8_1_WGM8_WGMXCC1_WGMXCCGn1
    SolutionIndex: 254
    SolutionNameMin: Cijk_Ailk_Bljk_HHS_BH_UserArgs_MT128x64x128_MI16x16x1_SN_LDSB1_GRVWA8_GRVWB8_GSU0_GSUC0_GSUWGMRR0_K1_LBSPPA2048_LBSPPB256_LPA0_LPB16_LRVW8_MIWT4_2_NLCA1_SU32_SUM0_SUS256_SVW4_SKXCCM0_VWA4_WG32_8_1_WGM8_WGMXCC1_WGMXCCGn1
    SolutionIndex: 255
    SolutionNameMin: Cijk_Ailk_Bljk_HHS_BH_UserArgs_MT128x64x128_MI16x16x1_SN_LDSB1_GRVWA8_GRVWB8_GSU0_GSUC0_GSUWGMRR0_K1_LBSPPA2048_LBSPPB256_LPA0_LPB16_LRVW8_MIWT4_2_NLCA1_SU32_SUM0_SUS256_SVW4_SKXCCM8_VWA4_WG32_8_1_WGM8_WGMXCC1_WGMXCCGn1
    SolutionIndex: 256
    SolutionNameMin: Cijk_Ailk_Bljk_HHS_BH_UserArgs_MT128x80x32_MI16x16x1_SN_LDSB0_GRVWA8_GRVWB2_GSU0_GSUC0_GSUWGMRR0_K1_LBSPPA1024_LBSPPB128_LPA32_LPB4_LRVW4_MIWT2_5_NLCA1_SU32_SUM0_SUS256_SVW2_SKXCCM0_VWA2_WG64_4_1_WGM8_WGMXCC1_WGMXCCGn1
    SolutionIndex: 257
    SolutionNameMin: Cijk_Ailk_Bljk_HHS_BH_UserArgs_MT128x80x32_MI16x16x1_SN_LDSB0_GRVWA8_GRVWB2_GSU0_GSUC0_GSUWGMRR0_K1_LBSPPA1024_LBSPPB128_LPA32_LPB4_LRVW4_MIWT2_5_NLCA1_SU32_SUM0_SUS256_SVW2_SKXCCM8_VWA2_WG64_4_1_WGM8_WGMXCC1_WGMXCCGn1
    SolutionIndex: 258
    SolutionNameMin: Cijk_Ailk_Bljk_HHS_BH_UserArgs_MT128x80x64_MI16x16x1_SN_LDSB1_GRVWA8_GRVWB4_GSU0_GSUC0_GSUWGMRR0_K1_LBSPPA2048_LBSPPB128_LPA32_LPB16_LRVW8_MIWT2_5_NLCA1_SU32_SUM0_SUS256_SVW2_SKXCCM0_VWA2_WG64_4_1_WGM8_WGMXCC1_WGMXCCGn1
    SolutionIndex: 259
    SolutionNameMin: Cijk_Ailk_Bljk_HHS_BH_UserArgs_MT128x80x64_MI16x16x1_SN_LDSB1_GRVWA8_GRVWB4_GSU0_GSUC0_GSUWGMRR0_K1_LBSPPA2048_LBSPPB128_LPA32_LPB16_LRVW8_MIWT2_5_NLCA1_SU32_SUM0_SUS256_SVW2_SKXCCM8_VWA2_WG64_4_1_WGM8_WGMXCC1_WGMXCCGn1
    SolutionIndex: 260
    SolutionNameMin: Cijk_Ailk_Bljk_HHS_BH_UserArgs_MT128x80x128_MI16x16x1_SN_LDSB1_GRVWA8_GRVWB8_GSU0_GSUC0_GSUWGMRR0_K1_LBSPPA2048_LBSPPB256_LPA32_LPB16_LRVW8_MIWT2_5_NLCA1_SU32_SUM0_SUS256_SVW2_SKXCCM0_VWA2_WG64_4_1_WGM8_WGMXCC1_WGMXCCGn1
    SolutionIndex: 261
    SolutionNameMin: Cijk_Ailk_Bljk_HHS_BH_UserArgs_MT128x80x128_MI16x16x1_SN_LDSB1_GRVWA8_GRVWB8_GSU0_GSUC0_GSUWGMRR0_K1_LBSPPA2048_LBSPPB256_LPA32_LPB16_LRVW8_MIWT2_5_NLCA1_SU32_SUM0_SUS256_SVW2_SKXCCM8_VWA2_WG64_4_1_WGM8_WGMXCC1_WGMXCCGn1
    SolutionIndex: 262
    SolutionNameMin: Cijk_Ailk_Bljk_HHS_BH_UserArgs_MT128x96x32_MI16x16x1_SN_LDSB0_GRVWA8_GRVWB4_GSU0_GSUC0_GSUWGMRR0_K1_LBSPPA1024_LBSPPB128_LPA32_LPB4_LRVW4_MIWT2_6_NLCA1_SU32_SUM0_SUS256_SVW2_SKXCCM0_VWA2_WG64_4_1_WGM8_WGMXCC1_WGMXCCGn1
    SolutionIndex: 263
    SolutionNameMin: Cijk_Ailk_Bljk_HHS_BH_UserArgs_MT128x96x32_MI16x16x1_SN_LDSB0_GRVWA8_GRVWB4_GSU0_GSUC0_GSUWGMRR0_K1_LBSPPA1024_LBSPPB128_LPA32_LPB4_LRVW4_MIWT2_6_NLCA1_SU32_SUM0_SUS256_SVW2_SKXCCM8_VWA2_WG64_4_1_WGM8_WGMXCC1_WGMXCCGn1
    SolutionIndex: 264
    SolutionNameMin: Cijk_Ailk_Bljk_HHS_BH_UserArgs_MT128x96x64_MI16x16x1_SN_LDSB1_GRVWA8_GRVWB8_GSU0_GSUC0_GSUWGMRR0_K1_LBSPPA2048_LBSPPB128_LPA32_LPB16_LRVW8_MIWT2_6_NLCA1_SU32_SUM0_SUS256_SVW2_SKXCCM0_VWA2_WG64_4_1_WGM8_WGMXCC1_WGMXCCGn1
    SolutionIndex: 265
    SolutionNameMin: Cijk_Ailk_Bljk_HHS_BH_UserArgs_MT128x96x64_MI16x16x1_SN_LDSB1_GRVWA8_GRVWB8_GSU0_GSUC0_GSUWGMRR0_K1_LBSPPA2048_LBSPPB128_LPA32_LPB16_LRVW8_MIWT2_6_NLCA1_SU32_SUM0_SUS256_SVW2_SKXCCM8_VWA2_WG64_4_1_WGM8_WGMXCC1_WGMXCCGn1
    SolutionIndex: 266
    SolutionNameMin: Cijk_Ailk_Bljk_HHS_BH_UserArgs_MT128x96x128_MI16x16x1_SN_LDSB1_GRVWA8_GRVWB8_GSU0_GSUC0_GSUWGMRR0_K1_LBSPPA2048_LBSPPB256_LPA32_LPB16_LRVW8_MIWT2_6_NLCA1_SU32_SUM0_SUS256_SVW2_SKXCCM0_VWA2_WG64_4_1_WGM8_WGMXCC1_WGMXCCGn1
    SolutionIndex: 267
    SolutionNameMin: Cijk_Ailk_Bljk_HHS_BH_UserArgs_MT128x96x128_MI16x16x1_SN_LDSB1_GRVWA8_GRVWB8_GSU0_GSUC0_GSUWGMRR0_K1_LBSPPA2048_LBSPPB256_LPA32_LPB16_LRVW8_MIWT2_6_NLCA1_SU32_SUM0_SUS256_SVW2_SKXCCM8_VWA2_WG64_4_1_WGM8_WGMXCC1_WGMXCCGn1
    SolutionIndex: 268
    SolutionNameMin: Cijk_Ailk_Bljk_HHS_BH_UserArgs_MT128x112x32_MI16x16x1_SN_LDSB0_GRVWA8_GRVWB2_GSU0_GSUC0_GSUWGMRR0_K1_LBSPPA1024_LBSPPB128_LPA32_LPB4_LRVW4_MIWT2_7_NLCA1_SU32_SUM0_SUS256_SVW2_SKXCCM0_VWA2_WG64_4_1_WGM8_WGMXCC1_WGMXCCGn1
    SolutionIndex: 269
    SolutionNameMin: Cijk_Ailk_Bljk_HHS_BH_UserArgs_MT128x112x32_MI16x16x1_SN_LDSB0_GRVWA8_GRVWB2_GSU0_GSUC0_GSUWGMRR0_K1_LBSPPA1024_LBSPPB128_LPA32_LPB4_LRVW4_MIWT2_7_NLCA1_SU32_SUM0_SUS256_SVW2_SKXCCM8_VWA2_WG64_4_1_WGM8_WGMXCC1_WGMXCCGn1
    SolutionIndex: 270
    SolutionNameMin: Cijk_Ailk_Bljk_HHS_BH_UserArgs_MT128x112x64_MI16x16x1_SN_LDSB1_GRVWA8_GRVWB4_GSU0_GSUC0_GSUWGMRR0_K1_LBSPPA2048_LBSPPB128_LPA32_LPB16_LRVW8_MIWT2_7_NLCA1_SU32_SUM0_SUS256_SVW2_SKXCCM0_VWA2_WG64_4_1_WGM8_WGMXCC1_WGMXCCGn1
    SolutionIndex: 271
    SolutionNameMin: Cijk_Ailk_Bljk_HHS_BH_UserArgs_MT128x112x64_MI16x16x1_SN_LDSB1_GRVWA8_GRVWB4_GSU0_GSUC0_GSUWGMRR0_K1_LBSPPA2048_LBSPPB128_LPA32_LPB16_LRVW8_MIWT2_7_NLCA1_SU32_SUM0_SUS256_SVW2_SKXCCM8_VWA2_WG64_4_1_WGM8_WGMXCC1_WGMXCCGn1
    SolutionIndex: 272
    SolutionNameMin: Cijk_Ailk_Bljk_HHS_BH_UserArgs_MT128x112x128_MI16x16x1_SN_LDSB1_GRVWA8_GRVWB4_GSU0_GSUC0_GSUWGMRR0_K1_LBSPPA1024_LBSPPB256_LPA32_LPB4_LRVW4_MIWT2_7_NLCA1_SU32_SUM0_SUS256_SVW2_SKXCCM0_VWA2_WG64_4_1_WGM8_WGMXCC1_WGMXCCGn1
    SolutionIndex: 273
    SolutionNameMin: Cijk_Ailk_Bljk_HHS_BH_UserArgs_MT128x112x128_MI16x16x1_SN_LDSB1_GRVWA8_GRVWB4_GSU0_GSUC0_GSUWGMRR0_K1_LBSPPA1024_LBSPPB256_LPA32_LPB4_LRVW4_MIWT2_7_NLCA1_SU32_SUM0_SUS256_SVW2_SKXCCM8_VWA2_WG64_4_1_WGM8_WGMXCC1_WGMXCCGn1
    SolutionIndex: 274
    SolutionNameMin: Cijk_Ailk_Bljk_HHS_BH_UserArgs_MT128x128x32_MI16x16x1_SN_LDSB1_GRVWA8_GRVWB4_GSU0_GSUC0_GSUWGMRR0_K1_LBSPPA1024_LBSPPB128_LPA0_LPB4_LRVW4_MIWT4_4_NLCA1_SU32_SUM0_SUS256_SVW4_SKXCCM0_VWA4_WG32_8_1_WGM8_WGMXCC1_WGMXCCGn1
    SolutionIndex: 275
    SolutionNameMin: Cijk_Ailk_Bljk_HHS_BH_UserArgs_MT128x128x32_MI16x16x1_SN_LDSB1_GRVWA8_GRVWB4_GSU0_GSUC0_GSUWGMRR0_K1_LBSPPA1024_LBSPPB128_LPA0_LPB4_LRVW4_MIWT4_4_NLCA1_SU32_SUM0_SUS256_SVW4_SKXCCM8_VWA4_WG32_8_1_WGM8_WGMXCC1_WGMXCCGn1
    SolutionIndex: 276
    SolutionNameMin: Cijk_Ailk_Bljk_HHS_BH_UserArgs_MT128x128x64_MI16x16x1_SN_LDSB1_GRVWA8_GRVWB8_GSU0_GSUC0_GSUWGMRR0_K1_LBSPPA2048_LBSPPB128_LPA0_LPB16_LRVW8_MIWT4_4_NLCA1_SU32_SUM0_SUS256_SVW4_SKXCCM0_VWA4_WG32_8_1_WGM8_WGMXCC1_WGMXCCGn1
    SolutionIndex: 277
    SolutionNameMin: Cijk_Ailk_Bljk_HHS_BH_UserArgs_MT128x128x64_MI16x16x1_SN_LDSB1_GRVWA8_GRVWB8_GSU0_GSUC0_GSUWGMRR0_K1_LBSPPA2048_LBSPPB128_LPA0_LPB16_LRVW8_MIWT4_4_NLCA1_SU32_SUM0_SUS256_SVW4_SKXCCM8_VWA4_WG32_8_1_WGM8_WGMXCC1_WGMXCCGn1
    SolutionIndex: 278
    SolutionNameMin: Cijk_Ailk_Bljk_HHS_BH_UserArgs_MT128x144x32_MI16x16x1_SN_LDSB1_GRVWA8_GRVWB2_GSU0_GSUC0_GSUWGMRR0_K1_LBSPPA1024_LBSPPB128_LPA32_LPB4_LRVW4_MIWT2_9_NLCA1_SU32_SUM0_SUS256_SVW2_SKXCCM0_VWA2_WG64_4_1_WGM8_WGMXCC1_WGMXCCGn1
    SolutionIndex: 279
    SolutionNameMin: Cijk_Ailk_Bljk_HHS_BH_UserArgs_MT128x144x32_MI16x16x1_SN_LDSB1_GRVWA8_GRVWB2_GSU0_GSUC0_GSUWGMRR0_K1_LBSPPA1024_LBSPPB128_LPA32_LPB4_LRVW4_MIWT2_9_NLCA1_SU32_SUM0_SUS256_SVW2_SKXCCM8_VWA2_WG64_4_1_WGM8_WGMXCC1_WGMXCCGn1
    SolutionIndex: 280
    SolutionNameMin: Cijk_Ailk_Bljk_HHS_BH_UserArgs_MT128x144x64_MI16x16x1_SN_LDSB1_GRVWA8_GRVWB4_GSU0_GSUC0_GSUWGMRR0_K1_LBSPPA2048_LBSPPB128_LPA32_LPB16_LRVW8_MIWT2_9_NLCA1_SU32_SUM0_SUS256_SVW2_SKXCCM0_VWA2_WG64_4_1_WGM8_WGMXCC1_WGMXCCGn1
    SolutionIndex: 281
    SolutionNameMin: Cijk_Ailk_Bljk_HHS_BH_UserArgs_MT128x144x64_MI16x16x1_SN_LDSB1_GRVWA8_GRVWB4_GSU0_GSUC0_GSUWGMRR0_K1_LBSPPA2048_LBSPPB128_LPA32_LPB16_LRVW8_MIWT2_9_NLCA1_SU32_SUM0_SUS256_SVW2_SKXCCM8_VWA2_WG64_4_1_WGM8_WGMXCC1_WGMXCCGn1
    SolutionIndex: 282
    SolutionNameMin: Cijk_Ailk_Bljk_HHS_BH_UserArgs_MT128x160x32_MI16x16x1_SN_LDSB1_GRVWA8_GRVWB4_GSU0_GSUC0_GSUWGMRR0_K1_LBSPPA1024_LBSPPB128_LPA32_LPB4_LRVW4_MIWT2_10_NLCA1_SU32_SUM0_SUS256_SVW2_SKXCCM0_VWA2_WG64_4_1_WGM8_WGMXCC1_WGMXCCGn1
    SolutionIndex: 283
    SolutionNameMin: Cijk_Ailk_Bljk_HHS_BH_UserArgs_MT128x160x32_MI16x16x1_SN_LDSB1_GRVWA8_GRVWB4_GSU0_GSUC0_GSUWGMRR0_K1_LBSPPA1024_LBSPPB128_LPA32_LPB4_LRVW4_MIWT2_10_NLCA1_SU32_SUM0_SUS256_SVW2_SKXCCM8_VWA2_WG64_4_1_WGM8_WGMXCC1_WGMXCCGn1
    SolutionIndex: 284
    SolutionNameMin: Cijk_Ailk_Bljk_HHS_BH_UserArgs_MT128x160x64_MI16x16x1_SN_LDSB1_GRVWA8_GRVWB8_GSU0_GSUC0_GSUWGMRR0_K1_LBSPPA2048_LBSPPB128_LPA32_LPB16_LRVW8_MIWT2_10_NLCA1_SU32_SUM0_SUS256_SVW2_SKXCCM0_VWA2_WG64_4_1_WGM8_WGMXCC1_WGMXCCGn1
    SolutionIndex: 285
    SolutionNameMin: Cijk_Ailk_Bljk_HHS_BH_UserArgs_MT128x160x64_MI16x16x1_SN_LDSB1_GRVWA8_GRVWB8_GSU0_GSUC0_GSUWGMRR0_K1_LBSPPA2048_LBSPPB128_LPA32_LPB16_LRVW8_MIWT2_10_NLCA1_SU32_SUM0_SUS256_SVW2_SKXCCM8_VWA2_WG64_4_1_WGM8_WGMXCC1_WGMXCCGn1
    SolutionIndex: 286
    SolutionNameMin: Cijk_Ailk_Bljk_HHS_BH_UserArgs_MT128x176x32_MI16x16x1_SN_LDSB1_GRVWA8_GRVWB2_GSU0_GSUC0_GSUWGMRR0_K1_LBSPPA1024_LBSPPB128_LPA32_LPB4_LRVW4_MIWT2_11_NLCA1_SU32_SUM0_SUS256_SVW2_SKXCCM0_VWA2_WG64_4_1_WGM8_WGMXCC1_WGMXCCGn1
    SolutionIndex: 287
    SolutionNameMin: Cijk_Ailk_Bljk_HHS_BH_UserArgs_MT128x176x32_MI16x16x1_SN_LDSB1_GRVWA8_GRVWB2_GSU0_GSUC0_GSUWGMRR0_K1_LBSPPA1024_LBSPPB128_LPA32_LPB4_LRVW4_MIWT2_11_NLCA1_SU32_SUM0_SUS256_SVW2_SKXCCM8_VWA2_WG64_4_1_WGM8_WGMXCC1_WGMXCCGn1
    SolutionIndex: 288
    SolutionNameMin: Cijk_Ailk_Bljk_HHS_BH_UserArgs_MT128x176x64_MI16x16x1_SN_LDSB1_GRVWA8_GRVWB4_GSU0_GSUC0_GSUWGMRR0_K1_LBSPPA2048_LBSPPB128_LPA32_LPB16_LRVW8_MIWT2_11_NLCA1_SU32_SUM0_SUS256_SVW2_SKXCCM0_VWA2_WG64_4_1_WGM8_WGMXCC1_WGMXCCGn1
    SolutionIndex: 289
    SolutionNameMin: Cijk_Ailk_Bljk_HHS_BH_UserArgs_MT128x176x64_MI16x16x1_SN_LDSB1_GRVWA8_GRVWB4_GSU0_GSUC0_GSUWGMRR0_K1_LBSPPA2048_LBSPPB128_LPA32_LPB16_LRVW8_MIWT2_11_NLCA1_SU32_SUM0_SUS256_SVW2_SKXCCM8_VWA2_WG64_4_1_WGM8_WGMXCC1_WGMXCCGn1
    SolutionIndex: 290
    SolutionNameMin: Cijk_Ailk_Bljk_HHS_BH_UserArgs_MT128x192x32_MI16x16x1_SN_LDSB1_GRVWA8_GRVWB4_GSU0_GSUC0_GSUWGMRR0_K1_LBSPPA1024_LBSPPB128_LPA0_LPB4_LRVW4_MIWT4_6_NLCA1_SU32_SUM0_SUS256_SVW4_SKXCCM0_VWA4_WG32_8_1_WGM8_WGMXCC1_WGMXCCGn1
    SolutionIndex: 291
    SolutionNameMin: Cijk_Ailk_Bljk_HHS_BH_UserArgs_MT128x192x32_MI16x16x1_SN_LDSB1_GRVWA8_GRVWB4_GSU0_GSUC0_GSUWGMRR0_K1_LBSPPA1024_LBSPPB128_LPA0_LPB4_LRVW4_MIWT4_6_NLCA1_SU32_SUM0_SUS256_SVW4_SKXCCM8_VWA4_WG32_8_1_WGM8_WGMXCC1_WGMXCCGn1
    SolutionIndex: 292
    SolutionNameMin: Cijk_Ailk_Bljk_HHS_BH_UserArgs_MT128x192x64_MI16x16x1_SN_LDSB1_GRVWA8_GRVWB8_GSU0_GSUC0_GSUWGMRR0_K1_LBSPPA2048_LBSPPB128_LPA0_LPB16_LRVW8_MIWT4_6_NLCA1_SU32_SUM0_SUS256_SVW4_SKXCCM0_VWA4_WG32_8_1_WGM8_WGMXCC1_WGMXCCGn1
    SolutionIndex: 293
    SolutionNameMin: Cijk_Ailk_Bljk_HHS_BH_UserArgs_MT128x192x64_MI16x16x1_SN_LDSB1_GRVWA8_GRVWB8_GSU0_GSUC0_GSUWGMRR0_K1_LBSPPA2048_LBSPPB128_LPA0_LPB16_LRVW8_MIWT4_6_NLCA1_SU32_SUM0_SUS256_SVW4_SKXCCM8_VWA4_WG32_8_1_WGM8_WGMXCC1_WGMXCCGn1
    SolutionIndex: 294
    SolutionNameMin: Cijk_Ailk_Bljk_HHS_BH_UserArgs_MT128x208x32_MI16x16x1_SN_LDSB1_GRVWA8_GRVWB2_GSU0_GSUC0_GSUWGMRR0_K1_LBSPPA1024_LBSPPB128_LPA32_LPB4_LRVW4_MIWT2_13_NLCA1_SU32_SUM0_SUS256_SVW2_SKXCCM0_VWA2_WG64_4_1_WGM8_WGMXCC1_WGMXCCGn1
    SolutionIndex: 295
    SolutionNameMin: Cijk_Ailk_Bljk_HHS_BH_UserArgs_MT128x208x32_MI16x16x1_SN_LDSB1_GRVWA8_GRVWB2_GSU0_GSUC0_GSUWGMRR0_K1_LBSPPA1024_LBSPPB128_LPA32_LPB4_LRVW4_MIWT2_13_NLCA1_SU32_SUM0_SUS256_SVW2_SKXCCM8_VWA2_WG64_4_1_WGM8_WGMXCC1_WGMXCCGn1
    SolutionIndex: 296
    SolutionNameMin: Cijk_Ailk_Bljk_HHS_BH_UserArgs_MT128x208x64_MI16x16x1_SN_LDSB1_GRVWA8_GRVWB4_GSU0_GSUC0_GSUWGMRR0_K1_LBSPPA2048_LBSPPB128_LPA32_LPB16_LRVW8_MIWT2_13_NLCA1_SU32_SUM0_SUS256_SVW2_SKXCCM0_VWA2_WG64_4_1_WGM8_WGMXCC1_WGMXCCGn1
    SolutionIndex: 297
    SolutionNameMin: Cijk_Ailk_Bljk_HHS_BH_UserArgs_MT128x208x64_MI16x16x1_SN_LDSB1_GRVWA8_GRVWB4_GSU0_GSUC0_GSUWGMRR0_K1_LBSPPA2048_LBSPPB128_LPA32_LPB16_LRVW8_MIWT2_13_NLCA1_SU32_SUM0_SUS256_SVW2_SKXCCM8_VWA2_WG64_4_1_WGM8_WGMXCC1_WGMXCCGn1
    SolutionIndex: 298
    SolutionNameMin: Cijk_Ailk_Bljk_HHS_BH_UserArgs_MT128x224x32_MI16x16x1_SN_LDSB1_GRVWA8_GRVWB4_GSU0_GSUC0_GSUWGMRR0_K1_LBSPPA1024_LBSPPB128_LPA32_LPB4_LRVW4_MIWT2_14_NLCA1_SU32_SUM0_SUS256_SVW2_SKXCCM0_VWA2_WG64_4_1_WGM8_WGMXCC1_WGMXCCGn1
    SolutionIndex: 299
    SolutionNameMin: Cijk_Ailk_Bljk_HHS_BH_UserArgs_MT128x224x32_MI16x16x1_SN_LDSB1_GRVWA8_GRVWB4_GSU0_GSUC0_GSUWGMRR0_K1_LBSPPA1024_LBSPPB128_LPA32_LPB4_LRVW4_MIWT2_14_NLCA1_SU32_SUM0_SUS256_SVW2_SKXCCM8_VWA2_WG64_4_1_WGM8_WGMXCC1_WGMXCCGn1
    SolutionIndex: 300
    SolutionNameMin: Cijk_Ailk_Bljk_HHS_BH_UserArgs_MT128x224x64_MI16x16x1_SN_LDSB1_GRVWA8_GRVWB8_GSU0_GSUC0_GSUWGMRR0_K1_LBSPPA2048_LBSPPB128_LPA32_LPB16_LRVW8_MIWT2_14_NLCA1_SU32_SUM0_SUS256_SVW2_SKXCCM0_VWA2_WG64_4_1_WGM8_WGMXCC1_WGMXCCGn1
    SolutionIndex: 301
    SolutionNameMin: Cijk_Ailk_Bljk_HHS_BH_UserArgs_MT128x224x64_MI16x16x1_SN_LDSB1_GRVWA8_GRVWB8_GSU0_GSUC0_GSUWGMRR0_K1_LBSPPA2048_LBSPPB128_LPA32_LPB16_LRVW8_MIWT2_14_NLCA1_SU32_SUM0_SUS256_SVW2_SKXCCM8_VWA2_WG64_4_1_WGM8_WGMXCC1_WGMXCCGn1
    SolutionIndex: 302
    SolutionNameMin: Cijk_Ailk_Bljk_HHS_BH_UserArgs_MT128x240x32_MI16x16x1_SN_LDSB1_GRVWA8_GRVWB2_GSU0_GSUC0_GSUWGMRR0_K1_LBSPPA1024_LBSPPB128_LPA32_LPB4_LRVW4_MIWT2_15_NLCA1_SU32_SUM0_SUS256_SVW2_SKXCCM0_VWA2_WG64_4_1_WGM8_WGMXCC1_WGMXCCGn1
    SolutionIndex: 303
    SolutionNameMin: Cijk_Ailk_Bljk_HHS_BH_UserArgs_MT128x240x32_MI16x16x1_SN_LDSB1_GRVWA8_GRVWB2_GSU0_GSUC0_GSUWGMRR0_K1_LBSPPA1024_LBSPPB128_LPA32_LPB4_LRVW4_MIWT2_15_NLCA1_SU32_SUM0_SUS256_SVW2_SKXCCM8_VWA2_WG64_4_1_WGM8_WGMXCC1_WGMXCCGn1
    SolutionIndex: 304
    SolutionNameMin: Cijk_Ailk_Bljk_HHS_BH_UserArgs_MT128x240x64_MI16x16x1_SN_LDSB1_GRVWA8_GRVWB4_GSU0_GSUC0_GSUWGMRR0_K1_LBSPPA2048_LBSPPB128_LPA32_LPB16_LRVW8_MIWT2_15_NLCA1_SU32_SUM0_SUS256_SVW2_SKXCCM0_VWA2_WG64_4_1_WGM8_WGMXCC1_WGMXCCGn1
    SolutionIndex: 305
    SolutionNameMin: Cijk_Ailk_Bljk_HHS_BH_UserArgs_MT128x240x64_MI16x16x1_SN_LDSB1_GRVWA8_GRVWB4_GSU0_GSUC0_GSUWGMRR0_K1_LBSPPA2048_LBSPPB128_LPA32_LPB16_LRVW8_MIWT2_15_NLCA1_SU32_SUM0_SUS256_SVW2_SKXCCM8_VWA2_WG64_4_1_WGM8_WGMXCC1_WGMXCCGn1
    SolutionIndex: 306
    SolutionNameMin: Cijk_Ailk_Bljk_HHS_BH_UserArgs_MT128x256x32_MI16x16x1_SN_LDSB1_GRVWA8_GRVWB4_GSU0_GSUC0_GSUWGMRR0_K1_LBSPPA1024_LBSPPB128_LPA0_LPB4_LRVW4_MIWT4_8_NLCA1_SU32_SUM0_SUS256_SVW4_SKXCCM0_VWA4_WG32_8_1_WGM8_WGMXCC1_WGMXCCGn1
    SolutionIndex: 307
    SolutionNameMin: Cijk_Ailk_Bljk_HHS_BH_UserArgs_MT128x256x32_MI16x16x1_SN_LDSB1_GRVWA8_GRVWB4_GSU0_GSUC0_GSUWGMRR0_K1_LBSPPA1024_LBSPPB128_LPA0_LPB4_LRVW4_MIWT4_8_NLCA1_SU32_SUM0_SUS256_SVW4_SKXCCM8_VWA4_WG32_8_1_WGM8_WGMXCC1_WGMXCCGn1
    SolutionIndex: 308
    SolutionNameMin: Cijk_Ailk_Bljk_HHS_BH_UserArgs_MT128x256x64_MI16x16x1_SN_LDSB1_GRVWA8_GRVWB8_GSU0_GSUC0_GSUWGMRR0_K1_LBSPPA2048_LBSPPB128_LPA0_LPB16_LRVW8_MIWT4_8_NLCA1_SU32_SUM0_SUS256_SVW4_SKXCCM0_VWA4_WG32_8_1_WGM8_WGMXCC1_WGMXCCGn1
    SolutionIndex: 309
    SolutionNameMin: Cijk_Ailk_Bljk_HHS_BH_UserArgs_MT128x256x64_MI16x16x1_SN_LDSB1_GRVWA8_GRVWB8_GSU0_GSUC0_GSUWGMRR0_K1_LBSPPA2048_LBSPPB128_LPA0_LPB16_LRVW8_MIWT4_8_NLCA1_SU32_SUM0_SUS256_SVW4_SKXCCM8_VWA4_WG32_8_1_WGM8_WGMXCC1_WGMXCCGn1
    SolutionIndex: 310
    SolutionNameMin: Cijk_Ailk_Bljk_HHS_BH_UserArgs_MT144x64x32_MI16x16x1_SN_LDSB0_GRVWA2_GRVWB4_GSU0_GSUC0_GSUWGMRR0_K1_LBSPPA1152_LBSPPB128_LPA16_LPB4_LRVW4_MIWT9_1_NLCA9_SU32_SUM0_SUS256_SVW1_SKXCCM0_VWA1_WG16_16_1_WGM1_WGMXCC1_WGMXCCGn1
    SolutionIndex: 311
    SolutionNameMin: Cijk_Ailk_Bljk_HHS_BH_UserArgs_MT144x64x32_MI16x16x1_SN_LDSB0_GRVWA2_GRVWB4_GSU0_GSUC0_GSUWGMRR0_K1_LBSPPA1152_LBSPPB128_LPA16_LPB4_LRVW4_MIWT9_1_NLCA9_SU32_SUM0_SUS256_SVW1_SKXCCM8_VWA1_WG16_16_1_WGM1_WGMXCC1_WGMXCCGn1
    SolutionIndex: 312
    SolutionNameMin: Cijk_Ailk_Bljk_HHS_BH_UserArgs_MT144x64x64_MI16x16x1_SN_LDSB1_GRVWA4_GRVWB8_GSU0_GSUC0_GSUWGMRR0_K1_LBSPPA2304_LBSPPB128_LPA16_LPB16_LRVW8_MIWT9_1_NLCA9_SU32_SUM0_SUS256_SVW1_SKXCCM0_VWA1_WG16_16_1_WGM8_WGMXCC1_WGMXCCGn1
    SolutionIndex: 313
    SolutionNameMin: Cijk_Ailk_Bljk_HHS_BH_UserArgs_MT144x64x64_MI16x16x1_SN_LDSB1_GRVWA4_GRVWB8_GSU0_GSUC0_GSUWGMRR0_K1_LBSPPA2304_LBSPPB128_LPA16_LPB16_LRVW8_MIWT9_1_NLCA9_SU32_SUM0_SUS256_SVW1_SKXCCM8_VWA1_WG16_16_1_WGM8_WGMXCC1_WGMXCCGn1
    SolutionIndex: 314
    SolutionNameMin: Cijk_Ailk_Bljk_HHS_BH_UserArgs_MT144x128x32_MI16x16x1_SN_LDSB1_GRVWA2_GRVWB4_GSU0_GSUC0_GSUWGMRR0_K1_LBSPPA1152_LBSPPB128_LPA16_LPB4_LRVW4_MIWT9_2_NLCA9_SU32_SUM0_SUS256_SVW1_SKXCCM0_VWA1_WG16_16_1_WGM8_WGMXCC1_WGMXCCGn1
    SolutionIndex: 315
    SolutionNameMin: Cijk_Ailk_Bljk_HHS_BH_UserArgs_MT144x128x32_MI16x16x1_SN_LDSB1_GRVWA2_GRVWB4_GSU0_GSUC0_GSUWGMRR0_K1_LBSPPA1152_LBSPPB128_LPA16_LPB4_LRVW4_MIWT9_2_NLCA9_SU32_SUM0_SUS256_SVW1_SKXCCM8_VWA1_WG16_16_1_WGM8_WGMXCC1_WGMXCCGn1
    SolutionIndex: 316
    SolutionNameMin: Cijk_Ailk_Bljk_HHS_BH_UserArgs_MT144x128x64_MI16x16x1_SN_LDSB1_GRVWA4_GRVWB8_GSU0_GSUC0_GSUWGMRR0_K1_LBSPPA2304_LBSPPB128_LPA16_LPB16_LRVW8_MIWT9_2_NLCA9_SU32_SUM0_SUS256_SVW1_SKXCCM0_VWA1_WG16_16_1_WGM8_WGMXCC1_WGMXCCGn1
    SolutionIndex: 317
    SolutionNameMin: Cijk_Ailk_Bljk_HHS_BH_UserArgs_MT144x128x64_MI16x16x1_SN_LDSB1_GRVWA4_GRVWB8_GSU0_GSUC0_GSUWGMRR0_K1_LBSPPA2304_LBSPPB128_LPA16_LPB16_LRVW8_MIWT9_2_NLCA9_SU32_SUM0_SUS256_SVW1_SKXCCM8_VWA1_WG16_16_1_WGM8_WGMXCC1_WGMXCCGn1
    SolutionIndex: 318
    SolutionNameMin: Cijk_Ailk_Bljk_HHS_BH_UserArgs_MT144x192x32_MI16x16x1_SN_LDSB1_GRVWA2_GRVWB4_GSU0_GSUC0_GSUWGMRR0_K1_LBSPPA1152_LBSPPB128_LPA16_LPB4_LRVW4_MIWT9_3_NLCA9_SU32_SUM0_SUS256_SVW1_SKXCCM0_VWA1_WG16_16_1_WGM8_WGMXCC1_WGMXCCGn1
    SolutionIndex: 319
    SolutionNameMin: Cijk_Ailk_Bljk_HHS_BH_UserArgs_MT144x192x32_MI16x16x1_SN_LDSB1_GRVWA2_GRVWB4_GSU0_GSUC0_GSUWGMRR0_K1_LBSPPA1152_LBSPPB128_LPA16_LPB4_LRVW4_MIWT9_3_NLCA9_SU32_SUM0_SUS256_SVW1_SKXCCM8_VWA1_WG16_16_1_WGM8_WGMXCC1_WGMXCCGn1
    SolutionIndex: 320
    SolutionNameMin: Cijk_Ailk_Bljk_HHS_BH_UserArgs_MT144x192x64_MI16x16x1_SN_LDSB1_GRVWA4_GRVWB8_GSU0_GSUC0_GSUWGMRR0_K1_LBSPPA2304_LBSPPB128_LPA16_LPB16_LRVW8_MIWT9_3_NLCA9_SU32_SUM0_SUS256_SVW1_SKXCCM0_VWA1_WG16_16_1_WGM8_WGMXCC1_WGMXCCGn1
    SolutionIndex: 321
    SolutionNameMin: Cijk_Ailk_Bljk_HHS_BH_UserArgs_MT144x192x64_MI16x16x1_SN_LDSB1_GRVWA4_GRVWB8_GSU0_GSUC0_GSUWGMRR0_K1_LBSPPA2304_LBSPPB128_LPA16_LPB16_LRVW8_MIWT9_3_NLCA9_SU32_SUM0_SUS256_SVW1_SKXCCM8_VWA1_WG16_16_1_WGM8_WGMXCC1_WGMXCCGn1
    SolutionIndex: 322
    SolutionNameMin: Cijk_Ailk_Bljk_HHS_BH_UserArgs_MT144x256x32_MI16x16x1_SN_LDSB0_GRVWA2_GRVWB4_GSU0_GSUC0_GSUWGMRR0_K1_LBSPPA1152_LBSPPB128_LPA16_LPB4_LRVW4_MIWT9_4_NLCA9_SU32_SUM0_SUS256_SVW1_SKXCCM0_VWA1_WG16_16_1_WGM8_WGMXCC1_WGMXCCGn1
    SolutionIndex: 323
    SolutionNameMin: Cijk_Ailk_Bljk_HHS_BH_UserArgs_MT144x256x32_MI16x16x1_SN_LDSB0_GRVWA2_GRVWB4_GSU0_GSUC0_GSUWGMRR0_K1_LBSPPA1152_LBSPPB128_LPA16_LPB4_LRVW4_MIWT9_4_NLCA9_SU32_SUM0_SUS256_SVW1_SKXCCM8_VWA1_WG16_16_1_WGM8_WGMXCC1_WGMXCCGn1
    SolutionIndex: 324
    SolutionNameMin: Cijk_Ailk_Bljk_HHS_BH_UserArgs_MT144x256x64_MI16x16x1_SN_LDSB1_GRVWA4_GRVWB8_GSU0_GSUC0_GSUWGMRR0_K1_LBSPPA2304_LBSPPB128_LPA16_LPB16_LRVW8_MIWT9_4_NLCA9_SU32_SUM0_SUS256_SVW1_SKXCCM0_VWA1_WG16_16_1_WGM8_WGMXCC1_WGMXCCGn1
    SolutionIndex: 325
    SolutionNameMin: Cijk_Ailk_Bljk_HHS_BH_UserArgs_MT144x256x64_MI16x16x1_SN_LDSB1_GRVWA4_GRVWB8_GSU0_GSUC0_GSUWGMRR0_K1_LBSPPA2304_LBSPPB128_LPA16_LPB16_LRVW8_MIWT9_4_NLCA9_SU32_SUM0_SUS256_SVW1_SKXCCM8_VWA1_WG16_16_1_WGM8_WGMXCC1_WGMXCCGn1
    SolutionIndex: 326
    SolutionNameMin: Cijk_Ailk_Bljk_HHS_BH_UserArgs_MT160x32x32_MI16x16x1_SN_LDSB0_GRVWA4_GRVWB4_GSU0_GSUC0_GSUWGMRR0_K1_LBSPPA1280_LBSPPB128_LPA16_LPB4_LRVW4_MIWT5_1_NLCA5_SU32_SUM0_SUS256_SVW1_SKXCCM0_VWA1_WG32_8_1_WGM1_WGMXCC1_WGMXCCGn1
    SolutionIndex: 327
    SolutionNameMin: Cijk_Ailk_Bljk_HHS_BH_UserArgs_MT160x32x32_MI16x16x1_SN_LDSB0_GRVWA4_GRVWB4_GSU0_GSUC0_GSUWGMRR0_K1_LBSPPA1280_LBSPPB128_LPA16_LPB4_LRVW4_MIWT5_1_NLCA5_SU32_SUM0_SUS256_SVW1_SKXCCM8_VWA1_WG32_8_1_WGM1_WGMXCC1_WGMXCCGn1
    SolutionIndex: 328
    SolutionNameMin: Cijk_Ailk_Bljk_HHS_BH_UserArgs_MT160x32x64_MI16x16x1_SN_LDSB1_GRVWA8_GRVWB8_GSU0_GSUC0_GSUWGMRR0_K1_LBSPPA2560_LBSPPB128_LPA16_LPB16_LRVW8_MIWT5_1_NLCA5_SU32_SUM0_SUS256_SVW1_SKXCCM0_VWA1_WG32_8_1_WGM8_WGMXCC1_WGMXCCGn1
    SolutionIndex: 329
    SolutionNameMin: Cijk_Ailk_Bljk_HHS_BH_UserArgs_MT160x32x64_MI16x16x1_SN_LDSB1_GRVWA8_GRVWB8_GSU0_GSUC0_GSUWGMRR0_K1_LBSPPA2560_LBSPPB128_LPA16_LPB16_LRVW8_MIWT5_1_NLCA5_SU32_SUM0_SUS256_SVW1_SKXCCM8_VWA1_WG32_8_1_WGM8_WGMXCC1_WGMXCCGn1
    SolutionIndex: 330
    SolutionNameMin: Cijk_Ailk_Bljk_HHS_BH_UserArgs_MT160x32x128_MI16x16x1_SN_LDSB1_GRVWA8_GRVWB8_GSU0_GSUC0_GSUWGMRR0_K1_LBSPPA2560_LBSPPB256_LPA16_LPB16_LRVW8_MIWT5_1_NLCA5_SU32_SUM0_SUS256_SVW1_SKXCCM0_VWA1_WG32_8_1_WGM8_WGMXCC1_WGMXCCGn1
    SolutionIndex: 331
    SolutionNameMin: Cijk_Ailk_Bljk_HHS_BH_UserArgs_MT160x32x128_MI16x16x1_SN_LDSB1_GRVWA8_GRVWB8_GSU0_GSUC0_GSUWGMRR0_K1_LBSPPA2560_LBSPPB256_LPA16_LPB16_LRVW8_MIWT5_1_NLCA5_SU32_SUM0_SUS256_SVW1_SKXCCM8_VWA1_WG32_8_1_WGM8_WGMXCC1_WGMXCCGn1
    SolutionIndex: 332
    SolutionNameMin: Cijk_Ailk_Bljk_HHS_BH_UserArgs_MT160x64x32_MI16x16x1_SN_LDSB0_GRVWA4_GRVWB4_GSU0_GSUC0_GSUWGMRR0_K1_LBSPPA1280_LBSPPB128_LPA32_LPB4_LRVW4_MIWT10_1_NLCA5_SU32_SUM0_SUS256_SVW2_SKXCCM0_VWA2_WG16_16_1_WGM8_WGMXCC1_WGMXCCGn1
    SolutionIndex: 333
    SolutionNameMin: Cijk_Ailk_Bljk_HHS_BH_UserArgs_MT160x64x32_MI16x16x1_SN_LDSB0_GRVWA4_GRVWB4_GSU0_GSUC0_GSUWGMRR0_K1_LBSPPA1280_LBSPPB128_LPA32_LPB4_LRVW4_MIWT10_1_NLCA5_SU32_SUM0_SUS256_SVW2_SKXCCM8_VWA2_WG16_16_1_WGM8_WGMXCC1_WGMXCCGn1
    SolutionIndex: 334
    SolutionNameMin: Cijk_Ailk_Bljk_HHS_BH_UserArgs_MT160x64x64_MI16x16x1_SN_LDSB1_GRVWA8_GRVWB8_GSU0_GSUC0_GSUWGMRR0_K1_LBSPPA2560_LBSPPB128_LPA32_LPB16_LRVW8_MIWT10_1_NLCA5_SU32_SUM0_SUS256_SVW2_SKXCCM0_VWA2_WG16_16_1_WGM8_WGMXCC1_WGMXCCGn1
    SolutionIndex: 335
    SolutionNameMin: Cijk_Ailk_Bljk_HHS_BH_UserArgs_MT160x64x64_MI16x16x1_SN_LDSB1_GRVWA8_GRVWB8_GSU0_GSUC0_GSUWGMRR0_K1_LBSPPA2560_LBSPPB128_LPA32_LPB16_LRVW8_MIWT10_1_NLCA5_SU32_SUM0_SUS256_SVW2_SKXCCM8_VWA2_WG16_16_1_WGM8_WGMXCC1_WGMXCCGn1
    SolutionIndex: 336
    SolutionNameMin: Cijk_Ailk_Bljk_HHS_BH_UserArgs_MT160x96x32_MI16x16x1_SN_LDSB1_GRVWA4_GRVWB4_GSU0_GSUC0_GSUWGMRR0_K1_LBSPPA1280_LBSPPB128_LPA16_LPB4_LRVW4_MIWT5_3_NLCA5_SU32_SUM0_SUS256_SVW1_SKXCCM0_VWA1_WG32_8_1_WGM8_WGMXCC1_WGMXCCGn1
    SolutionIndex: 337
    SolutionNameMin: Cijk_Ailk_Bljk_HHS_BH_UserArgs_MT160x96x32_MI16x16x1_SN_LDSB1_GRVWA4_GRVWB4_GSU0_GSUC0_GSUWGMRR0_K1_LBSPPA1280_LBSPPB128_LPA16_LPB4_LRVW4_MIWT5_3_NLCA5_SU32_SUM0_SUS256_SVW1_SKXCCM8_VWA1_WG32_8_1_WGM8_WGMXCC1_WGMXCCGn1
    SolutionIndex: 338
    SolutionNameMin: Cijk_Ailk_Bljk_HHS_BH_UserArgs_MT160x96x64_MI16x16x1_SN_LDSB1_GRVWA8_GRVWB8_GSU0_GSUC0_GSUWGMRR0_K1_LBSPPA2560_LBSPPB128_LPA16_LPB16_LRVW8_MIWT5_3_NLCA5_SU32_SUM0_SUS256_SVW1_SKXCCM0_VWA1_WG32_8_1_WGM8_WGMXCC1_WGMXCCGn1
    SolutionIndex: 339
    SolutionNameMin: Cijk_Ailk_Bljk_HHS_BH_UserArgs_MT160x96x64_MI16x16x1_SN_LDSB1_GRVWA8_GRVWB8_GSU0_GSUC0_GSUWGMRR0_K1_LBSPPA2560_LBSPPB128_LPA16_LPB16_LRVW8_MIWT5_3_NLCA5_SU32_SUM0_SUS256_SVW1_SKXCCM8_VWA1_WG32_8_1_WGM8_WGMXCC1_WGMXCCGn1
    SolutionIndex: 340
    SolutionNameMin: Cijk_Ailk_Bljk_HHS_BH_UserArgs_MT160x128x32_MI16x16x1_SN_LDSB1_GRVWA4_GRVWB4_GSU0_GSUC0_GSUWGMRR0_K1_LBSPPA1280_LBSPPB128_LPA32_LPB4_LRVW4_MIWT10_2_NLCA5_SU32_SUM0_SUS256_SVW2_SKXCCM0_VWA2_WG16_16_1_WGM8_WGMXCC1_WGMXCCGn1
    SolutionIndex: 341
    SolutionNameMin: Cijk_Ailk_Bljk_HHS_BH_UserArgs_MT160x128x32_MI16x16x1_SN_LDSB1_GRVWA4_GRVWB4_GSU0_GSUC0_GSUWGMRR0_K1_LBSPPA1280_LBSPPB128_LPA32_LPB4_LRVW4_MIWT10_2_NLCA5_SU32_SUM0_SUS256_SVW2_SKXCCM8_VWA2_WG16_16_1_WGM8_WGMXCC1_WGMXCCGn1
    SolutionIndex: 342
    SolutionNameMin: Cijk_Ailk_Bljk_HHS_BH_UserArgs_MT160x128x64_MI16x16x1_SN_LDSB1_GRVWA8_GRVWB8_GSU0_GSUC0_GSUWGMRR0_K1_LBSPPA2560_LBSPPB128_LPA32_LPB16_LRVW8_MIWT10_2_NLCA5_SU32_SUM0_SUS256_SVW2_SKXCCM0_VWA2_WG16_16_1_WGM8_WGMXCC1_WGMXCCGn1
    SolutionIndex: 343
    SolutionNameMin: Cijk_Ailk_Bljk_HHS_BH_UserArgs_MT160x128x64_MI16x16x1_SN_LDSB1_GRVWA8_GRVWB8_GSU0_GSUC0_GSUWGMRR0_K1_LBSPPA2560_LBSPPB128_LPA32_LPB16_LRVW8_MIWT10_2_NLCA5_SU32_SUM0_SUS256_SVW2_SKXCCM8_VWA2_WG16_16_1_WGM8_WGMXCC1_WGMXCCGn1
    SolutionIndex: 344
    SolutionNameMin: Cijk_Ailk_Bljk_HHS_BH_UserArgs_MT160x160x32_MI16x16x1_SN_LDSB1_GRVWA4_GRVWB4_GSU0_GSUC0_GSUWGMRR0_K1_LBSPPA1280_LBSPPB128_LPA16_LPB4_LRVW4_MIWT5_5_NLCA5_SU32_SUM0_SUS256_SVW1_SKXCCM0_VWA1_WG32_8_1_WGM8_WGMXCC1_WGMXCCGn1
    SolutionIndex: 345
    SolutionNameMin: Cijk_Ailk_Bljk_HHS_BH_UserArgs_MT160x160x32_MI16x16x1_SN_LDSB1_GRVWA4_GRVWB4_GSU0_GSUC0_GSUWGMRR0_K1_LBSPPA1280_LBSPPB128_LPA16_LPB4_LRVW4_MIWT5_5_NLCA5_SU32_SUM0_SUS256_SVW1_SKXCCM8_VWA1_WG32_8_1_WGM8_WGMXCC1_WGMXCCGn1
    SolutionIndex: 346
    SolutionNameMin: Cijk_Ailk_Bljk_HHS_BH_UserArgs_MT160x160x64_MI16x16x1_SN_LDSB1_GRVWA8_GRVWB8_GSU0_GSUC0_GSUWGMRR0_K1_LBSPPA2560_LBSPPB128_LPA16_LPB16_LRVW8_MIWT5_5_NLCA5_SU32_SUM0_SUS256_SVW1_SKXCCM0_VWA1_WG32_8_1_WGM8_WGMXCC1_WGMXCCGn1
    SolutionIndex: 347
    SolutionNameMin: Cijk_Ailk_Bljk_HHS_BH_UserArgs_MT160x160x64_MI16x16x1_SN_LDSB1_GRVWA8_GRVWB8_GSU0_GSUC0_GSUWGMRR0_K1_LBSPPA2560_LBSPPB128_LPA16_LPB16_LRVW8_MIWT5_5_NLCA5_SU32_SUM0_SUS256_SVW1_SKXCCM8_VWA1_WG32_8_1_WGM8_WGMXCC1_WGMXCCGn1
    SolutionIndex: 348
    SolutionNameMin: Cijk_Ailk_Bljk_HHS_BH_UserArgs_MT160x192x32_MI16x16x1_SN_LDSB1_GRVWA4_GRVWB4_GSU0_GSUC0_GSUWGMRR0_K1_LBSPPA1280_LBSPPB128_LPA32_LPB4_LRVW4_MIWT10_3_NLCA5_SU32_SUM0_SUS256_SVW2_SKXCCM0_VWA2_WG16_16_1_WGM8_WGMXCC1_WGMXCCGn1
    SolutionIndex: 349
    SolutionNameMin: Cijk_Ailk_Bljk_HHS_BH_UserArgs_MT160x192x32_MI16x16x1_SN_LDSB1_GRVWA4_GRVWB4_GSU0_GSUC0_GSUWGMRR0_K1_LBSPPA1280_LBSPPB128_LPA32_LPB4_LRVW4_MIWT10_3_NLCA5_SU32_SUM0_SUS256_SVW2_SKXCCM8_VWA2_WG16_16_1_WGM8_WGMXCC1_WGMXCCGn1
    SolutionIndex: 350
    SolutionNameMin: Cijk_Ailk_Bljk_HHS_BH_UserArgs_MT160x192x64_MI16x16x1_SN_LDSB1_GRVWA8_GRVWB8_GSU0_GSUC0_GSUWGMRR0_K1_LBSPPA2560_LBSPPB128_LPA32_LPB16_LRVW8_MIWT10_3_NLCA5_SU32_SUM0_SUS256_SVW2_SKXCCM0_VWA2_WG16_16_1_WGM8_WGMXCC1_WGMXCCGn1
    SolutionIndex: 351
    SolutionNameMin: Cijk_Ailk_Bljk_HHS_BH_UserArgs_MT160x192x64_MI16x16x1_SN_LDSB1_GRVWA8_GRVWB8_GSU0_GSUC0_GSUWGMRR0_K1_LBSPPA2560_LBSPPB128_LPA32_LPB16_LRVW8_MIWT10_3_NLCA5_SU32_SUM0_SUS256_SVW2_SKXCCM8_VWA2_WG16_16_1_WGM8_WGMXCC1_WGMXCCGn1
    SolutionIndex: 352
    SolutionNameMin: Cijk_Ailk_Bljk_HHS_BH_UserArgs_MT160x224x32_MI16x16x1_SN_LDSB0_GRVWA4_GRVWB4_GSU0_GSUC0_GSUWGMRR0_K1_LBSPPA1280_LBSPPB128_LPA16_LPB4_LRVW4_MIWT5_7_NLCA5_SU32_SUM0_SUS256_SVW1_SKXCCM0_VWA1_WG32_8_1_WGM8_WGMXCC1_WGMXCCGn1
    SolutionIndex: 353
    SolutionNameMin: Cijk_Ailk_Bljk_HHS_BH_UserArgs_MT160x224x32_MI16x16x1_SN_LDSB0_GRVWA4_GRVWB4_GSU0_GSUC0_GSUWGMRR0_K1_LBSPPA1280_LBSPPB128_LPA16_LPB4_LRVW4_MIWT5_7_NLCA5_SU32_SUM0_SUS256_SVW1_SKXCCM8_VWA1_WG32_8_1_WGM8_WGMXCC1_WGMXCCGn1
    SolutionIndex: 354
    SolutionNameMin: Cijk_Ailk_Bljk_HHS_BH_UserArgs_MT160x224x64_MI16x16x1_SN_LDSB1_GRVWA8_GRVWB8_GSU0_GSUC0_GSUWGMRR0_K1_LBSPPA2560_LBSPPB128_LPA16_LPB16_LRVW8_MIWT5_7_NLCA5_SU32_SUM0_SUS256_SVW1_SKXCCM0_VWA1_WG32_8_1_WGM8_WGMXCC1_WGMXCCGn1
    SolutionIndex: 355
    SolutionNameMin: Cijk_Ailk_Bljk_HHS_BH_UserArgs_MT160x224x64_MI16x16x1_SN_LDSB1_GRVWA8_GRVWB8_GSU0_GSUC0_GSUWGMRR0_K1_LBSPPA2560_LBSPPB128_LPA16_LPB16_LRVW8_MIWT5_7_NLCA5_SU32_SUM0_SUS256_SVW1_SKXCCM8_VWA1_WG32_8_1_WGM8_WGMXCC1_WGMXCCGn1
    SolutionIndex: 356
    SolutionNameMin: Cijk_Ailk_Bljk_HHS_BH_UserArgs_MT160x256x32_MI16x16x1_SN_LDSB0_GRVWA4_GRVWB4_GSU0_GSUC0_GSUWGMRR0_K1_LBSPPA1280_LBSPPB128_LPA32_LPB4_LRVW4_MIWT10_4_NLCA5_SU32_SUM0_SUS256_SVW2_SKXCCM0_VWA2_WG16_16_1_WGM8_WGMXCC1_WGMXCCGn1
    SolutionIndex: 357
    SolutionNameMin: Cijk_Ailk_Bljk_HHS_BH_UserArgs_MT160x256x32_MI16x16x1_SN_LDSB0_GRVWA4_GRVWB4_GSU0_GSUC0_GSUWGMRR0_K1_LBSPPA1280_LBSPPB128_LPA32_LPB4_LRVW4_MIWT10_4_NLCA5_SU32_SUM0_SUS256_SVW2_SKXCCM8_VWA2_WG16_16_1_WGM8_WGMXCC1_WGMXCCGn1
    SolutionIndex: 358
    SolutionNameMin: Cijk_Ailk_Bljk_HHS_BH_UserArgs_MT160x256x64_MI16x16x1_SN_LDSB1_GRVWA8_GRVWB8_GSU0_GSUC0_GSUWGMRR0_K1_LBSPPA2560_LBSPPB128_LPA32_LPB16_LRVW8_MIWT10_4_NLCA5_SU32_SUM0_SUS256_SVW2_SKXCCM0_VWA2_WG16_16_1_WGM8_WGMXCC1_WGMXCCGn1
    SolutionIndex: 359
    SolutionNameMin: Cijk_Ailk_Bljk_HHS_BH_UserArgs_MT160x256x64_MI16x16x1_SN_LDSB1_GRVWA8_GRVWB8_GSU0_GSUC0_GSUWGMRR0_K1_LBSPPA2560_LBSPPB128_LPA32_LPB16_LRVW8_MIWT10_4_NLCA5_SU32_SUM0_SUS256_SVW2_SKXCCM8_VWA2_WG16_16_1_WGM8_WGMXCC1_WGMXCCGn1
    SolutionIndex: 360
    SolutionNameMin: Cijk_Ailk_Bljk_HHS_BH_UserArgs_MT176x64x64_MI16x16x1_SN_LDSB1_GRVWA4_GRVWB8_GSU0_GSUC0_GSUWGMRR0_K1_LBSPPA2816_LBSPPB128_LPA16_LPB16_LRVW8_MIWT11_1_NLCA11_SU32_SUM0_SUS256_SVW1_SKXCCM0_VWA1_WG16_16_1_WGM8_WGMXCC1_WGMXCCGn1
    SolutionIndex: 361
    SolutionNameMin: Cijk_Ailk_Bljk_HHS_BH_UserArgs_MT176x64x64_MI16x16x1_SN_LDSB1_GRVWA4_GRVWB8_GSU0_GSUC0_GSUWGMRR0_K1_LBSPPA2816_LBSPPB128_LPA16_LPB16_LRVW8_MIWT11_1_NLCA11_SU32_SUM0_SUS256_SVW1_SKXCCM8_VWA1_WG16_16_1_WGM8_WGMXCC1_WGMXCCGn1
    SolutionIndex: 362
    SolutionNameMin: Cijk_Ailk_Bljk_HHS_BH_UserArgs_MT176x128x32_MI16x16x1_SN_LDSB1_GRVWA2_GRVWB4_GSU0_GSUC0_GSUWGMRR0_K1_LBSPPA1408_LBSPPB128_LPA16_LPB4_LRVW4_MIWT11_2_NLCA11_SU32_SUM0_SUS256_SVW1_SKXCCM0_VWA1_WG16_16_1_WGM8_WGMXCC1_WGMXCCGn1
    SolutionIndex: 363
    SolutionNameMin: Cijk_Ailk_Bljk_HHS_BH_UserArgs_MT176x128x32_MI16x16x1_SN_LDSB1_GRVWA2_GRVWB4_GSU0_GSUC0_GSUWGMRR0_K1_LBSPPA1408_LBSPPB128_LPA16_LPB4_LRVW4_MIWT11_2_NLCA11_SU32_SUM0_SUS256_SVW1_SKXCCM8_VWA1_WG16_16_1_WGM8_WGMXCC1_WGMXCCGn1
    SolutionIndex: 364
    SolutionNameMin: Cijk_Ailk_Bljk_HHS_BH_UserArgs_MT176x128x64_MI16x16x1_SN_LDSB1_GRVWA4_GRVWB8_GSU0_GSUC0_GSUWGMRR0_K1_LBSPPA2816_LBSPPB128_LPA16_LPB16_LRVW8_MIWT11_2_NLCA11_SU32_SUM0_SUS256_SVW1_SKXCCM0_VWA1_WG16_16_1_WGM8_WGMXCC1_WGMXCCGn1
    SolutionIndex: 365
    SolutionNameMin: Cijk_Ailk_Bljk_HHS_BH_UserArgs_MT176x128x64_MI16x16x1_SN_LDSB1_GRVWA4_GRVWB8_GSU0_GSUC0_GSUWGMRR0_K1_LBSPPA2816_LBSPPB128_LPA16_LPB16_LRVW8_MIWT11_2_NLCA11_SU32_SUM0_SUS256_SVW1_SKXCCM8_VWA1_WG16_16_1_WGM8_WGMXCC1_WGMXCCGn1
    SolutionIndex: 366
    SolutionNameMin: Cijk_Ailk_Bljk_HHS_BH_UserArgs_MT176x192x32_MI16x16x1_SN_LDSB0_GRVWA2_GRVWB4_GSU0_GSUC0_GSUWGMRR0_K1_LBSPPA1408_LBSPPB128_LPA16_LPB4_LRVW4_MIWT11_3_NLCA11_SU32_SUM0_SUS256_SVW1_SKXCCM0_VWA1_WG16_16_1_WGM8_WGMXCC1_WGMXCCGn1
    SolutionIndex: 367
    SolutionNameMin: Cijk_Ailk_Bljk_HHS_BH_UserArgs_MT176x192x32_MI16x16x1_SN_LDSB0_GRVWA2_GRVWB4_GSU0_GSUC0_GSUWGMRR0_K1_LBSPPA1408_LBSPPB128_LPA16_LPB4_LRVW4_MIWT11_3_NLCA11_SU32_SUM0_SUS256_SVW1_SKXCCM8_VWA1_WG16_16_1_WGM8_WGMXCC1_WGMXCCGn1
    SolutionIndex: 368
    SolutionNameMin: Cijk_Ailk_Bljk_HHS_BH_UserArgs_MT176x256x32_MI16x16x1_SN_LDSB0_GRVWA2_GRVWB4_GSU0_GSUC0_GSUWGMRR0_K1_LBSPPA1408_LBSPPB128_LPA16_LPB4_LRVW4_MIWT11_4_NLCA11_SU32_SUM0_SUS256_SVW1_SKXCCM0_VWA1_WG16_16_1_WGM8_WGMXCC1_WGMXCCGn1
    SolutionIndex: 369
    SolutionNameMin: Cijk_Ailk_Bljk_HHS_BH_UserArgs_MT176x256x32_MI16x16x1_SN_LDSB0_GRVWA2_GRVWB4_GSU0_GSUC0_GSUWGMRR0_K1_LBSPPA1408_LBSPPB128_LPA16_LPB4_LRVW4_MIWT11_4_NLCA11_SU32_SUM0_SUS256_SVW1_SKXCCM8_VWA1_WG16_16_1_WGM8_WGMXCC1_WGMXCCGn1
    SolutionIndex: 370
    SolutionNameMin: Cijk_Ailk_Bljk_HHS_BH_UserArgs_MT192x16x32_MI16x16x1_SN_LDSB0_GRVWA8_GRVWB2_GSU0_GSUC0_GSUWGMRR0_K1_LBSPPA1536_LBSPPB128_LPA16_LPB4_LRVW4_MIWT3_1_NLCA3_SU32_SUM0_SUS256_SVW1_SKXCCM0_VWA1_WG64_4_1_WGM8_WGMXCC1_WGMXCCGn1
    SolutionIndex: 371
    SolutionNameMin: Cijk_Ailk_Bljk_HHS_BH_UserArgs_MT192x16x32_MI16x16x1_SN_LDSB0_GRVWA8_GRVWB2_GSU0_GSUC0_GSUWGMRR0_K1_LBSPPA1536_LBSPPB128_LPA16_LPB4_LRVW4_MIWT3_1_NLCA3_SU32_SUM0_SUS256_SVW1_SKXCCM8_VWA1_WG64_4_1_WGM8_WGMXCC1_WGMXCCGn1
    SolutionIndex: 372
    SolutionNameMin: Cijk_Ailk_Bljk_HHS_BH_UserArgs_MT192x16x64_MI16x16x1_SN_LDSB1_GRVWA8_GRVWB4_GSU0_GSUC0_GSUWGMRR0_K1_LBSPPA3072_LBSPPB128_LPA16_LPB16_LRVW8_MIWT3_1_NLCA3_SU32_SUM0_SUS256_SVW1_SKXCCM0_VWA1_WG64_4_1_WGM8_WGMXCC1_WGMXCCGn1
    SolutionIndex: 373
    SolutionNameMin: Cijk_Ailk_Bljk_HHS_BH_UserArgs_MT192x16x64_MI16x16x1_SN_LDSB1_GRVWA8_GRVWB4_GSU0_GSUC0_GSUWGMRR0_K1_LBSPPA3072_LBSPPB128_LPA16_LPB16_LRVW8_MIWT3_1_NLCA3_SU32_SUM0_SUS256_SVW1_SKXCCM8_VWA1_WG64_4_1_WGM8_WGMXCC1_WGMXCCGn1
    SolutionIndex: 374
    SolutionNameMin: Cijk_Ailk_Bljk_HHS_BH_UserArgs_MT192x16x128_MI16x16x1_SN_LDSB1_GRVWA8_GRVWB8_GSU0_GSUC0_GSUWGMRR0_K1_LBSPPA3072_LBSPPB256_LPA16_LPB16_LRVW8_MIWT3_1_NLCA3_SU32_SUM0_SUS256_SVW1_SKXCCM0_VWA1_WG64_4_1_WGM8_WGMXCC1_WGMXCCGn1
    SolutionIndex: 375
    SolutionNameMin: Cijk_Ailk_Bljk_HHS_BH_UserArgs_MT192x16x128_MI16x16x1_SN_LDSB1_GRVWA8_GRVWB8_GSU0_GSUC0_GSUWGMRR0_K1_LBSPPA3072_LBSPPB256_LPA16_LPB16_LRVW8_MIWT3_1_NLCA3_SU32_SUM0_SUS256_SVW1_SKXCCM8_VWA1_WG64_4_1_WGM8_WGMXCC1_WGMXCCGn1
    SolutionIndex: 376
    SolutionNameMin: Cijk_Ailk_Bljk_HHS_BH_UserArgs_MT192x32x32_MI16x16x1_SN_LDSB0_GRVWA8_GRVWB4_GSU0_GSUC0_GSUWGMRR0_K1_LBSPPA1536_LBSPPB128_LPA32_LPB4_LRVW4_MIWT6_1_NLCA3_SU32_SUM0_SUS256_SVW2_SKXCCM0_VWA2_WG32_8_1_WGM8_WGMXCC1_WGMXCCGn1
    SolutionIndex: 377
    SolutionNameMin: Cijk_Ailk_Bljk_HHS_BH_UserArgs_MT192x32x32_MI16x16x1_SN_LDSB0_GRVWA8_GRVWB4_GSU0_GSUC0_GSUWGMRR0_K1_LBSPPA1536_LBSPPB128_LPA32_LPB4_LRVW4_MIWT6_1_NLCA3_SU32_SUM0_SUS256_SVW2_SKXCCM8_VWA2_WG32_8_1_WGM8_WGMXCC1_WGMXCCGn1
    SolutionIndex: 378
    SolutionNameMin: Cijk_Ailk_Bljk_HHS_BH_UserArgs_MT192x32x64_MI16x16x1_SN_LDSB1_GRVWA8_GRVWB8_GSU0_GSUC0_GSUWGMRR0_K1_LBSPPA3072_LBSPPB128_LPA32_LPB16_LRVW8_MIWT6_1_NLCA3_SU32_SUM0_SUS256_SVW2_SKXCCM0_VWA2_WG32_8_1_WGM8_WGMXCC1_WGMXCCGn1
    SolutionIndex: 379
    SolutionNameMin: Cijk_Ailk_Bljk_HHS_BH_UserArgs_MT192x32x64_MI16x16x1_SN_LDSB1_GRVWA8_GRVWB8_GSU0_GSUC0_GSUWGMRR0_K1_LBSPPA3072_LBSPPB128_LPA32_LPB16_LRVW8_MIWT6_1_NLCA3_SU32_SUM0_SUS256_SVW2_SKXCCM8_VWA2_WG32_8_1_WGM8_WGMXCC1_WGMXCCGn1
    SolutionIndex: 380
    SolutionNameMin: Cijk_Ailk_Bljk_HHS_BH_UserArgs_MT192x32x128_MI16x16x1_SN_LDSB1_GRVWA8_GRVWB8_GSU0_GSUC0_GSUWGMRR0_K1_LBSPPA3072_LBSPPB256_LPA32_LPB16_LRVW8_MIWT6_1_NLCA3_SU32_SUM0_SUS256_SVW2_SKXCCM0_VWA2_WG32_8_1_WGM8_WGMXCC1_WGMXCCGn1
    SolutionIndex: 381
    SolutionNameMin: Cijk_Ailk_Bljk_HHS_BH_UserArgs_MT192x32x128_MI16x16x1_SN_LDSB1_GRVWA8_GRVWB8_GSU0_GSUC0_GSUWGMRR0_K1_LBSPPA3072_LBSPPB256_LPA32_LPB16_LRVW8_MIWT6_1_NLCA3_SU32_SUM0_SUS256_SVW2_SKXCCM8_VWA2_WG32_8_1_WGM8_WGMXCC1_WGMXCCGn1
    SolutionIndex: 382
    SolutionNameMin: Cijk_Ailk_Bljk_HHS_BH_UserArgs_MT192x48x32_MI16x16x1_SN_LDSB0_GRVWA8_GRVWB2_GSU0_GSUC0_GSUWGMRR0_K1_LBSPPA1536_LBSPPB128_LPA16_LPB4_LRVW4_MIWT3_3_NLCA3_SU32_SUM0_SUS256_SVW1_SKXCCM0_VWA1_WG64_4_1_WGM8_WGMXCC1_WGMXCCGn1
    SolutionIndex: 383
    SolutionNameMin: Cijk_Ailk_Bljk_HHS_BH_UserArgs_MT192x48x32_MI16x16x1_SN_LDSB0_GRVWA8_GRVWB2_GSU0_GSUC0_GSUWGMRR0_K1_LBSPPA1536_LBSPPB128_LPA16_LPB4_LRVW4_MIWT3_3_NLCA3_SU32_SUM0_SUS256_SVW1_SKXCCM8_VWA1_WG64_4_1_WGM8_WGMXCC1_WGMXCCGn1
    SolutionIndex: 384
    SolutionNameMin: Cijk_Ailk_Bljk_HHS_BH_UserArgs_MT192x48x64_MI16x16x1_SN_LDSB1_GRVWA8_GRVWB4_GSU0_GSUC0_GSUWGMRR0_K1_LBSPPA3072_LBSPPB128_LPA16_LPB16_LRVW8_MIWT3_3_NLCA3_SU32_SUM0_SUS256_SVW1_SKXCCM0_VWA1_WG64_4_1_WGM1_WGMXCC1_WGMXCCGn1
    SolutionIndex: 385
    SolutionNameMin: Cijk_Ailk_Bljk_HHS_BH_UserArgs_MT192x48x64_MI16x16x1_SN_LDSB1_GRVWA8_GRVWB4_GSU0_GSUC0_GSUWGMRR0_K1_LBSPPA3072_LBSPPB128_LPA16_LPB16_LRVW8_MIWT3_3_NLCA3_SU32_SUM0_SUS256_SVW1_SKXCCM8_VWA1_WG64_4_1_WGM1_WGMXCC1_WGMXCCGn1
    SolutionIndex: 386
    SolutionNameMin: Cijk_Ailk_Bljk_HHS_BH_UserArgs_MT192x48x128_MI16x16x1_SN_LDSB1_GRVWA8_GRVWB8_GSU0_GSUC0_GSUWGMRR0_K1_LBSPPA3072_LBSPPB256_LPA16_LPB16_LRVW8_MIWT3_3_NLCA3_SU32_SUM0_SUS256_SVW1_SKXCCM0_VWA1_WG64_4_1_WGM8_WGMXCC1_WGMXCCGn1
    SolutionIndex: 387
    SolutionNameMin: Cijk_Ailk_Bljk_HHS_BH_UserArgs_MT192x48x128_MI16x16x1_SN_LDSB1_GRVWA8_GRVWB8_GSU0_GSUC0_GSUWGMRR0_K1_LBSPPA3072_LBSPPB256_LPA16_LPB16_LRVW8_MIWT3_3_NLCA3_SU32_SUM0_SUS256_SVW1_SKXCCM8_VWA1_WG64_4_1_WGM8_WGMXCC1_WGMXCCGn1
    SolutionIndex: 388
    SolutionNameMin: Cijk_Ailk_Bljk_HHS_BH_UserArgs_MT192x64x32_MI16x16x1_SN_LDSB1_GRVWA8_GRVWB4_GSU0_GSUC0_GSUWGMRR0_K1_LBSPPA1536_LBSPPB128_LPA32_LPB4_LRVW4_MIWT6_2_NLCA3_SU32_SUM0_SUS256_SVW2_SKXCCM0_VWA2_WG32_8_1_WGM8_WGMXCC1_WGMXCCGn1
    SolutionIndex: 389
    SolutionNameMin: Cijk_Ailk_Bljk_HHS_BH_UserArgs_MT192x64x32_MI16x16x1_SN_LDSB1_GRVWA8_GRVWB4_GSU0_GSUC0_GSUWGMRR0_K1_LBSPPA1536_LBSPPB128_LPA32_LPB4_LRVW4_MIWT6_2_NLCA3_SU32_SUM0_SUS256_SVW2_SKXCCM8_VWA2_WG32_8_1_WGM8_WGMXCC1_WGMXCCGn1
    SolutionIndex: 390
    SolutionNameMin: Cijk_Ailk_Bljk_HHS_BH_UserArgs_MT192x64x64_MI16x16x1_SN_LDSB1_GRVWA8_GRVWB8_GSU0_GSUC0_GSUWGMRR0_K1_LBSPPA3072_LBSPPB128_LPA32_LPB16_LRVW8_MIWT6_2_NLCA3_SU32_SUM0_SUS256_SVW2_SKXCCM0_VWA2_WG32_8_1_WGM8_WGMXCC1_WGMXCCGn1
    SolutionIndex: 391
    SolutionNameMin: Cijk_Ailk_Bljk_HHS_BH_UserArgs_MT192x64x64_MI16x16x1_SN_LDSB1_GRVWA8_GRVWB8_GSU0_GSUC0_GSUWGMRR0_K1_LBSPPA3072_LBSPPB128_LPA32_LPB16_LRVW8_MIWT6_2_NLCA3_SU32_SUM0_SUS256_SVW2_SKXCCM8_VWA2_WG32_8_1_WGM8_WGMXCC1_WGMXCCGn1
    SolutionIndex: 392
    SolutionNameMin: Cijk_Ailk_Bljk_HHS_BH_UserArgs_MT192x80x32_MI16x16x1_SN_LDSB1_GRVWA8_GRVWB2_GSU0_GSUC0_GSUWGMRR0_K1_LBSPPA1536_LBSPPB128_LPA16_LPB4_LRVW4_MIWT3_5_NLCA3_SU32_SUM0_SUS256_SVW1_SKXCCM0_VWA1_WG64_4_1_WGM8_WGMXCC1_WGMXCCGn1
    SolutionIndex: 393
    SolutionNameMin: Cijk_Ailk_Bljk_HHS_BH_UserArgs_MT192x80x32_MI16x16x1_SN_LDSB1_GRVWA8_GRVWB2_GSU0_GSUC0_GSUWGMRR0_K1_LBSPPA1536_LBSPPB128_LPA16_LPB4_LRVW4_MIWT3_5_NLCA3_SU32_SUM0_SUS256_SVW1_SKXCCM8_VWA1_WG64_4_1_WGM8_WGMXCC1_WGMXCCGn1
    SolutionIndex: 394
    SolutionNameMin: Cijk_Ailk_Bljk_HHS_BH_UserArgs_MT192x80x64_MI16x16x1_SN_LDSB1_GRVWA8_GRVWB4_GSU0_GSUC0_GSUWGMRR0_K1_LBSPPA3072_LBSPPB128_LPA16_LPB16_LRVW8_MIWT3_5_NLCA3_SU32_SUM0_SUS256_SVW1_SKXCCM0_VWA1_WG64_4_1_WGM8_WGMXCC1_WGMXCCGn1
    SolutionIndex: 395
    SolutionNameMin: Cijk_Ailk_Bljk_HHS_BH_UserArgs_MT192x80x64_MI16x16x1_SN_LDSB1_GRVWA8_GRVWB4_GSU0_GSUC0_GSUWGMRR0_K1_LBSPPA3072_LBSPPB128_LPA16_LPB16_LRVW8_MIWT3_5_NLCA3_SU32_SUM0_SUS256_SVW1_SKXCCM8_VWA1_WG64_4_1_WGM8_WGMXCC1_WGMXCCGn1
    SolutionIndex: 396
    SolutionNameMin: Cijk_Ailk_Bljk_HHS_BH_UserArgs_MT192x96x32_MI16x16x1_SN_LDSB1_GRVWA8_GRVWB4_GSU0_GSUC0_GSUWGMRR0_K1_LBSPPA1536_LBSPPB128_LPA32_LPB4_LRVW4_MIWT6_3_NLCA3_SU32_SUM0_SUS256_SVW2_SKXCCM0_VWA2_WG32_8_1_WGM8_WGMXCC1_WGMXCCGn1
    SolutionIndex: 397
    SolutionNameMin: Cijk_Ailk_Bljk_HHS_BH_UserArgs_MT192x96x32_MI16x16x1_SN_LDSB1_GRVWA8_GRVWB4_GSU0_GSUC0_GSUWGMRR0_K1_LBSPPA1536_LBSPPB128_LPA32_LPB4_LRVW4_MIWT6_3_NLCA3_SU32_SUM0_SUS256_SVW2_SKXCCM8_VWA2_WG32_8_1_WGM8_WGMXCC1_WGMXCCGn1
    SolutionIndex: 398
    SolutionNameMin: Cijk_Ailk_Bljk_HHS_BH_UserArgs_MT192x96x64_MI16x16x1_SN_LDSB1_GRVWA8_GRVWB8_GSU0_GSUC0_GSUWGMRR0_K1_LBSPPA3072_LBSPPB128_LPA32_LPB16_LRVW8_MIWT6_3_NLCA3_SU32_SUM0_SUS256_SVW2_SKXCCM0_VWA2_WG32_8_1_WGM8_WGMXCC1_WGMXCCGn1
    SolutionIndex: 399
    SolutionNameMin: Cijk_Ailk_Bljk_HHS_BH_UserArgs_MT192x96x64_MI16x16x1_SN_LDSB1_GRVWA8_GRVWB8_GSU0_GSUC0_GSUWGMRR0_K1_LBSPPA3072_LBSPPB128_LPA32_LPB16_LRVW8_MIWT6_3_NLCA3_SU32_SUM0_SUS256_SVW2_SKXCCM8_VWA2_WG32_8_1_WGM8_WGMXCC1_WGMXCCGn1
    SolutionIndex: 400
    SolutionNameMin: Cijk_Ailk_Bljk_HHS_BH_UserArgs_MT192x112x32_MI16x16x1_SN_LDSB1_GRVWA8_GRVWB2_GSU0_GSUC0_GSUWGMRR0_K1_LBSPPA1536_LBSPPB128_LPA16_LPB4_LRVW4_MIWT3_7_NLCA3_SU32_SUM0_SUS256_SVW1_SKXCCM0_VWA1_WG64_4_1_WGM8_WGMXCC1_WGMXCCGn1
    SolutionIndex: 401
    SolutionNameMin: Cijk_Ailk_Bljk_HHS_BH_UserArgs_MT192x112x32_MI16x16x1_SN_LDSB1_GRVWA8_GRVWB2_GSU0_GSUC0_GSUWGMRR0_K1_LBSPPA1536_LBSPPB128_LPA16_LPB4_LRVW4_MIWT3_7_NLCA3_SU32_SUM0_SUS256_SVW1_SKXCCM8_VWA1_WG64_4_1_WGM8_WGMXCC1_WGMXCCGn1
    SolutionIndex: 402
    SolutionNameMin: Cijk_Ailk_Bljk_HHS_BH_UserArgs_MT192x112x64_MI16x16x1_SN_LDSB1_GRVWA8_GRVWB4_GSU0_GSUC0_GSUWGMRR0_K1_LBSPPA3072_LBSPPB128_LPA16_LPB16_LRVW8_MIWT3_7_NLCA3_SU32_SUM0_SUS256_SVW1_SKXCCM0_VWA1_WG64_4_1_WGM8_WGMXCC1_WGMXCCGn1
    SolutionIndex: 403
    SolutionNameMin: Cijk_Ailk_Bljk_HHS_BH_UserArgs_MT192x112x64_MI16x16x1_SN_LDSB1_GRVWA8_GRVWB4_GSU0_GSUC0_GSUWGMRR0_K1_LBSPPA3072_LBSPPB128_LPA16_LPB16_LRVW8_MIWT3_7_NLCA3_SU32_SUM0_SUS256_SVW1_SKXCCM8_VWA1_WG64_4_1_WGM8_WGMXCC1_WGMXCCGn1
    SolutionIndex: 404
    SolutionNameMin: Cijk_Ailk_Bljk_HHS_BH_UserArgs_MT192x128x32_MI16x16x1_SN_LDSB1_GRVWA8_GRVWB4_GSU0_GSUC0_GSUWGMRR0_K1_LBSPPA1536_LBSPPB128_LPA0_LPB4_LRVW4_MIWT12_2_NLCA3_SU32_SUM0_SUS256_SVW4_SKXCCM0_VWA4_WG16_16_1_WGM8_WGMXCC1_WGMXCCGn1
    SolutionIndex: 405
    SolutionNameMin: Cijk_Ailk_Bljk_HHS_BH_UserArgs_MT192x128x32_MI16x16x1_SN_LDSB1_GRVWA8_GRVWB4_GSU0_GSUC0_GSUWGMRR0_K1_LBSPPA1536_LBSPPB128_LPA0_LPB4_LRVW4_MIWT12_2_NLCA3_SU32_SUM0_SUS256_SVW4_SKXCCM8_VWA4_WG16_16_1_WGM8_WGMXCC1_WGMXCCGn1
    SolutionIndex: 406
    SolutionNameMin: Cijk_Ailk_Bljk_HHS_BH_UserArgs_MT192x128x64_MI16x16x1_SN_LDSB1_GRVWA8_GRVWB8_GSU0_GSUC0_GSUWGMRR0_K1_LBSPPA3072_LBSPPB128_LPA0_LPB16_LRVW8_MIWT12_2_NLCA3_SU32_SUM0_SUS256_SVW4_SKXCCM0_VWA4_WG16_16_1_WGM8_WGMXCC1_WGMXCCGn1
    SolutionIndex: 407
    SolutionNameMin: Cijk_Ailk_Bljk_HHS_BH_UserArgs_MT192x128x64_MI16x16x1_SN_LDSB1_GRVWA8_GRVWB8_GSU0_GSUC0_GSUWGMRR0_K1_LBSPPA3072_LBSPPB128_LPA0_LPB16_LRVW8_MIWT12_2_NLCA3_SU32_SUM0_SUS256_SVW4_SKXCCM8_VWA4_WG16_16_1_WGM8_WGMXCC1_WGMXCCGn1
    SolutionIndex: 408
    SolutionNameMin: Cijk_Ailk_Bljk_HHS_BH_UserArgs_MT192x144x32_MI16x16x1_SN_LDSB1_GRVWA8_GRVWB2_GSU0_GSUC0_GSUWGMRR0_K1_LBSPPA1536_LBSPPB128_LPA16_LPB4_LRVW4_MIWT3_9_NLCA3_SU32_SUM0_SUS256_SVW1_SKXCCM0_VWA1_WG64_4_1_WGM8_WGMXCC1_WGMXCCGn1
    SolutionIndex: 409
    SolutionNameMin: Cijk_Ailk_Bljk_HHS_BH_UserArgs_MT192x144x32_MI16x16x1_SN_LDSB1_GRVWA8_GRVWB2_GSU0_GSUC0_GSUWGMRR0_K1_LBSPPA1536_LBSPPB128_LPA16_LPB4_LRVW4_MIWT3_9_NLCA3_SU32_SUM0_SUS256_SVW1_SKXCCM8_VWA1_WG64_4_1_WGM8_WGMXCC1_WGMXCCGn1
    SolutionIndex: 410
    SolutionNameMin: Cijk_Ailk_Bljk_HHS_BH_UserArgs_MT192x144x64_MI16x16x1_SN_LDSB1_GRVWA8_GRVWB4_GSU0_GSUC0_GSUWGMRR0_K1_LBSPPA3072_LBSPPB128_LPA16_LPB16_LRVW8_MIWT3_9_NLCA3_SU32_SUM0_SUS256_SVW1_SKXCCM0_VWA1_WG64_4_1_WGM8_WGMXCC1_WGMXCCGn1
    SolutionIndex: 411
    SolutionNameMin: Cijk_Ailk_Bljk_HHS_BH_UserArgs_MT192x144x64_MI16x16x1_SN_LDSB1_GRVWA8_GRVWB4_GSU0_GSUC0_GSUWGMRR0_K1_LBSPPA3072_LBSPPB128_LPA16_LPB16_LRVW8_MIWT3_9_NLCA3_SU32_SUM0_SUS256_SVW1_SKXCCM8_VWA1_WG64_4_1_WGM8_WGMXCC1_WGMXCCGn1
    SolutionIndex: 412
    SolutionNameMin: Cijk_Ailk_Bljk_HHS_BH_UserArgs_MT192x160x32_MI16x16x1_SN_LDSB1_GRVWA8_GRVWB4_GSU0_GSUC0_GSUWGMRR0_K1_LBSPPA1536_LBSPPB128_LPA32_LPB4_LRVW4_MIWT6_5_NLCA3_SU32_SUM0_SUS256_SVW2_SKXCCM0_VWA2_WG32_8_1_WGM8_WGMXCC1_WGMXCCGn1
    SolutionIndex: 413
    SolutionNameMin: Cijk_Ailk_Bljk_HHS_BH_UserArgs_MT192x160x32_MI16x16x1_SN_LDSB1_GRVWA8_GRVWB4_GSU0_GSUC0_GSUWGMRR0_K1_LBSPPA1536_LBSPPB128_LPA32_LPB4_LRVW4_MIWT6_5_NLCA3_SU32_SUM0_SUS256_SVW2_SKXCCM8_VWA2_WG32_8_1_WGM8_WGMXCC1_WGMXCCGn1
    SolutionIndex: 414
    SolutionNameMin: Cijk_Ailk_Bljk_HHS_BH_UserArgs_MT192x160x64_MI16x16x1_SN_LDSB1_GRVWA8_GRVWB8_GSU0_GSUC0_GSUWGMRR0_K1_LBSPPA3072_LBSPPB128_LPA32_LPB16_LRVW8_MIWT6_5_NLCA3_SU32_SUM0_SUS256_SVW2_SKXCCM0_VWA2_WG32_8_1_WGM8_WGMXCC1_WGMXCCGn1
    SolutionIndex: 415
    SolutionNameMin: Cijk_Ailk_Bljk_HHS_BH_UserArgs_MT192x160x64_MI16x16x1_SN_LDSB1_GRVWA8_GRVWB8_GSU0_GSUC0_GSUWGMRR0_K1_LBSPPA3072_LBSPPB128_LPA32_LPB16_LRVW8_MIWT6_5_NLCA3_SU32_SUM0_SUS256_SVW2_SKXCCM8_VWA2_WG32_8_1_WGM8_WGMXCC1_WGMXCCGn1
    SolutionIndex: 416
    SolutionNameMin: Cijk_Ailk_Bljk_HHS_BH_UserArgs_MT192x176x32_MI16x16x1_SN_LDSB0_GRVWA8_GRVWB2_GSU0_GSUC0_GSUWGMRR0_K1_LBSPPA1536_LBSPPB128_LPA16_LPB4_LRVW4_MIWT3_11_NLCA3_SU32_SUM0_SUS256_SVW1_SKXCCM0_VWA1_WG64_4_1_WGM8_WGMXCC1_WGMXCCGn1
    SolutionIndex: 417
    SolutionNameMin: Cijk_Ailk_Bljk_HHS_BH_UserArgs_MT192x176x32_MI16x16x1_SN_LDSB0_GRVWA8_GRVWB2_GSU0_GSUC0_GSUWGMRR0_K1_LBSPPA1536_LBSPPB128_LPA16_LPB4_LRVW4_MIWT3_11_NLCA3_SU32_SUM0_SUS256_SVW1_SKXCCM8_VWA1_WG64_4_1_WGM8_WGMXCC1_WGMXCCGn1
    SolutionIndex: 418
    SolutionNameMin: Cijk_Ailk_Bljk_HHS_BH_UserArgs_MT192x176x64_MI16x16x1_SN_LDSB1_GRVWA8_GRVWB4_GSU0_GSUC0_GSUWGMRR0_K1_LBSPPA3072_LBSPPB128_LPA16_LPB16_LRVW8_MIWT3_11_NLCA3_SU32_SUM0_SUS256_SVW1_SKXCCM0_VWA1_WG64_4_1_WGM8_WGMXCC1_WGMXCCGn1
    SolutionIndex: 419
    SolutionNameMin: Cijk_Ailk_Bljk_HHS_BH_UserArgs_MT192x176x64_MI16x16x1_SN_LDSB1_GRVWA8_GRVWB4_GSU0_GSUC0_GSUWGMRR0_K1_LBSPPA3072_LBSPPB128_LPA16_LPB16_LRVW8_MIWT3_11_NLCA3_SU32_SUM0_SUS256_SVW1_SKXCCM8_VWA1_WG64_4_1_WGM8_WGMXCC1_WGMXCCGn1
    SolutionIndex: 420
    SolutionNameMin: Cijk_Ailk_Bljk_HHS_BH_UserArgs_MT192x192x32_MI16x16x1_SN_LDSB0_GRVWA8_GRVWB4_GSU0_GSUC0_GSUWGMRR0_K1_LBSPPA1536_LBSPPB128_LPA32_LPB4_LRVW4_MIWT6_6_NLCA3_SU32_SUM0_SUS256_SVW2_SKXCCM0_VWA2_WG32_8_1_WGM8_WGMXCC1_WGMXCCGn1
    SolutionIndex: 421
    SolutionNameMin: Cijk_Ailk_Bljk_HHS_BH_UserArgs_MT192x192x32_MI16x16x1_SN_LDSB0_GRVWA8_GRVWB4_GSU0_GSUC0_GSUWGMRR0_K1_LBSPPA1536_LBSPPB128_LPA32_LPB4_LRVW4_MIWT6_6_NLCA3_SU32_SUM0_SUS256_SVW2_SKXCCM8_VWA2_WG32_8_1_WGM8_WGMXCC1_WGMXCCGn1
    SolutionIndex: 422
    SolutionNameMin: Cijk_Ailk_Bljk_HHS_BH_UserArgs_MT192x192x64_MI16x16x1_SN_LDSB1_GRVWA8_GRVWB8_GSU0_GSUC0_GSUWGMRR0_K1_LBSPPA3072_LBSPPB128_LPA32_LPB16_LRVW8_MIWT6_6_NLCA3_SU32_SUM0_SUS256_SVW2_SKXCCM0_VWA2_WG32_8_1_WGM8_WGMXCC1_WGMXCCGn1
    SolutionIndex: 423
    SolutionNameMin: Cijk_Ailk_Bljk_HHS_BH_UserArgs_MT192x192x64_MI16x16x1_SN_LDSB1_GRVWA8_GRVWB8_GSU0_GSUC0_GSUWGMRR0_K1_LBSPPA3072_LBSPPB128_LPA32_LPB16_LRVW8_MIWT6_6_NLCA3_SU32_SUM0_SUS256_SVW2_SKXCCM8_VWA2_WG32_8_1_WGM8_WGMXCC1_WGMXCCGn1
    SolutionIndex: 424
    SolutionNameMin: Cijk_Ailk_Bljk_HHS_BH_UserArgs_MT192x208x32_MI16x16x1_SN_LDSB0_GRVWA8_GRVWB2_GSU0_GSUC0_GSUWGMRR0_K1_LBSPPA1536_LBSPPB128_LPA16_LPB4_LRVW4_MIWT3_13_NLCA3_SU32_SUM0_SUS256_SVW1_SKXCCM0_VWA1_WG64_4_1_WGM8_WGMXCC1_WGMXCCGn1
    SolutionIndex: 425
    SolutionNameMin: Cijk_Ailk_Bljk_HHS_BH_UserArgs_MT192x208x32_MI16x16x1_SN_LDSB0_GRVWA8_GRVWB2_GSU0_GSUC0_GSUWGMRR0_K1_LBSPPA1536_LBSPPB128_LPA16_LPB4_LRVW4_MIWT3_13_NLCA3_SU32_SUM0_SUS256_SVW1_SKXCCM8_VWA1_WG64_4_1_WGM8_WGMXCC1_WGMXCCGn1
    SolutionIndex: 426
    SolutionNameMin: Cijk_Ailk_Bljk_HHS_BH_UserArgs_MT192x208x64_MI16x16x1_SN_LDSB1_GRVWA8_GRVWB4_GSU0_GSUC0_GSUWGMRR0_K1_LBSPPA3072_LBSPPB128_LPA16_LPB16_LRVW8_MIWT3_13_NLCA3_SU32_SUM0_SUS256_SVW1_SKXCCM0_VWA1_WG64_4_1_WGM8_WGMXCC1_WGMXCCGn1
    SolutionIndex: 427
    SolutionNameMin: Cijk_Ailk_Bljk_HHS_BH_UserArgs_MT192x208x64_MI16x16x1_SN_LDSB1_GRVWA8_GRVWB4_GSU0_GSUC0_GSUWGMRR0_K1_LBSPPA3072_LBSPPB128_LPA16_LPB16_LRVW8_MIWT3_13_NLCA3_SU32_SUM0_SUS256_SVW1_SKXCCM8_VWA1_WG64_4_1_WGM8_WGMXCC1_WGMXCCGn1
    SolutionIndex: 428
    SolutionNameMin: Cijk_Ailk_Bljk_HHS_BH_UserArgs_MT192x224x32_MI16x16x1_SN_LDSB0_GRVWA8_GRVWB4_GSU0_GSUC0_GSUWGMRR0_K1_LBSPPA1536_LBSPPB128_LPA16_LPB4_LRVW4_MIWT3_14_NLCA3_SU32_SUM0_SUS256_SVW1_SKXCCM0_VWA1_WG64_4_1_WGM8_WGMXCC1_WGMXCCGn1
    SolutionIndex: 429
    SolutionNameMin: Cijk_Ailk_Bljk_HHS_BH_UserArgs_MT192x224x32_MI16x16x1_SN_LDSB0_GRVWA8_GRVWB4_GSU0_GSUC0_GSUWGMRR0_K1_LBSPPA1536_LBSPPB128_LPA16_LPB4_LRVW4_MIWT3_14_NLCA3_SU32_SUM0_SUS256_SVW1_SKXCCM8_VWA1_WG64_4_1_WGM8_WGMXCC1_WGMXCCGn1
    SolutionIndex: 430
    SolutionNameMin: Cijk_Ailk_Bljk_HHS_BH_UserArgs_MT192x224x64_MI16x16x1_SN_LDSB1_GRVWA8_GRVWB8_GSU0_GSUC0_GSUWGMRR0_K1_LBSPPA3072_LBSPPB128_LPA16_LPB16_LRVW8_MIWT3_14_NLCA3_SU32_SUM0_SUS256_SVW1_SKXCCM0_VWA1_WG64_4_1_WGM8_WGMXCC1_WGMXCCGn1
    SolutionIndex: 431
    SolutionNameMin: Cijk_Ailk_Bljk_HHS_BH_UserArgs_MT192x224x64_MI16x16x1_SN_LDSB1_GRVWA8_GRVWB8_GSU0_GSUC0_GSUWGMRR0_K1_LBSPPA3072_LBSPPB128_LPA16_LPB16_LRVW8_MIWT3_14_NLCA3_SU32_SUM0_SUS256_SVW1_SKXCCM8_VWA1_WG64_4_1_WGM8_WGMXCC1_WGMXCCGn1
    SolutionIndex: 432
    SolutionNameMin: Cijk_Ailk_Bljk_HHS_BH_UserArgs_MT192x240x32_MI16x16x1_SN_LDSB0_GRVWA8_GRVWB2_GSU0_GSUC0_GSUWGMRR0_K1_LBSPPA1536_LBSPPB128_LPA16_LPB4_LRVW4_MIWT3_15_NLCA3_SU32_SUM0_SUS256_SVW1_SKXCCM0_VWA1_WG64_4_1_WGM8_WGMXCC1_WGMXCCGn1
    SolutionIndex: 433
    SolutionNameMin: Cijk_Ailk_Bljk_HHS_BH_UserArgs_MT192x240x32_MI16x16x1_SN_LDSB0_GRVWA8_GRVWB2_GSU0_GSUC0_GSUWGMRR0_K1_LBSPPA1536_LBSPPB128_LPA16_LPB4_LRVW4_MIWT3_15_NLCA3_SU32_SUM0_SUS256_SVW1_SKXCCM8_VWA1_WG64_4_1_WGM8_WGMXCC1_WGMXCCGn1
    SolutionIndex: 434
    SolutionNameMin: Cijk_Ailk_Bljk_HHS_BH_UserArgs_MT192x240x64_MI16x16x1_SN_LDSB1_GRVWA8_GRVWB4_GSU0_GSUC0_GSUWGMRR0_K1_LBSPPA3072_LBSPPB128_LPA16_LPB16_LRVW8_MIWT3_15_NLCA3_SU32_SUM0_SUS256_SVW1_SKXCCM0_VWA1_WG64_4_1_WGM8_WGMXCC1_WGMXCCGn1
    SolutionIndex: 435
    SolutionNameMin: Cijk_Ailk_Bljk_HHS_BH_UserArgs_MT192x240x64_MI16x16x1_SN_LDSB1_GRVWA8_GRVWB4_GSU0_GSUC0_GSUWGMRR0_K1_LBSPPA3072_LBSPPB128_LPA16_LPB16_LRVW8_MIWT3_15_NLCA3_SU32_SUM0_SUS256_SVW1_SKXCCM8_VWA1_WG64_4_1_WGM8_WGMXCC1_WGMXCCGn1
    SolutionIndex: 436
    SolutionNameMin: Cijk_Ailk_Bljk_HHS_BH_UserArgs_MT192x256x32_MI16x16x1_SN_LDSB0_GRVWA8_GRVWB4_GSU0_GSUC0_GSUWGMRR0_K1_LBSPPA1536_LBSPPB128_LPA32_LPB4_LRVW4_MIWT6_8_NLCA3_SU32_SUM0_SUS256_SVW2_SKXCCM0_VWA2_WG32_8_1_WGM8_WGMXCC1_WGMXCCGn1
    SolutionIndex: 437
    SolutionNameMin: Cijk_Ailk_Bljk_HHS_BH_UserArgs_MT192x256x32_MI16x16x1_SN_LDSB0_GRVWA8_GRVWB4_GSU0_GSUC0_GSUWGMRR0_K1_LBSPPA1536_LBSPPB128_LPA32_LPB4_LRVW4_MIWT6_8_NLCA3_SU32_SUM0_SUS256_SVW2_SKXCCM8_VWA2_WG32_8_1_WGM8_WGMXCC1_WGMXCCGn1
    SolutionIndex: 438
    SolutionNameMin: Cijk_Ailk_Bljk_HHS_BH_UserArgs_MT208x128x32_MI16x16x1_SN_LDSB1_GRVWA2_GRVWB4_GSU0_GSUC0_GSUWGMRR0_K1_LBSPPA1664_LBSPPB128_LPA16_LPB4_LRVW4_MIWT13_2_NLCA13_SU32_SUM0_SUS256_SVW1_SKXCCM0_VWA1_WG16_16_1_WGM8_WGMXCC1_WGMXCCGn1
    SolutionIndex: 439
    SolutionNameMin: Cijk_Ailk_Bljk_HHS_BH_UserArgs_MT208x128x32_MI16x16x1_SN_LDSB1_GRVWA2_GRVWB4_GSU0_GSUC0_GSUWGMRR0_K1_LBSPPA1664_LBSPPB128_LPA16_LPB4_LRVW4_MIWT13_2_NLCA13_SU32_SUM0_SUS256_SVW1_SKXCCM8_VWA1_WG16_16_1_WGM8_WGMXCC1_WGMXCCGn1
    SolutionIndex: 440
    SolutionNameMin: Cijk_Ailk_Bljk_HHS_BH_UserArgs_MT208x192x32_MI16x16x1_SN_LDSB0_GRVWA2_GRVWB4_GSU0_GSUC0_GSUWGMRR0_K1_LBSPPA1664_LBSPPB128_LPA16_LPB4_LRVW4_MIWT13_3_NLCA13_SU32_SUM0_SUS256_SVW1_SKXCCM0_VWA1_WG16_16_1_WGM8_WGMXCC1_WGMXCCGn1
    SolutionIndex: 441
    SolutionNameMin: Cijk_Ailk_Bljk_HHS_BH_UserArgs_MT208x192x32_MI16x16x1_SN_LDSB0_GRVWA2_GRVWB4_GSU0_GSUC0_GSUWGMRR0_K1_LBSPPA1664_LBSPPB128_LPA16_LPB4_LRVW4_MIWT13_3_NLCA13_SU32_SUM0_SUS256_SVW1_SKXCCM8_VWA1_WG16_16_1_WGM8_WGMXCC1_WGMXCCGn1
    SolutionIndex: 442
    SolutionNameMin: Cijk_Ailk_Bljk_HHS_BH_UserArgs_MT208x256x32_MI16x16x1_SN_LDSB0_GRVWA2_GRVWB4_GSU0_GSUC0_GSUWGMRR0_K1_LBSPPA1664_LBSPPB128_LPA16_LPB4_LRVW4_MIWT13_4_NLCA13_SU32_SUM0_SUS256_SVW1_SKXCCM0_VWA1_WG16_16_1_WGM8_WGMXCC1_WGMXCCGn1
    SolutionIndex: 443
    SolutionNameMin: Cijk_Ailk_Bljk_HHS_BH_UserArgs_MT208x256x32_MI16x16x1_SN_LDSB0_GRVWA2_GRVWB4_GSU0_GSUC0_GSUWGMRR0_K1_LBSPPA1664_LBSPPB128_LPA16_LPB4_LRVW4_MIWT13_4_NLCA13_SU32_SUM0_SUS256_SVW1_SKXCCM8_VWA1_WG16_16_1_WGM8_WGMXCC1_WGMXCCGn1
    SolutionIndex: 444
    SolutionNameMin: Cijk_Ailk_Bljk_HHS_BH_UserArgs_MT224x32x32_MI16x16x1_SN_LDSB1_GRVWA4_GRVWB4_GSU0_GSUC0_GSUWGMRR0_K1_LBSPPA1792_LBSPPB128_LPA16_LPB4_LRVW4_MIWT7_1_NLCA7_SU32_SUM0_SUS256_SVW1_SKXCCM0_VWA1_WG32_8_1_WGM8_WGMXCC1_WGMXCCGn1
    SolutionIndex: 445
    SolutionNameMin: Cijk_Ailk_Bljk_HHS_BH_UserArgs_MT224x32x32_MI16x16x1_SN_LDSB1_GRVWA4_GRVWB4_GSU0_GSUC0_GSUWGMRR0_K1_LBSPPA1792_LBSPPB128_LPA16_LPB4_LRVW4_MIWT7_1_NLCA7_SU32_SUM0_SUS256_SVW1_SKXCCM8_VWA1_WG32_8_1_WGM8_WGMXCC1_WGMXCCGn1
    SolutionIndex: 446
    SolutionNameMin: Cijk_Ailk_Bljk_HHS_BH_UserArgs_MT224x32x64_MI16x16x1_SN_LDSB1_GRVWA8_GRVWB8_GSU0_GSUC0_GSUWGMRR0_K1_LBSPPA3584_LBSPPB128_LPA16_LPB16_LRVW8_MIWT7_1_NLCA7_SU32_SUM0_SUS256_SVW1_SKXCCM0_VWA1_WG32_8_1_WGM8_WGMXCC1_WGMXCCGn1
    SolutionIndex: 447
    SolutionNameMin: Cijk_Ailk_Bljk_HHS_BH_UserArgs_MT224x32x64_MI16x16x1_SN_LDSB1_GRVWA8_GRVWB8_GSU0_GSUC0_GSUWGMRR0_K1_LBSPPA3584_LBSPPB128_LPA16_LPB16_LRVW8_MIWT7_1_NLCA7_SU32_SUM0_SUS256_SVW1_SKXCCM8_VWA1_WG32_8_1_WGM8_WGMXCC1_WGMXCCGn1
    SolutionIndex: 448
    SolutionNameMin: Cijk_Ailk_Bljk_HHS_BH_UserArgs_MT224x64x32_MI16x16x1_SN_LDSB1_GRVWA4_GRVWB4_GSU0_GSUC0_GSUWGMRR0_K1_LBSPPA1792_LBSPPB128_LPA32_LPB4_LRVW4_MIWT14_1_NLCA7_SU32_SUM0_SUS256_SVW2_SKXCCM0_VWA2_WG16_16_1_WGM8_WGMXCC1_WGMXCCGn1
    SolutionIndex: 449
    SolutionNameMin: Cijk_Ailk_Bljk_HHS_BH_UserArgs_MT224x64x32_MI16x16x1_SN_LDSB1_GRVWA4_GRVWB4_GSU0_GSUC0_GSUWGMRR0_K1_LBSPPA1792_LBSPPB128_LPA32_LPB4_LRVW4_MIWT14_1_NLCA7_SU32_SUM0_SUS256_SVW2_SKXCCM8_VWA2_WG16_16_1_WGM8_WGMXCC1_WGMXCCGn1
    SolutionIndex: 450
    SolutionNameMin: Cijk_Ailk_Bljk_HHS_BH_UserArgs_MT224x64x64_MI16x16x1_SN_LDSB1_GRVWA8_GRVWB8_GSU0_GSUC0_GSUWGMRR0_K1_LBSPPA3584_LBSPPB128_LPA32_LPB16_LRVW8_MIWT14_1_NLCA7_SU32_SUM0_SUS256_SVW2_SKXCCM0_VWA2_WG16_16_1_WGM8_WGMXCC1_WGMXCCGn1
    SolutionIndex: 451
    SolutionNameMin: Cijk_Ailk_Bljk_HHS_BH_UserArgs_MT224x64x64_MI16x16x1_SN_LDSB1_GRVWA8_GRVWB8_GSU0_GSUC0_GSUWGMRR0_K1_LBSPPA3584_LBSPPB128_LPA32_LPB16_LRVW8_MIWT14_1_NLCA7_SU32_SUM0_SUS256_SVW2_SKXCCM8_VWA2_WG16_16_1_WGM8_WGMXCC1_WGMXCCGn1
    SolutionIndex: 452
    SolutionNameMin: Cijk_Ailk_Bljk_HHS_BH_UserArgs_MT224x96x32_MI16x16x1_SN_LDSB1_GRVWA4_GRVWB4_GSU0_GSUC0_GSUWGMRR0_K1_LBSPPA1792_LBSPPB128_LPA16_LPB4_LRVW4_MIWT7_3_NLCA7_SU32_SUM0_SUS256_SVW1_SKXCCM0_VWA1_WG32_8_1_WGM8_WGMXCC1_WGMXCCGn1
    SolutionIndex: 453
    SolutionNameMin: Cijk_Ailk_Bljk_HHS_BH_UserArgs_MT224x96x32_MI16x16x1_SN_LDSB1_GRVWA4_GRVWB4_GSU0_GSUC0_GSUWGMRR0_K1_LBSPPA1792_LBSPPB128_LPA16_LPB4_LRVW4_MIWT7_3_NLCA7_SU32_SUM0_SUS256_SVW1_SKXCCM8_VWA1_WG32_8_1_WGM8_WGMXCC1_WGMXCCGn1
    SolutionIndex: 454
    SolutionNameMin: Cijk_Ailk_Bljk_HHS_BH_UserArgs_MT224x96x64_MI16x16x1_SN_LDSB1_GRVWA8_GRVWB8_GSU0_GSUC0_GSUWGMRR0_K1_LBSPPA3584_LBSPPB128_LPA16_LPB16_LRVW8_MIWT7_3_NLCA7_SU32_SUM0_SUS256_SVW1_SKXCCM0_VWA1_WG32_8_1_WGM8_WGMXCC1_WGMXCCGn1
    SolutionIndex: 455
    SolutionNameMin: Cijk_Ailk_Bljk_HHS_BH_UserArgs_MT224x96x64_MI16x16x1_SN_LDSB1_GRVWA8_GRVWB8_GSU0_GSUC0_GSUWGMRR0_K1_LBSPPA3584_LBSPPB128_LPA16_LPB16_LRVW8_MIWT7_3_NLCA7_SU32_SUM0_SUS256_SVW1_SKXCCM8_VWA1_WG32_8_1_WGM8_WGMXCC1_WGMXCCGn1
    SolutionIndex: 456
    SolutionNameMin: Cijk_Ailk_Bljk_HHS_BH_UserArgs_MT224x128x32_MI16x16x1_SN_LDSB1_GRVWA4_GRVWB4_GSU0_GSUC0_GSUWGMRR0_K1_LBSPPA1792_LBSPPB128_LPA32_LPB4_LRVW4_MIWT14_2_NLCA7_SU32_SUM0_SUS256_SVW2_SKXCCM0_VWA2_WG16_16_1_WGM8_WGMXCC1_WGMXCCGn1
    SolutionIndex: 457
    SolutionNameMin: Cijk_Ailk_Bljk_HHS_BH_UserArgs_MT224x128x32_MI16x16x1_SN_LDSB1_GRVWA4_GRVWB4_GSU0_GSUC0_GSUWGMRR0_K1_LBSPPA1792_LBSPPB128_LPA32_LPB4_LRVW4_MIWT14_2_NLCA7_SU32_SUM0_SUS256_SVW2_SKXCCM8_VWA2_WG16_16_1_WGM8_WGMXCC1_WGMXCCGn1
    SolutionIndex: 458
    SolutionNameMin: Cijk_Ailk_Bljk_HHS_BH_UserArgs_MT224x128x64_MI16x16x1_SN_LDSB1_GRVWA8_GRVWB8_GSU0_GSUC0_GSUWGMRR0_K1_LBSPPA3584_LBSPPB128_LPA32_LPB16_LRVW8_MIWT14_2_NLCA7_SU32_SUM0_SUS256_SVW2_SKXCCM0_VWA2_WG16_16_1_WGM8_WGMXCC1_WGMXCCGn1
    SolutionIndex: 459
    SolutionNameMin: Cijk_Ailk_Bljk_HHS_BH_UserArgs_MT224x128x64_MI16x16x1_SN_LDSB1_GRVWA8_GRVWB8_GSU0_GSUC0_GSUWGMRR0_K1_LBSPPA3584_LBSPPB128_LPA32_LPB16_LRVW8_MIWT14_2_NLCA7_SU32_SUM0_SUS256_SVW2_SKXCCM8_VWA2_WG16_16_1_WGM8_WGMXCC1_WGMXCCGn1
    SolutionIndex: 460
    SolutionNameMin: Cijk_Ailk_Bljk_HHS_BH_UserArgs_MT224x160x32_MI16x16x1_SN_LDSB0_GRVWA4_GRVWB4_GSU0_GSUC0_GSUWGMRR0_K1_LBSPPA1792_LBSPPB128_LPA16_LPB4_LRVW4_MIWT7_5_NLCA7_SU32_SUM0_SUS256_SVW1_SKXCCM0_VWA1_WG32_8_1_WGM8_WGMXCC1_WGMXCCGn1
    SolutionIndex: 461
    SolutionNameMin: Cijk_Ailk_Bljk_HHS_BH_UserArgs_MT224x160x32_MI16x16x1_SN_LDSB0_GRVWA4_GRVWB4_GSU0_GSUC0_GSUWGMRR0_K1_LBSPPA1792_LBSPPB128_LPA16_LPB4_LRVW4_MIWT7_5_NLCA7_SU32_SUM0_SUS256_SVW1_SKXCCM8_VWA1_WG32_8_1_WGM8_WGMXCC1_WGMXCCGn1
    SolutionIndex: 462
    SolutionNameMin: Cijk_Ailk_Bljk_HHS_BH_UserArgs_MT224x160x64_MI16x16x1_SN_LDSB1_GRVWA8_GRVWB8_GSU0_GSUC0_GSUWGMRR0_K1_LBSPPA3584_LBSPPB128_LPA16_LPB16_LRVW8_MIWT7_5_NLCA7_SU32_SUM0_SUS256_SVW1_SKXCCM0_VWA1_WG32_8_1_WGM8_WGMXCC1_WGMXCCGn1
    SolutionIndex: 463
    SolutionNameMin: Cijk_Ailk_Bljk_HHS_BH_UserArgs_MT224x160x64_MI16x16x1_SN_LDSB1_GRVWA8_GRVWB8_GSU0_GSUC0_GSUWGMRR0_K1_LBSPPA3584_LBSPPB128_LPA16_LPB16_LRVW8_MIWT7_5_NLCA7_SU32_SUM0_SUS256_SVW1_SKXCCM8_VWA1_WG32_8_1_WGM8_WGMXCC1_WGMXCCGn1
    SolutionIndex: 464
    SolutionNameMin: Cijk_Ailk_Bljk_HHS_BH_UserArgs_MT224x192x32_MI16x16x1_SN_LDSB0_GRVWA4_GRVWB4_GSU0_GSUC0_GSUWGMRR0_K1_LBSPPA1792_LBSPPB128_LPA16_LPB4_LRVW4_MIWT7_6_NLCA7_SU32_SUM0_SUS256_SVW1_SKXCCM0_VWA1_WG32_8_1_WGM8_WGMXCC1_WGMXCCGn1
    SolutionIndex: 465
    SolutionNameMin: Cijk_Ailk_Bljk_HHS_BH_UserArgs_MT224x192x32_MI16x16x1_SN_LDSB0_GRVWA4_GRVWB4_GSU0_GSUC0_GSUWGMRR0_K1_LBSPPA1792_LBSPPB128_LPA16_LPB4_LRVW4_MIWT7_6_NLCA7_SU32_SUM0_SUS256_SVW1_SKXCCM8_VWA1_WG32_8_1_WGM8_WGMXCC1_WGMXCCGn1
    SolutionIndex: 466
    SolutionNameMin: Cijk_Ailk_Bljk_HHS_BH_UserArgs_MT224x192x64_MI16x16x1_SN_LDSB1_GRVWA8_GRVWB8_GSU0_GSUC0_GSUWGMRR0_K1_LBSPPA3584_LBSPPB128_LPA16_LPB16_LRVW8_MIWT7_6_NLCA7_SU32_SUM0_SUS256_SVW1_SKXCCM0_VWA1_WG32_8_1_WGM8_WGMXCC1_WGMXCCGn1
    SolutionIndex: 467
    SolutionNameMin: Cijk_Ailk_Bljk_HHS_BH_UserArgs_MT224x192x64_MI16x16x1_SN_LDSB1_GRVWA8_GRVWB8_GSU0_GSUC0_GSUWGMRR0_K1_LBSPPA3584_LBSPPB128_LPA16_LPB16_LRVW8_MIWT7_6_NLCA7_SU32_SUM0_SUS256_SVW1_SKXCCM8_VWA1_WG32_8_1_WGM8_WGMXCC1_WGMXCCGn1
    SolutionIndex: 468
    SolutionNameMin: Cijk_Ailk_Bljk_HHS_BH_UserArgs_MT224x224x32_MI16x16x1_SN_LDSB0_GRVWA4_GRVWB4_GSU0_GSUC0_GSUWGMRR0_K1_LBSPPA1792_LBSPPB128_LPA16_LPB4_LRVW4_MIWT7_7_NLCA7_SU32_SUM0_SUS256_SVW1_SKXCCM0_VWA1_WG32_8_1_WGM8_WGMXCC1_WGMXCCGn1
    SolutionIndex: 469
    SolutionNameMin: Cijk_Ailk_Bljk_HHS_BH_UserArgs_MT224x224x32_MI16x16x1_SN_LDSB0_GRVWA4_GRVWB4_GSU0_GSUC0_GSUWGMRR0_K1_LBSPPA1792_LBSPPB128_LPA16_LPB4_LRVW4_MIWT7_7_NLCA7_SU32_SUM0_SUS256_SVW1_SKXCCM8_VWA1_WG32_8_1_WGM8_WGMXCC1_WGMXCCGn1
    SolutionIndex: 470
    SolutionNameMin: Cijk_Ailk_Bljk_HHS_BH_UserArgs_MT224x224x64_MI16x16x1_SN_LDSB1_GRVWA8_GRVWB8_GSU0_GSUC0_GSUWGMRR0_K1_LBSPPA3584_LBSPPB128_LPA16_LPB16_LRVW8_MIWT7_7_NLCA7_SU32_SUM0_SUS256_SVW1_SKXCCM0_VWA1_WG32_8_1_WGM8_WGMXCC1_WGMXCCGn1
    SolutionIndex: 471
    SolutionNameMin: Cijk_Ailk_Bljk_HHS_BH_UserArgs_MT224x224x64_MI16x16x1_SN_LDSB1_GRVWA8_GRVWB8_GSU0_GSUC0_GSUWGMRR0_K1_LBSPPA3584_LBSPPB128_LPA16_LPB16_LRVW8_MIWT7_7_NLCA7_SU32_SUM0_SUS256_SVW1_SKXCCM8_VWA1_WG32_8_1_WGM8_WGMXCC1_WGMXCCGn1
    SolutionIndex: 472
    SolutionNameMin: Cijk_Ailk_Bljk_HHS_BH_UserArgs_MT224x256x32_MI16x16x1_SN_LDSB0_GRVWA4_GRVWB4_GSU0_GSUC0_GSUWGMRR0_K1_LBSPPA1792_LBSPPB128_LPA32_LPB4_LRVW4_MIWT14_4_NLCA7_SU32_SUM0_SUS256_SVW2_SKXCCM0_VWA2_WG16_16_1_WGM8_WGMXCC1_WGMXCCGn1
    SolutionIndex: 473
    SolutionNameMin: Cijk_Ailk_Bljk_HHS_BH_UserArgs_MT224x256x32_MI16x16x1_SN_LDSB0_GRVWA4_GRVWB4_GSU0_GSUC0_GSUWGMRR0_K1_LBSPPA1792_LBSPPB128_LPA32_LPB4_LRVW4_MIWT14_4_NLCA7_SU32_SUM0_SUS256_SVW2_SKXCCM8_VWA2_WG16_16_1_WGM8_WGMXCC1_WGMXCCGn1
    SolutionIndex: 474
    SolutionNameMin: Cijk_Ailk_Bljk_HHS_BH_UserArgs_MT240x192x32_MI16x16x1_SN_LDSB0_GRVWA2_GRVWB4_GSU0_GSUC0_GSUWGMRR0_K1_LBSPPA1920_LBSPPB128_LPA16_LPB4_LRVW4_MIWT15_3_NLCA15_SU32_SUM0_SUS256_SVW1_SKXCCM0_VWA1_WG16_16_1_WGM8_WGMXCC1_WGMXCCGn1
    SolutionIndex: 475
    SolutionNameMin: Cijk_Ailk_Bljk_HHS_BH_UserArgs_MT240x192x32_MI16x16x1_SN_LDSB0_GRVWA2_GRVWB4_GSU0_GSUC0_GSUWGMRR0_K1_LBSPPA1920_LBSPPB128_LPA16_LPB4_LRVW4_MIWT15_3_NLCA15_SU32_SUM0_SUS256_SVW1_SKXCCM8_VWA1_WG16_16_1_WGM8_WGMXCC1_WGMXCCGn1
    SolutionIndex: 476
    SolutionNameMin: Cijk_Ailk_Bljk_HHS_BH_UserArgs_MT240x256x32_MI16x16x1_SN_LDSB1_GRVWA2_GRVWB4_GSU0_GSUC0_GSUWGMRR0_K1_LBSPPA1920_LBSPPB128_LPA16_LPB4_LRVW4_MIWT15_4_NLCA15_SU32_SUM0_SUS256_SVW1_SKXCCM0_VWA1_WG16_16_1_WGM8_WGMXCC1_WGMXCCGn1
    SolutionIndex: 477
    SolutionNameMin: Cijk_Ailk_Bljk_HHS_BH_UserArgs_MT240x256x32_MI16x16x1_SN_LDSB1_GRVWA2_GRVWB4_GSU0_GSUC0_GSUWGMRR0_K1_LBSPPA1920_LBSPPB128_LPA16_LPB4_LRVW4_MIWT15_4_NLCA15_SU32_SUM0_SUS256_SVW1_SKXCCM8_VWA1_WG16_16_1_WGM8_WGMXCC1_WGMXCCGn1
    SolutionIndex: 478
    SolutionNameMin: Cijk_Ailk_Bljk_HHS_BH_UserArgs_MT256x16x32_MI16x16x1_SN_LDSB1_GRVWA8_GRVWB2_GSU0_GSUC0_GSUWGMRR0_K1_LBSPPA2048_LBSPPB128_LPA0_LPB4_LRVW4_MIWT4_1_NLCA1_SU32_SUM0_SUS256_SVW4_SKXCCM0_VWA4_WG64_4_1_WGM8_WGMXCC1_WGMXCCGn1
    SolutionIndex: 479
    SolutionNameMin: Cijk_Ailk_Bljk_HHS_BH_UserArgs_MT256x16x32_MI16x16x1_SN_LDSB1_GRVWA8_GRVWB2_GSU0_GSUC0_GSUWGMRR0_K1_LBSPPA2048_LBSPPB128_LPA0_LPB4_LRVW4_MIWT4_1_NLCA1_SU32_SUM0_SUS256_SVW4_SKXCCM8_VWA4_WG64_4_1_WGM8_WGMXCC1_WGMXCCGn1
    SolutionIndex: 480
    SolutionNameMin: Cijk_Ailk_Bljk_HHS_BH_UserArgs_MT256x16x64_MI16x16x1_SN_LDSB1_GRVWA8_GRVWB4_GSU0_GSUC0_GSUWGMRR0_K1_LBSPPA4096_LBSPPB128_LPA0_LPB16_LRVW8_MIWT4_1_NLCA1_SU32_SUM0_SUS256_SVW4_SKXCCM0_VWA4_WG64_4_1_WGM8_WGMXCC1_WGMXCCGn1
    SolutionIndex: 481
    SolutionNameMin: Cijk_Ailk_Bljk_HHS_BH_UserArgs_MT256x16x64_MI16x16x1_SN_LDSB1_GRVWA8_GRVWB4_GSU0_GSUC0_GSUWGMRR0_K1_LBSPPA4096_LBSPPB128_LPA0_LPB16_LRVW8_MIWT4_1_NLCA1_SU32_SUM0_SUS256_SVW4_SKXCCM8_VWA4_WG64_4_1_WGM8_WGMXCC1_WGMXCCGn1
    SolutionIndex: 482
    SolutionNameMin: Cijk_Ailk_Bljk_HHS_BH_UserArgs_MT256x32x32_MI16x16x1_SN_LDSB1_GRVWA8_GRVWB4_GSU0_GSUC0_GSUWGMRR0_K1_LBSPPA2048_LBSPPB128_LPA0_LPB4_LRVW4_MIWT4_2_NLCA1_SU32_SUM0_SUS256_SVW4_SKXCCM0_VWA4_WG64_4_1_WGM8_WGMXCC1_WGMXCCGn1
    SolutionIndex: 483
    SolutionNameMin: Cijk_Ailk_Bljk_HHS_BH_UserArgs_MT256x32x32_MI16x16x1_SN_LDSB1_GRVWA8_GRVWB4_GSU0_GSUC0_GSUWGMRR0_K1_LBSPPA2048_LBSPPB128_LPA0_LPB4_LRVW4_MIWT4_2_NLCA1_SU32_SUM0_SUS256_SVW4_SKXCCM8_VWA4_WG64_4_1_WGM8_WGMXCC1_WGMXCCGn1
    SolutionIndex: 484
    SolutionNameMin: Cijk_Ailk_Bljk_HHS_BH_UserArgs_MT256x32x64_MI16x16x1_SN_LDSB1_GRVWA8_GRVWB8_GSU0_GSUC0_GSUWGMRR0_K1_LBSPPA4096_LBSPPB128_LPA0_LPB16_LRVW8_MIWT4_2_NLCA1_SU32_SUM0_SUS256_SVW4_SKXCCM0_VWA4_WG64_4_1_WGM8_WGMXCC1_WGMXCCGn1
    SolutionIndex: 485
    SolutionNameMin: Cijk_Ailk_Bljk_HHS_BH_UserArgs_MT256x32x64_MI16x16x1_SN_LDSB1_GRVWA8_GRVWB8_GSU0_GSUC0_GSUWGMRR0_K1_LBSPPA4096_LBSPPB128_LPA0_LPB16_LRVW8_MIWT4_2_NLCA1_SU32_SUM0_SUS256_SVW4_SKXCCM8_VWA4_WG64_4_1_WGM8_WGMXCC1_WGMXCCGn1
    SolutionIndex: 486
    SolutionNameMin: Cijk_Ailk_Bljk_HHS_BH_UserArgs_MT256x48x32_MI16x16x1_SN_LDSB1_GRVWA8_GRVWB2_GSU0_GSUC0_GSUWGMRR0_K1_LBSPPA2048_LBSPPB128_LPA0_LPB4_LRVW4_MIWT4_3_NLCA1_SU32_SUM0_SUS256_SVW4_SKXCCM0_VWA4_WG64_4_1_WGM8_WGMXCC1_WGMXCCGn1
    SolutionIndex: 487
    SolutionNameMin: Cijk_Ailk_Bljk_HHS_BH_UserArgs_MT256x48x32_MI16x16x1_SN_LDSB1_GRVWA8_GRVWB2_GSU0_GSUC0_GSUWGMRR0_K1_LBSPPA2048_LBSPPB128_LPA0_LPB4_LRVW4_MIWT4_3_NLCA1_SU32_SUM0_SUS256_SVW4_SKXCCM8_VWA4_WG64_4_1_WGM8_WGMXCC1_WGMXCCGn1
    SolutionIndex: 488
    SolutionNameMin: Cijk_Ailk_Bljk_HHS_BH_UserArgs_MT256x48x64_MI16x16x1_SN_LDSB1_GRVWA8_GRVWB4_GSU0_GSUC0_GSUWGMRR0_K1_LBSPPA4096_LBSPPB128_LPA0_LPB16_LRVW8_MIWT4_3_NLCA1_SU32_SUM0_SUS256_SVW4_SKXCCM0_VWA4_WG64_4_1_WGM8_WGMXCC1_WGMXCCGn1
    SolutionIndex: 489
    SolutionNameMin: Cijk_Ailk_Bljk_HHS_BH_UserArgs_MT256x48x64_MI16x16x1_SN_LDSB1_GRVWA8_GRVWB4_GSU0_GSUC0_GSUWGMRR0_K1_LBSPPA4096_LBSPPB128_LPA0_LPB16_LRVW8_MIWT4_3_NLCA1_SU32_SUM0_SUS256_SVW4_SKXCCM8_VWA4_WG64_4_1_WGM8_WGMXCC1_WGMXCCGn1
    SolutionIndex: 490
    SolutionNameMin: Cijk_Ailk_Bljk_HHS_BH_UserArgs_MT256x64x32_MI16x16x1_SN_LDSB1_GRVWA8_GRVWB4_GSU0_GSUC0_GSUWGMRR0_K1_LBSPPA2048_LBSPPB128_LPA0_LPB4_LRVW4_MIWT4_4_NLCA1_SU32_SUM0_SUS256_SVW4_SKXCCM0_VWA4_WG64_4_1_WGM8_WGMXCC1_WGMXCCGn1
    SolutionIndex: 491
    SolutionNameMin: Cijk_Ailk_Bljk_HHS_BH_UserArgs_MT256x64x32_MI16x16x1_SN_LDSB1_GRVWA8_GRVWB4_GSU0_GSUC0_GSUWGMRR0_K1_LBSPPA2048_LBSPPB128_LPA0_LPB4_LRVW4_MIWT4_4_NLCA1_SU32_SUM0_SUS256_SVW4_SKXCCM8_VWA4_WG64_4_1_WGM8_WGMXCC1_WGMXCCGn1
    SolutionIndex: 492
    SolutionNameMin: Cijk_Ailk_Bljk_HHS_BH_UserArgs_MT256x64x64_MI16x16x1_SN_LDSB1_GRVWA8_GRVWB8_GSU0_GSUC0_GSUWGMRR0_K1_LBSPPA4096_LBSPPB128_LPA0_LPB16_LRVW8_MIWT4_4_NLCA1_SU32_SUM0_SUS256_SVW4_SKXCCM0_VWA4_WG64_4_1_WGM8_WGMXCC1_WGMXCCGn1
    SolutionIndex: 493
    SolutionNameMin: Cijk_Ailk_Bljk_HHS_BH_UserArgs_MT256x64x64_MI16x16x1_SN_LDSB1_GRVWA8_GRVWB8_GSU0_GSUC0_GSUWGMRR0_K1_LBSPPA4096_LBSPPB128_LPA0_LPB16_LRVW8_MIWT4_4_NLCA1_SU32_SUM0_SUS256_SVW4_SKXCCM8_VWA4_WG64_4_1_WGM8_WGMXCC1_WGMXCCGn1
    SolutionIndex: 494
    SolutionNameMin: Cijk_Ailk_Bljk_HHS_BH_UserArgs_MT256x80x32_MI16x16x1_SN_LDSB1_GRVWA8_GRVWB2_GSU0_GSUC0_GSUWGMRR0_K1_LBSPPA2048_LBSPPB128_LPA0_LPB4_LRVW4_MIWT4_5_NLCA1_SU32_SUM0_SUS256_SVW4_SKXCCM0_VWA4_WG64_4_1_WGM8_WGMXCC1_WGMXCCGn1
    SolutionIndex: 495
    SolutionNameMin: Cijk_Ailk_Bljk_HHS_BH_UserArgs_MT256x80x32_MI16x16x1_SN_LDSB1_GRVWA8_GRVWB2_GSU0_GSUC0_GSUWGMRR0_K1_LBSPPA2048_LBSPPB128_LPA0_LPB4_LRVW4_MIWT4_5_NLCA1_SU32_SUM0_SUS256_SVW4_SKXCCM8_VWA4_WG64_4_1_WGM8_WGMXCC1_WGMXCCGn1
    SolutionIndex: 496
    SolutionNameMin: Cijk_Ailk_Bljk_HHS_BH_UserArgs_MT256x80x64_MI16x16x1_SN_LDSB1_GRVWA8_GRVWB4_GSU0_GSUC0_GSUWGMRR0_K1_LBSPPA4096_LBSPPB128_LPA0_LPB16_LRVW8_MIWT4_5_NLCA1_SU32_SUM0_SUS256_SVW4_SKXCCM0_VWA4_WG64_4_1_WGM8_WGMXCC1_WGMXCCGn1
    SolutionIndex: 497
    SolutionNameMin: Cijk_Ailk_Bljk_HHS_BH_UserArgs_MT256x80x64_MI16x16x1_SN_LDSB1_GRVWA8_GRVWB4_GSU0_GSUC0_GSUWGMRR0_K1_LBSPPA4096_LBSPPB128_LPA0_LPB16_LRVW8_MIWT4_5_NLCA1_SU32_SUM0_SUS256_SVW4_SKXCCM8_VWA4_WG64_4_1_WGM8_WGMXCC1_WGMXCCGn1
    SolutionIndex: 498
    SolutionNameMin: Cijk_Ailk_Bljk_HHS_BH_UserArgs_MT256x96x32_MI16x16x1_SN_LDSB1_GRVWA8_GRVWB4_GSU0_GSUC0_GSUWGMRR0_K1_LBSPPA2048_LBSPPB128_LPA0_LPB4_LRVW4_MIWT4_6_NLCA1_SU32_SUM0_SUS256_SVW4_SKXCCM0_VWA4_WG64_4_1_WGM1_WGMXCC1_WGMXCCGn1
    SolutionIndex: 499
    SolutionNameMin: Cijk_Ailk_Bljk_HHS_BH_UserArgs_MT256x96x32_MI16x16x1_SN_LDSB1_GRVWA8_GRVWB4_GSU0_GSUC0_GSUWGMRR0_K1_LBSPPA2048_LBSPPB128_LPA0_LPB4_LRVW4_MIWT4_6_NLCA1_SU32_SUM0_SUS256_SVW4_SKXCCM8_VWA4_WG64_4_1_WGM1_WGMXCC1_WGMXCCGn1
    SolutionIndex: 500
    SolutionNameMin: Cijk_Ailk_Bljk_HHS_BH_UserArgs_MT256x96x64_MI16x16x1_SN_LDSB1_GRVWA8_GRVWB8_GSU0_GSUC0_GSUWGMRR0_K1_LBSPPA4096_LBSPPB128_LPA0_LPB16_LRVW8_MIWT4_6_NLCA1_SU32_SUM0_SUS256_SVW4_SKXCCM0_VWA4_WG64_4_1_WGM8_WGMXCC1_WGMXCCGn1
    SolutionIndex: 501
    SolutionNameMin: Cijk_Ailk_Bljk_HHS_BH_UserArgs_MT256x96x64_MI16x16x1_SN_LDSB1_GRVWA8_GRVWB8_GSU0_GSUC0_GSUWGMRR0_K1_LBSPPA4096_LBSPPB128_LPA0_LPB16_LRVW8_MIWT4_6_NLCA1_SU32_SUM0_SUS256_SVW4_SKXCCM8_VWA4_WG64_4_1_WGM8_WGMXCC1_WGMXCCGn1
    SolutionIndex: 502
    SolutionNameMin: Cijk_Ailk_Bljk_HHS_BH_UserArgs_MT256x112x32_MI16x16x1_SN_LDSB1_GRVWA8_GRVWB2_GSU0_GSUC0_GSUWGMRR0_K1_LBSPPA2048_LBSPPB128_LPA0_LPB4_LRVW4_MIWT4_7_NLCA1_SU32_SUM0_SUS256_SVW4_SKXCCM0_VWA4_WG64_4_1_WGM8_WGMXCC1_WGMXCCGn1
    SolutionIndex: 503
    SolutionNameMin: Cijk_Ailk_Bljk_HHS_BH_UserArgs_MT256x112x32_MI16x16x1_SN_LDSB1_GRVWA8_GRVWB2_GSU0_GSUC0_GSUWGMRR0_K1_LBSPPA2048_LBSPPB128_LPA0_LPB4_LRVW4_MIWT4_7_NLCA1_SU32_SUM0_SUS256_SVW4_SKXCCM8_VWA4_WG64_4_1_WGM8_WGMXCC1_WGMXCCGn1
    SolutionIndex: 504
    SolutionNameMin: Cijk_Ailk_Bljk_HHS_BH_UserArgs_MT256x112x64_MI16x16x1_SN_LDSB1_GRVWA8_GRVWB4_GSU0_GSUC0_GSUWGMRR0_K1_LBSPPA4096_LBSPPB128_LPA0_LPB16_LRVW8_MIWT4_7_NLCA1_SU32_SUM0_SUS256_SVW4_SKXCCM0_VWA4_WG64_4_1_WGM8_WGMXCC1_WGMXCCGn1
    SolutionIndex: 505
    SolutionNameMin: Cijk_Ailk_Bljk_HHS_BH_UserArgs_MT256x112x64_MI16x16x1_SN_LDSB1_GRVWA8_GRVWB4_GSU0_GSUC0_GSUWGMRR0_K1_LBSPPA4096_LBSPPB128_LPA0_LPB16_LRVW8_MIWT4_7_NLCA1_SU32_SUM0_SUS256_SVW4_SKXCCM8_VWA4_WG64_4_1_WGM8_WGMXCC1_WGMXCCGn1
    SolutionIndex: 506
    SolutionNameMin: Cijk_Ailk_Bljk_HHS_BH_UserArgs_MT256x128x32_MI16x16x1_SN_LDSB1_GRVWA8_GRVWB4_GSU0_GSUC0_GSUWGMRR0_K1_LBSPPA2048_LBSPPB128_LPA0_LPB4_LRVW4_MIWT8_4_NLCA1_SU32_SUM0_SUS256_SVW8_SKXCCM0_VWA8_WG32_8_1_WGM8_WGMXCC1_WGMXCCGn1
    SolutionIndex: 507
    SolutionNameMin: Cijk_Ailk_Bljk_HHS_BH_UserArgs_MT256x128x32_MI16x16x1_SN_LDSB1_GRVWA8_GRVWB4_GSU0_GSUC0_GSUWGMRR0_K1_LBSPPA2048_LBSPPB128_LPA0_LPB4_LRVW4_MIWT8_4_NLCA1_SU32_SUM0_SUS256_SVW8_SKXCCM8_VWA8_WG32_8_1_WGM8_WGMXCC1_WGMXCCGn1
    SolutionIndex: 508
    SolutionNameMin: Cijk_Ailk_Bljk_HHS_BH_UserArgs_MT256x128x64_MI16x16x1_SN_LDSB1_GRVWA8_GRVWB8_GSU0_GSUC0_GSUWGMRR0_K1_LBSPPA4096_LBSPPB128_LPA0_LPB16_LRVW8_MIWT8_4_NLCA1_SU32_SUM0_SUS256_SVW8_SKXCCM0_VWA8_WG32_8_1_WGM8_WGMXCC1_WGMXCCGn1
    SolutionIndex: 509
    SolutionNameMin: Cijk_Ailk_Bljk_HHS_BH_UserArgs_MT256x128x64_MI16x16x1_SN_LDSB1_GRVWA8_GRVWB8_GSU0_GSUC0_GSUWGMRR0_K1_LBSPPA4096_LBSPPB128_LPA0_LPB16_LRVW8_MIWT8_4_NLCA1_SU32_SUM0_SUS256_SVW8_SKXCCM8_VWA8_WG32_8_1_WGM8_WGMXCC1_WGMXCCGn1
    SolutionIndex: 510
    SolutionNameMin: Cijk_Ailk_Bljk_HHS_BH_UserArgs_MT256x144x32_MI16x16x1_SN_LDSB0_GRVWA8_GRVWB2_GSU0_GSUC0_GSUWGMRR0_K1_LBSPPA2048_LBSPPB128_LPA0_LPB4_LRVW4_MIWT4_9_NLCA1_SU32_SUM0_SUS256_SVW4_SKXCCM0_VWA4_WG64_4_1_WGM8_WGMXCC1_WGMXCCGn1
    SolutionIndex: 511
    SolutionNameMin: Cijk_Ailk_Bljk_HHS_BH_UserArgs_MT256x144x32_MI16x16x1_SN_LDSB0_GRVWA8_GRVWB2_GSU0_GSUC0_GSUWGMRR0_K1_LBSPPA2048_LBSPPB128_LPA0_LPB4_LRVW4_MIWT4_9_NLCA1_SU32_SUM0_SUS256_SVW4_SKXCCM8_VWA4_WG64_4_1_WGM8_WGMXCC1_WGMXCCGn1
    SolutionIndex: 512
    SolutionNameMin: Cijk_Ailk_Bljk_HHS_BH_UserArgs_MT256x144x64_MI16x16x1_SN_LDSB1_GRVWA8_GRVWB4_GSU0_GSUC0_GSUWGMRR0_K1_LBSPPA4096_LBSPPB128_LPA0_LPB16_LRVW8_MIWT4_9_NLCA1_SU32_SUM0_SUS256_SVW4_SKXCCM0_VWA4_WG64_4_1_WGM8_WGMXCC1_WGMXCCGn1
    SolutionIndex: 513
    SolutionNameMin: Cijk_Ailk_Bljk_HHS_BH_UserArgs_MT256x144x64_MI16x16x1_SN_LDSB1_GRVWA8_GRVWB4_GSU0_GSUC0_GSUWGMRR0_K1_LBSPPA4096_LBSPPB128_LPA0_LPB16_LRVW8_MIWT4_9_NLCA1_SU32_SUM0_SUS256_SVW4_SKXCCM8_VWA4_WG64_4_1_WGM8_WGMXCC1_WGMXCCGn1
    SolutionIndex: 514
    SolutionNameMin: Cijk_Ailk_Bljk_HHS_BH_UserArgs_MT256x160x32_MI16x16x1_SN_LDSB0_GRVWA8_GRVWB4_GSU0_GSUC0_GSUWGMRR0_K1_LBSPPA2048_LBSPPB128_LPA0_LPB4_LRVW4_MIWT4_10_NLCA1_SU32_SUM0_SUS256_SVW4_SKXCCM0_VWA4_WG64_4_1_WGM8_WGMXCC1_WGMXCCGn1
    SolutionIndex: 515
    SolutionNameMin: Cijk_Ailk_Bljk_HHS_BH_UserArgs_MT256x160x32_MI16x16x1_SN_LDSB0_GRVWA8_GRVWB4_GSU0_GSUC0_GSUWGMRR0_K1_LBSPPA2048_LBSPPB128_LPA0_LPB4_LRVW4_MIWT4_10_NLCA1_SU32_SUM0_SUS256_SVW4_SKXCCM8_VWA4_WG64_4_1_WGM8_WGMXCC1_WGMXCCGn1
    SolutionIndex: 516
    SolutionNameMin: Cijk_Ailk_Bljk_HHS_BH_UserArgs_MT256x160x64_MI16x16x1_SN_LDSB1_GRVWA8_GRVWB8_GSU0_GSUC0_GSUWGMRR0_K1_LBSPPA4096_LBSPPB128_LPA0_LPB16_LRVW8_MIWT4_10_NLCA1_SU32_SUM0_SUS256_SVW4_SKXCCM0_VWA4_WG64_4_1_WGM8_WGMXCC1_WGMXCCGn1
    SolutionIndex: 517
    SolutionNameMin: Cijk_Ailk_Bljk_HHS_BH_UserArgs_MT256x160x64_MI16x16x1_SN_LDSB1_GRVWA8_GRVWB8_GSU0_GSUC0_GSUWGMRR0_K1_LBSPPA4096_LBSPPB128_LPA0_LPB16_LRVW8_MIWT4_10_NLCA1_SU32_SUM0_SUS256_SVW4_SKXCCM8_VWA4_WG64_4_1_WGM8_WGMXCC1_WGMXCCGn1
    SolutionIndex: 518
    SolutionNameMin: Cijk_Ailk_Bljk_HHS_BH_UserArgs_MT256x176x32_MI16x16x1_SN_LDSB0_GRVWA8_GRVWB2_GSU0_GSUC0_GSUWGMRR0_K1_LBSPPA2048_LBSPPB128_LPA0_LPB4_LRVW4_MIWT4_11_NLCA1_SU32_SUM0_SUS256_SVW4_SKXCCM0_VWA4_WG64_4_1_WGM8_WGMXCC1_WGMXCCGn1
    SolutionIndex: 519
    SolutionNameMin: Cijk_Ailk_Bljk_HHS_BH_UserArgs_MT256x176x32_MI16x16x1_SN_LDSB0_GRVWA8_GRVWB2_GSU0_GSUC0_GSUWGMRR0_K1_LBSPPA2048_LBSPPB128_LPA0_LPB4_LRVW4_MIWT4_11_NLCA1_SU32_SUM0_SUS256_SVW4_SKXCCM8_VWA4_WG64_4_1_WGM8_WGMXCC1_WGMXCCGn1
    SolutionIndex: 520
    SolutionNameMin: Cijk_Ailk_Bljk_HHS_BH_UserArgs_MT256x176x64_MI16x16x1_SN_LDSB1_GRVWA8_GRVWB4_GSU0_GSUC0_GSUWGMRR0_K1_LBSPPA4096_LBSPPB128_LPA0_LPB16_LRVW8_MIWT4_11_NLCA1_SU32_SUM0_SUS256_SVW4_SKXCCM0_VWA4_WG64_4_1_WGM8_WGMXCC1_WGMXCCGn1
    SolutionIndex: 521
    SolutionNameMin: Cijk_Ailk_Bljk_HHS_BH_UserArgs_MT256x176x64_MI16x16x1_SN_LDSB1_GRVWA8_GRVWB4_GSU0_GSUC0_GSUWGMRR0_K1_LBSPPA4096_LBSPPB128_LPA0_LPB16_LRVW8_MIWT4_11_NLCA1_SU32_SUM0_SUS256_SVW4_SKXCCM8_VWA4_WG64_4_1_WGM8_WGMXCC1_WGMXCCGn1
    SolutionIndex: 522
    SolutionNameMin: Cijk_Ailk_Bljk_HHS_BH_UserArgs_MT256x192x32_MI16x16x1_SN_LDSB0_GRVWA8_GRVWB4_GSU0_GSUC0_GSUWGMRR0_K1_LBSPPA2048_LBSPPB128_LPA0_LPB4_LRVW4_MIWT8_6_NLCA1_SU32_SUM0_SUS256_SVW8_SKXCCM0_VWA8_WG32_8_1_WGM8_WGMXCC1_WGMXCCGn1
    SolutionIndex: 523
    SolutionNameMin: Cijk_Ailk_Bljk_HHS_BH_UserArgs_MT256x192x32_MI16x16x1_SN_LDSB0_GRVWA8_GRVWB4_GSU0_GSUC0_GSUWGMRR0_K1_LBSPPA2048_LBSPPB128_LPA0_LPB4_LRVW4_MIWT8_6_NLCA1_SU32_SUM0_SUS256_SVW8_SKXCCM8_VWA8_WG32_8_1_WGM8_WGMXCC1_WGMXCCGn1
    SolutionIndex: 524
    SolutionNameMin: Cijk_Ailk_Bljk_HHS_BH_UserArgs_MT256x192x64_MI16x16x1_SN_LDSB1_GRVWA8_GRVWB8_GSU0_GSUC0_GSUWGMRR0_K1_LBSPPA4096_LBSPPB128_LPA0_LPB16_LRVW8_MIWT8_6_NLCA1_SU32_SUM0_SUS256_SVW8_SKXCCM0_VWA8_WG32_8_1_WGM8_WGMXCC1_WGMXCCGn1
    SolutionIndex: 525
    SolutionNameMin: Cijk_Ailk_Bljk_HHS_BH_UserArgs_MT256x192x64_MI16x16x1_SN_LDSB1_GRVWA8_GRVWB8_GSU0_GSUC0_GSUWGMRR0_K1_LBSPPA4096_LBSPPB128_LPA0_LPB16_LRVW8_MIWT8_6_NLCA1_SU32_SUM0_SUS256_SVW8_SKXCCM8_VWA8_WG32_8_1_WGM8_WGMXCC1_WGMXCCGn1
    SolutionIndex: 526
    SolutionNameMin: Cijk_Ailk_Bljk_HHS_BH_UserArgs_MT256x208x32_MI16x16x1_SN_LDSB0_GRVWA8_GRVWB2_GSU0_GSUC0_GSUWGMRR0_K1_LBSPPA2048_LBSPPB128_LPA0_LPB4_LRVW4_MIWT4_13_NLCA1_SU32_SUM0_SUS256_SVW4_SKXCCM0_VWA4_WG64_4_1_WGM8_WGMXCC1_WGMXCCGn1
    SolutionIndex: 527
    SolutionNameMin: Cijk_Ailk_Bljk_HHS_BH_UserArgs_MT256x208x32_MI16x16x1_SN_LDSB0_GRVWA8_GRVWB2_GSU0_GSUC0_GSUWGMRR0_K1_LBSPPA2048_LBSPPB128_LPA0_LPB4_LRVW4_MIWT4_13_NLCA1_SU32_SUM0_SUS256_SVW4_SKXCCM8_VWA4_WG64_4_1_WGM8_WGMXCC1_WGMXCCGn1
    SolutionIndex: 528
    SolutionNameMin: Cijk_Ailk_Bljk_HHS_BH_UserArgs_MT256x208x64_MI16x16x1_SN_LDSB1_GRVWA8_GRVWB4_GSU0_GSUC0_GSUWGMRR0_K1_LBSPPA2048_LBSPPB128_LPA0_LPB4_LRVW4_MIWT4_13_NLCA1_SU32_SUM0_SUS256_SVW4_SKXCCM0_VWA4_WG64_4_1_WGM8_WGMXCC1_WGMXCCGn1
    SolutionIndex: 529
    SolutionNameMin: Cijk_Ailk_Bljk_HHS_BH_UserArgs_MT256x208x64_MI16x16x1_SN_LDSB1_GRVWA8_GRVWB4_GSU0_GSUC0_GSUWGMRR0_K1_LBSPPA2048_LBSPPB128_LPA0_LPB4_LRVW4_MIWT4_13_NLCA1_SU32_SUM0_SUS256_SVW4_SKXCCM8_VWA4_WG64_4_1_WGM8_WGMXCC1_WGMXCCGn1
    SolutionIndex: 530
    SolutionNameMin: Cijk_Ailk_Bljk_HHS_BH_UserArgs_MT256x224x32_MI16x16x1_SN_LDSB0_GRVWA8_GRVWB4_GSU0_GSUC0_GSUWGMRR0_K1_LBSPPA2048_LBSPPB128_LPA0_LPB4_LRVW4_MIWT4_14_NLCA1_SU32_SUM0_SUS256_SVW4_SKXCCM0_VWA4_WG64_4_1_WGM8_WGMXCC1_WGMXCCGn1
    SolutionIndex: 531
    SolutionNameMin: Cijk_Ailk_Bljk_HHS_BH_UserArgs_MT256x224x32_MI16x16x1_SN_LDSB0_GRVWA8_GRVWB4_GSU0_GSUC0_GSUWGMRR0_K1_LBSPPA2048_LBSPPB128_LPA0_LPB4_LRVW4_MIWT4_14_NLCA1_SU32_SUM0_SUS256_SVW4_SKXCCM8_VWA4_WG64_4_1_WGM8_WGMXCC1_WGMXCCGn1
    SolutionIndex: 532
    SolutionNameMin: Cijk_Ailk_Bljk_HHS_BH_UserArgs_MT256x224x64_MI16x16x1_SN_LDSB1_GRVWA8_GRVWB4_GSU0_GSUC0_GSUWGMRR0_K1_LBSPPA2048_LBSPPB128_LPA0_LPB4_LRVW4_MIWT4_14_NLCA1_SU32_SUM0_SUS256_SVW4_SKXCCM0_VWA4_WG64_4_1_WGM8_WGMXCC1_WGMXCCGn1
    SolutionIndex: 533
    SolutionNameMin: Cijk_Ailk_Bljk_HHS_BH_UserArgs_MT256x224x64_MI16x16x1_SN_LDSB1_GRVWA8_GRVWB4_GSU0_GSUC0_GSUWGMRR0_K1_LBSPPA2048_LBSPPB128_LPA0_LPB4_LRVW4_MIWT4_14_NLCA1_SU32_SUM0_SUS256_SVW4_SKXCCM8_VWA4_WG64_4_1_WGM8_WGMXCC1_WGMXCCGn1
    SolutionIndex: 534
    SolutionNameMin: Cijk_Ailk_Bljk_HHS_BH_UserArgs_MT256x240x32_MI16x16x1_SN_LDSB0_GRVWA8_GRVWB2_GSU0_GSUC0_GSUWGMRR0_K1_LBSPPA2048_LBSPPB128_LPA0_LPB4_LRVW4_MIWT4_15_NLCA1_SU32_SUM0_SUS256_SVW4_SKXCCM0_VWA4_WG64_4_1_WGM8_WGMXCC1_WGMXCCGn1
    SolutionIndex: 535
    SolutionNameMin: Cijk_Ailk_Bljk_HHS_BH_UserArgs_MT256x240x32_MI16x16x1_SN_LDSB0_GRVWA8_GRVWB2_GSU0_GSUC0_GSUWGMRR0_K1_LBSPPA2048_LBSPPB128_LPA0_LPB4_LRVW4_MIWT4_15_NLCA1_SU32_SUM0_SUS256_SVW4_SKXCCM8_VWA4_WG64_4_1_WGM8_WGMXCC1_WGMXCCGn1
    SolutionIndex: 536
    SolutionNameMin: Cijk_Ailk_Bljk_HHS_BH_UserArgs_MT256x240x64_MI16x16x1_SN_LDSB1_GRVWA8_GRVWB4_GSU0_GSUC0_GSUWGMRR0_K1_LBSPPA2048_LBSPPB128_LPA0_LPB4_LRVW4_MIWT4_15_NLCA1_SU32_SUM0_SUS256_SVW4_SKXCCM0_VWA4_WG64_4_1_WGM8_WGMXCC1_WGMXCCGn1
    SolutionIndex: 537
    SolutionNameMin: Cijk_Ailk_Bljk_HHS_BH_UserArgs_MT256x240x64_MI16x16x1_SN_LDSB1_GRVWA8_GRVWB4_GSU0_GSUC0_GSUWGMRR0_K1_LBSPPA2048_LBSPPB128_LPA0_LPB4_LRVW4_MIWT4_15_NLCA1_SU32_SUM0_SUS256_SVW4_SKXCCM8_VWA4_WG64_4_1_WGM8_WGMXCC1_WGMXCCGn1
    SolutionIndex: 538
    SolutionNameMin: Cijk_Ailk_Bljk_HHS_BH_UserArgs_MT256x256x32_MI16x16x1_SN_LDSB1_GRVWA8_GRVWB4_GSU0_GSUC0_GSUWGMRR0_K1_LBSPPA2048_LBSPPB128_LPA0_LPB4_LRVW4_MIWT8_8_NLCA1_SU32_SUM0_SUS256_SVW8_SKXCCM0_VWA8_WG32_8_1_WGM8_WGMXCC1_WGMXCCGn1
    SolutionIndex: 539
    SolutionNameMin: Cijk_Ailk_Bljk_HHS_BH_UserArgs_MT256x256x32_MI16x16x1_SN_LDSB1_GRVWA8_GRVWB4_GSU0_GSUC0_GSUWGMRR0_K1_LBSPPA2048_LBSPPB128_LPA0_LPB4_LRVW4_MIWT8_8_NLCA1_SU32_SUM0_SUS256_SVW8_SKXCCM8_VWA8_WG32_8_1_WGM8_WGMXCC1_WGMXCCGn1
    SolutionIndex: 540
    SolutionNameMin: Cijk_Ailk_Bljk_HHS_BH_UserArgs_MT320x16x32_MI16x16x1_SN_LDSB1_GRVWA8_GRVWB2_GSU0_GSUC0_GSUWGMRR0_K1_LBSPPA2560_LBSPPB128_LPA16_LPB4_LRVW4_MIWT5_1_NLCA5_SU32_SUM0_SUS256_SVW1_SKXCCM0_VWA1_WG64_4_1_WGM1_WGMXCC1_WGMXCCGn1
    SolutionIndex: 541
    SolutionNameMin: Cijk_Ailk_Bljk_HHS_BH_UserArgs_MT320x16x32_MI16x16x1_SN_LDSB1_GRVWA8_GRVWB2_GSU0_GSUC0_GSUWGMRR0_K1_LBSPPA2560_LBSPPB128_LPA16_LPB4_LRVW4_MIWT5_1_NLCA5_SU32_SUM0_SUS256_SVW1_SKXCCM8_VWA1_WG64_4_1_WGM1_WGMXCC1_WGMXCCGn1
    SolutionIndex: 542
    SolutionNameMin: Cijk_Ailk_Bljk_HHS_BH_UserArgs_MT320x16x64_MI16x16x1_SN_LDSB1_GRVWA8_GRVWB4_GSU0_GSUC0_GSUWGMRR0_K1_LBSPPA5120_LBSPPB128_LPA16_LPB16_LRVW8_MIWT5_1_NLCA5_SU32_SUM0_SUS256_SVW1_SKXCCM0_VWA1_WG64_4_1_WGM8_WGMXCC1_WGMXCCGn1
    SolutionIndex: 543
    SolutionNameMin: Cijk_Ailk_Bljk_HHS_BH_UserArgs_MT320x16x64_MI16x16x1_SN_LDSB1_GRVWA8_GRVWB4_GSU0_GSUC0_GSUWGMRR0_K1_LBSPPA5120_LBSPPB128_LPA16_LPB16_LRVW8_MIWT5_1_NLCA5_SU32_SUM0_SUS256_SVW1_SKXCCM8_VWA1_WG64_4_1_WGM8_WGMXCC1_WGMXCCGn1
    SolutionIndex: 544
    SolutionNameMin: Cijk_Ailk_Bljk_HHS_BH_UserArgs_MT384x16x32_MI16x16x1_SN_LDSB1_GRVWA8_GRVWB2_GSU0_GSUC0_GSUWGMRR0_K1_LBSPPA3072_LBSPPB128_LPA32_LPB4_LRVW4_MIWT6_1_NLCA3_SU32_SUM0_SUS256_SVW2_SKXCCM0_VWA2_WG64_4_1_WGM8_WGMXCC1_WGMXCCGn1
    SolutionIndex: 545
    SolutionNameMin: Cijk_Ailk_Bljk_HHS_BH_UserArgs_MT384x16x32_MI16x16x1_SN_LDSB1_GRVWA8_GRVWB2_GSU0_GSUC0_GSUWGMRR0_K1_LBSPPA3072_LBSPPB128_LPA32_LPB4_LRVW4_MIWT6_1_NLCA3_SU32_SUM0_SUS256_SVW2_SKXCCM8_VWA2_WG64_4_1_WGM8_WGMXCC1_WGMXCCGn1
    SolutionIndex: 546
    SolutionNameMin: Cijk_Ailk_Bljk_HHS_BH_UserArgs_MT384x16x64_MI16x16x1_SN_LDSB1_GRVWA8_GRVWB4_GSU0_GSUC0_GSUWGMRR0_K1_LBSPPA6144_LBSPPB128_LPA32_LPB16_LRVW8_MIWT6_1_NLCA3_SU32_SUM0_SUS256_SVW2_SKXCCM0_VWA2_WG64_4_1_WGM8_WGMXCC1_WGMXCCGn1
    SolutionIndex: 547
    SolutionNameMin: Cijk_Ailk_Bljk_HHS_BH_UserArgs_MT384x16x64_MI16x16x1_SN_LDSB1_GRVWA8_GRVWB4_GSU0_GSUC0_GSUWGMRR0_K1_LBSPPA6144_LBSPPB128_LPA32_LPB16_LRVW8_MIWT6_1_NLCA3_SU32_SUM0_SUS256_SVW2_SKXCCM8_VWA2_WG64_4_1_WGM8_WGMXCC1_WGMXCCGn1
    SolutionIndex: 548
    SolutionNameMin: Cijk_Ailk_Bljk_HHS_BH_UserArgs_MT448x16x32_MI16x16x1_SN_LDSB1_GRVWA8_GRVWB2_GSU0_GSUC0_GSUWGMRR0_K1_LBSPPA3584_LBSPPB128_LPA16_LPB4_LRVW4_MIWT7_1_NLCA7_SU32_SUM0_SUS256_SVW1_SKXCCM0_VWA1_WG64_4_1_WGM8_WGMXCC1_WGMXCCGn1
    SolutionIndex: 549
    SolutionNameMin: Cijk_Ailk_Bljk_HHS_BH_UserArgs_MT448x16x32_MI16x16x1_SN_LDSB1_GRVWA8_GRVWB2_GSU0_GSUC0_GSUWGMRR0_K1_LBSPPA3584_LBSPPB128_LPA16_LPB4_LRVW4_MIWT7_1_NLCA7_SU32_SUM0_SUS256_SVW1_SKXCCM8_VWA1_WG64_4_1_WGM8_WGMXCC1_WGMXCCGn1
    SolutionIndex: 550
    SolutionNameMin: Cijk_Ailk_Bljk_HHS_BH_UserArgs_MT448x16x64_MI16x16x1_SN_LDSB1_GRVWA8_GRVWB4_GSU0_GSUC0_GSUWGMRR0_K1_LBSPPA7168_LBSPPB128_LPA16_LPB16_LRVW8_MIWT7_1_NLCA7_SU32_SUM0_SUS256_SVW1_SKXCCM0_VWA1_WG64_4_1_WGM8_WGMXCC1_WGMXCCGn1
    SolutionIndex: 551
    SolutionNameMin: Cijk_Ailk_Bljk_HHS_BH_UserArgs_MT448x16x64_MI16x16x1_SN_LDSB1_GRVWA8_GRVWB4_GSU0_GSUC0_GSUWGMRR0_K1_LBSPPA7168_LBSPPB128_LPA16_LPB16_LRVW8_MIWT7_1_NLCA7_SU32_SUM0_SUS256_SVW1_SKXCCM8_VWA1_WG64_4_1_WGM8_WGMXCC1_WGMXCCGn1
    SolutionIndex: 552
    SolutionNameMin: Cijk_Ailk_Bljk_HHS_BH_UserArgs_MT512x16x32_MI16x16x1_SN_LDSB1_GRVWA8_GRVWB2_GSU0_GSUC0_GSUWGMRR0_K1_LBSPPA4096_LBSPPB128_LPA0_LPB4_LRVW4_MIWT8_1_NLCA1_SU32_SUM0_SUS256_SVW8_SKXCCM0_VWA8_WG64_4_1_WGM8_WGMXCC1_WGMXCCGn1
    SolutionIndex: 553
    SolutionNameMin: Cijk_Ailk_Bljk_HHS_BH_UserArgs_MT512x16x32_MI16x16x1_SN_LDSB1_GRVWA8_GRVWB2_GSU0_GSUC0_GSUWGMRR0_K1_LBSPPA4096_LBSPPB128_LPA0_LPB4_LRVW4_MIWT8_1_NLCA1_SU32_SUM0_SUS256_SVW8_SKXCCM8_VWA8_WG64_4_1_WGM8_WGMXCC1_WGMXCCGn1
- - - [16, 16, 1, 16]
    - [0, 0.0]
  - - [32, 32, 1, 32]
    - [1, 0.0]
  - - [48, 48, 1, 48]
    - [2, 0.0]
  - - [64, 64, 1, 64]
    - [3, 0.0]
  - - [80, 80, 1, 80]
    - [4, 0.0]
  - - [96, 96, 1, 96]
    - [5, 0.0]
  - - [112, 112, 1, 112]
    - [6, 0.0]
  - - [128, 128, 1, 128]
    - [7, 0.0]
  - - [144, 144, 1, 144]
    - [8, 0.0]
  - - [160, 160, 1, 160]
    - [9, 0.0]
  - - [176, 176, 1, 176]
    - [10, 0.0]
  - - [192, 192, 1, 192]
    - [11, 0.0]
  - - [208, 208, 1, 208]
    - [12, 0.0]
  - - [224, 224, 1, 224]
    - [13, 0.0]
  - - [240, 240, 1, 240]
    - [14, 0.0]
  - - [256, 256, 1, 256]
    - [15, 0.0]
  - - [272, 272, 1, 272]
    - [16, 0.0]
  - - [288, 288, 1, 288]
    - [17, 0.0]
  - - [304, 304, 1, 304]
    - [18, 0.0]
  - - [320, 320, 1, 320]
    - [19, 0.0]
  - - [336, 336, 1, 336]
    - [20, 0.0]
  - - [352, 352, 1, 352]
    - [21, 0.0]
  - - [368, 368, 1, 368]
    - [22, 0.0]
  - - [384, 384, 1, 384]
    - [23, 0.0]
  - - [400, 400, 1, 400]
    - [24, 0.0]
  - - [416, 416, 1, 416]
    - [25, 0.0]
  - - [432, 432, 1, 432]
    - [26, 0.0]
  - - [448, 448, 1, 448]
    - [27, 0.0]
  - - [464, 464, 1, 464]
    - [28, 0.0]
  - - [480, 480, 1, 480]
    - [29, 0.0]
  - - [496, 496, 1, 496]
    - [30, 0.0]
  - - [512, 512, 1, 512]
    - [31, 0.0]
  - - [528, 528, 1, 528]
    - [32, 0.0]
  - - [544, 544, 1, 544]
    - [33, 0.0]
  - - [560, 560, 1, 560]
    - [34, 0.0]
  - - [576, 576, 1, 576]
    - [35, 0.0]
  - - [592, 592, 1, 592]
    - [36, 0.0]
  - - [608, 608, 1, 608]
    - [37, 0.0]
  - - [624, 624, 1, 624]
    - [38, 0.0]
  - - [640, 640, 1, 640]
    - [39, 0.0]
  - - [656, 656, 1, 656]
    - [40, 0.0]
  - - [672, 672, 1, 672]
    - [41, 0.0]
  - - [688, 688, 1, 688]
    - [42, 0.0]
  - - [704, 704, 1, 704]
    - [43, 0.0]
  - - [720, 720, 1, 720]
    - [44, 0.0]
  - - [736, 736, 1, 736]
    - [45, 0.0]
  - - [752, 752, 1, 752]
    - [46, 0.0]
  - - [768, 768, 1, 768]
    - [47, 0.0]
  - - [784, 784, 1, 784]
    - [48, 0.0]
  - - [800, 800, 1, 800]
    - [49, 0.0]
  - - [816, 816, 1, 816]
    - [50, 0.0]
  - - [832, 832, 1, 832]
    - [51, 0.0]
  - - [848, 848, 1, 848]
    - [52, 0.0]
  - - [864, 864, 1, 864]
    - [53, 0.0]
  - - [880, 880, 1, 880]
    - [54, 0.0]
  - - [896, 896, 1, 896]
    - [55, 0.0]
  - - [912, 912, 1, 912]
    - [56, 0.0]
  - - [928, 928, 1, 928]
    - [57, 0.0]
  - - [944, 944, 1, 944]
    - [58, 0.0]
  - - [960, 960, 1, 960]
    - [59, 0.0]
  - - [976, 976, 1, 976]
    - [60, 0.0]
  - - [992, 992, 1, 992]
    - [61, 0.0]
  - - [1008, 1008, 1, 1008]
    - [62, 0.0]
  - - [1024, 1024, 1, 1024]
    - [63, 0.0]
  - - [1040, 1040, 1, 1040]
    - [64, 0.0]
  - - [1056, 1056, 1, 1056]
    - [65, 0.0]
  - - [1072, 1072, 1, 1072]
    - [66, 0.0]
  - - [1088, 1088, 1, 1088]
    - [67, 0.0]
  - - [1104, 1104, 1, 1104]
    - [68, 0.0]
  - - [1120, 1120, 1, 1120]
    - [69, 0.0]
  - - [1136, 1136, 1, 1136]
    - [70, 0.0]
  - - [1152, 1152, 1, 1152]
    - [71, 0.0]
  - - [1168, 1168, 1, 1168]
    - [72, 0.0]
  - - [1184, 1184, 1, 1184]
    - [73, 0.0]
  - - [1200, 1200, 1, 1200]
    - [74, 0.0]
  - - [1216, 1216, 1, 1216]
    - [75, 0.0]
  - - [1232, 1232, 1, 1232]
    - [76, 0.0]
  - - [1248, 1248, 1, 1248]
    - [77, 0.0]
  - - [1264, 1264, 1, 1264]
    - [78, 0.0]
  - - [1280, 1280, 1, 1280]
    - [79, 0.0]
  - - [1296, 1296, 1, 1296]
    - [80, 0.0]
  - - [1312, 1312, 1, 1312]
    - [81, 0.0]
  - - [1328, 1328, 1, 1328]
    - [82, 0.0]
  - - [1344, 1344, 1, 1344]
    - [83, 0.0]
  - - [1360, 1360, 1, 1360]
    - [84, 0.0]
  - - [1376, 1376, 1, 1376]
    - [85, 0.0]
  - - [1392, 1392, 1, 1392]
    - [86, 0.0]
  - - [1408, 1408, 1, 1408]
    - [87, 0.0]
  - - [1424, 1424, 1, 1424]
    - [88, 0.0]
  - - [1440, 1440, 1, 1440]
    - [89, 0.0]
  - - [1456, 1456, 1, 1456]
    - [90, 0.0]
  - - [1472, 1472, 1, 1472]
    - [91, 0.0]
  - - [1488, 1488, 1, 1488]
    - [92, 0.0]
  - - [1504, 1504, 1, 1504]
    - [93, 0.0]
  - - [1520, 1520, 1, 1520]
    - [94, 0.0]
  - - [1536, 1536, 1, 1536]
    - [95, 0.0]
  - - [1552, 1552, 1, 1552]
    - [96, 0.0]
  - - [1568, 1568, 1, 1568]
    - [97, 0.0]
  - - [1584, 1584, 1, 1584]
    - [98, 0.0]
  - - [1600, 1600, 1, 1600]
    - [99, 0.0]
  - - [1616, 1616, 1, 1616]
    - [100, 0.0]
  - - [1632, 1632, 1, 1632]
    - [101, 0.0]
  - - [1648, 1648, 1, 1648]
    - [102, 0.0]
  - - [1664, 1664, 1, 1664]
    - [103, 0.0]
  - - [1680, 1680, 1, 1680]
    - [104, 0.0]
  - - [1696, 1696, 1, 1696]
    - [105, 0.0]
  - - [1712, 1712, 1, 1712]
    - [106, 0.0]
  - - [1728, 1728, 1, 1728]
    - [107, 0.0]
  - - [1744, 1744, 1, 1744]
    - [108, 0.0]
  - - [1760, 1760, 1, 1760]
    - [109, 0.0]
  - - [1776, 1776, 1, 1776]
    - [110, 0.0]
  - - [1792, 1792, 1, 1792]
    - [111, 0.0]
  - - [1808, 1808, 1, 1808]
    - [112, 0.0]
  - - [1824, 1824, 1, 1824]
    - [113, 0.0]
  - - [1840, 1840, 1, 1840]
    - [114, 0.0]
  - - [1856, 1856, 1, 1856]
    - [115, 0.0]
  - - [1872, 1872, 1, 1872]
    - [116, 0.0]
  - - [1888, 1888, 1, 1888]
    - [117, 0.0]
  - - [1904, 1904, 1, 1904]
    - [118, 0.0]
  - - [1920, 1920, 1, 1920]
    - [119, 0.0]
  - - [1936, 1936, 1, 1936]
    - [120, 0.0]
  - - [1952, 1952, 1, 1952]
    - [121, 0.0]
  - - [1968, 1968, 1, 1968]
    - [122, 0.0]
  - - [1984, 1984, 1, 1984]
    - [123, 0.0]
  - - [2000, 2000, 1, 2000]
    - [124, 0.0]
  - - [2016, 2016, 1, 2016]
    - [125, 0.0]
  - - [2032, 2032, 1, 2032]
    - [126, 0.0]
  - - [2048, 2048, 1, 2048]
    - [127, 0.0]
  - - [2064, 2064, 1, 2064]
    - [128, 0.0]
  - - [2080, 2080, 1, 2080]
    - [129, 0.0]
  - - [2096, 2096, 1, 2096]
    - [130, 0.0]
  - - [2112, 2112, 1, 2112]
    - [131, 0.0]
  - - [2128, 2128, 1, 2128]
    - [132, 0.0]
  - - [2144, 2144, 1, 2144]
    - [133, 0.0]
  - - [2160, 2160, 1, 2160]
    - [134, 0.0]
  - - [2176, 2176, 1, 2176]
    - [135, 0.0]
  - - [2192, 2192, 1, 2192]
    - [136, 0.0]
  - - [2208, 2208, 1, 2208]
    - [137, 0.0]
  - - [2224, 2224, 1, 2224]
    - [138, 0.0]
  - - [2240, 2240, 1, 2240]
    - [139, 0.0]
  - - [2256, 2256, 1, 2256]
    - [140, 0.0]
  - - [2272, 2272, 1, 2272]
    - [141, 0.0]
  - - [2288, 2288, 1, 2288]
    - [142, 0.0]
  - - [2304, 2304, 1, 2304]
    - [143, 0.0]
  - - [2320, 2320, 1, 2320]
    - [144, 0.0]
  - - [2336, 2336, 1, 2336]
    - [145, 0.0]
  - - [2352, 2352, 1, 2352]
    - [146, 0.0]
  - - [2368, 2368, 1, 2368]
    - [147, 0.0]
  - - [2384, 2384, 1, 2384]
    - [148, 0.0]
  - - [2400, 2400, 1, 2400]
    - [149, 0.0]
  - - [2416, 2416, 1, 2416]
    - [150, 0.0]
  - - [2432, 2432, 1, 2432]
    - [151, 0.0]
  - - [2448, 2448, 1, 2448]
    - [152, 0.0]
  - - [2464, 2464, 1, 2464]
    - [153, 0.0]
  - - [2480, 2480, 1, 2480]
    - [154, 0.0]
  - - [2496, 2496, 1, 2496]
    - [155, 0.0]
  - - [2512, 2512, 1, 2512]
    - [156, 0.0]
  - - [2528, 2528, 1, 2528]
    - [157, 0.0]
  - - [2544, 2544, 1, 2544]
    - [158, 0.0]
  - - [2560, 2560, 1, 2560]
    - [159, 0.0]
  - - [2576, 2576, 1, 2576]
    - [160, 0.0]
  - - [2592, 2592, 1, 2592]
    - [161, 0.0]
  - - [2608, 2608, 1, 2608]
    - [162, 0.0]
  - - [2624, 2624, 1, 2624]
    - [163, 0.0]
  - - [2640, 2640, 1, 2640]
    - [164, 0.0]
  - - [2656, 2656, 1, 2656]
    - [165, 0.0]
  - - [2672, 2672, 1, 2672]
    - [166, 0.0]
  - - [2688, 2688, 1, 2688]
    - [167, 0.0]
  - - [2704, 2704, 1, 2704]
    - [168, 0.0]
  - - [2720, 2720, 1, 2720]
    - [169, 0.0]
  - - [2736, 2736, 1, 2736]
    - [170, 0.0]
  - - [2752, 2752, 1, 2752]
    - [171, 0.0]
  - - [2768, 2768, 1, 2768]
    - [172, 0.0]
  - - [2784, 2784, 1, 2784]
    - [173, 0.0]
  - - [2800, 2800, 1, 2800]
    - [174, 0.0]
  - - [2816, 2816, 1, 2816]
    - [175, 0.0]
  - - [2832, 2832, 1, 2832]
    - [176, 0.0]
  - - [2848, 2848, 1, 2848]
    - [177, 0.0]
  - - [2864, 2864, 1, 2864]
    - [178, 0.0]
  - - [2880, 2880, 1, 2880]
    - [179, 0.0]
  - - [2896, 2896, 1, 2896]
    - [180, 0.0]
  - - [2912, 2912, 1, 2912]
    - [181, 0.0]
  - - [2928, 2928, 1, 2928]
    - [182, 0.0]
  - - [2944, 2944, 1, 2944]
    - [183, 0.0]
  - - [2960, 2960, 1, 2960]
    - [184, 0.0]
  - - [2976, 2976, 1, 2976]
    - [185, 0.0]
  - - [2992, 2992, 1, 2992]
    - [186, 0.0]
  - - [3008, 3008, 1, 3008]
    - [187, 0.0]
  - - [3024, 3024, 1, 3024]
    - [188, 0.0]
  - - [3040, 3040, 1, 3040]
    - [189, 0.0]
  - - [3056, 3056, 1, 3056]
    - [190, 0.0]
  - - [3072, 3072, 1, 3072]
    - [191, 0.0]
  - - [3088, 3088, 1, 3088]
    - [192, 0.0]
  - - [3104, 3104, 1, 3104]
    - [193, 0.0]
  - - [3120, 3120, 1, 3120]
    - [194, 0.0]
  - - [3136, 3136, 1, 3136]
    - [195, 0.0]
  - - [3152, 3152, 1, 3152]
    - [196, 0.0]
  - - [3168, 3168, 1, 3168]
    - [197, 0.0]
  - - [3184, 3184, 1, 3184]
    - [198, 0.0]
  - - [3200, 3200, 1, 3200]
    - [199, 0.0]
  - - [3216, 3216, 1, 3216]
    - [200, 0.0]
  - - [3232, 3232, 1, 3232]
    - [201, 0.0]
  - - [3248, 3248, 1, 3248]
    - [202, 0.0]
  - - [3264, 3264, 1, 3264]
    - [203, 0.0]
  - - [3280, 3280, 1, 3280]
    - [204, 0.0]
  - - [3296, 3296, 1, 3296]
    - [205, 0.0]
  - - [3312, 3312, 1, 3312]
    - [206, 0.0]
  - - [3328, 3328, 1, 3328]
    - [207, 0.0]
  - - [3344, 3344, 1, 3344]
    - [208, 0.0]
  - - [3360, 3360, 1, 3360]
    - [209, 0.0]
  - - [3376, 3376, 1, 3376]
    - [210, 0.0]
  - - [3392, 3392, 1, 3392]
    - [211, 0.0]
  - - [3408, 3408, 1, 3408]
    - [212, 0.0]
  - - [3424, 3424, 1, 3424]
    - [213, 0.0]
  - - [3440, 3440, 1, 3440]
    - [214, 0.0]
  - - [3456, 3456, 1, 3456]
    - [215, 0.0]
  - - [3472, 3472, 1, 3472]
    - [216, 0.0]
  - - [3488, 3488, 1, 3488]
    - [217, 0.0]
  - - [3504, 3504, 1, 3504]
    - [218, 0.0]
  - - [3520, 3520, 1, 3520]
    - [219, 0.0]
  - - [3536, 3536, 1, 3536]
    - [220, 0.0]
  - - [3552, 3552, 1, 3552]
    - [221, 0.0]
  - - [3568, 3568, 1, 3568]
    - [222, 0.0]
  - - [3584, 3584, 1, 3584]
    - [223, 0.0]
  - - [3600, 3600, 1, 3600]
    - [224, 0.0]
  - - [3616, 3616, 1, 3616]
    - [225, 0.0]
  - - [3632, 3632, 1, 3632]
    - [226, 0.0]
  - - [3648, 3648, 1, 3648]
    - [227, 0.0]
  - - [3664, 3664, 1, 3664]
    - [228, 0.0]
  - - [3680, 3680, 1, 3680]
    - [229, 0.0]
  - - [3696, 3696, 1, 3696]
    - [230, 0.0]
  - - [3712, 3712, 1, 3712]
    - [231, 0.0]
  - - [3728, 3728, 1, 3728]
    - [232, 0.0]
  - - [3744, 3744, 1, 3744]
    - [233, 0.0]
  - - [3760, 3760, 1, 3760]
    - [234, 0.0]
  - - [3776, 3776, 1, 3776]
    - [235, 0.0]
  - - [3792, 3792, 1, 3792]
    - [236, 0.0]
  - - [3808, 3808, 1, 3808]
    - [237, 0.0]
  - - [3824, 3824, 1, 3824]
    - [238, 0.0]
  - - [3840, 3840, 1, 3840]
    - [239, 0.0]
  - - [3856, 3856, 1, 3856]
    - [240, 0.0]
  - - [3872, 3872, 1, 3872]
    - [241, 0.0]
  - - [3888, 3888, 1, 3888]
    - [242, 0.0]
  - - [3904, 3904, 1, 3904]
    - [243, 0.0]
  - - [3920, 3920, 1, 3920]
    - [244, 0.0]
  - - [3936, 3936, 1, 3936]
    - [245, 0.0]
  - - [3952, 3952, 1, 3952]
    - [246, 0.0]
  - - [3968, 3968, 1, 3968]
    - [247, 0.0]
  - - [3984, 3984, 1, 3984]
    - [248, 0.0]
  - - [4000, 4000, 1, 4000]
    - [249, 0.0]
  - - [4016, 4016, 1, 4016]
    - [250, 0.0]
  - - [4032, 4032, 1, 4032]
    - [251, 0.0]
  - - [4048, 4048, 1, 4048]
    - [252, 0.0]
  - - [4064, 4064, 1, 4064]
    - [253, 0.0]
  - - [4080, 4080, 1, 4080]
    - [254, 0.0]
  - - [4096, 4096, 1, 4096]
    - [255, 0.0]
  - - [4112, 4112, 1, 4112]
    - [256, 0.0]
  - - [4128, 4128, 1, 4128]
    - [257, 0.0]
  - - [4144, 4144, 1, 4144]
    - [258, 0.0]
  - - [4160, 4160, 1, 4160]
    - [259, 0.0]
  - - [4176, 4176, 1, 4176]
    - [260, 0.0]
  - - [4192, 4192, 1, 4192]
    - [261, 0.0]
  - - [4208, 4208, 1, 4208]
    - [262, 0.0]
  - - [4224, 4224, 1, 4224]
    - [263, 0.0]
  - - [4240, 4240, 1, 4240]
    - [264, 0.0]
  - - [4256, 4256, 1, 4256]
    - [265, 0.0]
  - - [4272, 4272, 1, 4272]
    - [266, 0.0]
  - - [4288, 4288, 1, 4288]
    - [267, 0.0]
  - - [4304, 4304, 1, 4304]
    - [268, 0.0]
  - - [4320, 4320, 1, 4320]
    - [269, 0.0]
  - - [4336, 4336, 1, 4336]
    - [270, 0.0]
  - - [4352, 4352, 1, 4352]
    - [271, 0.0]
  - - [4368, 4368, 1, 4368]
    - [272, 0.0]
  - - [4384, 4384, 1, 4384]
    - [273, 0.0]
  - - [4400, 4400, 1, 4400]
    - [274, 0.0]
  - - [4416, 4416, 1, 4416]
    - [275, 0.0]
  - - [4432, 4432, 1, 4432]
    - [276, 0.0]
  - - [4448, 4448, 1, 4448]
    - [277, 0.0]
  - - [4464, 4464, 1, 4464]
    - [278, 0.0]
  - - [4480, 4480, 1, 4480]
    - [279, 0.0]
  - - [4496, 4496, 1, 4496]
    - [280, 0.0]
  - - [4512, 4512, 1, 4512]
    - [281, 0.0]
  - - [4528, 4528, 1, 4528]
    - [282, 0.0]
  - - [4544, 4544, 1, 4544]
    - [283, 0.0]
  - - [4560, 4560, 1, 4560]
    - [284, 0.0]
  - - [4576, 4576, 1, 4576]
    - [285, 0.0]
  - - [4592, 4592, 1, 4592]
    - [286, 0.0]
  - - [4608, 4608, 1, 4608]
    - [287, 0.0]
  - - [4624, 4624, 1, 4624]
    - [288, 0.0]
  - - [4640, 4640, 1, 4640]
    - [289, 0.0]
  - - [4656, 4656, 1, 4656]
    - [290, 0.0]
  - - [4672, 4672, 1, 4672]
    - [291, 0.0]
  - - [4688, 4688, 1, 4688]
    - [292, 0.0]
  - - [4704, 4704, 1, 4704]
    - [293, 0.0]
  - - [4720, 4720, 1, 4720]
    - [294, 0.0]
  - - [4736, 4736, 1, 4736]
    - [295, 0.0]
  - - [4752, 4752, 1, 4752]
    - [296, 0.0]
  - - [4768, 4768, 1, 4768]
    - [297, 0.0]
  - - [4784, 4784, 1, 4784]
    - [298, 0.0]
  - - [4800, 4800, 1, 4800]
    - [299, 0.0]
  - - [4816, 4816, 1, 4816]
    - [300, 0.0]
  - - [4832, 4832, 1, 4832]
    - [301, 0.0]
  - - [4848, 4848, 1, 4848]
    - [302, 0.0]
  - - [4864, 4864, 1, 4864]
    - [303, 0.0]
  - - [4880, 4880, 1, 4880]
    - [304, 0.0]
  - - [4896, 4896, 1, 4896]
    - [305, 0.0]
  - - [4912, 4912, 1, 4912]
    - [306, 0.0]
  - - [4928, 4928, 1, 4928]
    - [307, 0.0]
  - - [4944, 4944, 1, 4944]
    - [308, 0.0]
  - - [4960, 4960, 1, 4960]
    - [309, 0.0]
  - - [4976, 4976, 1, 4976]
    - [310, 0.0]
  - - [4992, 4992, 1, 4992]
    - [311, 0.0]
  - - [5008, 5008, 1, 5008]
    - [312, 0.0]
  - - [5024, 5024, 1, 5024]
    - [313, 0.0]
  - - [5040, 5040, 1, 5040]
    - [314, 0.0]
  - - [5056, 5056, 1, 5056]
    - [315, 0.0]
  - - [5072, 5072, 1, 5072]
    - [316, 0.0]
  - - [5088, 5088, 1, 5088]
    - [317, 0.0]
  - - [5104, 5104, 1, 5104]
    - [318, 0.0]
  - - [5120, 5120, 1, 5120]
    - [319, 0.0]
  - - [5136, 5136, 1, 5136]
    - [320, 0.0]
  - - [5152, 5152, 1, 5152]
    - [321, 0.0]
  - - [5168, 5168, 1, 5168]
    - [322, 0.0]
  - - [5184, 5184, 1, 5184]
    - [323, 0.0]
  - - [5200, 5200, 1, 5200]
    - [324, 0.0]
  - - [5216, 5216, 1, 5216]
    - [325, 0.0]
  - - [5232, 5232, 1, 5232]
    - [326, 0.0]
  - - [5248, 5248, 1, 5248]
    - [327, 0.0]
  - - [5264, 5264, 1, 5264]
    - [328, 0.0]
  - - [5280, 5280, 1, 5280]
    - [329, 0.0]
  - - [5296, 5296, 1, 5296]
    - [330, 0.0]
  - - [5312, 5312, 1, 5312]
    - [331, 0.0]
  - - [5328, 5328, 1, 5328]
    - [332, 0.0]
  - - [5344, 5344, 1, 5344]
    - [333, 0.0]
  - - [5360, 5360, 1, 5360]
    - [334, 0.0]
  - - [5376, 5376, 1, 5376]
    - [335, 0.0]
  - - [5392, 5392, 1, 5392]
    - [336, 0.0]
  - - [5408, 5408, 1, 5408]
    - [337, 0.0]
  - - [5424, 5424, 1, 5424]
    - [338, 0.0]
  - - [5440, 5440, 1, 5440]
    - [339, 0.0]
  - - [5456, 5456, 1, 5456]
    - [340, 0.0]
  - - [5472, 5472, 1, 5472]
    - [341, 0.0]
  - - [5488, 5488, 1, 5488]
    - [342, 0.0]
  - - [5504, 5504, 1, 5504]
    - [343, 0.0]
  - - [5520, 5520, 1, 5520]
    - [344, 0.0]
  - - [5536, 5536, 1, 5536]
    - [345, 0.0]
  - - [5552, 5552, 1, 5552]
    - [346, 0.0]
  - - [5568, 5568, 1, 5568]
    - [347, 0.0]
  - - [5584, 5584, 1, 5584]
    - [348, 0.0]
  - - [5600, 5600, 1, 5600]
    - [349, 0.0]
  - - [5616, 5616, 1, 5616]
    - [350, 0.0]
  - - [5632, 5632, 1, 5632]
    - [351, 0.0]
  - - [5648, 5648, 1, 5648]
    - [352, 0.0]
  - - [5664, 5664, 1, 5664]
    - [353, 0.0]
  - - [5680, 5680, 1, 5680]
    - [354, 0.0]
  - - [5696, 5696, 1, 5696]
    - [355, 0.0]
  - - [5712, 5712, 1, 5712]
    - [356, 0.0]
  - - [5728, 5728, 1, 5728]
    - [357, 0.0]
  - - [5744, 5744, 1, 5744]
    - [358, 0.0]
  - - [5760, 5760, 1, 5760]
    - [359, 0.0]
  - - [5776, 5776, 1, 5776]
    - [360, 0.0]
  - - [5792, 5792, 1, 5792]
    - [361, 0.0]
  - - [5808, 5808, 1, 5808]
    - [362, 0.0]
  - - [5824, 5824, 1, 5824]
    - [363, 0.0]
  - - [5840, 5840, 1, 5840]
    - [364, 0.0]
  - - [5856, 5856, 1, 5856]
    - [365, 0.0]
  - - [5872, 5872, 1, 5872]
    - [366, 0.0]
  - - [5888, 5888, 1, 5888]
    - [367, 0.0]
  - - [5904, 5904, 1, 5904]
    - [368, 0.0]
  - - [5920, 5920, 1, 5920]
    - [369, 0.0]
  - - [5936, 5936, 1, 5936]
    - [370, 0.0]
  - - [5952, 5952, 1, 5952]
    - [371, 0.0]
  - - [5968, 5968, 1, 5968]
    - [372, 0.0]
  - - [5984, 5984, 1, 5984]
    - [373, 0.0]
  - - [6000, 6000, 1, 6000]
    - [374, 0.0]
  - - [6016, 6016, 1, 6016]
    - [375, 0.0]
  - - [6032, 6032, 1, 6032]
    - [376, 0.0]
  - - [6048, 6048, 1, 6048]
    - [377, 0.0]
  - - [6064, 6064, 1, 6064]
    - [378, 0.0]
  - - [6080, 6080, 1, 6080]
    - [379, 0.0]
  - - [6096, 6096, 1, 6096]
    - [380, 0.0]
  - - [6112, 6112, 1, 6112]
    - [381, 0.0]
  - - [6128, 6128, 1, 6128]
    - [382, 0.0]
  - - [6144, 6144, 1, 6144]
    - [383, 0.0]
  - - [6160, 6160, 1, 6160]
    - [384, 0.0]
  - - [6176, 6176, 1, 6176]
    - [385, 0.0]
  - - [6192, 6192, 1, 6192]
    - [386, 0.0]
  - - [6208, 6208, 1, 6208]
    - [387, 0.0]
  - - [6224, 6224, 1, 6224]
    - [388, 0.0]
  - - [6240, 6240, 1, 6240]
    - [389, 0.0]
  - - [6256, 6256, 1, 6256]
    - [390, 0.0]
  - - [6272, 6272, 1, 6272]
    - [391, 0.0]
  - - [6288, 6288, 1, 6288]
    - [392, 0.0]
  - - [6304, 6304, 1, 6304]
    - [393, 0.0]
  - - [6320, 6320, 1, 6320]
    - [394, 0.0]
  - - [6336, 6336, 1, 6336]
    - [395, 0.0]
  - - [6352, 6352, 1, 6352]
    - [396, 0.0]
  - - [6368, 6368, 1, 6368]
    - [397, 0.0]
  - - [6384, 6384, 1, 6384]
    - [398, 0.0]
  - - [6400, 6400, 1, 6400]
    - [399, 0.0]
  - - [6416, 6416, 1, 6416]
    - [400, 0.0]
  - - [6432, 6432, 1, 6432]
    - [401, 0.0]
  - - [6448, 6448, 1, 6448]
    - [402, 0.0]
  - - [6464, 6464, 1, 6464]
    - [403, 0.0]
  - - [6480, 6480, 1, 6480]
    - [404, 0.0]
  - - [6496, 6496, 1, 6496]
    - [405, 0.0]
  - - [6512, 6512, 1, 6512]
    - [406, 0.0]
  - - [6528, 6528, 1, 6528]
    - [407, 0.0]
  - - [6544, 6544, 1, 6544]
    - [408, 0.0]
  - - [6560, 6560, 1, 6560]
    - [409, 0.0]
  - - [6576, 6576, 1, 6576]
    - [410, 0.0]
  - - [6592, 6592, 1, 6592]
    - [411, 0.0]
  - - [6608, 6608, 1, 6608]
    - [412, 0.0]
  - - [6624, 6624, 1, 6624]
    - [413, 0.0]
  - - [6640, 6640, 1, 6640]
    - [414, 0.0]
  - - [6656, 6656, 1, 6656]
    - [415, 0.0]
  - - [6672, 6672, 1, 6672]
    - [416, 0.0]
  - - [6688, 6688, 1, 6688]
    - [417, 0.0]
  - - [6704, 6704, 1, 6704]
    - [418, 0.0]
  - - [6720, 6720, 1, 6720]
    - [419, 0.0]
  - - [6736, 6736, 1, 6736]
    - [420, 0.0]
  - - [6752, 6752, 1, 6752]
    - [421, 0.0]
  - - [6768, 6768, 1, 6768]
    - [422, 0.0]
  - - [6784, 6784, 1, 6784]
    - [423, 0.0]
  - - [6800, 6800, 1, 6800]
    - [424, 0.0]
  - - [6816, 6816, 1, 6816]
    - [425, 0.0]
  - - [6832, 6832, 1, 6832]
    - [426, 0.0]
  - - [6848, 6848, 1, 6848]
    - [427, 0.0]
  - - [6864, 6864, 1, 6864]
    - [428, 0.0]
  - - [6880, 6880, 1, 6880]
    - [429, 0.0]
  - - [6896, 6896, 1, 6896]
    - [430, 0.0]
  - - [6912, 6912, 1, 6912]
    - [431, 0.0]
  - - [6928, 6928, 1, 6928]
    - [432, 0.0]
  - - [6944, 6944, 1, 6944]
    - [433, 0.0]
  - - [6960, 6960, 1, 6960]
    - [434, 0.0]
  - - [6976, 6976, 1, 6976]
    - [435, 0.0]
  - - [6992, 6992, 1, 6992]
    - [436, 0.0]
  - - [7008, 7008, 1, 7008]
    - [437, 0.0]
  - - [7024, 7024, 1, 7024]
    - [438, 0.0]
  - - [7040, 7040, 1, 7040]
    - [439, 0.0]
  - - [7056, 7056, 1, 7056]
    - [440, 0.0]
  - - [7072, 7072, 1, 7072]
    - [441, 0.0]
  - - [7088, 7088, 1, 7088]
    - [442, 0.0]
  - - [7104, 7104, 1, 7104]
    - [443, 0.0]
  - - [7120, 7120, 1, 7120]
    - [444, 0.0]
  - - [7136, 7136, 1, 7136]
    - [445, 0.0]
  - - [7152, 7152, 1, 7152]
    - [446, 0.0]
  - - [7168, 7168, 1, 7168]
    - [447, 0.0]
  - - [7184, 7184, 1, 7184]
    - [448, 0.0]
  - - [7200, 7200, 1, 7200]
    - [449, 0.0]
  - - [7216, 7216, 1, 7216]
    - [450, 0.0]
  - - [7232, 7232, 1, 7232]
    - [451, 0.0]
  - - [7248, 7248, 1, 7248]
    - [452, 0.0]
  - - [7264, 7264, 1, 7264]
    - [453, 0.0]
  - - [7280, 7280, 1, 7280]
    - [454, 0.0]
  - - [7296, 7296, 1, 7296]
    - [455, 0.0]
  - - [7312, 7312, 1, 7312]
    - [456, 0.0]
  - - [7328, 7328, 1, 7328]
    - [457, 0.0]
  - - [7344, 7344, 1, 7344]
    - [458, 0.0]
  - - [7360, 7360, 1, 7360]
    - [459, 0.0]
  - - [7376, 7376, 1, 7376]
    - [460, 0.0]
  - - [7392, 7392, 1, 7392]
    - [461, 0.0]
  - - [7408, 7408, 1, 7408]
    - [462, 0.0]
  - - [7424, 7424, 1, 7424]
    - [463, 0.0]
  - - [7440, 7440, 1, 7440]
    - [464, 0.0]
  - - [7456, 7456, 1, 7456]
    - [465, 0.0]
  - - [7472, 7472, 1, 7472]
    - [466, 0.0]
  - - [7488, 7488, 1, 7488]
    - [467, 0.0]
  - - [7504, 7504, 1, 7504]
    - [468, 0.0]
  - - [7520, 7520, 1, 7520]
    - [469, 0.0]
  - - [7536, 7536, 1, 7536]
    - [470, 0.0]
  - - [7552, 7552, 1, 7552]
    - [471, 0.0]
  - - [7568, 7568, 1, 7568]
    - [472, 0.0]
  - - [7584, 7584, 1, 7584]
    - [473, 0.0]
  - - [7600, 7600, 1, 7600]
    - [474, 0.0]
  - - [7616, 7616, 1, 7616]
    - [475, 0.0]
  - - [7632, 7632, 1, 7632]
    - [476, 0.0]
  - - [7648, 7648, 1, 7648]
    - [477, 0.0]
  - - [7664, 7664, 1, 7664]
    - [478, 0.0]
  - - [7680, 7680, 1, 7680]
    - [479, 0.0]
  - - [7696, 7696, 1, 7696]
    - [480, 0.0]
  - - [7712, 7712, 1, 7712]
    - [481, 0.0]
  - - [7728, 7728, 1, 7728]
    - [482, 0.0]
  - - [7744, 7744, 1, 7744]
    - [483, 0.0]
  - - [7760, 7760, 1, 7760]
    - [484, 0.0]
  - - [7776, 7776, 1, 7776]
    - [485, 0.0]
  - - [7792, 7792, 1, 7792]
    - [486, 0.0]
  - - [7808, 7808, 1, 7808]
    - [487, 0.0]
  - - [7824, 7824, 1, 7824]
    - [488, 0.0]
  - - [7840, 7840, 1, 7840]
    - [489, 0.0]
  - - [7856, 7856, 1, 7856]
    - [490, 0.0]
  - - [7872, 7872, 1, 7872]
    - [491, 0.0]
  - - [7888, 7888, 1, 7888]
    - [492, 0.0]
  - - [7904, 7904, 1, 7904]
    - [493, 0.0]
  - - [7920, 7920, 1, 7920]
    - [494, 0.0]
  - - [7936, 7936, 1, 7936]
    - [495, 0.0]
  - - [7952, 7952, 1, 7952]
    - [496, 0.0]
  - - [7968, 7968, 1, 7968]
    - [497, 0.0]
  - - [7984, 7984, 1, 7984]
    - [498, 0.0]
  - - [8000, 8000, 1, 8000]
    - [499, 0.0]
  - - [8016, 8016, 1, 8016]
    - [500, 0.0]
  - - [8032, 8032, 1, 8032]
    - [501, 0.0]
  - - [8048, 8048, 1, 8048]
    - [502, 0.0]
  - - [8064, 8064, 1, 8064]
    - [503, 0.0]
  - - [8080, 8080, 1, 8080]
    - [504, 0.0]
  - - [8096, 8096, 1, 8096]
    - [505, 0.0]
  - - [8112, 8112, 1, 8112]
    - [506, 0.0]
  - - [8128, 8128, 1, 8128]
    - [507, 0.0]
  - - [8144, 8144, 1, 8144]
    - [508, 0.0]
  - - [8160, 8160, 1, 8160]
    - [509, 0.0]
  - - [8176, 8176, 1, 8176]
    - [510, 0.0]
  - - [8192, 8192, 1, 8192]
    - [511, 0.0]
  - - [8208, 8208, 1, 8208]
    - [512, 0.0]
  - - [8224, 8224, 1, 8224]
    - [513, 0.0]
  - - [8240, 8240, 1, 8240]
    - [514, 0.0]
  - - [8256, 8256, 1, 8256]
    - [515, 0.0]
  - - [8272, 8272, 1, 8272]
    - [516, 0.0]
  - - [8288, 8288, 1, 8288]
    - [517, 0.0]
  - - [8304, 8304, 1, 8304]
    - [518, 0.0]
  - - [8320, 8320, 1, 8320]
    - [519, 0.0]
  - - [8336, 8336, 1, 8336]
    - [520, 0.0]
  - - [8352, 8352, 1, 8352]
    - [521, 0.0]
  - - [8368, 8368, 1, 8368]
    - [522, 0.0]
  - - [8384, 8384, 1, 8384]
    - [523, 0.0]
  - - [8400, 8400, 1, 8400]
    - [524, 0.0]
  - - [8416, 8416, 1, 8416]
    - [525, 0.0]
  - - [8432, 8432, 1, 8432]
    - [526, 0.0]
  - - [8448, 8448, 1, 8448]
    - [527, 0.0]
  - - [8464, 8464, 1, 8464]
    - [528, 0.0]
  - - [8480, 8480, 1, 8480]
    - [529, 0.0]
  - - [8496, 8496, 1, 8496]
    - [530, 0.0]
  - - [8512, 8512, 1, 8512]
    - [531, 0.0]
  - - [8528, 8528, 1, 8528]
    - [532, 0.0]
  - - [8544, 8544, 1, 8544]
    - [533, 0.0]
  - - [8560, 8560, 1, 8560]
    - [534, 0.0]
  - - [8576, 8576, 1, 8576]
    - [535, 0.0]
  - - [8592, 8592, 1, 8592]
    - [536, 0.0]
  - - [8608, 8608, 1, 8608]
    - [537, 0.0]
  - - [8624, 8624, 1, 8624]
    - [538, 0.0]
  - - [8640, 8640, 1, 8640]
    - [539, 0.0]
  - - [8656, 8656, 1, 8656]
    - [540, 0.0]
  - - [8672, 8672, 1, 8672]
    - [541, 0.0]
  - - [8688, 8688, 1, 8688]
    - [542, 0.0]
  - - [8704, 8704, 1, 8704]
    - [543, 0.0]
  - - [8720, 8720, 1, 8720]
    - [544, 0.0]
  - - [8736, 8736, 1, 8736]
    - [545, 0.0]
  - - [8752, 8752, 1, 8752]
    - [546, 0.0]
  - - [8768, 8768, 1, 8768]
    - [547, 0.0]
  - - [8784, 8784, 1, 8784]
    - [548, 0.0]
  - - [8800, 8800, 1, 8800]
    - [549, 0.0]
  - - [8816, 8816, 1, 8816]
    - [550, 0.0]
  - - [8832, 8832, 1, 8832]
    - [551, 0.0]
  - - [8848, 8848, 1, 8848]
    - [552, 0.0]
  - - [8864, 8864, 1, 8864]
    - [553, 0.0]
- null
- null
- DeviceEfficiency
- GridBased
